sentence_lemma	sentence_token	target_index	original_word
sie sein von zu Haus her gegen d Wüten d Mann abgebrüht $	Sie war von zu Hause her gegen das Wüten der Männer abgebrüht .	11	abgebrht
auch stellen in einige Maß d $ ob zwar zu groß Teil bloß d Phrase nach $ $ wissenschaftlich $ Unterricht $ welchen d Jugend zumal d hoch d. I. d kapitalistisch Klasse durch Zivilisation erhalten $ auf ihr Seite als eine Art von Zwangsarbeit sich dar $ wodurch leicht d gut Keim eigentümlich Geist in sie verkrüppeln $ ihr Gemüt erkälten und ihr Gewissen verhärten werden $ während doch dergleichen seine eigentlich Natur nach Musik und Gymnastik $ d. h. eine harmonisch Ausbildung d ganz Mensch $ d Leib und d Seele $ sein wollen $ so sein oder werden es jen besondere und einseitig Erziehung d Gedächtnis $ welche zur Willkür wenden machen $ als zur bewußt Anwendung eingeprägt Regel $ und mit Wort $ Satz $ ja sogar Methode auf mechanisch Weise operieren lehren $ wie denn aber in d Tat solch gedrillt $ gleichgültig-überlegen $ abgebrüht Mensch in d meiste jen Beschäftigung fordern werden $ oder doch am meiste brauchbar sein $ welchen solch Jugend im Dienst d Gesellschaft oder d Staat $ als d personifiziert Gesellschaft $ sich hingeben neigen oder nötigen sein $	Auch stellt in einigem Maasse der ( ob zwar zu grossem Theile blos den Phrasen nach ) » wissenschaftliche « Unterricht , welchen die Jugend zumal der höheren d. i. der kapitalistischen Klassen durch Civilisation erhält , auf ihrer Seite als eine Art von Zwangsarbeit sich dar , wodurch leicht die besten Keime eigenthümlichen Geistes in ihnen verkrüppeln , ihr Gemüth erkältet und ihr Gewissen verhärtet wird ; während doch dergleichen seiner eigentlichen Natur nach Musik und Gymnastik , d. h. eine harmonische Ausbildung des ganzen Menschen ( des Leibes und der Seele ) sein will , so ist oder wird es jene besondere und einseitige Erziehung des Gedächtnisses , welche zur Willkür gewandt macht , als zur bewussten Anwendung eingeprägter Regeln , und mit Worten , Sätzen , ja sogar Methoden auf mechanische Weise operiren lehrt ; wie denn aber in der That solche gedrillte , gleichgültig-überlegene , abgebrühte Menschen in den meisten jener Beschäftigungen gefordert werden , oder doch am meisten brauchbar sind , welchen solche Jugend im Dienste der Gesellschaft oder des Staates ( als der personificirten Gesellschaft ) sich hinzugeben geneigt oder genöthigt ist .	149	abgebrht
es suchen sich zur Trunkenheit zu zwingen durch Schiller zehnmal abgebrüht Phrase $ und als d Rausch er wollen nicht gelingen $ da rufen es aus $	Es suchte sich zur Trunkenheit zu zwingen Durch Schillers zehnmal abgebrühte Phrase , Und als der Rausch ihm wollte nicht gelingen , Da rief es aus :	10	abgebrht
wenn d Bouillon zu eine Gesellschaftsessen recht kräftig kochen werden und mehrere Gericht folgen $ so sein es üblich $ sie klar zu geben mit Wurzelwerk und Kloßchen $ im übrig tun man gut $ d Suppe mit Perlgraupe oder Reis zu binden $ d Reis müssen aber gut abgebrüht werden $	Wenn die Bouillon zu einem Gesellschaftsessen recht kräftig gekocht wird und mehrere Gerichte folgen , so ist es üblich , sie klar zu geben mit Wurzelwerk und Klößchen ; im übrigen thut man besser , die Suppe mit Perlgraupen oder Reis zu binden ; der Reis muß aber gut abgebrüht werden .	49	abgebrht
d Nahrung haben aber unter alle Umstand ihr Abschreckende $ zumal wenn d Indianer d Affe d Haar absengen oder er abgebrüht in d Topf stecken oder er zum Braten an eine spitz Stab befestigen haben $	Die Nahrung hat aber unter allen Umständen ihr Abschreckendes , zumal wenn die Jndianer dem Affen das Haar abgesengt oder ihn abgebrüht in den Topf gesteckt oder ihn zum Braten an einen spitzen Stab befestigt haben .	21	abgebrht
Reis $ welche gut abgebrüht sein $ werden mit Milch und d nötig Salz nicht gar zu steif kochen $ gekocht und gehackt Schinken $ mit sauer Sahne vermischen lagenweise mit d Reis und Parmesankäse in ausgestreichen und mit Zwieback bestreut Formchen füllen und backen $	Reis , welcher gut abgebrüht ist , wird mit Milch und dem nöthigen Salz nicht gar zu steif gekocht ; gekochter und gehackter Schinken , mit saurer Sahne vermischt lagenweise mit dem Reis und Parmesankäse in ausgestrichene und mit Zwieback bestreute Förmchen gefüllt und gebacken .	4	abgebrht
nachdem man dieselbe ausgraben haben $ werden sie von d Faser und ander Anhängsel befreien und sorgfältig abwaschen $ darauf rasch in kochend Wasser oder Wasserdampf abgebrüht $ so dass sie nachher auf d Querschnitt braungelb und gallertartig aussehen $	Nachdem man dieselben ausgegraben hat , werden sie von den Fasern und andern Anhängseln befreit und sorgfältig abgewaschen , darauf rasch in kochendem Wasser oder Wasserdampf abgebrüht , so dass sie nachher auf dem Querschnitt braungelb und gallertartig aussehen .	26	abgebrht
d Fleisch werden waschen $ mit kochend Wasser und nicht zu viel Salz aufs Feuer bringen $ abschäumen $ eine Sellerieknöllchen $ eine jung Kohlrabi $ feingeschneiden Zwiebel $ geschwitzt Mehl nach No. 7 und Perlgraupe oder abgebrüht Reis hinzugeben $ und $ fest zudecken $ langsam kochen $	Das Fleisch wird gewaschen , mit kochendem Wasser und nicht zu viel Salz aufs Feuer gebracht , abgeschäumt , ein Sellerieknöllchen , eine junge Kohlrabi , feingeschnittene Zwiebel , geschwitztes Mehl nach No. 7 und Perlgraupen oder abgebrühter Reis hinzugegeben , und , fest zugedeckt , langsam gekocht .	37	abgebrht
diese werden abgebrüht $ mit Wasser $ Zitronenschale und etwas Weißbrot weich kochen $ durch eine Sieb reiben $ viel Zucker $ Zimt und Wein durchkochen $ auf geröstet Weißbrot anrichten $	Diese werden abgebrüht , mit Wasser , Zitronenschale und etwas Weißbrod weich gekocht , durch ein Sieb gerieben , viel Zucker , Zimmet und Wein durchgekocht , auf geröstetem Weißbrod angerichtet .	2	abgebrht
36. Pfannkuchen von dickgekocht Reis $ 1/2 Pfund abgebrüht $ in Milch mit eine Stückchen Butter $ einige Stück Zimt oder Zitronenschale $ 1/4 Pfund Rosine $ welche etwas spät dazu kommen $ und etwas Salz weich und dick gekocht Reis $ 4 Ei $ 2-3 Eßlöffel Zucker $ etwas gestoßen Zwieback oder gereiben Weißbrot $	36. Pfannkuchen von dickgekochtem Reis . 1/2 Pfund abgebrühter , in Milch mit einem Stückchen Butter , einigen Stücken Zimmet oder Zitronenschale , 1/4 Pfund Rosinen ( welche etwas später dazu kommen ) und etwas Salz weich und dick gekochter Reis , 4 Eier , 2–3 Eßlöffel Zucker , etwas gestoßener Zwieback oder geriebenes Weißbrod .	8	abgebrht
zehn Lot Sago werden $ nachdem er behutsam abgebrüht sein $ in Milch mit 6 Lot Zucker und Zitronenschale langsam gar und ganz steif kochen $	Zehn Loth Sago wird , nachdem er behutsam abgebrüht ist , in Milch mit 6 Loth Zucker und Zitronenschale langsam gahr und ganz steif gekocht .	8	abgebrht
sein d Reis abgebrüht $ setzen man er nach vorhergehend Angabe zu Feuer $ geben $ wenn er eine klein Weile kochen haben $ ausgesucht und gewaschen Rosine dazu $ so wie auch spät Zucker und wenig Salz und lassen er gar werden $ aber nicht zerkochen $	Ist der Reis abgebrüht , setze man ihn nach vorhergehender Angabe zu Feuer , gebe , wenn er eine kleine Weile gekocht hat , ausgesuchte und gewaschene Rosinen dazu , so wie auch später Zucker und wenig Salz und lasse ihn gahr werden , aber nicht zerkochen .	3	abgebrht
sein d Reis abgebrüht $ so setzen man er nach vorhergehend Angabe aufs Feuer und geben $ wenn er 1/4 Stunde kochen haben $ ausgesucht und gewaschen Rosine dazu und lassen er weich werden $ aber nicht zerkochen $	Ist der Reis abgebrüht , so setze man ihn nach vorhergehender Angabe aufs Feuer und gebe , wenn er 1/4 Stunde gekocht hat , ausgesuchte und gewaschene Rosinen dazu und lasse ihn weich werden , aber nicht zerkochen .	3	abgebrht
werden spät im Frühjahr diese Gericht von Paradies-Apfel zubereiten $ so lassen man sie zur Hälfte weich kochen und geben dann erst d abgebrüht Reis hinzu $	Wird spät im Frühjahr dies Gericht von Paradies-Aepfeln zubereitet , so lasse man sie zur Hälfte weich kochen und gebe dann erst den abgebrühten Reis hinzu .	23	abgebrht
eine Suppenteller voll klein geschneiden sauer Apfel werden mit eine Obertasse voll abgebrüht Reis in Wasser ganz weich kochen $ durch eine Sieb reiben $ mit Zucker $ Zimt $ Zitronenschale und etwas Salz durchkochen und mit 2 Eidotter abrühren $	Ein Suppenteller voll klein geschnittener saurer Aepfel werden mit einer Obertasse voll abgebrühtem Reis in Wasser ganz weich gekocht , durch ein Sieb gerieben , mit Zucker , Zimmet , Zitronenschale und etwas Salz durchgekocht und mit 2 Eidottern abgerührt .	12	abgebrht
eine und eine halb Stunde vorher geben man gut abgebrüht Reis $ oder nach Belieben Perlgerste zur Suppe $ die jedoch wohl ½ Stunde lang kochen müssen $	Ein und eine halbe Stunde vorher gibt man gut abgebrühten Reis , oder nach Belieben Perlgerste zur Suppe , die jedoch wohl ½ Stunde länger kochen muß .	9	abgebrht
man kochen 1/2 Pfund Reis $ nachdem dieselbe gut abgebrüht $ mit Milch weich und recht steif $ geben dann eine Ei dick Butter $ Zucker und abgereiben Zitronenschale nach Geschmack hinzu $	Man kocht 1/2 Pfund Reis , nachdem derselbe gut abgebrüht , mit Milch weich und recht steif , gibt dann ein Ei dick Butter , Zucker und abgeriebene Zitronenschale nach Geschmack hinzu .	9	abgebrht
vorerst werden je 9 Gramm Ingwer $ Muskatblüte und Gewürznelke grob stoßen und mit 1.5 Liter kochend Wasser abgebrüht $	Vorerst werden je 9 Gramm Ingwer , Muscatblüthe und Gewürznelken grob gestoßen und mit 1.5 Liter kochendem Wasser abgebrüht .	18	abgebrht
echt Sago werden zweimal mit heiß Wasser abgebrüht $ mit heiß $ weich Wasser aufs Feuer bringen $ und mit einige Zitronenscheibe weich kochen $ welche etwa 2-21/2 Stunde dauern $ Perlsago $ welche aus Kartoffelmehl bereiten sein $ bedürfen nicht d Abgießen und nur eine Stunde Kochen $	Echter Sago wird zweimal mit heißem Wasser abgebrüht , mit heißem , weichem Wasser aufs Feuer gebracht , und mit einigen Zitronenscheiben weich gekocht , welches etwa 2–2½ Stunden dauert ; Perlsago , welcher aus Kartoffelmehl bereitet ist , bedarf nicht des Abgießens und nur einer Stunde Kochens .	7	abgebrht
man schwitzen etwas Butter mit eine Löffel Mehl gelb $ geben d nötig Quantität kochend Wasser $ abgebrüht Reis und verlesen und gewaschen Rosine hinzu $ lassen beide weich kochen und rühren d Suppe ab mit Salz $ Zucker $ etwas Wein $ einige Eidotter und Zimt $	Man schwitzt etwas Butter mit einem Löffel Mehl gelb , gibt die nöthige Quantität kochendes Wasser , abgebrühten Reis und verlesene und gewaschene Rosinen hinzu , läßt beides weich kochen und rührt die Suppe ab mit Salz , Zucker , etwas Wein , einigen Eidottern und Zimmet .	17	abgebrht
auch kochen man ¾ $ 1 Pfund abgebrüht Reis in Milch ganz steif und geben etwas Salz dazu $	Auch kocht man ¾ — 1 Pfund abgebrühten Reis in Milch ganz steif und gibt etwas Salz dazu .	7	abgebrht
d Sago werden behutsam abgebrüht $ mit Milch $ Zitronenschale und ganz Zimt langsam weich und steif kochen $	Der Sago wird behutsam abgebrüht , mit Milch , Zitronenschale und ganzem Zimmet langsam weich und steif gekocht .	4	abgebrht
29. eine ganz vorzüglich Getränk bei Diarrhöe und krankhaft Beschwerden. 1/2 Pfund gut Reis werden gut abgebrüht $ mit 1/2 Unze ganz Zimt in eine irden Topf zu 1 3/4 Quart kochend Wasser geben $ bis zu 1 1/8 Quart einkochen $ ohne Rühren durch eine Sieb gießen und mit oder ohne Zucker d Tag hindurch trinken $	29. Ein ganz vorzügliches Getränk bei Diarrhöe und krankhaften Beschwerden. 1/2 Pfund bester Reis wird gut abgebrüht , mit 1/2 Unze ganzem Zimmet in einem irdenen Topf zu 1 3/4 Quart kochendem Wassers gegeben , bis zu 1 1/8 Quart eingekocht , ohne Rühren durch ein Sieb gegossen und mit oder ohne Zucker den Tag hindurch getrunken .	16	abgebrht
d Reis werden gut abgebrüht $ in Wasser gar und dick $ nicht steif kochen $ die Körner aber dürfen nicht zerkochen $	Der Reis wird gut abgebrüht , in Wasser gahr und dick , nicht steif gekocht , die Körner aber dürfen nicht zerkochen .	4	abgebrht
zur Ersparnis können man etwas mit Zucker gestoßen Vanille lose in eine abgebrüht Läppchen binden in d Sauce auskochen lassen $	Zur Ersparniß kann man etwas mit Zucker gestoßene Vanille lose in ein abgebrühtes Läppchen gebunden in der Sauce auskochen lassen .	12	abgebrht
No. 3. 4 Eigelb $ 1 groß saftig Zitrone $ ¾ Tasse Zucker $ 1 Soda-Cracker $ fein rollen $ mit 11/2 Tasse kochend Wasser abgebrüht $ Zucker $ Eigelb $ abgereiben Schale und Saft d Zitrone hinzudrücken $ auf d Pie gießen und backen $	No. 3. 4 Eigelb , 1 große saftige Zitrone , ¾ Tasse Zucker , 1 Soda-Cracker , fein gerollt , mit 1½ Tasse kochendem Wasser abgebrüht , Zucker , Eigelb , abgeriebene Schale und Saft der Zitrone hinzugedrückt , auf den Pie gegossen und gebacken .	25	abgebrht
es werden dazu eine gut $ fleischig Stück nehmen $ wie oben mit etwas Salz ausschäumen $ d Brühe durch eine Sieb schütten $ mit Reis $ die in kochend Wasser abgebrüht sein $ gar kochen $	Es wird dazu ein gutes , fleischiges Stück genommen , wie oben mit etwas Salz ausgeschäumt , die Brühe durch ein Sieb geschüttet , mit Reis , der in kochendem Wasser abgebrüht ist , gahr gekocht .	31	abgebrht
drei Viertel Pfund Reis werden gut abgebrüht $ in Wasser gar kochen $ doch müssen d Korn ganz bleiben $	Drei Viertel Pfund Reis wird gut abgebrüht , in Wasser gahr gekocht , doch müssen die Körner ganz bleiben .	6	abgebrht
d abgebrüht Gehäuseschnecke können man $ indem d Spindelmuskel sich loslösen haben $ leicht aus d Gewinde herausdrehen $	Die abgebrühten Gehäusschnecken kann man , indem der Spindelmuskel sich losgelöst hat , leicht aus dem Gewinde herausdrehen .	1	abgebrht
unterdes werden 1 Pfund Reis abgebrüht $ in eine irden Geschirr mit reichlich 4 Maß Wasser und d Pfund Zucker 3 Stunde kochen $	Unterdeß wird 1 Pfund Reis abgebrüht , in einem irdenen Geschirr mit reichlich 4 Maß Wasser und dem Pfunde Zucker 3 Stunden gekocht .	5	abgebrht
¼ Pfund echt Sago oder Reis werden abgebrüht $ mit Wasser $ ohne zu rühren $ weich und dick kochen $ d Korn müssen ganz bleiben $ und in d Terrine füllen $	¼ Pfund echter Sago oder Reis wird abgebrüht , mit Wasser , ohne zu rühren , weich und dick gekocht ( die Körner müssen ganz bleiben ) und in die Terrine gefüllt .	7	abgebrht
können nach gering Arbeit und mäßig Bekleidung während dieselbe eine ordentlich Portion Schaum von d Pferd herunterschaben $ scraped $ werden $ um so gut $ wenn nicht $ so dürfen d Pferd in d meiste Fall dadurch zum Schwitze bringen werden $ dass man er eine Gerstentrank oder eine Abkochung von Maismehl oder fein Kleie $ ½ Liter heiß abgebrüht in eine Portion Wasser $ zu saufen geben $	Kann nach geringer Arbeit und mässiger Bekleidung während derselben eine ordentliche Portion Schaum von dem Pferde heruntergeschabt ( scraped ) werden , um so besser , wenn nicht , so dürfte das Pferd in den meisten Fällen dadurch zum Schwitzen gebracht werden , dass man ihm einen Gerstentrank oder eine Abkochung von Maismehl oder feinen Kleien ( ½ Liter heiss abgebrüht in einer Portion Wasser ) zu saufen gibt .	60	abgebrht
beim Gebrauch werden es mit nicht zu viel Wasser und Salz abschäumen $ mit einige Zwiebel $ 4 Lorberblättern $ Pfeffer und Nelke $ auch nach Belieben mit zwei Handvoll abgebrüht Pflaume $ gar kochen $	Beim Gebrauch wird es mit nicht zu vielem Wasser und Salz abgeschäumt , mit einigen Zwiebeln , 4 Lorberblättern , Pfeffer und Nelken ( auch nach Belieben mit zwei Handvoll abgebrühten Pflaumen ) gahr gekocht .	30	abgebrht
d Sago werden zwei Mal mit heiß Wasser abgebrüht $ mit kalt $ weich Wasser zu Feuer bringen und mit einige Zitronenscheibe weich kochen $ welche etwa 2 Stunde dauern $	Der Sago wird zwei Mal mit heißem Wasser abgebrüht , mit kaltem , weichem Wasser zu Feuer gebracht und mit einigen Zitronenscheiben weich gekocht , welches etwa 2 Stunden dauert .	8	abgebrht
eine Pfund Reis werden abgebrüht $ in Wasser mit eine Stückchen Butter halb gar kochen $ auf eine Durchschlag schütten und mit Jus $ die man zurückstellen haben $ und eine Tasse Madeira gar kochen $	Ein Pfund Reis wird abgebrüht , in Wasser mit einem Stückchen Butter halb gahr gekocht , auf einen Durchschlag geschüttet und mit Jus , die man zurückgestellt hat , und einer Tasse Madeira gahr gekocht .	4	abgebrht
man nehmen ganz klein Gurke $ welche abgebrüht und waschen werden $ reiben eine jede mit Salz ab und lassen sie 24 Stunde liegen $	Man nimmt ganz kleine Gurken , welche abgebrüht und gewaschen werden , reibt eine jede mit Salz ab und läßt sie 24 Stunden liegen .	7	abgebrht
Reis $ welche gut abgebrüht sein $ werden mit Milch und d nötig Salz weich und ganz steif kochen $ unterdes werden gekocht und ganz fein gehackt Schinken mit sauer Sahne vermengen und lagenweise mit d Zwieback bestreut Formchen füllen und backen $	Reis , welcher gut abgebrüht ist , wird mit Milch und dem nöthigen Salz weich und ganz steif gekocht ; unterdeß wird gekochter und ganz fein gehackter Schinken mit saurer Sahne vermengt und lagenweis mit dem Zwieback bestreute Förmchen gefüllt und gebacken .	4	abgebrht
es werden eine Tasse Reis gut abgebrüht $ mit eine Stück fein Zimt in eine irden Topf zu eine Maß kochend Wasser geben $ weich kochen $ ohne Rühren durch eine Sieb schütten und mit Zucker versüßen $	Es wird eine Tasse Reis gut abgebrüht , mit einem Stück feinen Zimmet in einen irdenen Topf zu einem Maß kochendem Wasser gegeben , weich gekocht , ohne Rühren durch ein Sieb geschüttet und mit Zucker versüßt .	6	abgebrht
eine halb Pfund Sago werden abgebrüht $ in Milch gar und so steif kochen $ daß er sich vom Topf ablösen $	Ein halbes Pfund Sago wird abgebrüht , in Milch gahr und so steif gekocht , daß er sich vom Topfe ablös’t .	5	abgebrht
nachdem d Reis gut abgebrüht $ kochen man denselben mit Milch $ Zucker und Zitronenschale langsam gar und dick und rühren er mit 4 Eidotter ab $	Nachdem der Reis gut abgebrüht , kocht man denselben mit Milch , Zucker und Zitronenschale langsam gahr und dick und rührt ihn mit 4 Eidottern ab .	4	abgebrht
zugleich haben man Reis $ für jede Person eine Eßlöffel rechnen $ abgebrüht und in Bouillon $ wozu man so viel mehr Fleisch nehmen $ gar und dick kochen $ doch müssen d Korn ganz bleiben $	Zugleich hat man Reis , für jede Person einen Eßlöffel gerechnet , abgebrüht und in Bouillon , wozu man so viel mehr Fleisch genommen , gahr und dick gekocht ; doch müssen die Körner ganz bleiben .	12	abgebrht
d Bouillon werden nach No. 1 kochen $ fein Perlgrauben oder abgebrüht Reis gleich nach d Ausschäumen hineingeben $ auch werden zur Zeit wohl einige jung Wurzel $ Möhre $ und jung Entschotete Erbsen $ oder 1/2 Stunde vor d Anrichte Spargelkopf oder etwas Blumenkohl $ letztere vorher abkochen $ hinzufügen $	Die Bouillon wird nach No. 1 gekocht , feine Perlgrauben oder abgebrühter Reis gleich nach dem Ausschäumen hineingegeben , auch werden zur Zeit wohl einige junge Wurzeln ( Möhren ) und junge entschotete Erbsen , oder 1/2 Stunde vor dem Anrichten Spargelköpfe oder etwas Blumenkohl , letzterer vorher abgekocht , hinzugefügt .	11	abgebrht
drei Viertelpfund Reis werden in Wasser gehörig abgebrüht $ mit Milch langsam weich $ aber recht steif kochen $ doch müssen d Korn ganz bleiben $	Drei Viertelpfund Reis wird in Wasser gehörig abgebrüht , mit Milch langsam weich , aber recht steif gekocht ; doch müssen die Körner ganz bleiben .	7	abgebrht
es werden ¼ Pfund Sago oder Reis abgebrüht $ in Wasser $ ohne er zu rühren $ weich und dick kochen $ d Korn müssen ganz bleiben $ $ in d Terrine geben $ nebst reichlich Zucker $ Zimt und abgereiben Zitronenschale $ gut gewaschen und aufgekocht Korinthe mit ihr Brühe $ und wenn diese eine Stunde sich durchziehen $ eine Flasche rot Wein $ eben so viel Wasser mit Zucker versüßen $ hinzugeben $	Es wird ¼ Pfund Sago oder Reis abgebrüht , in Wasser , ohne ihn zu rühren , weich und dick gekocht ( die Körner müssen ganz bleiben ) , in die Terrine gegeben , nebst reichlich Zucker , Zimmet und abgeriebener Zitronenschale , gut gewaschenen und aufgekochten Korinthen mit ihrer Brühe , und wenn dies eine Stunde sich durchzogen , eine Flasche rothen Wein , eben so viel Wasser mit Zucker versüßt , hinzugegeben .	7	abgebrht
d Reis werden abgebrüht $ in Milch mit etwas ganz Zimt und Zitronenschale langsam gar und steif $ nicht breiig kochen $	Der Reis wird abgebrüht , in Milch mit etwas ganzem Zimmet und Zitronenschale langsam gahr und steif , nicht breiig gekocht .	3	abgebrht
man lassen 1 Unze abgebrüht isländisch Moos mit 1 1/8 Quart Wasser 3 Stunde bis zu 3 Tasse einkochen $	Man läßt 1 Unze abgebrühtes isländisches Moos mit 1 1/8 Quart Wasser 3 Stunden bis zu 3 Tassen einkochen .	4	abgebrht
man kochen d Reis $ nachdem er abgebrüht sein $ in Milch $ Zucker und Zimt weich und nicht zu steif $	Man kocht den Reis , nachdem er abgebrüht ist , in Milch , Zucker und Zimmet weich und nicht zu steif .	7	abgebrht
nachdem es gut waschen $ mit Wasser und Salz rein ausschäumen $ geben man d Brühe nach Verlauf von eine stark halb Stunde durch eine Sieb $ schwitzen wie in No. 2 $ Mehl in Butter $ schütten d Kalbfleischbrühe vom Bodensatz langsam hinzu $ geben eine petersilien- und einige scorzoner- Wurzel dazu $ so wie ½ Stunde vor d Anrichte abgebrüht Reis $ und kochen d Suppe langsam $ fest zudecken $ gar $	Nachdem es gut gewaschen , mit Wasser und Salz rein ausgeschäumt , gibt man die Brühe nach Verlauf von einer starken halben Stunde durch ein Sieb , schwitzt wie in No. 2 , Mehl in Butter , schüttet die Kalbfleischbrühe vom Bodensatz langsam hinzu , gibt eine Petersilien- und einige Scorzoner- Wurzeln dazu , so wie ½ Stunde vor dem Anrichten abgebrühten Reis , und kocht die Suppe langsam , fest zugedeckt , gahr .	61	abgebrht
nachdem es gut waschen $ in Wasser und Salz abschäumen $ geben man d Brühe nach Verlauf von eine halb Stunde durch eine Sieb $ schwitzen wie in No. 7 etwas Mehl in d Butter $ gießen d Kalbfleischbrühe vom Bodensatz langsam hinzu $ geben eine Petersilienwurzel $ auch $ wenn man sie haben $ einige Scorzone hinein $ sowie 1 Stunde vor d Anrichte abgebrüht Reis $	Nachdem es gut gewaschen , in Wasser und Salz abgeschäumt , gibt man die Brühe nach Verlauf von einer halben Stunde durch ein Sieb , schwitzt wie in No. 7 etwas Mehl in die Butter , gießt die Kalbfleischbrühe vom Bodensatz langsam hinzu , gibt eine Petersilienwurzel , auch , wenn man sie hat , einige Scorzonern hinein , sowie 1 Stunde vor dem Anrichten abgebrühten Reis .	65	abgebrht
haben man d Gans nach I. zum Braten vorrichten $ so füllen man d Leib mit in 4 Teil geschneiden Apfel $ welche man auch mit Rosine oder Korinthe oder mit getrocknet abgebrüht Zwetsche vermischen können $	Hat man die Gans nach I. zum Braten vorgerichtet , so füllt man den Leib mit in 4 Theile geschnittenen Aepfeln , welche man auch mit Rosinen oder Korinthen oder mit getrockneten abgebrühten Zwetschen vermischen kann .	32	abgebrht
man kochen nach d Größe d Form ½ $ ¾ Pfund abgebrüht Reis mit Milch und eine Stück frisch Butter gar $ aber nicht zu weich $ rühren d nötig Zucker $ sowie die von 4--6 Ei zu steif Schaum geschlagen Weiße durch $	Man kocht nach der Größe der Form ½ — ¾ Pfund abgebrühten Reis mit Milch und einem Stück frischer Butter gahr , aber nicht zu weich , rührt den nöthigen Zucker , sowie das von 4—6 Eiern zu steifem Schaum geschlagene Weiße durch .	11	abgebrht
d Flosse werden $ so weit d Außenseite gehen $ abschneiden $ Fuß und Bauchplatte in kochend Wasser abgebrüht $ wodurch d Haut schuppenweise abziehen werden können $	Die Flossen werden , so weit die Außenseite geht , abgeschnitten , Füße und Bauchplatte in kochendem Wasser abgebrüht , wodurch die Haut schuppenweise abgezogen werden kann .	18	abgebrht
d Pflaume werden in heiß Wasser abwaschen $ Zwetsche abgebrüht $ sehen Compotes $ $ und in wenig Wasser so lange langsam kochen $ bis sich d Steig herausdrücken lassen $	Die Pflaumen werden in heißem Wasser abgewaschen , Zwetschen abgebrüht ( siehe Compotes ) , und in wenig Wasser so lange langsam gekocht , bis sich die Steige herausdrücken lassen .	9	abgebrht
eine halb Pfund Reis werden gut abgebrüht $ mit Bouillon $ d nötig Salz und mit Krebsbutter gar und dick kochen $ zuletzt eine Glas Madeira durchrühren $	Ein halbes Pfund Reis wird gut abgebrüht , mit Bouillon , dem nöthigen Salz und mit Krebsbutter gahr und dick gekocht , zuletzt ein Glas Madeira durchgerührt .	6	abgebrht
eine Viertel Pfund abgebrüht Reis werden mit Milch $ eine Stück Vanille und 8 Lot Zucker gar und dick kochen $	Ein Viertel Pfund abgebrühter Reis wird mit Milch , einem Stück Vanille und 8 Loth Zucker gahr und dick gekocht .	3	abgebrht
zugleich können man Reis $ für jede Person ½ Eßlöffel voll rechnen $ abgebrüht $ in abgeklärt Bouillon $ wozu man so viel mehr Fleisch rechnen müssen $ gar und dick kochen $ doch müssen d Korn ganz bleiben $	Zugleich kann man Reis , für jede Person ½ Eßlöffel voll gerechnet , abgebrüht , in abgeklärter Bouillon , wozu man so viel mehr Fleisch rechnen muß , gahr und dick kochen , doch müssen die Körner ganz bleiben .	13	abgebrht
man kochen d abgebrüht Reis in Milch und eine Stück frisch Butter gar $ aber nicht zu weich $	Man kocht den abgebrühten Reis in Milch und einem Stück frischer Butter gahr , aber nicht zu weich .	3	abgebrht
