sentence_lemma	sentence_token	target_index	original_word
d Sago werden abgebrüht $ in 1 Quart Milch gar und steif kochen $ daß er sich vom Topf ablösen $	Der Sago wird abgebrüht , in 1 Quart Milch gahr und steif gekocht , daß er sich vom Topfe ablöst .	3	abgebrht
man können $ da d Vanille sehr teuer sein $ für 1 Sgr. mit Zucker gestoßen Vanille zur Hälfte lose in eine abgebrüht Läppchen binden $ mit d Sauce zu Feuer setzen $	Man kann , da die Vanille sehr theuer ist , für 1 Sgr. mit Zucker gestoßener Vanille zur Hälfte lose in einem abgebrühten Läppchen gebunden , mit der Sauce zu Feuer setzen .	22	abgebrht
es werden dazu eine fleischig Stück nehmen $ wie oben ausschäumen $ d Brühe durch eine Sieb gießen und mit eine Stückchen frisch Butter und abgebrüht Reis gar kochen $	Es wird dazu ein fleischiges Stück genommen , wie oben ausgeschäumt , die Brühe durch ein Sieb gegossen und mit einem Stückchen frischer Butter und abgebrühtem Reis gahr gekocht .	25	abgebrht
von d Zeitpunkt an $ wo d Fohlen absetzen werden $ können man er manchmal warm Mash $ mit heiß Wasser abgebrüht Weizenkleie $ mit darunter gemischt Hafer verabreichen $	Von dem Zeitpunkte an , wo das Fohlen abgesetzt wurde , kann man ihm manchmal warmes Mash ( mit heissem Wasser abgebrühte Weizenkleie ) mit darunter gemischtem Hafer verabreichen .	21	abgebrht
eine Pfund Catharinenpflaumen $ oder gut Zwetsche $ werden gut abgebrüht und in etwas Wasser so lange langsam kochen $ bis sich d Stein herausdrücken lassen $ dann werden sie mit d Brühe $ ½ Flasche weiß Wein $ 12 Lot Zucker $ Saft und Schale eine Zitrone in eine irden Topfchen fest zudecken $ ganz langsam weich kochen $	Ein Pfund Catharinenpflaumen , oder gute Zwetschen , werden gut abgebrüht und in etwas Wasser so lange langsam gekocht , bis sich die Steine herausdrücken lassen , dann werden sie mit der Brühe , ½ Flasche weißem Wein , 12 Loth Zucker , Saft und Schale einer Zitrone in einem irdenen Töpfchen fest zugedeckt , ganz langsam weich gekocht .	10	abgebrht
haben man d Gans nach A. No. 3 zum Braten vorrichten $ füllen man d Leib mit in 4 Teil geschneiden Apfel $ unter welche man nach Belieben Rosine oder Korinthe $ oder auch abgebrüht Pflaume mischen können $	Hat man die Gans nach A. No. 3 zum Braten vorgerichtet , füllt man den Leib mit in 4 Theile geschnittenen Aepfeln , unter welche man nach Belieben Rosinen oder Corinthen , oder auch abgebrühte Pflaumen mischen kann .	34	abgebrht
