sentence_lemma	sentence_token	target_index	original_word
d $ Gott $ $ die haben sie eigentlich sagen wollen $ d. h. diejenige Dame $ welche als Vertreter d übrig Frauenpublikum im Lyzeum für sich eine zusagend Art von Geistesnahrung verlangen haben $ sein d maßgebend Erwähler sein und es sollen nun nur darauf ankommen $ auch d weit sich anfindend Publikum zu genügen oder $ wie Miss Archer in ihr Unternehmersprache sich ausdrücken $ zu $ gefallen $ $	Die „ Götter “ , das hatte sie eigentlich sagen wollen , d. h. diejenigen Damen , welche als Vertreter des übrigen Frauenpublicums im Lyceum für sich eine zusagendere Art von Geistesnahrung verlangt hatten , waren die maassgebenden Erwähler gewesen und es sollte nun nur darauf ankommen , auch dem weiter sich anfindenden Publicum zu genügen oder , wie Miss Archer in ihrer Unternehmersprache sich ausdrückte , zu „ gefallen “ .	24	Lyzeum
mit Eintritt d Stimmewechsel scheiden Mohr aus d Kreis d Domsänger $ studieren an d damals königlich bayerisch Lyzeum zu Salzburg Theologie und werden im Jahr 1815 zum Priester weihen $	Mit Eintritt des Stimmwechsels schied Mohr aus dem Kreise der Domsänger , studierte an dem damals königlich bayerischen Lyceum zu Salzburg Theologie und wurde im Jahre 1815 zum Priester geweiht .	18	Lyzeum
nur wenige sein Militärdeserteur $ noch wenige sein schon in Kerker sein $ manche sein in Kontumaz verurteilen $ so d Major in d 12. Legion $ Professor Dupont am Lyzeum Corneille $	Nur wenige sind Militärdeserteurs , noch weniger sind schon in Kerkern gewesen ; manche sind in Kontumaz verurtheilt , so der Major in der 12. Legion , Professor Dupont am Lyceum Corneille .	30	Lyzeum
23 Personenbahnhof Marseille-Avignon $ 24 Lyzeum $ 25 Place St. Michel $ 26 Militär-Spital $ 27 Kurs Du Chapitre und Boulevard Longchamp $ 28 Palais d arts de Longchamp $ 29 Boulevard Baille $ 30 Gefängnis und Spital $ 31 Prado-Bahnhof $ Gare Du Prado $ $	23 Personenbahnhof Marseille-Avignon , 24 Lyceum , 25 Place St. Michel , 26 Militär-Spital , 27 Cours du Chapitre und Boulevard Longchamp , 28 Palais des Arts de Longchamp , 29 Boulevard Baille , 30 Gefängniss und Spital , 31 Prado-Bahnhof ( Gare du Prado ) .	5	Lyzeum
diese Manier $ ich so ganz selbstverständlich zu verabschieden $ nebst d Phrase vom $ wollen wir hoffen $ sein angesichts die $ was ich nicht bloß geistig für d Lyzeum $ sondern auch ökonomisch für d Börse Miss Archer tun haben $ äußerst verletzen $ und da d ganz Sache vielleicht ausschließlich auf eine Miß-Auffaßung vom Vortrag und d erwähnt Rivalität her beruhen können $ so glauben ich mich verpflichten $ vor ander Schritt d Fräulein meine Standpunkt durch eine kurz Antwort $ wie folgen $ klarmachen $ $ 5. Mai 1876 $	Diese Manier , mich so ganz selbstverständlich zu verabschieden , nebst der Phrase vom „ wollen wir hoffen “ war Angesichts dessen , was ich nicht blos geistig für das Lyceum , sondern auch ökonomisch für die Börse Miss Archers gethan hatte , äusserst verletzend , und da die ganze Sache vielleicht ausschliesslich auf einer Miss-Auffassung vom Vortrag und der erwähnten Rivalität her beruhen konnte , so glaubte ich mich verpflichtet , vor andern Schritten dem Fräulein meinen Standpunkt durch eine kurze Antwort , wie folgt , klarzumachen : „ 5. Mai 1876 .	30	Lyzeum
er bringen er nach Aix zu eine seine alt Schulfreund $ welche dort Professor am Lyzeum sein $	Er brachte ihn nach Aix zu einem seiner ältesten Schulfreunde , welcher dort Professor am Lyceum war .	15	Lyzeum
Zyklostoma H. Haines Ann. Lyzeum n. h. New_York $ Oct. 1855 $ 5. $ 12_-_15 $	Cyclostoma H. Haine’s Ann. Lyceum n. h. New-York , Oct. 1855 . 5. , 12—15 .	4	Lyzeum
eine Rivalein von Miss Archer $ und zwar eine solch $ welche selbst Frauenverein leiten $ haben diese Stelle d Vortrag dahin deuten $ ich haben d Schwäche d Lyzeum richtig treffen $ und d Umstand $ dass diese Auffaßung vielfach weiter verbreiten werden $ geben meine Widersacher Gelegenheit $ die $ was sie bisher durch anscheinend sachlich Grund gegen ich nicht haben erreichen können $ nun durch Reizung d geschäftlich Empfindlichkeit d Inhaberin d Lyzeum durchsetzen $	Eine Rivalin von Miss Archer , und zwar eine solche , welche selbst Frauenvereine leitete , hatte diese Stelle des Vortrags dahin gedeutet , ich hätte die Schwächen des Lyceums richtig getroffen , und der Umstand , dass diese Auffassung vielfach weiter verbreitet wurde , gab meinen Widersachern Gelegenheit , das , was sie bisher durch anscheinend sachliche Gründe gegen mich nicht hatten erreichen können , nun durch Reizung der geschäftlichen Empfindlichkeit der Inhaberin des Lyceums durchzusetzen .	29	Lyzeum
von eine Selbständigkeit eine Realschulesystem neben d Gymnasialsystem in eigen Anstalten mit eigen Lehrer $ womit d Prinzip d Bifurkation erst beseitigen werden werden $ sein nach wie vor keine Rede $ d realistisch Fächer bleiben nach wie vor Fächer d Lyzeum $ wenn sie auch nicht mehr wie früh gerade Sektion d Sciences heißen $ und daher bleiben für deutsch Logik d Bestimmung d Circulärs vom 21. März 1863 unverständlich $ nach welche zwar d Bifurkationssystem beseitigen sein $ aber dennoch in demselben Lyzeum eine Examen für d Lettres im früh angegeben Sinn d Bakkalaureat es Lettres $ eine andere für d Sciences d Bakkalaureat es Sciences geben sollen $ neben die noch d Examen für d mathematiques speciales d Bedingung d Eintritt in d Ecole Polytechnique und von diese in d Ecole d ponts et Chaussee möglich machen $	Von einer Selbständigkeit eines Realschulsystems neben dem Gymnasialsystem in eignen Anstalten mit eignen Lehrern , womit das Princip der Bifurcation erst beseitigt werden würde , ist nach wie vor keine Rede ; die realistischen Fächer bleiben nach wie vor Fächer des Lyceums , wenn sie auch nicht mehr wie früher gerade section des sciences heißen ; und daher bleibt für deutsche Logik die Bestimmung des Circulärs vom 21. März 1863 unverständlich , nach welchem zwar das Bifurcationssystem beseitigt sein , aber dennoch in demselben Lyceum ein Examen für die lettres im früher angegebnen Sinne des baccalauréat ès lettres , ein andres für die sciences des baccalauréat ès sciences geben soll , neben denen noch das Examen für die mathématiques spéciales die Bedingung des Eintrittes in die École polytechnique und von dieser in die École des ponts et chaussées möglich macht .	84	Lyzeum
