sentence_lemma	sentence_token	target_index	original_word
d Musik tragen nicht so wie Plastik und Malerei anderwärts her genehmen Gestalt auf eine gegen dieselbe indifferent Stoff über $ sie errichten nicht $ wie d Architektur $ aus unorganisch $ formlos Masse eine Gebäude $ die Gestalt von d Phantasie ganz selbständig $ wenn auch immerhin mit Rücksicht auf d Beschaffenheit d Material $ konstruieren sein $ sie können nicht objektiv bilden $ nicht Gestalt in eigentlich Sinn schaffen $ sie können nur d Tonmaterial in Bewegung setzen $ nur Tonverknüpfung verschieden Art hervorbringen $ ihr Gebilde sein bloß Reihe und Gewebe von Klang $ die nie zu plastisch Objektivität und Individuellalität gelangen $ und bei die Hervorbringung sie schlechthin binden sein an d Qualität d Material selbst $ die sie sich bedienen $ d. h. an eine Reihe von Verhältnis d Intervall $ d Akkord $ d wohl- und Mißklang $ welche in d natürlich Gehörorganisation ihr Grundlage haben und daher d künstlerisch Tätigkeit mit unabänderlich Naturnotwendigkeit gegenüberstehen $ d Material d Musik sein nicht eine indifferent $ formlos $ sondern es haben schon in sich selbst eine Gesetzmäßigkeit $ eine Mannigfaltigkeit fest $ charakteristisch Form und Verhältnis $ welche zwar unendlich viel und verschieden Toncombination zulassen und in diese Beziehung d Komposition d frei Spielraum gewähren $ aber sie doch vorausgehen als gegeben Element $ die sie sich überall bedienen müssen $	Die Musik trägt nicht so wie Plastik und Malerei anderwärts her genommene Gestalten auf einen gegen dieselben indifferenten Stoff über , sie errichtet nicht , wie die Architektur , aus unorganischen , formlosen Massen ein Gebäude , dessen Gestalt von der Phantasie ganz selbständig , wenn auch immerhin mit Rücksicht auf die Beschaffenheit des Materials , construirt ist , sie kann nicht objectiv bilden , nicht Gestalten in eigentlichem Sinne schaffen , sie kann nur das Tonmaterial in Bewegung setzen , nur Tonverknüpfungen verschiedener Art hervorbringen ; ihre Gebilde sind blos Reihen und Gewebe von Klängen , die nie zu plastischer Objectivität und Individualität gelangen , und bei deren Hervorbringung sie schlechthin gebunden ist an die Qualität des Materials selbst , dessen sie sich bedient , d. h. an eine Reihe von Verhältnissen der Intervalle , der Accorde , des Wohl- und Mißklangs , welche in der natürlichen Gehörorganisation ihre Grundlage haben und daher der künstlerischen Thätigkeit mit unabänderlicher Naturnothwendigkeit gegenüberstehen ; das Material der Musik ist nicht ein indifferentes , formloses , sondern es hat schon in sich selbst eine Gesetzmäßigkeit , eine Mannigfaltigkeit fester , charakteristischer Formen und Verhältnisse , welche zwar unendlich viele und verschiedene Toncombinationen zulassen und in dieser Beziehung der Composition den freisten Spielraum gewähren , aber ihr doch vorausgehen als gegebene Elemente , deren sie sich überall bedienen muß .	142	Miklang
d Schullehrer müssen alle Fleiß daran wenden $ daß sowohl bei d Vorsprechen $ als bei d Nachsprechen sämtlich Kind $ Ton und Nachdruck auf d Wort legen werden $ auf welche es ankommen $ damit d äußerst widrig $ singend und einförmig Mißklang $ mit welche d Kind gewöhnlich eine biblisch Stelle hersagen $ sich aus d Schule verlieren $	Der Schullehrer muß allen Fleiß daran wenden , daß sowohl bei dem Vorsprechen , als bei dem Nachsprechen sämmtlicher Kinder , Ton und Nachdruck auf die Worte gelegt werden , auf welche es ankommt ; damit der äußerst widrige , singende und einförmige Mißklang , mit welchem die Kinder gewöhnlich eine biblische Stelle hersagen , sich aus den Schulen verliere .	43	Miklang
eine jäh Entsetzen reissen an meine Herz $ ich hören noch $ wie man rings aufschreien $ wie d Musik mit eine grell Mißklang abbrechen $ sehen $ wie man von alle Seite auf wir zustürzen $ dann drehen sich alle um ich und meine Sinn vergehen $ $ $	Ein jähes Entsetzen riß an meinem Herzen ; ich hörte noch , wie man rings aufschrie , wie die Musik mit einem grellen Mißklang abbrach ; sah , wie man von allen Seiten auf uns zustürzte — dann drehte sich Alles um mich und meine Sinne vergingen . — —	23	Miklang
wer Sold geben $ machen auch Anspruch $ die sich d Empfangende nicht entziehen können $ und da $ wo d lockend Aussicht auf Gewinn poetisch Tafelrunde bilden $ welche sich um freigebig Fürst $ wie Pisistratos und hier $ sammeln $ da treten auch mancherlei Schaden höfisch Kunst und mancherlei Mißklang $ selbst bei so hervorragend Geist $ wie Pindar $ Simonides $ Ibykos zu Tag $	Wer Sold giebt , macht auch Ansprüche , denen sich der Empfangende nicht entziehen kann , und da , wo die lockende Aussicht auf Gewinn poetische Tafelrunden bildete , welche sich um freigebige Fürsten , wie Pisistratos und Hiero , sammelten , da traten auch mancherlei Schäden höfischer Kunst und mancherlei Mißklänge , selbst bei so hervorragenden Geistern , wie Pindar , Simonides , Ibykos zu Tage .	51	Miklang
ebenso führen d zu häufig Wiederholung desselben Vokal zum Mißklang $ Kakophonie $ $ z. B. $	Ebenso führt die zu häufige Wiederholung desselben Vokals zum Mißklang (== Kakophonie ) , z. B. :	9	Miklang
denn d Sinn haben auf d Seele $ die sie d äußerlich wahrgenehmen und Empfindene mitteilen $ eine so entschieden Einwirkung $ und Lust oder Unlust d Sinn befördern oder stören so sehr d Seelentätigkeit $ dass auch eine sprachlich Darstellung $ welche d Gehör wohltuen haben $ leicht verstehen $ leicht überschauen $ leicht reproduzieren werden als eine $ die d Gehör durch Mißklang verletzen $	Denn die Sinne haben auf die Seele , der sie das äusserlich Wahrgenommene und Empfundene mittheilen , eine so entschiedene Einwirkung , und Lust oder Unlust der Sinne befördern oder stören so sehr die Seelenthätigkeit , dass auch eine sprachliche Darstellung , welche dem Gehör wohlgethan hat , leichter verstanden , leichter überschaut , leichter reproduciert wird als eine , die das Gehör durch Missklang verletzt .	64	Miklang
wie wollen man d verwandt Ton treffen $ um diese Mißklang in Einklang auflösen $	Wie will man den verwandten Ton treffen , um diesen Mißklang in Einklang aufzulösen !	10	Miklang
hier werden jede Ton zerquetschen $ verunstalten und misshandeln $ jede Naturlaut zum quälend $ ohrenzerreißend Mißklang umwandeln $ dort werden d Hauch zur Musik $ d Musik zu d herrlich und reich Liebesgedicht in Klang und Ton $	Hier wird jeder Ton zerquetscht , verunstaltet und gemißhandelt , jeder Naturlaut zum quälenden , ohrenzerreißenden Mißklange umgewandelt : dort wird der Hauch zur Musik , die Musik zu dem herrlichsten und reichsten Liebesgedichte in Klängen und Tönen .	16	Miklang
d Mangel und Mißklang $ welche hieraus entstehen $ können aber teils durch d Vermittlung von Weiß $ Schwarz $ grau $ so wie durch d Verhältnis d Ton und Schattierung $ teils durch d Form eine Körper und durch Abstand d Körper von einander mildern werden oder d mangelnd abstrakt Farbenschönheit durch d Bestimmtheit d charakteristisch Bezeichnung ersetzen $	Die Mängel und Mißklänge , welche hieraus entstehen , können aber theils durch die Vermittlung von Weiß , Schwarz , Grau , so wie durch das Verhältniß der Töne und Schattirungen , theils durch die Formen eines Körpers und durch Abstand der Körper von einander gemildert werden oder die mangelnde abstracte Farbenschönheit durch die Bestimmtheit der charakteristischen Bezeichnung ersetzen .	3	Miklang
Treten nun mehr als zwei Farbe zusammen $ so werden zwar d Mangel oder Mißklang in ihr Verbindung auch durch d Fortbewegung d Auge zu weit Farbe mildern $ d obig Bestimmung behaupten aber doch in d Grad Geltung $ in welche jene sich als zusammengehörig darstellen $	Treten nun mehr als zwei Farben zusammen , so wird zwar der Mangel oder Mißklang in ihrer Verbindung auch durch die Fortbewegung des Augs zu weiteren Farben gemildert , die obigen Bestimmungen behaupten aber doch in dem Grade Geltung , in welchem jene sich als zusammengehörig darstellen .	14	Miklang
diese haben wesentlich seine Grund im Mangel d Farbe $ d Farbe lösen aber Mißklang d Linie nicht nur überhaupt $ sondern speziell auch dadurch auf $ daß sie d Auge auf d geistig Tiefe d Ausdruck hinlenken $ d letztere Form d Auflösung nehmen d Umweg durch d Furchtbare $ auch nur im weit Sinn Erhabene $ oder d Komische $ und diese weit Gebiet d ästhetisch Versöhnung mit d Häßliche sein denn d Bildnerkunst ebenfalls verschließen $	Dieß hat wesentlich seinen Grund im Mangel der Farbe ; die Farbe löst aber Mißklänge der Linie nicht nur überhaupt , sondern speziell auch dadurch auf , daß sie das Auge auf die geistigen Tiefen des Ausdrucks hinlenkt ; die letztere Form der Auflösung nimmt den Umweg durch das Furchtbare , auch nur im weiteren Sinn Erhabene , oder das Komische , und dieses weite Gebiet der ästhetischen Versöhnung mit dem Häßlichen ist denn der Bildnerkunst ebenfalls verschlossen .	14	Miklang
treten aber nicht als Farbe ihr Kleid $ sondern anderswie eine gelb in ihr Nähe $ so können durch d verschieden anderweitig Farbenton $ Schatten d sich dazwischen ziehen $ d Mißklang sich aufheben $	Tritt aber nicht als Farbe ihres Kleids , sondern anderswie ein Gelb in ihre Nähe , so kann durch die verschiedensten anderweitigen Farbentöne , Schatten die sich dazwischen ziehen , der Mißklang sich aufheben .	31	Miklang
Tritt z. B. mit eine tief Blau eine dünn Grün zusammen $ so sein d Mißklang empfindlich $ dagegen wo sich dunkel $ ölig $ schwärzlich Grün von tief Blau absetzen $ stellen sich d nötig Gegensatz her $	Tritt z. B. mit einem tiefen Blau ein dünnes Grün zusammen , so ist der Mißklang empfindlich ; dagegen wo sich dunkles , öligtes , schwärzliches Grün von tiefem Blau absetzt , stellt sich der nöthige Gegensatz her .	15	Miklang
unter diese drei Fall können d zweit $ d Mißklang $ d schlechthinnig Dissonanz $ nur als kurz $ rasch verklingend $ jedoch auch sehr wirksam Durchgangsmoment gebrauchen werden $	Unter diesen drei Fällen kann der zweite , der Mißklang , die schlechthinige Dissonanz , nur als kurzes , rasch verklingendes , jedoch auch sehr wirksames Durchgangsmoment gebraucht werden .	9	Miklang
doch behalten auch unter diese Zusammenstellung $ um Goethe Ausdruck zu brauchen $ diejenige immer noch eine gewiß Recht $ die sich gegen Rot steigern $ denn sie deuten eine Fortschreiten an $ gelb und grün aber und Blau und Grün steigern sich eigentlich nicht $ sondern in beide Paar stehen d indifferent Farbe auf d eine Seite und auf d ander d eine diejenige Farbe $ die Indifferenz sie sein $ und diese sein eine wirklich Mißklang $	Doch behalten auch unter diesen Zusammenstellungen , um Göthes Ausdruck zu brauchen , diejenigen immer noch ein gewisses Recht , die sich gegen Roth steigern , denn sie deuten ein Fortschreiten an ; Gelb und Grün aber und Blau und Grün steigern sich eigentlich nicht , sondern in beiden Paaren steht die indifferente Farbe auf der einen Seite und auf der andern die eine derjenigen Farben , deren Indifferenz sie ist , und dieß ist ein wirklicher Mißklang .	77	Miklang
