sentence_lemma	target_index	cluster	lemma	sentence_token	identifier
d Garnison bestehen aus 150 gut gekleidet Soldat von d verschieden Hautfarbe $ meist Mulatte und Schwarze aus Timur $ von wo auch viel Sklave nach Macao bringen werden $	14	0	Mulatte	Die Garnison bestand aus 150 gut gekleideten Soldaten von der verschiedensten Hautfarbe , meist Mulatten und Schwarzen aus Timur , von wo auch viele Sclaven nach Macao gebracht wurden .	berg_ostasien04_1873-2793-14
was unter unsere Auge vorgehen $ lassen jedenfalls kaum glauben $ dass aus Mulatte eine fest $ unveränderlich $ alle Sturm d Zeit überlebend Typus hervorgehen können $ d Treibsand sein nicht beweglich und unbeständig als gerade diese Bastard $ hier müssen wir also d Erfahrung zum Trotz $ voraussetzen $ d undenkbar $ die nie Beobachtete sein bei d Beduine geschehen $	13	0	Mulatte	Was unter unseren Augen vorgeht , lässt jedenfalls kaum glauben , dass aus Mulatten ein fester , unveränderlicher , alle Stürme der Zeit überlebender Typus hervorgehen könnte ; der Treibsand ist nicht beweglicher und unbeständiger als gerade dieser Bastard ; hier müssten wir also der Erfahrung zum Trotz , voraussetzen , das Undenkbare , das nie Beobachtete sei bei den Beduinen geschehen .	chamberlain_grundlagen01_1899-4308-13
d Statthalter Don Manuel Centurion haben alsbald eine paar Haus $ welche spanisch $ die heißen nicht indianisch $ Familie $ Weiße und Mulatte $ bei d Schanze bauen $ d Titel Ciudad De San Carlos geben $	23	0	Mulatte	Der Statthalter Don Manuel Centurion hatte alsbald ein paar Häuſern , welche ſpaniſche ( das heißt nicht indianiſche ) Familien , Weiße und Mulatten , bei der Schanze gebaut , den Titel Ciudad de San Carlos gegeben .	humboldt_aequinoktial04_1859-1887-23
auf d erst Lagerplatz $ noch in dicht Nähe von Cuyaba $ schließen sich wir endlich d klein Mulatte Manoel an $	18	0	Mulatte	Auf dem ersten Lagerplatz , noch in dichtester Nähe von Cuyabá , schloss sich uns endlich der kleine Mulatte Manoel an .	steinen_naturvoelker_1894-934-18
Rasse heißen aber im genau Sinn eine solch durch Degeneration entstehen Charakter $ die durch d Fortpflanzung unausbleiblich und notwendig forterben $ wie z. B. wenn Weiße mit d Neger Mulatte $ oder mit amerikanisch Indianer Mestissen zeugen $ welches hingegen bei d Spielart keine notwendig Folge sein $ wie Z B. wenn blauäugig Blonde mit braunäugig brünett Kind zeugen $	30	0	Mulatte	Rasse heißt aber im genauem Sinne ein solcher durch Degeneration entstandener Charakter , der durch die Fortpflanzung unausbleiblich und nothwendig forterbt , wie z. B. wenn Weiße mit den Negern Mulatten , oder mit amerikanischen Indianern Mestissen zeugen : welches hingegen bey den Spielarten keine nothwendige Folge ist ; wie z B. wenn blauäugige Blonde mit braunäugigen Brünetten Kinder zeugen .	blumenbach_naturgeschichte_1803-323-30
