sentence_lemma	target_index	cluster	lemma	sentence_token	identifier
at the last of the evening 's perseid and burrow down into the twin sleeping bag they share in the cold sierra night and bite josh gently on the shoulder $ $	15	0	bag	at the last of the evening 's Perseids and burrowed down into the twin sleeping bag they shared in the cold Sierra night and bit Josh gently on the shoulder . "	fic_1997_54828.txt-6-15
when a man try to grab my purse in a parking lot one friday evening and seaboy be with me $ i clobber him in the head with my shoulder bag $	30	0	bag	When a man tried to grab my purse in a parking lot one Friday evening and Seaboy was with me , I clobbered him in the head with my shoulder bag .	fic_1997_54717.txt-262-30
we be go na finally get this big bag of shit into the vehicle $ $	8	0	bag	We 're gon na finally get this big bag of shit into the vehicle . "	fic_1984_10714.txt-3154-8
an ancient boxer 's heavy bag lean in one corner $	5	0	bag	An ancient boxer 's heavy bag leaning in one corner .	fic_2002_14561.txt-10-5
while outline his objection to this project brian sit down at his desk $ uncover his container of coffee $ and upend his paper bag $	24	0	bag	While outlining his objections to this project Brian sat down at his desk , uncovered his container of coffee , and upended his paper bag .	fic_1974_10584.txt-27-24
they want bag of water and any dried buffalo meat the village could spare $	2	0	bag	They wanted bags of water and any dried buffalo meat the village could spare .	fic_1993_1040076.txt-1289-2
mr.- pancake however be an ardent foe of the federal reserve and be in fact one of those eccentric about whom one occasionally read $ hoard his entire life saving either under the proverbial mattress or $ as in mr.- pancake 's case $ in a hefty bag that	47	0	bag	Mr. Pancake however is an ardent foe of the federal reserve and is in fact one of those eccentrics about whom one occasionally reads , hoarding his entire life savings either under the proverbial mattress or , as in Mr. Pancake 's case , in a Hefty bag that	fic_2004_780513.txt-1938-47
apparently frustrate by resistance to his pet auto safety device $ the inflatable air bag $ nader lace into secretary of transportation william <nul> coleman jr $	14	0	bag	Apparently frustrated by resistance to his pet auto safety device , the inflatable air bag , Nader laced into Secretary of Transportation William T. Coleman Jr .	mag_1976_290953.txt-5-14
he turn the bag inside out and tie it off $	3	0	bag	He turned the bag inside out and tied it off .	fic_2005_30446.txt-137-3
ella enter from down right carry a bag of grocery $	7	0	bag	ELLA enters from down right carrying a bag of groceries .	fic_1976_13997.txt-1693-7
if they be not -- if over month of fight $ as soldier stream home in body bag $ the will of the anti-iraq alliance weaken $ and support among american politician dissolve into hand-wringing and recrimination -- then this whole exercise will add up only to a sterling example of something the world be not willing to do again $	17	0	bag	If they 're not -- if over months of fighting , as soldiers stream home in body bags , the will of the anti-Iraq alliance weakens , and support among American politicians dissolves into hand-wringing and recrimination -- then this whole exercise will add up only to a sterling example of something the world is not willing to do again .	mag_1990_387445.txt-29-17
i put my bag on the bed and turn back to the mirror $ then stop still $ in shock-i have almost fail to recognize myself $	3	0	bag	I put my bag on the bed and turned back to the mirror , then stopped still , in shock-I had almost failed to recognize myself !	fic_1997_54621.txt-255-3
after lift weight $ the last thing i need be to lug a bag of road salt up from the basement to make my step safe fir the world of journalism $	13	0	bag	After lifting weights , the last thing I needed was to lug a bag of road salt up from the basement to make my steps safe fir the world of journalism .	fic_1993_25033.txt-4939-13
while she have be otherwise occupy $ he have put the motorcycle up on its center stand and be $ as she return $ unhitch the gym bag from the back $	27	0	bag	While she had been otherwise occupied , he had put the motorcycle up on its center stand and was , as she returned , unhitching the gym bag from the back .	fic_1993_1040085.txt-3491-27
sheet $ pillow $ quilt $ with rolled-up rug and sleeping bag $ with bicycle $ ski $ rucksack $ english and western saddle $ inflate raft $	11	1	bag	sheets , pillows , quilts ; with rolled-up rugs and sleeping bags , with bicycles , skis , rucksacks , English and Western saddles , inflated rafts .	mag_2001_416301.txt-220-11
with one swift movement he gather up the icy sleeping bag $ press it close to him $ and stand $	10	1	bag	With one swift movement he gathers up the icy sleeping bag , presses it close to him , and stands .	fic_2005_28065.txt-108-10
