sentence_lemma	sentence_token	index_lemma	index_token	lemma
hit ankomma resande $ upp grekista aktiv ariuecn till $ man $ utom $ öfwade matros $	hit ankommen resande , uppgifwer Grekista aktiva ariuecn till 80,000 man , utom 30,020 öfwade matroser . 	6	6	aktiv
som aktiv will bära den kostbar och ny $ af stg sjelf komma til den naturlig och enkel $ astwingar ni hon den sä werkar dock twäng ingen bättring $ och med första frihet utbryta $ i löjcliga och kostbar fymptomer $	som aktiv will bära det kostbara och nya , af stg sjelf komma til det naturliga och enkla ; Astwingar Ni henne det sä werkar dock twäng ingen bättring , och med första frihet utbryter Mode-sjukan i löjcliga och kostbara fymptomer . 	1	1	aktiv
rysk trupp framrycka från all håll emöt donau $ och den vara väl ingen tvifvel underkastadt $ att man arnar blockera en turluska denan fästning och tillika operera aktiv ifrån varna $	Ryska trupperna framrycka från alla håll emöt Donau , och det är väl ingen tvifvel underkastadt , att man arnar blockera de Turluska Denan fästningarna och tillika operera aktivt ifrån Varna . 	28	28	aktiv
härtill vara $ dels att man vilja skona soldat $ helsa $ som mycket lida genom den stark hetta $ dels att den aktiv armé ej tycka	härtill är , dels att man vill skona soldaten » helsa , som mycket lider genom den starka hettan , dels att den aktiva armés ej tyckes 	23	23	aktiv
länge drbgdcs nied eldsläckningsämne $ som dock i rätkan lid wisade sig fkrträffcliga $ menighet mar nu simma aktiv $ oförtrulen och arbetsam $ utan liten otäkighel öfwer den swära watlubärningen $	längre drbgdcs nied Eldsläckningsämnet , som dock i rätkan lid wisade sin fkrträffcliga wärkan^ Menigheten mar nu sam aktiv , oförtrulen och arbetsam , utan minsta otäkighel öfwer den swära watlubärningen . 	18	18	aktiv
häruti skaffa sig en värn mot den aktiv armé $	häruti skaffa sig ett värn mot den aktiva armén . 	7	7	aktiv
regering spsielsätter sig med organisering as aktiv milis $ simma	Regeringen spsielsätter sig med organisering as aktiva Milisen / sam 	6	6	aktiv
de äro i sälffap aktiv alswarsamme $ sällan se man en mor le $ au	De äro i sälffap aktiv alswarsamme ; sällan ser man en Mor le , aU 	4	4	aktiv
låta anteckna sig till aktiv tjenstgöring $ hafwa tills widare blvkt $ blifwit anta $ dels för att icke alltför mycket blott hufwudstaden pk mili $ tärcr $ dels af financiella orsak denna trupp äro fördelta pa tjugu i hamn ligga transportfartyg $ och stola med första gynnande wind gä under segel $	låtit anteckna sig till aktiv tjenstgöring , hafwa tills widare blvkt 3,000 blifwit antagne , dels för att icke alltför mycket blotta hufwudstaden pK mili » tärcr , dels af financiella orsaker Dessa trupper äro fördelta pa tjugu i hamnen liggande transportfartyg , och stola med första gynnande wind gä under segel . 	4	4	aktiv
$ $ grefwe toll ha blifwil utnämna list riddare af $ georgs orden andra klaff $ till belöning för en förljenster han ädagalagt fä chef sbr aktiv arim $ under sednaste fältläg $	' : Grefwe Toll har blifwil utnämnd list Riddare af S:t GeorgS Ordens andra klaff , till belöning för de förljenster han ädagalagt fäftin chef sbr aktiva Arim-ens General-Stab under sednaste fältläg . 	26	26	aktiv
den aktiv och den passiv person $ sfvensom sjelfva ceremoni med all den $ äro behandla med all önsklig utförlighet $ af en motsvara moralisk styggelse äro en mången andra karakter och uppträde här teckna $	den aktiva och den passiva personen , Sfvensom sjelfva ceremonien med alla dess detaljer^ äro behandlade med all önsklig utförlighet — Af en motsvarande moralisk styggelse äro de flesta andra karakterer och uppträden här tecknas . 	1	1	aktiv
$ uppehålla senat ha $ z utfärda en senatskonsiilt af innehälla att en styrka af $ stola stalla till krigsminister disposition för att föröka en aktiv armcerna $ nemi $	— Uppehållande Senaten har d. z utfärdat ett Senatskonsiilt af innehäll att en styrka af 180,000 stola stallas till Krigsministerns disposition för att föröka de aktiva Armcerna , nemi . 	25	25	aktiv
$ magnus $ få äfwenledes reglera aua bolag aktiv och	E. Magnus , fom äfwenledes reglerar aUa Bolagets Aktiva och 	8	8	aktiv
$ vag testamentera hälft af inina privitdomäner till en qwarlefwande officer öch $ soldat wid franspssa arinen $ som frän 1792 till i3rs fäkta för nation ära och sjelfständighet utdelning ssall sse i förhällande till den tid $ de warit i aktiv tjenstgöring $	, vag testamenterar hälften af inina privitdomäner till de qwarlefwande Officerare öch ' soldater wid Franspssa arinen , som frän 1792 till i3rs fäktat för nationens ära och sjelfständighet- Utdelningen ssall sse i förhällande till den tid , de warit i aktiv tjenstgöring . 	41	41	aktiv
anmärkare söka widare insinuera $ såsom skola profektet innehålla inrättning af en ny brandkorps af 27 $ nia med nödig befäl och stor kostnad $ me $ rälta förhällandel vara $ all nuwarande brandwaktskorps blott skola öka med 6r nia $ för alt utgöra en ändamälscnligare organisera brandkorps $ under nödig befäl $ hwilkcn brcinekorps $ fördela i n kasern $ med cn aktiv spruta i hwardera kasern $ barde pä kallelse natt eller dag hasta de till hfelp $ hos hwilka eldsolpcka uppkomma och innan den hinna utbryta $ en äkgard som sakna wid nuwarande kldstäckningsanstaller $ der hjclpen $ först est $ eld $ medelst klämtning och larm famla $ och icke sällan ankomma kille eld kwä timme sednare an cldswädan af husfolk blifwil känd $	Anmärkaren söker widare insinuera , såsom skulle profektet innehålla inrättningen af en ny brandkorps af 27 ; nian med nödigt befäl och stor kostnad , me » rälta förhällandel är , all nuwarande Brandwaktskorps blott skulle ökas med 6r nian , för alt utgöra en ändamälscnligare organiserad brandkorps , under nödigt befäl , hwilkcn brcinekorps , fördelad i n kaserner , med cn aktiv spruta i hwardera kasernen , barde pä kallelse natt eller dag hasta dem till hfelp , hos hwilka eldsolpcka uppkommit och innan den hunnit utbryta : en äkgard som saknas wid nuwarande kldstäckningsanstaller , der hjclpen , först ester utbruten eld , medelst klämtning och larm famlas , och icke sällan ankommer kill elden kwä timmar sednare an cldswädan af husfolket blifwil känd . 	63	63	aktiv
broder $ den aktiv sakna och aldrig nog begrätne gustaf dea tredje $ witterhe4ens bestyddare $ wän och idkare $ ha knapt äta denna acadcmie gifwit en ny $ reise $ knapt $ och uplifwat dest yrke $ förrän den grusiigaste af all stag $ rafsa henne och hel rike $	Broder , den aktiv saknade och aldrig nog begrätne GUSTAF dea Tredje , Witterhe4ens Bestyddare , Wän och Idkare , hade knapt ät denna Acadcmie gifwit en ny wa« reise , knapt utstakat och uplifwat Dest yrken , förrän det grusiigaste af alla stag » rafsade Henne och hela Riket . 	3	3	aktiv
läsare $ ogilla således icke äfiyen ni aktiv bruk af	Läsare » ogillar således icke äfiyen ert aktivt bruk af 	7	7	aktiv
denna instrankning gär sä länge $ at den hammar uplysningen i ek land $ ak den stulle binda ost wid en system $ som mi ivid nogare pröfning lil äswentyrs finna wara swaga $ re än ek annan $ men derföre icke wägade motsäga $ om ben allenast aktiv later ost se sak pä en sida $ utan ak fä jämföra hwad som kunna sagås deremot $ wåga stäk mot stäf $ bewis mot bewis $ hwilket egentcligen kunna kalla pröfning $ hwad stada göra ben icke dä $	denna instrankning gär sä länge , at den hammar uplysningen i ek land , ak den stulle binda ost wid ett System , som mi ivid nogare pröfning lil äswentyrs funne wara swaga » re än ek annat , men derföre icke wägade motsäga ; om ben allenast aktiv later ost se saker pä en sida , utan ak fä jämföra hwad som kan sagås deremot , wåga stäk mot stäf , bewis mot bewis , hwilket egentcligen kan kallas pröfning ; hwad stada gör ben icke dä ? 	48	48	aktiv
as de sedan korrt tiv enrollera $ man vara ungefär hälft $ sitta i aktiv tillstånd $	As de sedan korrt tiv enrollerade 80,000 man är ungefär hälften r.dan satt i aktivt tillstånd . 	14	14	aktiv
der cape sä iiort antal af den aktiv milis som hen anse nödig $ och ställa na $ tionalgarderna till dejj disposition med rättighet att anwända de äfwen utom en särflilta stat $	der capen sä iiort antal af den aktiva milisen som hn anses nödigt , och ställer na » tionalgarderna till dejj disposition med rättighet att anwända dem äfwen utom de särflilta stater ? 	7	7	aktiv
nägot befäl $ förr än den aktiv krig utbryta $ i följa hwaraf referent ta stg anledning att göra en flaga panegyrik öfwer framliden h $ $ fältmarffalken grefwe est $ utan att jag med en enda ord i biografi för dest $ missöde beffyllt nämna fältmarskalk $ eller ali dag ens rimligen till general vegesacks owerkfamhet $ i tuffland ätminstone $ kunna föranleda $	nägot befäl , förr än det aktiva kriget utbröt , i följd hwaraf referenten tagit stg anledning att göra ett flags panegyrik öfwer framlidne H . E. Fältmarffalken Grefwe Esten , utan att jag med ett enda ord i biografien för dest » missöden beffyllt nämnde Fältmarskalk , eller ali dan ens rimligen till General Vegesacks owerkfamhet , i Tuffland ätminstone , kunnat föranleda . 	6	6	aktiv
att all gift mansperson frän 18 till 4s vara $ och ogift till 50 $ stola inrulleras bland den aktiv miufen $ samt all gifta frän 45 till 60 och ogift frän 50 till 60 bland den passiv $	att alla gifta manspersoner frän 18 till 4S är , och ogifta till 50 , stola inrulleraS bland den aktiva miUfen , samt alla gifta frän 45 till 60 och ogifta frän 50 till 60 bland den passiva . 	19	19	aktiv
wid den aktiv armäen $ stola inom 8 dag inställa sig $	wid den aktiva Armäen , stola inom 8 dagar inställa sig . 	2	2	aktiv
skola man wal gista til at hwartenda komma aktiv af nägot	Skulle man wal gista til at hwartenda kommer aktiv af nägot 	8	8	aktiv
uppbädade till tjenstgöring $ genom en k kesta dag utiärdadt cirkulär frän krigsminister hemförlofwas 17 af denna regementcr och blott tolf bibehålla i aktiv $ tjusa $ oberäknad grenadrerkompanierna $ som införlifwas med kongl $ garde $	uppbädade till tjenstgöring ; genom ett k kesta dagar utiärdadt cirkulär frän Krigsministern hemförlofwas 17 af dessa regementcr och blott tolf bibehållas i aktiv ' tjust , oberäknade grenadrerkompanierna , som införlifwas med Kongl , gardet . 	23	23	aktiv
som efter d 14 julli 1789 lämna frankrike $ vch icke kunna inbegripa i en redan tzjorda undantag $ stro för aktiv sörbudne at återkomma $	som efter d 14 Julli 1789 lämnat Frankrike , vch icke kunna inbegripas i de redan tzjorda undantag , stro för aktiv sörbudne at återkomma . 	21	21	aktiv
sophia eller sofia $ filosof eller philosoph $ filip eller philipp $ stephan eller stefan $ 0 $ $ llkwäl se man $ at romarne aldrig wägat striswa denna och dylik ord nied samma k som i felix eller filiusj utan aktiv uttrycka de med ph $ vch sä länge scholan wil sä hafwa $ böra mi samwetsgrant behälla samma ph $ för at ej göra förargelse i den larda weridén $ oaktadt wi äro lika fluge $ huru de prononcera den $	Sophia eller Sofia , Filosof eller philosoph , Filip eller philipp , Stephan eller Stefan , 0 f. w. Llkwäl ser man , at Romarne aldrig wägat striswa dessa och dylika ord nied samma k som i felix eller filiusj utan aktiv uttryckt dem med ph ; vch sä länge Scholan wil sä hafwa , böra mi samwetsgrant behälla samma ph , för at ej göra förargelse i den larda weridén ; oaktadt wi äro lika fluge , huru de prononcerat det . 	41	41	aktiv
ineralmajor pankratiews befäl $ i distrikt khoi befintlig trupp $ aftågade denna till sig ny bestämmelse $ oell den 20 november ofvertog general panktatiew i $ befäl öfver den aktiv arm venstra flygel $	ineralMajor Pankratiews befäl , i distriktet Khoi befintliga trupperna , aftågade dessa till sin nya bestämmelse , oell den 20 November ofvertog General Panktatiew i Baja&id befälet öfver den aktiva armens venstra flygel . 	29	29	aktiv
och om de instänga ej försvara af trupp till land $ hvilka blott för deri skulle bmve hindra att mera aktiv använda annorstädes $ kunna lätt hända $ såsom hr n $ anföra om en skepp i holland $ att de genom en coup de main af $ husar skola eröfra $ $	Och om de instängde ej försvaras af trupper till lands , hvilka blott för deris skull bMve hindrade att mera aktivt användas annorstädes , kunde lätt hända , såsom Hr N . anfört om ett skepp i Holland , att de genom en coup de main af landsatte- husarer skulle eröfra » . 	20	20	aktiv
$ gt $ frankrike för nästa ar $ komma likasom i ar att bestä af 60 $ coo man $ hwaraf hälft vara bestämd för en aktiv armé $ öst $ hälft för $ $	& gt ; Frankrike för nästa ar , kommer likasom i ar att bestä af 60 , coo Man , hwaraf hälften är bestämd för de aktiva arméerna , öst ) hälften för Reserf-armeen . 	26	26	aktiv
$ $ $ cn 10 besluta $ att i anseende kill den orolig tillsiändct i rike $ öka ben aktiv milis nied $ man $ som endast äkta manadcr om stret göra tjenst $ emedan hel den bewäpnade styrka för narwarande icke utgöra $ man $ hwarifrän likwal 8000 $ för tillfällig orsak $ fa afräkna $	_ X&gt ; cn 10 beslöts , att i anseende kill det oroliga tillsiändct i Riket , öka ben aktiva milisen nied 12,000 man , som endast äkta manadcr om stret göra tjenst , emedan hela den bewäpnade styrkan för narwarande icke utgör 45,002 man , hwarifrän likwal 8000 , för tillfälliga orsaker , fa afräknas . 	19	19	aktiv
ärna äfven medelst lottning uttaga $ man lill krigstjenst $ af $ sorn öfverblefve efter den aktiv armé komplettera $ skola formera ny regementer alt använda emot amerika $	ärnade äfven medelst lottning uttaga Zs.oSo man lill krigstjenst ; af det.manskap sorn öfverblefve efter den aktiva arméns kompletterande , skulle formeras nya regementer alt användas emot Amerika . 	16	16	aktiv
ömse sida syna här inta sig winker $ qwarter $ och turkista soldat $ ej ännu kunna undertrycka sig owilja söva en $ $ ty enligt ärckilliga bref frän constailtinopel wandra en $ trupp wid balkan ifrån sine station $ sör att $ efter gammatt bruk $ tillbringa wintern $ fo $ i del beier $ wid egen brasa $ blott pä en punkt tycka dek ännu gä aktiv tillwäga $ nemligen i liwadien $ beorien ech tkarnanien $ hwarcst demetrius ipsilanti $ nästan utan att oroa $ marschera genom den incllan wikarne af salo $ a och $ ligga land och $ som den $ $ sätta sig i besittning af åistilliga befästade plats $	ömse sidor synas härarne intagit sina winker » qwarter , och Turkista Soldaten lycke- ej ännu kunna undertrycka sin owilja söv ett winterf.ilttäg ; ty enligt ärckilliga bref frän Constailtinopel wandra de irrsgulie.ra trupperna wid Balkan ifrån sine stationer , sör att , efter gammatt bruk , tillbringa wintern , fo » i del beier , wid egen brasa / Blott pä en punkt tyckes dek ännu gä aktivt tillwäga , nemligen i Liwadien , Beorien ech Tkarnanien , hwarcst Demetrius Ipsilanti , nästan utan att oroas , marscherar genom det incllan wikarne af Salo ' a och ^eirun liggande landet och , som det syne- , sätter sig i besittning af åistilliga befästade platser . 	68	68	aktiv
i bolivia vara ben pä lifstld $ utnä $ nnde president denna punkt p8 han bero hel regelmessigheten i wärk system $ utan att han derföre vara berättiga till nägon aktiv inblandning $	I Bolivia är ben pä lifstld ' utnä , nnde Presidenten denna punkt P8 honom beror hela regelmessigheten i wärk system , utan att han derföre är berättigad till nägon aktiv inblandning . 	30	30	aktiv
konung en kraftig föreställning häremot $ tillkännagifwande att medel wäl sunnes till utbetala $ af sold för manflap och underbefäl wld den aktiv arm $ men att lfficerarne mäste $ i sörhällande t b stna grad $ $ en del af fin lön innesikx tillika beswärade sig hr remisa öfwer widcrbörandes mistbrttk att tillsanda han i konung namn utfärda befallning rörande mänadtliga gratifikation utbeta $ lande tit wisia flyddlingar och andra obehörig person $ äsivensom han skildra nödwändigheten att liten utgift för $ $	Konungen en kraftig föreställning häremot , tillkännagifwande att medel wäl sunneS till utbetalande - af solden för manflap och underbefäl wld den aktiva armen , men att Lfficerarne mäste , i sörhällande t B stna grader , i&to en del af fina löner innesiKx tillika beswärade sig Hr Remisa öfwer widcrbörandes mistbrttk att tillsanda honom i Konungens namn utfärdade befallningar rörande mänadtliga gratifikationers utbeta , lande tit wisia flyddlingar och andra obehöriga personer , äsivensom han skildrade nödwändigheten att minsta utgifterna för bäsh^llningen . 	22	22	aktiv
tusen man stola fatta i aktiv tjenst $ och genast hafwa 4200 man linietruppar och 6000 man provincial milis uppbryta till galliciens gränsor $ de stola sammanträffa i astorga $	tusen man stola fattas i aktiv tjenst , och genast hafwa 4200 man Linietruppar och 6000 man Provincial Milis uppbrutit till Galliciens gränsor ; De stola sammanträffa i Astorga . 	5	5	aktiv
öfverbefälhafvare tor den aktiv armé ila till dan maji insändt rapport örn den operation till den i3 denna $ hvaraf följande vara den hufvudsaklig $ efter fiende reträtt från järnbol beordra generalmajorerne ragowski och sawadski att säll sig i besittning af defilé vid tschelikawak och tschenge $ sorn ännu vörö i turk våld $ äfvensom generallöjtnant krassowski anbefalla att från marasch utföra en rörelse rnot schumla $ i afsigt att komma i nära förbindelse med hufvudarmén $	ÖfverBefälhafvaren tor den aktiva armén Ilar till Dans Majit insändt rapporter örn dess operation till den i3 dennes , hvaraf följande är det hufvudsakliga : Efter fiendens reträtt från Järnbol beordrades GeneralMajorerne Ragowski och Sawadski att sälla sig i besittning af defiléerna vid Tschelikawak och Tschenge , sorn ännu vörö i Turkarnes våld , äfvensom GeneralLöjtnant Krassowski anbefalldes att från Marasch utföra en rörelse rnot Schumla , i afsigt att komma i närmare förbindelse med hufvudarmén . 	3	3	aktiv
erbjuda fyra månad till förrätta af all landtmannasyslor $ hvilka just äro årstid för en aktiv krig förande $	erbjuder fyra månader till förrättande af alla landtmannasyslor , hvilka just äro årstiden för ett aktivt krigs förande . 	15	15	aktiv
infalla krig tvänna klass beväring genast ingingo i aktiv tjenst $ så återstå trenne $	infallande krig tvänna klasser beväring genast ingingo i aktiv tjenst , så återstode trenne . 	8	8	aktiv
tryad eller treenighet $ hvars första person af manlig kön vara budha $ en symbol af den al $ strand kraft $ den andra af qvinlig kön mr dharrna $ den föda $ kraft typ $ den tredje $ som utgå af en båda första $ vara sanga $ de son $ som representera den nuvarande skapa kraft $ eller den aktiv skapare och verldsstyraren $	tryad eller treenighet , hvars första person af manligt kön är Budha , en symbol af den al » strands kraften ; den andra af qvinligt kön Mr Dharrna , den födande , kraftens typ ; den tredje , som utgår af de båda första , är Sanga , deras son , som representerar den nuvarande skapande kraften , eller den aktiva skaparen och verldsstyraren . 	61	61	aktiv
juni behaga mrddela mi $ allernädtgste vrivstcginm $ att t jag $ $ och under jag inseende $ lika i $ stad uvvflra spektakel $ kunna en som tilltro $ lia nog skicklighet $ för att wid sjelswa aktiv dibraga $	Juni behagat mrddela mi , Allernädtgste Vrivstcginm , att t mitt Teater-Hus , och under mitt inseende , lika i Göteborg- Stad uvvfLra Spektakel , kunna de som tilltro 8« Lia nog skicklighet , för att wid sjelswa aktiva dibraga . 	38	38	aktiv
den förljudas $ äro all permittera militär af kongl $ gärde inkalla tilt aktiv tjenstgöring $	det förljudes , äro alla permitterade militärer af kongl , gärdet inkallade tilt aktiv tjenstgöring . 	13	13	aktiv
den förljudas nu $ alt styrka af denna slag trupp vid den aktiv $ skola oka till trellie regementer $ $ ungefär 5o $ ooo man $ $	Det förljudes nu , alt styrkan af detta slags trupper vid den aktiva operations-armén skall okas till trellie regementer ( " ungefär 5o , ooo man ) . 	12	12	aktiv
kalla till vapen $ indelt i två klass $ den ena utgöra nationalgarde $ bestämdt till hemort försvar $ och den andra bildande den aktiv armé $ bestå af alle ogift invånare från 18 till 40 år $ 7 $ om den behöfs till fiende fördrifvande $ resa sig hel befolkning i massa $ utan afseende på ålder eller kön $	kallas till vapen , indelta i två klasser , den ena utgörande nationalgardet , bestämdt till hemortens försvar , och den andra bildande den aktiva armén , bestående af alle ogifta invånare från 18 till 40 år , 7 ) Om det behöfs till fiendens fördrifvande , reser sig hela befolkningen i massa , utan afseende på ålder eller kön . 	24	24	aktiv
ili oner $ forn bestodo af person frän 20 till 26 $ forn höra till konstription 6 sista klafier $ men ej ha blifwit kalla till den aktiv armeen $	ili oner , forn bestodo af personer frän 20 till 26 är^ forn hörde till konstriptionens 6 sista klafier , men ej hade blifwit kallade till den aktiva Armeen . 	27	27	aktiv
tacksamhet $ hembära aktiv ren offer ht holk beskyddare $	tacksamheten , hembär aktiv rena offer Ht Holkens Beskyddare . 	3	3	aktiv
$ lhafioaren för all aktiv armeerne $ general af infanteri först golonitschew kutusow $ inberätta till kejsare frän högqwarteret wid kyrkobyn bsrodins följande $ af d $	' lhafioaren för alla aktiva Armeerne , Generalen af Infanteriet Först Golonitschew Kutusow , inberättar till Kejsaren frän Högqwarteret wid Kyrkobyn Bsrodins följande : Af d . 	4	4	aktiv
regclmästigt $ och man pästär alt $ man stola wara bestämd till ben aktiv $ wid donau och $ man till livadien $	regclmästigt , och man pästär alt 20,000 man stola wara bestämda till ben aktiva Arln^en wid Donau och 30,000 man till Livadien . 	13	13	aktiv
civilisera europa $ ännu wara den band $ som inwänarena med hwarandra $ och mäta dygd som hon fordra $ aktiv wara med uplysningcn öfwercnsstämmandc $	civiliserade Europa , ännu wara det band , som inwänarena med hwarandra , och mätte dygder som hon fordrar , aktiv wara med uplysningcn öfwercnsstämmandc ! 	20	20	aktiv
$ stulle de bli alltför kostsam att underlätta $ emedan de till stor del lefwa af dagspenning $ och man säledes $ i fall man försätta de i aktiv tjenstgöring $ mäste loswa dcm akt dra försorg för de hustru och barn uppehälle $	£effi1 stulle de bli alltför kostsamma att underlätta , emedan de till största delen lefwa af dagspenning , och man säledes , i fall man försatte dem i aktiv tjenstgöring , mäste loswa dcm akt draga försorg för deras hustrurs och barns uppehälle . 	28	28	aktiv
i frankrike för nasta sr komma $ likasom i vara $ att besia af $ man $ hwaraf hälft vara bestämd för en aktiv armecrne och hälft för rcserftarmecn $	i Frankrike för nasta Sr kommer , likasom i är , att besia af 60,200 man , hwaraf hälften är bestämd för de aktiva Armecrne och hälften för RcserftArmecn . 	23	23	aktiv
för de nied sig $ och öfwar deni i kort utflygt $ låta deni wäga smä fall $ hwilka hon aktiv hindra $ i den hon styndar sig lil de hjelp $	för dem nied sig , och öfwar deni i korta utflygter , låter deni wäga smä fall , hwilka hon aktiv hindrar / i det hon styndar sig lil deras hjelp . 	20	20	aktiv
dtkts intit $ thuru it $ fij uppdrag att göra för brittisk handel sanssa fördel $ aktiv proposition $ och deribland den $ att för 20 vara erbjusa stor lzritannien en rxclufiv handel med ny grenada och benezuela $ denna oartad $ kunna lo $ maria del real $ pä sig fira gång férnpace anhällan $ icke få en $ onserence $ mmistern för uliifeé ärenverna $	dtktS Intit , thuru it had- fij uppdraget att göra för Brittiska handeln sanssa fördel , aktiva propositioner , och deribland den , att för 20 är erbjusa Stora LZritannien en rxclufiv handel med Nya Grenada och Benezuela ; detta oartadt , kunde Lon Ivs« Maria del Real , pä sin fira gånger férnpace anhällan , icke fS en » onserence n.cd Mmistern för uliifeé ärenverna . 	16	16	aktiv
komma säledes $ säival igenom sig inre organism $ som genom sig belägenhet $ att utgöra en nöowändig öfwergäng frän s passiv till den aktiv lifwet $ frän den mera $ akademista till den fri medborgerlig $ dä den nybildad läkare stall börja att tänka och werka $ icke säfom cn maschin $ drjfmen af yttre kraft $ utan sond en fullbildad man $ so n bära kraft inom sig $	kommer säledes , säival igenom sin inre organism , som genom sin belägenhet , att utgöra en nöowändig öfwergäng frän Set passiva till det aktiva lifwet , frän det mera jkol-lika Akademista till det fria medborgerliga , dä den nybildade läkaren stall börja att tänka och werka , icke säfom cn maschin , drjfmen af yttre krafter , utan sond en fullbildad man , so n bär kraften inom sig . 	24	24	aktiv
entlediga frän sig aktiv tjenst och $ poifcrré de cbre $ förlustig sig funktion $	entledigad frän sin aktiva tjenst och ex-deputcraden Poifcrré de Cbre , förlustig sina funktioner . 	3	3	aktiv
om $ aktiv hederlig person $ som kunna prest $ kontant cl $ $ god $	Om nä^on aktiv hederlig Person , som kan prester » kontant cl ! » god ? 	2	2	aktiv
