sentence_lemma	sentence_token	index_lemma	index_token	lemma
ix inta af fördom $ hwilkas uiplänande och ombyte mot andra dä altid bl r swlrare vch fordra en stor möda och lång lid $ pä denna gennd lare mi dä med skäl pästä $ at den ordning $ ben mildhet och ömhet $ som ofta göra musik lä angenäm för osi $ nödwändigt böra meddela imrvcken deraf äta wärk hjerta och wära böjelse $ hwarigenom besia sör manstkia samsmtdslcfnaden sä dyrbar $ kunna upwackas vch stärka $ ordning l bwilkcn egenstap hos medborgare af alka ständ l den vara den stom $ $ befalla wcrksam och driftig i stt koll $ som benpar l onom en lid och möda $ hwilken förhastande och förwirriiig ofta förspilla $ som utstaka en gränsor loge salt för dest myndighet $ och göra all han ögonblick nvniga til nedmännistjors gagn eller egen uvmumran $	ix intagen af fördomar , hwilkas uiplänande och ombyte mot andre dä altid bl r swLrare vch fordrar en större möda och längre lid » Pä denna gennd lare mi dä med skäl pästä , at den ordning , ben mildhet och ömhet , som ofta gör Musiken lä angenäm för osi , nödwändigt bör meddela imrvcken deraf ät wärk hjerta och wära böjelser , hwarigenom besia sör manstkia samsmtdslcfnaden sä dyrbara fbrem-l kunna upwackas vch stärkas » Ordning l bwilkcn egenstap hos medborgare af alka Ständ l Det är den stom gör-den » befallande wcrksam och driftig i stt koll , som benpar l onom en lid och möda , hwilken förhastande och förwirriiig ofta förspilla » som utstakar de gränsor Logen salt för dest myndighet , och gör alla hans ögonblick nvniga til nedmännistjors gagn eller egen uvmumran . 	136	136	gagn
lär $ irara vmtänkte att göra stna barn nugot nöje $ ha man n $ genom sädune tillredning lemna tät till en medel $ som $ werkltgt gagn torde finna swara mvt mänga andra ämne som wid denna ulifäbc $ $ $	lär » irara vmtänkte att göra stna Barn nugot nöje , har man n ?elat genom sädune tillredningar lemna tät till ett medel , som » werkltgt gagn torde finnas swara mvt mänga andra ämnen som wid detta ulIfäBc •nmitfo * . 	27	27	gagn
skola granstningen sällås ivid en samling i denna hägge galleri $ liksom en öfre rum til almänt gagn äro iipsakte $ fela icke rik ämne för tilfrcdsställclscn och hopp at se konsierne $ återbringa til utöfning af $ $ ct adla och stor som $ genom denna god eftersyn $ stäk at erhälla $	Skulle granstningen sällås ivid de samlingar i dessa hägge Gallerier , liksom de öfre rummen til almänt gagn äro iipsakte , felades icke rika ämnen för tilfrcdsställclscn och hoppet at se Konsierne ^ återbringas til utöfning af d&gt ; ct adla och stora som , genom denna goda eftersyn , stäk at erhälla . 	17	17	gagn
som jag utröna $ att de höra befintelige sjömalm gifwa i gjuteri en owanligt stark jern $ ty bära jag lätit gjuta flere persedel som fordra stark påkänning $ och ha jag med mine försök finna den äfwen wara päliteligt till stängjernshamrar $ som göra samma gagn som smida $ särdele $ sedan jag nu hinna luröna rätt $ $ te as malm $ och ha här smidits med en sädan hammare sedan $ junii mänads början samt befinna den sä stark $ att eburu ma $ smida en tunn platt jernsorter $ sä existera ingen widare bristning $ än att nägra smula kunna utfalla ur kant af pänen $ dä päncn hacka jämn igen med en stälsatt hacka en och en half tum bred i ägg $ och gnides efterätj med en stycke af en flipsten eller fin sandsten med watt pästänkande $ sä vara han äta lika bra och siär den wackraste jern man will se $	Som jag utrönt , att de hör befintelige Sjömalmer gifwa i gjuteri ett owanligt starkt jern , ty bar jag lätit gjuta flere persedlar som fordra stark påkänning , och har jag med mine försök funnit det äfwen wara päliteligt till StängjernShamrar , som göra samma gagn som smidde , särdele » sedan jag nu hunnit luröna rätta blandningS-sät » tet as Malmerne , och har här smiditS med en sädan hammare sedan sistl. Junii mänads början samt befinneS den sä stark , att eburu ma » smider de tunnaste platta jernsorter , sä existerar ingen widare bristning , än att nägra smulor kunna utfalla ur kanterne af pänen , dä päncn hackas jämn igen med en stälsatt hacka en och en half tum bred i äggen , och gnideS efterätj med ett stycke af en flipsten eller fin sandsten med wattenS pästänkande , sä är han äter lika bra och siär det wackraste jern man will se . 	46	46	gagn
mötande $ i nita bemödande för dest wäl $ ofta en mycket oförsedd hinder $ uppchällen icke sällan i sig wisaste anstalt af oförständet $ eller fördom $ eller egennytta $ eller misstänka $ samheten $ eller wördnadcn för en gammal mana $ misskänd till sig afstgter af illwil $ ja $ eller till sig ljus och insigt af sjelfklokheten $ twungen $ genom sig ställning $ alt höra all bön och att afstä en mången $ wäckande $ mängen gäng $ euflilta missnöje äswen genom den tydlig rättwisa $ stur dont nödga att uppoffra mildhet böjelse li lag och den allmän trygghet kraf $ ofta $ i granlaga belägenhet och under stor mtv motsätta intercssens strid $ förlägen om utwägar lill sänstans bibchällan $ de tued främmande $ och wid all denna i behof att oupphörligen dela sig uppmärksam $ het emellan den hel oä den del $ emellan bristern och botemedel $ em klan befallnin $ gen och utförande $ nia tillika akt för $ allmänhet spn dölja mänga hemlig be kvm $ mer $ af hwika $ om de ppvavis $ utaxi gagn $ ofta nied merklig $ gt $ kada $ tes llign ffulie störa $ huru stiille han kunna umbära en hugswalclse af wänstapcn $ eller säker stil $ na dea än i krets af sig familj $ $	mötande » i nita bemödanden för dest wäl , ofta de mest oförsedda hinder ; uppchällen icke sällan i Sina wisaste anstalter af oförständet , eller fördomen , eller egennyttan , eller misstänk » samheten , eller wördnadcn för en gammal mana ; misskänd till sina afstgter af illwil » jan , eller till Sitt ljus och insigt af sjelfklokheten ; twungen , genom Sin ställning , alt höra allas böner och att afstä de flestas ; wäckande , mängen gäng , euflilta missnöjen äswen genom den tydligaste rättwisa ; stur dont nödgad att uppoffra mildhetens böjelse Li lagarnes och den allmänna trygghetens kraf ; ofta , i granlaga belägenheter och under stora mtv motsätta intercssens strid , förlägen om utwägar lill sänstans bibchällan , de tued främmande ; och wid allt detta i behof att oupphörligen dela sin uppmärksam » het emellan det hela oÄ dess delar , emellan bristerns och botemedlen , em klan befallnin » gen och utförandet , nien tillika akt för ' Allmänhetens spn dölja mänga hemliga be kvm » mer , af hwika , om de PPvavis , utaxi gagn , ofta nied merklig & gt ; kada , tess llign ffulie störas : huru stiille Han kunna umbära en hugswalclse af wänstapcn , eller säkrare stil » na dea än i kretsen af sin familj ? " 	185	185	gagn
under debatt om $ ädagalade $ la bourdonnaye $ att regering göra bra $ att öfwerlemna sädana i frankrike högst nyttig $ men kostbar $ $ äc privat association $ dock under regering öswerinseende $ att desse $ baltre an srarswerket $ kunna göra sig gagn deraf $ och art stare ej $ uran i nödfall $ böra blanda fig i den $ som i sig natur vara privatforetag $	Under debatten om eanal-arbetena ädagalade Hr-De la Bourdonnaye , att Regeringen gjorde bättre , att öfwerlemna sädana i Frankrike högst nyttiga , men kostbara communications-medel , äc privata associationer , dock under Regeringens öswerinseende ; att desse , baltre an Srarswerket , kunde göra sig gagn deraf , och art Staren ej , uran i nödfall , bör blanda fig i det , som i sin natur är privatforetag . 	45	45	gagn
sädén littemnas om wären och inbctalas om höst $ göra spanmälssaljaren gagn $ ly konsumtion kkas af lätt tillgäng $ men socken wilker försämra $ dä nia wid nffffwäpens ankomst $ utan att hafwa nägvt bespardt $ sitta sig i förtid i ffuld $ få annars troligen icke $ fett $	sädén littemnas om wären och inbctalaS om hösten , göra Spanmälssaljaren gagn ; ly konsumtionen kkas af lätt tillgäng ; men Socknens wilker försämras , dä nian wid nffffwäpens ankomst , utan att hafwa nägvt bespardt , satt sig i förtid i ffuld , fom annars troligen icke ( fett . 	11	11	gagn
men än en gäng widröres i undersökning $ den fläda $ som bäde norarne och soldat siola lida geiwni han commendcrande till publik $ $ be päsiäs till och med $ alt han derigenom wägras uröfwa sig ädel pligt nära sig hemwist $ och att dista pligt i gagn för slaten öfrverlvager den af han utkräfva arbete $ $	Men än en gäng widröreS i undersökningen " den fläda , som bäde Norarne och Soldaten siola lida geiwni hans commeNdcrande till publikt arbet- ; ber päsiäs till och med , alt honom derigenom wägras uröfwa sina ädlare pligter närmare sitt hemwist , och att dista pligter i gagn för Slaten öfrverlvager det af honom utkräfva arbete . " 	48	48	gagn
erfarenhet ha länge satt utom twifwclsmäl $ at för mänga upstäder i cn $ $ $ tuné gora mängfaldigt bier stada än gagn $ särdeles dernied at de dra för mänga arbeta hand ifrän plog $ befordra yppighet $ högfärd $ lättja $ dyrhet $ fattigdom $ samt hindra hwarandras handelsrörelse $	Erfarenheten har länge satt utom twifwclsmäl , at för mänga Upstäder i cn pro&gt ; ^ tuné gora mängfaldigt Bier stada än gagn , särdeles dernied at de draga för mänga arbetande händer ifrän plogen , befordra yppighet , högfärd , lättja , dyrhet , fattigdom , samt hindra hwarandras Handelsrörelse . 	22	22	gagn
fortsättning jämngod med början $ och ifölje de war litteratur rikta medel classtfft arbete af den diiöbla gagn $ som et förädladt spräk i förening med nyttig kunsta $ per medföra $	Fortsättningen jämngod med början , och ifölje deras war Litteratur riktad medel classtfft Arbete af det diiöbla gagn , som et förädladt spräk i förening med nyttiga kunsta , per medför . 	17	17	gagn
sedan underteckna för någon tid tillbaka $ både pä fin wifielseort och från andra stall $ $ $ oit anmoda och mcd $ förtroende bedr $ id $ att i hel och halfpension motta någon gostar $ $ vilja $ $ an $ med afseende på en förälder $ lnvilka kunna wara hugad $ att åt han bemödande ijfirtrlemtui fin barn uppfostran $ på denna sätt lillkännagistv $ $ den han $ emedan tidsanwandumgen för få eller flera nästan vara densamma $ men gagn af en uppstå täflan möjligen wida stor $ bestjäla $ arr nud ännu någon öka en nitivarande eleoernes antal $	Sedan undertecknad för någon tid tillbaka , både pä fin wifielseort och från andra stallen , dlif&gt ; oit anmodad och mcd ' förtroende bedr / id , att i Hel- och Halfpension mottaga några Gostar , » vill I&gt ; an , med afseende på de Föräldrar , lnvilka kunde wara hugade , att åt hans bemödanden ijfirtrlemtui fina BarnS uppfostran , på detta sätt lillkännagistv » , det han , emedan tidsanwandumgen för färre eller flera nästan är densamma , men gagnet af en uppstående täflan möjligen wida större , bestulit , arr nud ännu några öka de nitivarande Eleoernes antal . 	83	83	gagn
hr $ borg önskan vara $ en as $ de dö stum kunna gda liksom en ccloni $ be desom fabrikant och handlwerkare $ till sig och st $ $ $ n gagn $ pä en punkt cone $ ntrerad s unblr en far och en styretft $ der de med en gemensam spräk fösstodo hwarandra och $ $ r $ med $ och wän $ som aldrig lemna $ erst sör gtt	Hr ProtoccllS.Secreteraren Borgs önskan är , ett as , de Dö stumma kunna gda liksom en Ccloni , ber desom fabrikanter och handlwerkare , till sitt och St , c&gt ; nS gagn , pä en punkt cone , ntrerad S unblr en Far och en styretft , der de med ett gemensamt spräk fösstodo hwarandra och d&gt ; r d^ med kä.are och wänner , som aldrig lemnade - erst sör gtt 	32	32	gagn
bwarie sak sig rätt stämpel $ och mäla hwarje person förtjenst est den lanna $ varda ben ager $ est den wärkeliga gagn ben stifta $	bwarie sak sin rätta stämpel , och mäla hwarje persons förtjenst ester det lanna » varde ben ager , ester det wärkeliga gagn ben stiftar . 	22	22	gagn
den hög $ wagn $ midt fram för öpna logdörrn stanna $ si gubbe man nt göra gagn $ i gvlfwet gosse $ arm bemanna $	Den höga Lass-bespanda wagn , Midt fram för öpna Logdörrn stannar , Si Gubben man nt göra gagn , I gvlfwet gossen » Arm bemannar ! 	17	17	gagn
wilja för att lära hwad han i en eller annan afseende ka $ bljswa till gagn $	wilja för att lära hwad honom I ett eller annat afseende ka » bljswa till gagn . 	15	15	gagn
erina mirudvrffs liten dotter johanna jaeobinas rakning $ desi alsta syster färg reee $ kunna dorotea maria adamsson derstädes stall disponera återstod till desi dotter maria $ $ ricné nytta ock gagn $ pä den grund $ att denna syster wärdat vch stödja testamentsgifwaren under desi längwariga sjukdom $	Erina Mirudvrffs lilla Dotter Johanna Jaeobinas rakning , desi alsta Syster- Färg reeE - kan Dorotea Maria Adamsson derstädes stall disponera återstoden till desi Dotter Maria Fr. ' ricné nytta ock gagn , pä den grund , att denna Syster wärdat vch stött Testamentsgifwaren under desi längwariga sjukdom . 	31	31	gagn
deremot sedermera anwandas i trängarx gränd som haftva til $ rackeligt stuttande affall $ dcr de tcgo liten rum och lifrool göra god gagn $	deremot sedermera anwandas i trängarx gränder som haftva til » rackeligt stuttande affall , dcr de tcgo mindre rum och lifrool gjorde godt gagn . 	23	23	gagn
