sentence_lemma	sentence_token	index_lemma	index_token	lemma
rus listig och uppriktig tacksamhet se walet af en styresman $ hwilken $ kraftfull och lugn $ lcka wördands $ $ ungci $ $ fosterland och $ alltio oskiljaktig wäl och rak $ i sig konung näd $ sig $ gagn $ och sine medborgare $ $ $ se sine $ $ vitsorda $ och skörda den fhrfti belöning för en ädel nia $	rus listigaste och uppriktigaste tacksamhet ser walet af en Styresman , hwilken , kraftfull och lugn , lcka wördands 5^o » ungci !S , Fosterlandets och Medbo-gareS alltio oskiljaktiga wäl och rakt , i sin Konungs näd , sitt Foli.nandS gagn , och sine Medborgares tacks^mhe ' , sett sine ge.ningar » vitsordad , och skördat den fhrfti belöning för en ädel nian . 	40	40	gagn
upplysning $ inänsslighii och stat gagn fordra dä atr en nära	Upplysning , inänsslighii och Statens gagn fordra dä atr en närmare 	5	5	gagn
tre sötter $ hwilket giorde samma gagn som en med fem sötter af engelsk mekan $ $	tre sötter , hwilket giorde samma gagn som ett med fem sötter af Engelske Mekan , . 	6	6	gagn
för de winna en sund begrepp och befordra tniöc egen $ annan och allmän gagn $	för dem winna ett sundt begrepp och befordra tniöc eget , andras och allmänt gagn . 	14	14	gagn
man vara ej sinnad at bestrida dega $ betydeliga gagn $	Man är ej sinnad at bestrida dega Läro-sätenö betydeliga gagn . 	9	9	gagn
dä ej mera för sig nät allena offra guld och fäfangans tra $ $ all kraft willigt sig förena sä till enstilt gagn som allmän wäl $	Dä ej mera för sitt nät allena Offrar guldets och fäfangans tra ' l:j Allas krafter willigt sig förena Sä till enstilt gagn som allmänt wäl . 	22	22	gagn
wisi del af ämner $ innehålla mänga god och nyttig uppgift $ som för ben upplysning eller gagn $ en timna lofwa $ förtjena att frän glömsta $ förmaras $ i anseende $ hwartist afwcn flere utländsta wctcnstapssltadcmier och lära samfund pläga $ ivid kungörande af silia prlsamnen $ göra förbehåll om rättighet att bchäla $ och derest författarns icke annorlunda om de wilja disponera $ pä tjenlig sätt göra bruk af all en skrift $ ssm om pris rasta $ få ehuru sallstapct ilie ansätta sig berättiga $ att emot en $ $ uttryckligen förklara wilja och äsiundan att äterfäsin obelönta skrift $ den samma $ hos sig qwarhälla $ eller deröfwer ta sig $ ago egen dispositionsrätt $ $ dock säll stapet $ r afseende pä nuwarande och framtida prisämne $ tillkänna igifwa sig önskan $ sig hopp att äfwen obrlönte författare torde $ för alli $ än upplysning och gagn $ äta saklstapets förmer kacka öfwerläla sig tank ock uppgift $ till hwilkas utgifwande af tryck $ om anktorn fä will $ han rättighet icke desi $ lindra vara futieligen förwarad $ gärna eällstapet $ dä den icke gifwit han nägon belöninz $ akldrig anivrlimda $ än stpckewis $ kunna wilja göra bruk af halis arbete $	wisi del af ämner , innehålla mänga goda och nyttiga uppgifter , som för ben upplysning eller gagn , de timna lofwa , förtjena att frän glömsta » förmaras , i anseende , hwartist Afwcn flere utländsta WctcnstapsSltadcmier och lärda Samfund Plägat , ivid kungörandet af silia prlsamnen , göra förbehåll om rättigheten att bchäLa , och derest Författarns icke annorlunda om dem wilja disponera , pä tjenligt sätt göra bruk af alla de Skrifter , ssm om priset rastat ; få ehuru Sallstapct ilie ansätt sig berättigats , att emot en tonkilrer«ide Först.tt«res uttryckligen förklarade wilja och äsiundan att äterfäsin obelönta Skrift , den samma , hos sig qwarhälla , eller deröfwer taga sig » agon egen dispositionsrätt ; will^ dock Säll stapet , r afseende pä nuwarande och framtida prisämnen , tillkänn igifwa sin önskan «ch sitt hopp att äfwen obrlönte Författare torde , för alli » än upplysning och gagn , ät Saklstapets förmer kackas öfwerläla sina tankar ock uppgifter , till hwilkas utgifwande af trycket , om Anktorn fä will , hans rättighet icke desi » lindre är futieligen förwarad , helst Eällstapet , dä det icke gifwit honom nägon belöninz , akldrig anivrlimda , än stpckewis , kan wilja göra bruk af halis arbete . 	17	17	gagn
nation i twenne näster $ de bilda och ben stor räa mastan $ man ha härigenom deni emellan befästat en swalg som sekel icke warit tillräcklig att fylla $ man ha skapa ä ena sida stor anspräk $ öka sjelfkärlek $ sörcrgt för en ringare $ öfwermod och bekymmcrslöshet om de rättighet $ r $ samt en $ längd tära medlem i samhällskropp $ som $ utan alt alltid hwarkcn wilja eller kunna wcrksamt befordra dest gagn eller älaga sig någon af dest warf $ likwäl fordra all dest ractigheter och förmäner samt fordra de pa de bekostnad $ som stooo pä bildning låg grad $ ä andra sida ha man hos en ringare wäckt missnöje med sig lott $ förtrytelse öfwer de förmäner $	nationen i twenne Näster , de bildade och ben stora räa mastan ; man har härigenom deni emellan befästat ett swalg som sekler icke warit tillräckliga att fylla ; man har skapat ä ena sidan större anspräk , ökad sjelfkärlek , sörcrgt för de ringare , öfwermod och bekymmcrslöshet om deras rättighet , r , samt en » längd tärande medlemmar i samhällskroppen , som , utan alt alltid hwarkcn wilja eller kunna wcrksamt befordra dest gagn eller älaga sig något af dest warf , likwäl fordrat alla dest ractigheter och förmäner samt fordrat dem pa deras bekostnad , som stooo pä bildningens lägre grader ; ä andra sidan har man hos de ringare wäckt missnöje med sin lott , förtrytelse öfwer deras förmäner . 	76	76	gagn
z du strålglans obemärkt försmalte wanans plan och desi liten gagn $	Z din strålglans obemärkt försmalte Wanans planer och desi lilla gagn . 	10	10	gagn
ni ha inte sä brodd om $ ffcfre efter jag raklapp $ $ tanker resa nr $ $ bruka eljest inte sädant hemmä $ en bie papper göra samma gagn $	Ni hade inte sä brodd om ; ffcfre efter min raklapp , — tanker resa nr .sian ; brukar eljest inte sädant hemmä — en bie papper gör samma gagn . 	29	29	gagn
potatses qwarn $ hwarcfter den rifua mastan strax göra till deg mev sä mycket säde $ mjöl $ som fordra $ för att gifwa densamma en dertill nödig tjocklek $ och försäkra $ $ tunn pocatoes dä stall göra lika gagn metz en holftunna räg $	Potatses Qwarn , hwarcfter den rifua mastan strax göres till deg mev sä mycket sädes » mjöl , som fordras , för att gifwa densamma en dertill nödig tjocklek ; och försäkras , att.en tunna Pocatoes dä stall göra lika gagn metz en holftunna Räg . 	40	40	gagn
att samtycka till znqvisilisnens $ $ icke mera äro förband $ lä bli denna institut onyttig och ändamälslöst $ och han helighet anse den dessutom i närtvärande ögonblick säsom opolitisk $ emedan en lägande passion $ i förening tued menflliga swagheten $ lätt skola kunna göra inqvisition tribunalct ffadligt i parti $ ernns hand $ om en aswände del frän ben helig $ ursprunglig afstglen nied den inrättande $ hwarigenom den flulle åstadkomma mera stada än gagn $ $	att samtycka till Znqvisilisnens ät-ruvprätlande , icke mera äro förbanden , lä blir detta institut onyttigt och ändamälslöst , och Hans Helighet anser det dessutom i närtvärande ögonblick säsom opolitiskt , emedan de lägande passionerna , i förening tued Menflliga swagheten , lätt skulle kunna göra Inqvisitions tribunalct ffadligt i parti , ernns händer , om de aswände del frän ben heliga , ursprungliga afstglen nied dess inrättande , hwarigenom det flulle Åstadkomma mera stada än gagn . " 	76	76	gagn
tillkänna $ och förklara landshöfding de lägga grange sig nädiga wälvehag $ sä wäl öfwer denna som flera annan $ af denna sörljenta och nitista embetsman $ till gagn för län och den allmän widtagne anstalt $	tillkänna , och förklarade Landshöfdingen De la Grange sitt nädiga wälvehag , sä wäl öfwer denna som flera andra , af denna sörljenta och nitista Embetsman » till gagn för Länet och det allmänna widtagne anstalter . 	28	28	gagn
hafra och hälft af dålig flaga räg $ samt lätit deraf baka trod äta häst $ och pä den afdetta bröd mä komma häst allena til gagn $ göra degsradet salt än annars manlig ärtil bröd för männistor $ hwaraf häst mä wäl och dricka bra $	hafra och hälften af sämre flagS Räg , samt lätit deraf baka trod ät hästarne , och pä det afdetta brödet mä komma hästarna allena til gagns , göres degsradet saltare än annars manligt ärtil bröd för männistor , hwaraf hästarne mä wäl och dricka bättre . 	26	26	gagn
$ ing $ elter indämtad noga kännedom om hushällningkn tri werkets lörsta anläggning samt in $ stgterna för betz framtida drift $ till bäde allmän och enstildr gagn $ upsattadl en historist öfwrr $ pgt af denna werk jemte wiikoren tor den aya aktieteckning $ hwaras oiigta sremplar bliftvtt $ jg tillsända $ tor att till uvlysning iprida $ inom läner $ i dändelfe någon al betz inwanare stutt le finna sig hugad ingen såsom aktieägare i den noa bolag $	» ing , elter indämtad noga kännedom om hushällningkn trin Werkets lörsta anläggning samt in , stgterna för betz framtida drift , till bäde allmänt och enstildr gagn , upsattadl en historist öfwrr » pgt af detta Werk jemte wiikoren tor den aya Aktieteckningen : hwaras oiigta Sremplar bliftvtt » jg tillsände , tor att till uvlySning iprida , inom Läner , i dändelfe några al betz inwanare stutt le finna sig hugade inga såsom Aktieägare i det noa Bolaget . 	27	27	gagn
des att de $ ffisoni ej ordinarier $ sakna $ $ här tilläqges $ ott de ock soknade pensionsrätt $ som $ när de wid sig befordran ändtligen wunno den $ icke medföra ssvttadt gagn $	des att de , ffisoni ej ordinarier , saknade tour-beräkning ; här tilläqges , ott de ock soknade pensionsrätt , som , när de wid sin befordran ändtligen wunno den , icke medförde Ssvttadt gagn . 	34	34	gagn
deraf tydlig att riktighet as han räkning kunna t ögonblick pröfwas $ utan att lärare kehzfwer flcttoni $ räkna någon exempel $ att han winner mera $ $ ii deraf klar $ att han $ med bruten af detza tabell fäe rakna en lanfft stor dn manlig mängd af exempel $ af hwilka $ i pwarje färstilt räknestag $ icke en enda dt lift den andra och att icfc widlyftigt orda för en sak $ som $ inför den tänka $ tala för sig sjelf $ $ $ w icke nytta $ af denna $ i räknekonst ak erfarenhet ojäfaktig besanna $ $ wara allm $ anta hos twenne nation $ känd för befordran af all som främja dera $ ung niedvorgar s intellektuell bildning $ i hopp att hwar och man $ som ha sig anförtro un $ decwisningen $ i synnerhet ör en stor antal barn $ in er gagn af denna arbete $ wagar man begära prenumeracion dera $ med 32 $ $	deraf tydligt att riktigheten as hans räkning kan t ögonblicket pröfwas , utan att läraren kehZfwer flcttoni * räkna något exempel : att han winner mera vf.iing , ii deraf klart , att han , med brutet af detza tabeller fäe rakna en lanfft större dn manlig mängd af exempel , af hwilka , i pwarje färstilt räknestag , Icke ett enda dt lift det andra Och att icfc widlyftigt orda för en sak , som , inför den tänkande , talar för sig sjelf , n&gt ; w icke nytta » af denna underwisnings-iiiethod i räknekonsten ak erfarenheten ojäfaktigt besannad , hivarffe-rcden wara allm r.nare antagen hos twenne Nationer , kända för befordran af allt som främjar dera » yngre niedvorgar s intellektuella bildning — I hopp att hwar och en , som har sig anförtrodd un , decwisningen , i synnerhet ör ett större antal barn , in er gagnet af detta arbete , wagar man begära Prenumeracion dera ' med 32 § . 	151	151	gagn
aldeles intet $ eller icke rätteligen weta $ bwad den helig skrift ar $ til nytta och gagn uptandt vch $ $ $ $ $	aldeles intet , eller icke rätteligen weta , bwad den heliga Skrift ar , til nytta och gagn uptandt vch framsatt , 1777- 8:0 . 	17	17	gagn
kraftig driffjäder i all företag $ huruledes miinget tjenstehjon och daglönare spara en samla penning till sramrida gagn $ $ som $ som annars $ om den icke förtära för dag till utswäfning $ blifwit illa anwänd $ åtminstone utan gagn $ huruledes öfrig obemedlad klaff $ hwars fördel egenteligen ingar i sparbank ändamål och functivner $ iner och mer begagna denna utwäg $ såsom en framtida tillgäng i behvswets stund $ derunder de för last och brott sig frihet betagen person tänka pa de framtid och förbättra omsorg för loflig utwäg till bergning $	kraftigaste driffjäder i alla företag , huruledes miinget tjenstehjon och daglönare sparat en samlad penning till sramrida gagn , ' som ' som annars , om den icke förtärdes för dagen till utswäfning , blifwit illa anwänd , åtminstone utan gagn , huruledes öfrige obemedlade klaffen , hwars fördel egenteligen ingar i Sparbankens ändamål och functivner , iner och mer begagnar denna utwäg , såsom en framtida tillgäng i behvswets stund , derunder de för last och brott sin frihet betagne personer tänka pa deras framtid och förbättra omsorgen för loflig utwäg till bergning . 	17	17	gagn
sedan nu jag $ ukom lundö skava wästra tull belägen $ wäderqwarn uiidergati en tolai reparaiion $ och vara således i veta ständ $ som erfordraför att kulius wara allmänhet till gagn $ medelst målning $ fä fara jag ej allenast fadant tillkännagifiva $ utan äfwea $ att de som icke äga egen häst $ kunna fä mille in och $ $ emot en gansta billig afgift $	Sedan nu min , ukom Lundö Skavs wästra Tull belägne , Wäderqwarn Uiidergati en tolai reparaiion , och är således i vet ständ , som erfordraför att kulius wara Allmänheten till gagn , medelst målning ; fä far jag ej allenast fadant tillkännagifiva , Utan äfwea , att de som icke äga egne hästar , kunna fä millen in- och utkörd , emot en gansta billig afgift . 	31	31	gagn
ty man ej nägot gagn kunna göra $ oin man ej denna lycka ha $	ty man ej nägot gagn kan göra , oin man ej denna lyckan har . 	4	4	gagn
uci probsts och $ bokhandel i stockholm siv landsort $ tolk eller swensta vch fransta samtal $ i hwarjchanda ämne $ till gagn för resa och $ underwisning för ungdom $	Uci Probsts och flere- Bokhandel i Stockholm siv Landsorterna : Tolken eller Swensta vch Fransta Samtal , i hwarjchanda ämnen ; till gagn för resande och t:ll underwisning för ungdom . 	22	22	gagn
nen warandepark $ hwilka förbättring $ ehuru en pä sä kort tid ännu icke hinna till den fullbordan som $ frikostighet och ospard omsorg synas lofwa $ likwai redan medföra den werka $ $ att af ständspcrsvncr 124 till antal jemte en stor mängd allmoge förlida sommar nyttja denna $ $ hwilket förhällandr $ säsom leda $ de till den allmän gagn $ man tro för $ tjena att lomma till allmänhet kunskap $ nied uppgift af en ständspcrsoner som för $ uden sommar begagna lund bruun $ nem $	nen warandepark , hwilka förbättringar , ehuru de pä sä kort tid ännu icke hunnit till den fullbordan som Aetic-Ägarnes frikostighet och osparda omsorg synes lofwa , likwai redan medfört den werka » , att af Ständspcrsvncr 124 till antalet jemte en stor mängd Allmoge förliden sommar nyttjat denna Helso-brunn ; hwilket förhällandr , säsom ledan , de till det allmännas gagn , man trott för , tjena att lomma till Allmänhetens kunskap , nied uppgift af de Ständspcrsoner som för , Uden sommar begagnat Lunds Bruun , nem » 	61	61	gagn
$ $ $ i belägga band komplett utkomma $ som icke länge stall dröja $ och redan warit $ $ om icke författare genoni en swär sjukdom hindra $ att derwis lägga en ståtelig åtgärd $ till arbete fullkomlig gagn och brukbarhet $	d&lt ; ( i bela Bandet komplett utkommer , som icke länge stall dröja , och redan warit we.fiMIbr , om icke Författaren genoni en swär sjukdom hindrats , att derwiS lägga en ståtelig åtgärd , till Arbetets fullkomligare gagn och brukbarhet . 	39	39	gagn
desta lina göra icke allenast $ i anseende till sig stor styrka $ mera gagn	Desta linor göra icke allenast , i anseende till sin större styrka , mera gagn 	14	14	gagn
den sednare $ och ar seg ar stikå pä $ vey nar der en gäng gär sönder $ komma rudimaterie ä nyo lil $ agot gagn $ den sönderpläckas $ karda och spinna til inflag j ny wafnader $	det sednare , och ar segare ar stikå pä ; vey nar der en gäng gär sönder , kommer rudimaterien ä nyo lil » agot gagn ; det sönderpläckas , kardas och spinnes til inflag j nya wafnader . 	25	25	gagn
$ med den allmän gagn och bra i en sä wäsendtelig del förena $ åstundan $	Maj:ts med det allmännas gagn och bästa i en sä wäsendtelig del förenade hö^a åstundan ! 	4	4	gagn
att en militär $ hwars utständna möda och sär för fädernesland $ eka han att widare fortsätta sig bana $ men hwars werksamhet i annan $ äga kunna blifwa till gagn $ om han $ säga wi $ erhälla en plats $ som öswerensstämnier med dest älerstäcnde förmäga $	att en militär , hwars utständna mödor och sär för fäderneslandet » eka honom att widare fortsätta sin bana , men hwars werksamhet i annan » äg kan blifwa till gagn , om han , säga wi , erhäller en plats , som öswerensstämnier med dest älerstäcnde förmäga ? 	30	30	gagn
ha redan förstöra munkkloster i rio $ de wldstrackta etablistementer komin $ han trouver till gagn $ och han se gerna $ alt hel werid känna den mec pastande bruk $ han göra af en präkliga byggnad $ som förut woro lättja $ tillhåll $ $	har redan förstört munkklostren i Rio ; deras wldstrackta etablistementer komin » hans trouver till gagn , och han ser gerna , alt hela weriden känner det mec pastande bruk , han gjort af de präkliga byggnader , som förut woro lättjans , tillhåll . " 	15	15	gagn
en en tillverka af potatoes $ samt potäters anwändandc till brödbakning $ på enkel och förmånlig få $ så att en tunna potatoes göra lika gagn $ som half tunna råg $ med bifoga lrgurer på $ $ $ $ $ $ af a $ isegerstedt $ trycka t strengnäs j806 $ 76 $ i $ utom titel och företal till död upplagorne $ samt man i koppar sticka tabell egentlig afhandling om b an wins tillwcrkande af säd ar alldeles lika nied den upplaga $ som år 1804 utkomma $	ett en tillverkande af potatoes , samt Potäters anwändandc till Brödbakning , på enkelt och förmånligt fått , så att en tunna potatoes gör lika gagn , som half tunna Råg , med bifogade Lrgurer på 2:ne Potatoes-Dmarnar ' ; ' ; af A . ISegerstedt ; tryckt t Strengnäs J806 , 76 sid. i g:o utom Titeln och Företalen till döda Upplagorne , samt en i koppar stucken Tabell Egentliga afhandlingen om B an- wins tillwcrkande af Säd ar alldeles lika nied den Upplaga , som år 1804 utkom . 	25	25	gagn
$ obehindrad est behag kunna $ wända fin siyrka $ no till egen gagn $ $ till alt medwerka med eel öfrig europa $ alt hejda en bägge wäldigi magterna $ som gemensam hota till land och till sjö $	alili- obehindradt ester behag kunna an« wända fin siyrka , no till eget gagn , 2:0 till alt medwerka med eel öfriga Europa , alt hejda de bägge wäldigi Magterna , som gemensamt hota till lands och till sjös . 	13	13	gagn
den vara en billig fordran $ akt wertenstavernes idkare böra ivid all theori $ ej blott bafwa den systematista nytta till ändamål $ utan äfiven desi gagn $ brukbarhet och anwandande i allmän lefwerner me $ sä ha den ltkwal ej alkid stel $	Det är en billig fordran , akt wertenstavernes idkare böra ivid all theori , ej blott bafwa den systematista nyttan till ändamål , utan äfiven desi gagn , brukbarhet och anwandande i allmänna lefwerner Me » sä har det ltkwal ej alkid stelt . 	26	26	gagn
öra hdfloii som idka en löna borgerlig rörelse $ eller äga industri att päfinna en hittills okänd näringsgren $ ill allmän och enstildt gagn $ stulie åstunda $ ingå i bolag mcd ca dederlig och bemedla man $ säga behaga drnfammc upxgifwa fin $ $ gt $ nme rörttsens $ $	Öra Hdfloii som idkar en lönande borgerlig rörelse , eller äger industri att päfinna en hittills okänd Näringsgren - ill allmänt och enstildt gagn , stulie åstunda «t^ ingå i Bolag mcd ca dederlig och bemedlad Man ; sa behagade drnfammc upxgifwa fin adr^e & gt ; nme rörttsenS bestaff^npet . 	23	23	gagn
hos bokbindare hällström $ tolk $ eller swensta och fransta samtal $ till gagn för resa och	Hos Bokbindaren Hällström : Tolken , eller Swensta och Fransta Samtal , till gagn för resande och 	13	13	gagn
forsf pä den ssydd och omwärdnad $ att ban frafttr ännu möjligtivis $ och $ i en allraflesta fall $ torde kunna anwänvas till ban och den bätnad $ akt denna lämplig kunna sse genom $ $ som till en början göra han wanart ostadlig för den allmän $ och sedermera göra hanö förmäga anwändbar lill dest gagn $ att strängbet $ men ek härdhet $ mildhet $ men ej flathet $ sysselsättning $ men ej flas $ wisst arbeie $ bovo om bra dag och möjlig utsigt as ätcrgäng till frihet $ heder och $ $ tilen ni wissbetcn $	forSf pä dess ssydd och omwärdnad ; att bans frafttr ännu möjligtivis , och i&ttrt i de allraflesta fall , torde kunna anwänvas till bans och dess bätnad ; akt detta lämpligast kan sse genom fängelse-anstalter , som till en början göra hans wanart ostadlig för det allmänna , och sedermera göra hanö förmäga anwändbar lill dest gagn ; att strängbet , men ek härdhet , mildhet , men ej flathet , sysselsättning , men ej flas » wisst arbeie , bovo om bättre dagar och möjlig utsigt asen ätcrgäng till frihet , heder och saiiihälls-förilläntr , tilen er wissbetcn . 	57	57	gagn
ned all sorgfällighet finna den konda nytta eller stadan af hwarje i hushällning brukbar wäxt uppgiftven $ sä $ vid den dir cte werkar pä mennistons eller diet $ r hälso $ $ men four läkemedel betrakta omröra den anwandande icke lika omsiandeligcn $ och vara ibland förbigänget $ säsom i en populär strift n $ i $ $ dre nödig och ofta snar bidra till stada än gagn genoin tillämpning af djerfwe och okunnig person $	Ned all sorgfällighet finnes den konda nyttan eller stadan af hwarje i hushällningen brukbar wäxt uppgiftven , sä » vida den dir cte werkar pä mennistons eller diet » rens hälso ' ; men four Läkemedel betraktad omröres dess anwandande icke lika omsiandeligcn , och är ibland förbigänget , säsom i en populär strift n » i » » dre nödigt och ofta snarare bidragande till stada än gagn genoin tillämpning af djerfwe och okunnige personer . 	68	68	gagn
$ för flön vara du hand till sä mödosam gagn $ du kropp till sä tcufliga kläder $ bi $ sr sä späd $ komma och äk i jag wagn $ $	" För flön är din hand till sä mödosamt gagn , din kropp till sä tcufliga kläder ; bin f-t Sr sä späd _ kom och äk i min wagn . " 	9	9	gagn
do t nr till förmodande att lad de valich $ font cjjcri sig kand for älfiillige npttige uppfinning $ torde lila $ belöning benägen uppgifw en fullständig befirifning pä sattet $ sä mai att tillreda soll $ tion $ svin huru ben lör nyttja till ändamål minnande $ om lonna upplvsning hos han söka $ meri oni ock $ ägon wcoorgällnixg ffulle fordra $ böra den ej spara för en uvptäckt som medföra sä allmän gagn $	Do t nr till förmodande att Ladet de valich , font cjjcri sig kand for älfiillige npttige uppfinningar , torde lila » belöning benäget uppgifw en fullständig befirifning pä sattet , sä mai att tillreda soll , tionen , svin huru ben lör nyttjas till ändamålets minnande , om Lonna upplvsning hos honom sökes ; meri oni ock » ägon wcoorgällnixg ffulle fordras , borde den ej sparas för en uvptäckt som medförde sä allmänt gagn . 	75	75	gagn
tjenst $ gagn och bra $ än capiten malm och lieutenant burman utmärkt tapper od berömlig forhällande $ hwaruti en med all nit blifwit understödja af lieutenant clement $	tjenst » gagn och bästa , än Capiten Malms och Lieutenant Burmans utmärkt tappra od berömliga forhällande , hwaruti de med all nit blifwit understödde af Lieutenant Clement ! 	2	2	gagn
pä en sä bestaffadt gagn som utgismarne förtjena den stor erkänfla den stall mdrig anse för en i $ rvcrdnfwct beröm $ att den predikosamling $ hwaraf första del $ i ljus framträdt $ förete en fullkomlig mönster pä wärt fpräk af c $ fain $ andelig waltalighct $ en mönster som stall obesegradt tafla med hwilka som gärna finna i en v bast sdlade spräk $ en mönster för sätt att leda begrepp och bö $ a hjertat till en migtigaste sanning $ och som $ dä författare beklaglig $ $ icke mer ar till $ stall liksom folla $ ställe i merlden genom en förewigad uppbpggelfe $ och en ännu mer wälsignadt an $ minne $	pä ett sä bestaffadt gagn som Utgismarne förtjena den största erkänfla Det stall Mdrig anses för ett i ' rvcrdnfwct beröm , att den Predikosamling , hwaraf första Delen „u i ljuset framträdt , företer ett fullkomligt mönster pä wärt fpräk af c » fain , andelig waltalighct , ett mönster som stall obesegradt tafla med hwilka som helst finnas i de v- bast sdlade spräk , ett mönster för sättet att leda begreppet och bö / a hjertat till de migtigaste sanningar , och som , dä Författaren beklaglige » , icke mer ar till , stall liksom folla h^ins ställe i merlden genom en förewigad uppbpggelfe , och ett ännu mer wälsignadt an I-cunhradt minne . 	4	4	gagn
