sentence_lemma	sentence_token	index_lemma	index_token	lemma
dä konung alldeles icke will $ att redlig och upplyst man stola wara hindra frän att ined frimodighet och anständighet offentliggöra stna tank $ olli all hwad forn efter de öfwcrtygclse fair bidra lill den allmän gagn $ fä stall dct icke heller wara nägon förbjuden att yttra sig mening $ angäende hwad dag tro bchöfwa förbättra eller räkta i land lag $ förordning och allmän inrättning $	Dä Konungen alldeles icke will , att redlige och upplyste man stola wara hindrade frän att ined frimodighet och anständighet offentliggöra stna tankar , olli allt hwad forn efter deras öfwcrtygclse fair bidraga lill det allmännas gagn ; fä stall dct icke heller wara nägon förbjudet att yttra sin mening , angäende hwad dan tror bchöfwa förbättras eller räktas i Landets Lagar , Förordningar och allmänna inrättningar . 	36	36	gagn
en hederlig borgersman som $ en förmonlig rörelse $ med dertill pakande egendom $ ästun $ dag en kompan $ som vara ägare as cirka 6000 rd $ banko sör att utwidga densamma $ oä utom en säker reveny fri rum kunna erhälla $ samt sjelf kunna dageligen fä se och kontrollera nämde rörelse till bada gagn och nytta $ widare underrättelse lemna uti hus $ 39 i på söder och tullportsgatan $ 3 trappa upp $	En hederlig Borgersman som inneha^wer en förmonlig Rörelse , med dertill pakande Egendom , ästun » dar en Kompanion , som är ägare as cirka 6000 Rd , Banko sör att utwidga densamma : Oä utom ett säkert reveny fria Rum kunna erhällas , samt sjelf kunna dageligen fä se och kontrollera nämde rörelse till badas gagn och nytta ; widare underrättelse lemnas uti Huset N:o 39 i på Söder och Tullportsgatan , 3 trappor upp . 	56	56	gagn
behof vnyitiee $ mm för privat gagn brukbar $ $	behof vnyitiee , mm för Privat gagn brukbara , . 	6	6	gagn
$ detze jag tank för rike gagn $ för mine trogen uaderfätares walfard $ stola ätfölja utstottets betankande $ jag ha jag an ytterlig förbehällit at efter bestaffenheten af den beslut $ standerne fatta i hwad til de afgöra afgär $ kunna lemna ni och esterwerlden et ny och öswertygande wedcrmale af jag önstan och föresats at befrämja dratzelverkets säkerhet och upratthällande $ sä widt manstlig försigtighet kunna förutse händelfer och misiöden och förmä at de förekomma $	— Detze mina tankar för Rikets gagn , för mine trogne Uaderfätares walfard , stola ätfölja Utstottets Betankande ; jag har mig an ytterligare förbehällit at efter bestaffenheten af det Beslut , Standerne fatta i hwad til deras afgörande afgär , kunna lemna Eder och esterwerlden et nytt och öswertygande wedcrmale af min önstan och föresats at befrämja DratzelVerkets säkerhet och upratthällande , sä widt manstlig försigtighet kan förutse händelfer och misiöden och förmä at dem förekomma . 	6	6	gagn
enda lill sig regering $ all en sädan rättighet ej mifibrukas $ och att privat nia $ lt $ $ krig lärer understödja uj o krona manssap till företag $ joni ej öro af ckt gifwet och betydlig gagn $ och ej hasna siri grund i annan än leir $ iller ensidig speculaiisncr $	ende lill sin Regering , all en sädan rättighet ej mifibrukas , och att privat nian & lt ; ll■ krig lärer understödjas uj o Kronans Manssap till företag , joni ej öro af ckt gifwet och betydligt gagn , och ej hasna siri grund i annat än leir , iller ensidiga speculaiisncr . 	38	38	gagn
frzn denna sida synas den ingalunda likgiltig $ om desiucet lipphäfdes $ och man tro $ att en i $ $ $ $ g w gtig vrincrpe ofta re ward mera uppmärksamhet än den alltid $ och osäker $ b $ räkning $ räkning af gagn för den $ $	FrZn denna sida syntes det ingalunda likgiltigt , om desiucet lipphäfdes — och man trodde , att en i !in utw.-ci ?ii » g w gtig vrincrpe oftast re ward mera uppmärksamhet än den alltid sw^rr och osäkert uppgjorda b ' räkningen ' räkningen af gagnet för det närwarand».ögonblicket . 	45	45	gagn
hälst den böra gjörai swarande mot en sida rätsherres namn och förtjenst c ni rike $ säledes önska jag $ at nägon annan för swenffa historia nitälska medborgare behaga sörssjuta förlag kostnad $ dä jag med nöje ssall åtaga niig $ med $ $ $ gt $ n granstning $ som emot c $ sädant arbete wärdc $ ch gagn swarar $	hälst den bör gjörai swarande mot en sidan RätSherres Namn och Förtjenster c ni Riket : säledeS önskade jag , at nägon annan för Swenffa Historien nitälskande Medborgare behagade sörssjuta Förlags- kostnaden ; dä jag med nöje ssall Åtaga niig ulgiiningS-mödan med d&gt ; & gt ; n granstning , som emot c » sädant Arbetes wärdc » ch gagn swarar . 	59	59	gagn
wid $ säga $ uma gagn $ som gäsister $ och kunna jenuväl nytljech i lampa i ställ för $ eller tran $	wid m«trcdning sa , uma gagn , som gäsister , och kan jenuväl nytljech i lampor i stället för o^a eller tran . 	5	5	gagn
sweriges man och denna land tiu gagn $ frid och enighet $	Sweriges Män och detta Landet tiU gagn , frid och enighet . 	6	6	gagn
armé i tyskland $ ar 1814 $ i norrige $ dels vid armé $ dels såsom commissarie vid storting i christiania $ i sanning ärofull förrättning $ dervid minne af någongång uträtta t allmän gagn $ kunna $ utan egenkärlek $ återhämta $	Arméen i Tyskland : ar 1814 , i Norrige , dels vid Arméen , dels såsom Commissarie vid StorTinget i Christiania : i sanning ärofulla förrättningar , dervid minnet af någongång uträttad t allmänt gagn , kan , utan egenkärlek , återhämtas . 	34	34	gagn
fall fomine öftvcrsattningsförsöket att sprida obestämd eller origtiga begrepp om för $ städren gudalära $ bedrift och sed $ och ländt dä mera till stava $ än gagn $	fall fomine öftvcrsattningsförsöket att sprida obestämda eller origtiga begrepp om för , städrens Gudalära , bedrifter och seder ; och ländt dä mera till stava , än gagn . 	27	27	gagn
be ps academien et tal ötwer frsgan $ om llplvsam $ göra en stat mera gagn än skada $	ber pS Academien et Tal ötwer FrSgan : Om llplvSam » gör en Stat mera Gagn än Skada ? 	15	15	gagn
söka pä all sätt gagn $ jag medborgare $ ärna jag att ifra $ nästkommande april mävadö början $ till augusti mänadö $ flut $ om gud förläna jag helsan $ hwarje $ och helgedag eftermiddag $ efter flutad aftonfäng $ rller frän ti 4 lill6 $ lemna kostnadsfri underwisning uti räkning $ skrifning m $ m $ till gesäll och lärogoffar $ hwilka äro uti knapp wilkor och hafwa lust att lära nägot $	söker pä allt sätt gagn , mina Medborgare , ärnar jag att ifra » nästkommande April mävadö början , till Augusti mänadö - flut , om Gud förlänar mig helsan , hwarje Gön- och Helgedags Eftermiddag , efter flutad Aftonfäng , rller frän ti 4 lill6 , lemna kostnadsfri underwisning uti Räkning , Skrifning m . m . till Gesäller och Lärogoffar , hwilka äro uti knappa wilkor och hafwa lust att lära nägot . 	4	4	gagn
$ denna dag vara den jag stykdig $ het och stall äfwen wara jag ljufwaste $ tilftedsställelse $ $ tilftedsställelse $ tilftedsställelse $ nt uti alt hwad pä jag ämbets äkgärd kunna ankomma $ söka befordra stad gagn och heder $ nt maka för ordning och säkerhet och för des lugn willigt upoffra mit egen $	„Ifrän denna dag är det min stykdig , het och stall äfwen wara min ljufwaste , tilftedsställelse , , tilftedsställelse , tilftedsställelse , nt uti alt hwad pä min Ämbets äkgärd kan ankomma , söka befordra Stadens gagn och heder , nt maka för ordning och säkerhet och för des lugn willigt upoffra mit eget . 	37	37	gagn
gagn för den föga bemedla $ $ och de $ hwilka af from suftcher njuta oinwardnad och försorg $ wid proviantcring af ckdcrs $ $ ma $ $ t flotta oästi	gagn för den mindre bemedlade folk-elasten , och dem , hwilka af fromma Suftcher njuta oinwardnad och försorg ; wid proviantcring af ckdcrS ^ 0nÖl- Ma , : tS flottaarme- oästi 	0	0	gagn
jemn fördeladt arbete swarar emot en stor och ge en stor product $ sä kunna icke den swensta bonde arbete jcmföras med annan under andra förhällande $ $ ch en ögonkast pä charran $ hwar ländcrne äro belägen $ samt kännedom af de upp $ h jning osmer hassytan $ hwilkct tillstrifwts wara den förnäm orsak till climatens olikhet $ torde göra tillfyllest alt utwisa $ med hwad öfwerlägsenhet den ena folkllaget anwänvcr sig kraft till äkerbruk framför en annan $ $ den bra jord $ man och flera gynnande emständigheicr $ hwilka kunna hajma falla pä den ena lolt framför den $ om upphäfwandct af $ och en stor $ styckning till smärre $ ha medföra älffilligt flaga gagn för mennistoflagtet i allmänhet $ tnwcck $ lat den i flerfaldig förhållande $ reta begär $ uppsporrat lankeförmägan $ befara $ drat $ wetenstaper och konst $ sä ta dock böra medgifwas $ att denna stor förändring wer $ kar gansta ofördelaktig till erhällande af en låg spannmälspris $	jemnare fördeladt arbete swarar emot ett större och ger en större product , sä kan icke den Swensta Bondens arbete jcmföras med andras under andra förhällanden ; » ch ett ögonkast pä charran , hwar ländcrne äro belägne , samt kännedom af deras upp » h jning osmer hassytan , hwilkct tillstrifwts wara den förnämsta orsaken till climatens olikhet , torde göra tillfyllest alt utwisa , med hwad öfwerlägsenhet det ena folkllaget anwänvcr sina krafter till äkerbruk framför ett annat , ob.räknadt den bättre jord » manen och flera gynnande emständigheicr , hwilka kunna hajma fallit pä det enas lolt framför det andras- Om upphäfwandct af Lif-egcnstapen och de stora landt-egendomarneö styckning till smärre , har medfört älffilligt flags gagn för mennistoflagtet i allmänhet , tnwcck » lat det i flerfaldigare förhållanden , retat begären , uppsporrat lankeförmägan , befor » drat ' wetenstaper och konster , sä tar dock böra medgifwas , att denna stora förändring wer » kar gansta ofördelaktigt till erhällande af ett lågt spannmälspris . 	119	119	gagn
zr att $ $ mera till medborgare och egen gagn fä lika oegennyttig helga sig äterstäende leinad $ som ban hittills göra i fädernesland tjenst $	Zr att » » mera till medborgares och eget gagn fä lika oegennyttigt helga sin äterstäende leinad , som ban hittills gjort i fäderneslandets tjenst . 	9	9	gagn
tid han $ enligt denna wår disposition $ komma att hemman till sig gagn och basta nyttja och brula $ answarande han endaft derföre $ att de $ samma under han $ hand ej må blifwa genom wårdslvsbet winstöit eller $ begrafningskostnad och all andra utgift för sterbhulet $ räkning äga hr kyrkoherde att $ vid sig afträ $ de och wid blifwande flutliga ärfsdelning af sterbhus lillgängar sig godtgöra $ ulan afkortning pä den frukl han af hemmane $ njuta $	tid han , enligt denna wår disposition , kommer att Hemmanet till sitt gagn och basta nyttja och brula , answarande han endaft derföre , att de , samma under han » hand ej må blifwa genom wårdSlvSbet winstöit eller förstöidt- BegrafningSkostnad och alla andra utgifter för Sterbhulet » räkning äger Hr Kyrkoherden att » vid sitt afträ » de och wid blifwande flutliga Ärfsdelning af SterbhusetS lillgängar sig godtgöra , ulan afkortning pä den frukl han af Hemmane » njutit . 	13	13	gagn
$ iorde man kunna anmäla den starf som man genom beswäret och omkostnad med denna inrättning welat offra till fädernesland gagn $	" iorde man kunna anmäla den starf som man genom beswäret och omkostnaden med denna inrättning welat offra till Fäderneslandets gagn . 	20	20	gagn
den allmän gagn $ font han personlig öfwersigt af flotta angelägenhet otwifwelaktigt böra bereda $ ha man tro sig under denna lrefök finna grunda anledning till den förhoppning $ att förwaltnjngen as $ och befälhafwande $ härstädes hetdanefter torde handla i tuera öfwercnsstanimclse an hittills $ hwilket för flotta angelägenhet utan twiswel more att i hög grad önska $ hälst i en lid då man se enhet inom samma styrclsewerk yrka såsom man säga wigtig nödwandighet $	det allmänna gagn , font hans personliga öfwersigt af Flottans angelägenheter otwifwelaktigt bör bereda , har man trott sig under detta lrefök finna grundade anledningar till den förhoppning , att Förwaltnjngen as Sjö-Ärenderne och Befälhafwande Ainirals-Enibetet härstädes hetdanefter torde handla i tuera öfwercnsstanimclse an hittills , hwilket för flottans angelägenheter utan twiswel more att i hög grad önska , hälst i en lid då man sett enhet inom samma Styrclsewerk yrkas såsom en sa wigtig nödwandighet . 	2	2	gagn
$ öömen sself hwad gagn i gören i samhälle $ til hiva tjenst $ ära	?S öömen sself hwad gagn I gören i samhället , til hivad tjenst I- ären 	4	4	gagn
till den af prefessoren äfyftade ändamiil rjcnlige wlitnande ej liten om han $ erfarenhet i barn $ $ örds $ läkare konst $ än han manlig nit för inedmenni $ gagn vch bra $ bwiikct yttrande genom utdrag af protokoll skola professorrn $	till det af Prefessoren äfyftade ändamiil rjcnlige wlitnande ej mindre om han » erfarenhet i Barns !&gt ; ördS ; Läkare konsten , än hans manliga nit för inedmenni ?cr« gagn vch bästa ; bwiikct yttrande genom Utdrag af Protokollet skulle Professorrn . 	30	30	gagn
desse hingst leo i wär till allmän gagn $ mot erläggande $ f en lunna hafre $ $	Desse Hingstar Leo i Wär till allmänt gagn , mot erläggande * f En Lunna Hafre Föl-afgift . 	7	7	gagn
vfiver jag medolyckiiges smara öde $ fanste vara denna tuktan ofi och $ andra titt gagn och wälsignelse $ utan för att härigenom hämta anledning att tilläta jag röra hjerta nägot utbrott af ben myckna glädje och ödmjuk tacksamhet den hysa $ för en äbeisinnade znwägare i huswudstaden vch medborgare i otterne som sammanflyta sä betydlig gänvvr till mine ömkadr och ömkanswäide landsman understöd $ vcku för att $ jag wägar hoppa den $ anleda flere godhjerjgde $ medmänniflor att följa fä wackra $ fä $	vfiver mina medolyckiiges smara öde — fanste är denna tuktan ofi och .wänga andra titt gagn och wälsignelse — utan för att härigenom hämta anledning att tilläta mitt rörda hjerta nägot utbrott af ben myckna glädje och ödmjukaste tacksamhet det hyser ' för de äbeisinnade Znwägare i huswudstaden vch Medborgare i Otterne som sammanflutit sä betydligt gänvvr till mine ömkadr och ömkanswäide Landsmäns understöd : vckU för att — jag wägar hoppas det — anleda flere godhjerjgde ochchemedla.de medmänniflor att följa fä wackra , fä sällhetgifwan- 	15	15	gagn
åtfölja af den lycklig framgäng $ sig elev möjlig bildning och de förälder ut $ aktning $ lian pretention öswerstiga tuipr icke den gagn $ lian tro sig kunna ästadkomma $	åtföljd af den lyckligaste framgäng , sina Elevers möjligaste bildning och deras Föräldrars ut !närkta aktning : lians Pretentioner öswerstiga tuipr icke det gagn , lian tror sig kunna ästadkomma . 	23	23	gagn
het anmäidte skäl och omständighet $ samt till befrämja af del här i stad $ $ noer wär höglälsteiig $ $ gemälo $ hon moj drottning hög beffydd $ $ tanda institut för bunde rch döfstumme fortfarande nytta och beständ $ finna för god i räd bifrlla och forerdna $ den en kollekt $ till förman för samma in $ rättning $ komma att öswer hel wärk rike uppta för innewarande vara 1822 $ sä ör derföre lill e ni wär näoiga wilja och befallning $ den z dra försorg $ öst ifrägawo $ randa kollekt $ sä sätt och med de undanta författning medgif $ wa $ warder uii lyrkorne inom en ni anförtro församling upphemtad $ hwarwld wi ost i räd tillförse $ att wäe trogen undersätare med wäl och möjlig frikostighet bidra $ aft understödja och fullkomna en inrättning $ hwars wälgvrande gagn af $ och $ fä hög pskallas $	het anmäidte skäl och omständigheter , samt till befrämjande af del här i Staden u&gt ; noer Wär Höglälsteiig , , Gemälo , Hennes Moj:t Drottningens Höga Beffydd wa« ' tande Instituts för BUnde rch Döfstumme fortfarande nytta och beständ , funnit för godt i Räder bifrlla och forerdna , det en Kollekt , till förmän för samma In » rättning , kommer att öswer hela Wärk Rike upptagas för innewarande är 1822 ; Sä ör derföre lill E er Wär Näoiga wilja och befallning , det Z dragen försorg , öst ifrägawo , rande Kollekt , sä sätt och med de undantog Författningarne medgif , wa , warder uii Lyrkorne inom de Eder anförtrodde Församlingar upphemtad , hwarwld Wi Ost i Räder tillförse , att Wäe trogne Undersätare med wälwilja och möjlig frikostighet bidraga , aft understödja och fullkomna en Inrättning , hwarS wälgvrande gagn af menfll-gtzet och famhälls-pligk fä högt pSkallaS . 	145	145	gagn
som dnutöswer sörtärcs göra mera stada $ än gagn $ och derföre se man sä mänga stor $ itare mager $ och person $ som äta liten $ deremot fet $	som dnutöswer sörtärcs gör mera stada , än gagn , och derföre ser man sä mänga stor » itare magra , och personer , som äta litet , deremot feta . 	8	8	gagn
ehuru föga lämpeligt den vara $ att här gifwa erforderlig begrepp om deffa spi $ sar $ ha man dock anse sig böra lemna sä mycken underrättelse derom $ att okunnighet och mifftybningsr icke mäge förhindra den betydlig gagn som allmänhet nu börja och framgent under jemn fortskrida stall winna af dest $ kokinrättning antagan $ de till daglig bruk och nyttjande $	Ehuru mindre lämpeligt det är , att här gifwa erforderligt begrepp om deffa spi » sar , har man dock ansett sig böra lemna sä mycken underrättelse derom , att okunnighet och mifftybningsr icke mäge förhindra det betydliga gagn som allmänheten nu börjat och framgent under jemnt fortskridande stall winna af dest » kokinrättningars antagan » de till dagligt bruk och nyttjande . 	38	38	gagn
hwilken summa $ ehuru ej obetydlig $ directionen tro sig kunna inbespara $ genom den förändring uti prämhästarnes foragering $ som den nu sätta i tillfälle att införa $ vch den gagn häst kunna göra wintertiden wid hamn $ nar en aro der att tillgä $ i stall för att de förut utfodra pä en landtegendom $ hel den tid de ej kunna begagna för mudderwerket $	hwilken summa , ehuru ej obetydlig , Directionen tror sig kunna inbespara , genom den förändring uti Prämhästarnes foragering , som den nu sattes i tillfälle att införa , vch det gagn hästarne kunna göra wintertiden wid Hamnen , nar de aro der att tillgä , i stallet för att de förut utfodrats pä en Landtegendom , hela den tiden de ej kunnat begagnas för Mudderwerket . 	31	31	gagn
$ $ mifsolierna till sörckommande och afbbiaiide af process och de obe $ hagligheter $ eir $ erfarenhet ha sä bekräfta de owanligt walgörande gagn $ akt man nied skal förundra sig $ att de ännu ingen annorstädes blifwit in $ sörda $	ninya-kon , mifsolierna till sörckommande och afbbiaiide af processer och deras obe » hagligheter .. Eir l^ng erfarenhet har sä bekräftat deras owanligt walgörande gagn , akt man nied skal förundrar sig deröfwer^ att de ännu ingen annorstädes blifwit in » sörda . 	24	24	gagn
ning $ och alt $ gt $ följd deraf utföra förrättning af stor och allmän gagn $ denna p igt st $ ille dä maia liten ädel $ än de $ $ ait gä hjelphjon och extra drang hos noiionden och grannarnc i trakt $	ning , och alt & gt ; följd deraf Utföra förrättningar af stort och allmänt gagn , denna p igt st , ille dä maia mindre ädel , än de » , ait gä hjelphjon och extra drang hos Noiionden och grannarnc i trakten ! 	15	15	gagn
af denna omdöme $ ha man ej lztit afffräfa fiq af den nog betydlig kostnad de $ brefs utgifwandc fordrot $ dz man jämte utsikt af en mätielig winst kunna äga den tilfredsställelsen $ at pä nägot sätt bidra til swenssa litteratur gagn och den täiande allmänhet nöje $	af detta omdöme , har man ej lZtit afffräfa fiq af den nog betydliga kostnad de ?e BrefS utgifwandc fordrot , dZ man jämte utsikten af en mätielig winst kunde äga den tilfredSställelsen , at pä nägot sätt bidraga til Swenssa Litteraturens gagn och den täiande Allmänhetens nöje . 	42	42	gagn
gagn kunna jag mänra af en man $ hwars förntögenhet ar förspilla $ och son $ $ i fall jag inlåter ung med han i samtal $ ej roa jag med glad ämne än sig motgängar och sig hehof $	gagn kan jag mänra af en man , hwars förntögenhet ar förspilld » och son » , i fall jag inlåter ung med honom i samtal , ej roar mig med gladare ämnen än sina motgängar och sina hehof ? 	0	0	gagn
jo $ de som aro sned och illa wäxt $ kunna hofwa stor gagn af ek snörlif eller en corsett $ som ar pasiande til kropp $ emedan den ond annars tiltager $	jo : De som aro sneda och illa wäxt » kunna hofwa stort gagn af ek snörlif eller en Corsett , som ar pasiande til kroppen , emedan det onda annars tiltager . 	13	13	gagn
fransk samtal $ till gagn köra resa $ och til underwismng i språk för ungdom $	Franska Samtal , till gagn kör resande - och til underwismng i Språken för Ungdom . 	4	4	gagn
de mänga finaneeplancr som inkomma $ hafwa göra mera stada $ gagn $	De mänga Finaneeplancr som inkommit , hafwa gjort mera stada «n gagn . 	11	11	gagn
ilia under denna kategori $ säga ware den bra att lota beiv ätergä till stiftarenas arfwingar $ sälcdes titt nägra enjkiltas gagn $ än ännu länge fortfara till den allmän $ stada $ $ nas $ stada $ $ $ stada $ $ att denna afgift böra tillfalla lärare $ säsoui påökning i de lön $ hwilka stat af stna medel blott barde bestamma till en måttlig belopp $ emedan arbetare vara sig lön wärd $ och de $ hwilka betragtat sig yrke som en dagswerke $ ej böra erhälla iller än betalning derföre $ att deremot en $ lön stulleanwändas $ dels till folkskola understöd $ hwartill de bäde stulle wara tillräcklig och wälstgnelferika dels till den fanna lärdom befrämja genom utmärka wctcnstapsmäns frikalländc frän lektion och de försättande i en tillstånd $ der de $ obekymrad för liftvets bergning kunna lcfwa för sig sak $ för fädernesland och fin egen ära $ till förlag för nyttig arbete $ lgifwande frän tryck $ hwartill nu incdel sä ofta sakna $ i anseende till bokhandel fläta $ och ben läsa pumtns knapp tillgängar $ hmarigenom dessutom en förbättring i profestorerncs lön	ilia under denna kategori , sa ware det bättre att lota beiv ätergä till stiftarenas arfwingar , sälcdes titt nägra enjkiltas gagn , än ännu längre fortfara till det allmännas ' stada ) ; nas ' stada ) ; ' stada ) ; att dessa afgifter borde tillfalla lärarens , säsoui påökning i deras löner , hwilka Staten af stna medel blott barde bestamma till ett måttligt belopp , emedan arbetaren är sin lön wärd , och de , hwilka betragtat sitt yrke som ett dagswerke , ej böra erhälla iller än betalningen derföre ; att deremot de indragna lönerna stulleanwändas , dels till folkskolornas understöd , hwartill de bäde stulle wara tillräckliga och wälstgnelferika dels till den fanna lärdomens befrämjande genom utmärkta wctcnstapsmäns frikalländc frän lektionerna och deras försättande i ett tillstånd , der de , obekymrade för liftvets bergning kunde lcfwa för sin sak , för fäderneslandets och fin egen ära ; till förlag för nyttiga arbetens » lgifwande frän trycket , hwartill nu incdel sä ofta saknas , i anseende till bokhandelns fläta tillställd och ben läsande puMtns knappa tillgängar ( hmarigenom dessutom en förbättring i Profestorerncs löner 	21	21	gagn
o $ $ nägon hederlig bestedlig mennista wille wara si nädig $ att bjelca en fattig $ wärnlös enka med att ta $ en yrärs $ qwick gohe $ att uppfostra och bilda till någon $ som för iionom och rike $ samt $ $ $ wälgörares heder och gagn wara fan $ sä hegäres $ swar i försegläd biilet $ ut $	O , « nägon hederlig bestedlig mennista wille wara si nädig , att bjelca en fattig , wärnlös Enka med att taga emot en yrärs , qwick GoHe , att uppfostra och bilda till något , som för iionom och Riket , samt d&gt ; § Wälgörares heder och gagn wara fan , sä hegäres , swar i försegläd biilet , ut ! 	49	49	gagn
allmänhet lärer jämwäl icke underläta $ al med manlig ädelmod bidra til en allmoge hjelp och understöd $ som med sä stor cnstilda upoffringar ständaktigt arbeta för allmän gagn $ och derigenom werkeligen räkat uti en belägenhet $ som i flera affeenden sörtjenar at af ömsint landsman behjertås $ hälst des kostnad och förlust ej föga wid arbete $	Allmänhet lärer jämwäl icke underläta , al med manligt ädelmod bidraga til en Allmoges hjelp och understöd , som med sä stora cnstilda upoffringar ständaktigt arbetat för allmänt gagn , och derigenom werkeligen räkat uti en belägenhet , som i flera affeenden sörtjenar at af ömsinte Landsmän behjertås , hälst des kostnad och förlust ej mindre wid arbete ? 	28	28	gagn
