sentence_lemma	sentence_token	target_index	original_word
$ att rita $ väl $ ha länge wari $ ansc $ t säsom man af en lysa talang $ hwilka utmärka en god uppfostran $ men dam hinna i allmänhet sällan till hög grad a $ fullkomlighet i denna stöna konst än att copier $ $ af den orsak $ att de ej känna $ grundlag $ hwilka allenast kunna gifwa form och proportion äta ritning och förklara effecren förorsaka af localite $ $ storlek och distans $ samt förestäl $ lägga objeeter pä papper $ säsom de i natur $ visa sig för ästädarens öga $	Perspecrif-Rirning Att rita » väl , har länge wari » ansc » t säsom en af de lysande talanger , hwilka utmärka en god uppfostran ; men Damerna hinna i allmänhet sällan till högre grad a » fullkomlighet i denna stöna konst än att copier » , af den orsak , att de ej känna Peripcetif-ritningeiiS grundlagar , hwilka allenast kunna gifwa form och proportion ät ritning och förklara effecren förorsakad af localite » , storlek och distans , samt förestäl , la objeeter pä papperet , säsom de i Naturen » visa sig för ästädarens öga . 	24	uppfostran
en $ $ stor till verten $ af god uppfostran och förse med hedra betyg $ som nära i 6 ära tid konditionera $ sstundar dvlik kondition $ $ u förr dest heldre linder lopp of innevarande sommar $ sist innan oktober $ hos en aos husbondepa en $ bra $ bra källare $ der hail nied säkerhet kali räkna pä att sä lära ut sig äta st sen en lärotid $	En Kypare-Goste , stor till verten , af god uppfostran och försedd med hedrande betyg , som nära i 6 ärS tid konditionerat , Sstundar dvlik kondition , , u förr dest heldre linder loppet of innevarande sommar , sist innan Oktober , hos en aos Husbondepa en , bättre , bättre Källare , der hail nied säkerhet kali räkna pä att sä lära ut sin äter st sen de lärotid . 	9	uppfostran
den gass hwarken uppfostran eller förkofran $ och stägtena mänga $	Det gass hwarken uppfostran eller förkofran , och stägtena mäng » 	3	uppfostran
spräket ock all den som $ $ ör till en bilda uppfostran $ älwen musik om sä ästnndas $	spräket ock allt det som l&gt ; ör till en bildad uppfostran ; älwen Musik om sä ästnndaS . 	11	uppfostran
potakves $ hushällar för sine dräng $ $ sine piga $ man fpavav $ $ men ofta föga för sig barnk uppfostran och ben nödlidandes understöd $ än för otta lllfw $ omtald för en wacker klädning $ en lysa souper $ eller $ simma den till $ gär i en låg krets $ $ be nöd make wid dörr och fattigdom med bister uppsyn presidera i den nästan tom rum $ man dricka raff $ $ $ säng $ och tigga till $ $	PotakveS ; huShällar för sine Drängar , ' sine Pigor ; man fpavav — ; men ofta mindre för sina Barnk uppfostran och ben Nödlidandes understöd , än för ott Lllfw » omtald för en wacker Klädning , en lysande Souper : eller , sam det till » gär i de lägsta kretsar , — ber Nöden makar wid dörren och Fattigdomen med bister uppsyn presiderar i det nästan tomma rummet — man dricker Raff » pL&gt ; sängen , och tigger till midd„gka . 	21	uppfostran
en yngling frän kandet $ 16 vara gammal $ som erhällit en god uppfostran $	En Yngling frän kandet , 16 är gammal , som erhällit en god uppfostran . 	13	uppfostran
med bank eller med industri öfwerstotler $ som en werk stall bekosta $ hwilket ej kunna betala stg förrän under sekel $ aldraminst i en land $ der hwarje 100000 $ vara 10 gänger mera wärdt än i england och frankrike $ och der wi icke tro ojj hafwa räd en gäng att anflä mer än 62000 $ för en af en hög medborgerlig ändamälen $ wira barn uppfostran och tillkommande generation upplysning $	med Bankens eller med industriens öfwerstotler , som ett werk stall bekostas , hwilket ej kan betala stg förrän under sekler , aldraminst i ett land , der hwarje 100000 R:dr är 10 gänger mera wärdt än i England och Frankrike , och der wi icke tro ojj hafwa räd en gäng att anflä mer än 62000 N.dr för ett af de högsta medborgerliga ändamälen , wira barnS uppfostran och tillkommande generationers upplysning . 	68	uppfostran
understöd $ $ $ en omständlig och nöjaktig berättelse om mcthoden finna införa $ och sedan engelsta presterstapct ej wille anförtro en stor del af ungdom uppfostran äta lancaster $ som snar blef allmaut kand och understödd $ men font war af en fchismatist trosbekännelse $ kalla doctor bell tillbaka $	understöd , ' ' en omständlig och nöjaktig berättelse om mcthoden fanns införd , och sedan Engelsta Presterstapct ej wille anförtro en stor del af ungdomens uppfostran ät Lancaster , som snart blef allmaut kand och understödd , men font war af en fchismatist trosbekännelse , kallades Doctor Bell tillbaka . 	26	uppfostran
en 10 avi slicka af god uppfostran som för $ lär att stöta fruntimmer manlig sy flor $ och som sfning i en af förnäm $ kök i prten $ önska att $ hushälla fä biträda nägot godr herrstap chäl $ $ land $	En 10 avi slicka af god uppfostran som för , lär att stöta Fruntimmers manliga sy flor , och som Sfning i ett af förnäms !a Kök i prten , önskar att ( Hushäller fä biträda nägot godr Herrstap chäl » , Landet . 	6	uppfostran
en alfwarsam och ordentlig flicka af bra uppfostran $ ästundar tis den 1 nästkommande oktober buswa anta 1 en bra herrskapshus som kamma eller syjungfru $ emedan hon tillförene sädane tjenst inneha $ lofwar hon att med flit och uppmärksamhet förrätia hwad hon tjenst tilldör $	En alfwarsam och ordentlig Flicka af bättre uppfostran , ästundar tiS den 1 nästkommande Oktober bUswa antagen 1 ett bättre Herrskapshus som Kammar eller Syjungfru , emedan hon tillförene sädane tjenster innehaft , lofwar hon att med flit och uppmärksamhet förrätia hwad hennes tjenst tilldör . 	7	uppfostran
säga wäl i bokstånd här i stad få i uddewalla finna fölljande $ bok $ samling af biblisk sprak och verfar sör 1806 $ luther tank om förwallningen af den evangelilka $ $ betraktelse öfwer en förståndig och kristelig $ $ vstenheims bref om $ $ uppsats om $ $ uppfostran $ barnasänger $ hög wifan $ till förman för en fattig i härwaranbe garnisensförsamling $ samling för $ $ $	Sa wäl i Bokstånden här i Staden fom i Uddewalla finnes fölljande inbundna Böcker : Samling af Bibliska sprak och verfar sör 1806 ; Luthers Tankar om Förwallningen af det Evangelilka Prediko-ämbetet ; Betraktelser öfwer en förståndig och Kristelig Barna-uppfostran ; vstenheims Bref om Barna-uppfostran ; Uppsats om Barna&gt ; uppfostran ; Barnasänger ; Höga Wifan , till förmän för de fattige i härwaranbe Garnisensförsamling ; Samlingar för Hlerc«r , ? 	50	uppfostran
$ en förnuftig uppfostran ka $ $ man i förhand försäkra $	o-h en förnuftig uppfostran ka , , man i förhand försäkra . 	3	uppfostran
en barnlös folk åstunda emoitoa en barn till uppfostran $ $ o $ $	Ett barnlöst Folk åstundar emoitoa ett Barn till uppfostran n&gt ; ot ö-werenskoinilielie . 	8	uppfostran
en ung bra frnnlimmer $ med en god uppfostran och stadga caracier $ aohäller cm plats $	Ett ungt bättre Frnnlimmer , med en god uppfostran och stadgad caracier , aohäller cm plats ! 	8	uppfostran
uppfostran $ mycket eöthifft i institution $ mycket mörk och $	uppfostran , mest Eöthifft i institutioner , mest mörkt och förstöadt-i 	0	uppfostran
de fä lära alli hwad som hörer till e $ god uppfostran $ samt blifwa behandla nied all moderlig omwärdnad $ emot en $ modererad pris $	De fä lära alli hwad som hörer till e » god uppfostran » samt blifwa behandlade nied all moderlig omwärdnad , emot ett ' modereradt pris . 	11	uppfostran
sig med laga tjenst och förswar $ om kandstrykeriet föga toldcs $ och correctionsznrättningars ändamäl utan krus och smek uppfylla $ förrymd lifstidsarrcstantcr bangdcs $ och ungdom uppfostran i en låg klastcrne sorgsälligare wärdades $ msinne icke smäningom wäldsamheten stulle kufwas och tjufwarne liten $ $	sig med Laga tjenst och förswar , om kandstrykeriet mindre toldcs , och CorrectionsZnrättningars ändamäl utan krus och smek uppfylldes ; förrymde lifstidsarrcstantcr bangdcs — och ungdomens uppfostran i de lägre klastcrne sorgsälligare wärdades ; Msinne icke smäningom wäldsamheten stulle kufwas och tjufwarne minstas ! ' 	27	uppfostran
uti denna stad $ säsom en of rike stor och betydlig $ ffulle främlin $ l gen och dr $ oerfaren näppeligen förmoda sä $ kleinstädtlichkeit $ smästadsl aklighet $ $ som här likwäl ej sällan röna $ äkwen $ olik fält att utkfwa fjelsswäld $ härleda $ te förra af merendels onoriiff uppfostran $ och den sednare $ $ ting of egennytlans manlig foster $ afwunden $ eller ack af pur hämdlystnad $ wid l tank om aniingcn werkcligen eller ock blon inbilla oförrätt $	Uti denna Stad , säsom en of Rikets större och betydligaste , ffulle främlin » l gen och dr » oerfarne näppeligen förmoda sä mpck.n Kleinstädtlichkeit ( Smästadsl aklighet ) , som här likwäl ej sällan rönes , äkwen u:i olika fält att utkfwa fjelsswäld , härledde , tet förra af merendels onoriiff uppfostran , och den sednare , anl- tingen of egennytlans manliga foster , afwunden , eller ack af pur hämdlystnad , wid l tanken om aniingcn werkcligen eller ock blon inbillade oförrätter . 	53	uppfostran
dm äfwen den vara nödwändigt $ wid en wäl ordna uppfostran $ att rum deri yngling stola wistas $ under den en pläcka frukt af $ vishet tkad $ böra mara andamälscmigare an hittills $ vara bruklig $ sä $ natta denna andamäl warauphunnet ivid skola i wenersborg $	Dm äfwen det är nödwändigt , wid en wäl ordnad uppfostran , att rummen deri ynglingarne stola wistas , under det de pläcka frukter af » vishetens tkad , böra mara andamälscmigare an hittills » varit brukligt , sä » natte detta andamäl warauphunnet ivid Skolan i Wenersborg . 	10	uppfostran
den svin hörer till en bilda uppfostran $ wärar $ ian äuven försäkra om de moralista bildning $	det svin hörer till en bildad uppfostran , wärar » ian äuven försäkra om deras moralista bildning . 	6	uppfostran
$ drottning testamente innehälla hufwudsakligcn $ att hon fullmäktig stola emotta all hon egendom och forwandla den till penning $ att hel capitalet utbetala till william austin $ som länge stätt under hon majtrs uppsigt och stybb $ sä snar han uppnätt 21 vara $ att ränta emedlertid anwandes till be $ wälle au stinn underhäll ech uppfostran $ att alka drottning documenter $ manuscripter $ bref $ tillfalla exerurorerne af hon testamente $ hrr lufhinztou och wilde $ $ hwilka	— Drottningens Testamente innehäller hufwudsakligcn : att Hennes fullmäktige stola emottaga all Hennes egendom och forwandla den till penningar ; att hela Capitalet utbetalas till William Austin , som länge stätt under Hennes Majtrs uppsigt och stybb , sä snart han uppnätt 21 är ; att räntan emedlertid anwandes till be » wälle Au stint underhäll ech uppfostran ; att alka Drottningens documenter , manuscripter , bref rc. tillfalla exerurorerne af Hennes Testamente ( Hrr Lufhinztou och Wilde ) , hwilka 	57	uppfostran
en angling af god uppfostran $ snssar fä nnderwiia nkgra hederlig man barn i räkna $ ffrifwa $	En Angling af god uppfostran , Snssar fä nnderwiia nkgra hederlige MänS Barn I räkna , ffrifwa . 	4	uppfostran
o i v e r f c $ en $ förälder $ som ästunda gifwa sig son en wärdad och fullständig uppfostran $ i synnerhet de som ämna till handel $ medelst en grundlig underivisning uti den för dwarje köpman oumbärlig räknekonst och bok förande $ samt annan till handel höra kunskap $ kunna derutinnun winna sig astu $ dag af en wälkänd handlande $ som i flera vara $ emot billig wilkor $ och för eleverne lätt och söriclaktig method $ gifwit undermisning $ enär de behaga $ sig uti hus $ 1 $ qwart $	O i v e r f c : De resp. Föräldrar , som ästunda gifwa sina Söner en wärdad och fullständig uppfostran , i synnerhet dem som ämnas till Handeln , medelst en grundlig underivisning uti den för dwarje Köpman oumbärligaste Räknekonsten och Böckers förande , samt andra till Handeln hörande kunskaper , kunna derutinnun winna sin astui&gt ; dan af en wälkänd Handlande , som i flera är , emot billiga wilkor , och för Eleverne lätt och söriclaktig method , gifwit undermisning , enär de behaga infinna sig uti Huset N:o 1 , Qwart . 	21	uppfostran
en snygg ocv ordentlig madam ästnndar en bar $ till uppfostran utan bröst $	En snygg ocv ordentlig Madam ästnndar ett Bar » till uppfostran utan bröstet . 	10	uppfostran
eli ung inett stadgadt fruntimmer $ metz en wärdad uppfostran $ önssar finna plats i nägot hederlig hns i slade $ eller pä land $ som sällskap och biträda $ inom hur ivid förekalla gsromsl $ äfiven om der more liten barn $ wille ho $ ltagastg att nllderwisa de $ emedan hon vara stickiig i srräk $ musik $ rita samt all modern fru $ $ $	Eli ungt inett stadgadt Fruntimmer , metz en wärdad uppfostran , önssar finna plats i nägot hederligt HnS i Slade » eller pä Landet , som sällskap och biträd : inom Hur ivid förekallande gSromSl , äfiven om der more mindre Barn , wille ho » Ltagastg att nllderwisa dem , emedan Hon är stickiig i Srräk , Musik , rita samt alla moderna Fru ! ' . 	9	uppfostran
en mor $ hwcrs enda so uppfostran utgöra förnäm föremål för hon omsorg $ önska att uti en hus $ antingen i stad eller pa $ $	En Mor , hwcrs enda Sons uppfostran utgör förnämsta föremålet för hennes omsorger , önskade att Uti ett Hus , antingen i Staden eller pa La^.det . 	6	uppfostran
en fader $ och moderlös flicka om 17 vara $ som fätt en bra uppfostran $ samt kunna sticka $ sy $ wzl räkna och strifwa $ äswen laga mat $ önstar atr komma uti en hederlig hus $ $ sting i stad eller pä land $ för att gä fru i hus tillhanda $ samt mera öfwaz i hushä $ lning $ undandra $ wnde sig ingen systor in o $ ii hus $ i brist deral roll hon biträda uti niopnbod $	En fader - och moderlös Flicka om 17 är , som fätt en bättre uppfostran , samt kan sticka , sy , wZl räkna och strifwa , äswen laga mat , önstar atr komma uti ett hederligt Hus , - stingen i Staden eller pä landet , för att gä Frun i huset tillhanda , samt mera öfwaZ i hushä " lning , undandra / wnde sig inga systor in o » ii hus ; i brist deral roll hon biträda uti Niopnbod . 	14	uppfostran
den dröja ej länge innan jag få se de uthungrad $ knapp skyla af trasa $ för desse vara den $ som jag matt röst höja saknande all uppfostran $ handled i lif en far $ som länge ifrän att hoö de wäck $ afflv för brott $ twärtom dertill uppinub	Det dröjde ej länge innan jag fick se dem uthungrade , knappt skylde af Trasor — För desse är det , som min matta röst höjes Saknande all uppfostran , handled i lif en Far , som länge ifrän att hoö dem wäck » afflv för brott , twärtom dertill uppinuB 	28	uppfostran
$ $ angling med god uppfostran $ som egna ssg äta landlv $ k $ ästundar tjänst näst $ michaeli $ antingen som inspektor pä en liten landtegentom eilee rättare pa en stor $	E-&gt ; Angling med god uppfostran , som egnat ssg ät landlv » ket , ästundar tjänst näst , Michaeli , antingen som Inspektor pä en mindre landtegentom eilee Rättare pa en större . 	5	uppfostran
om nägon stulle ästunda att emot en billig vris wilia till uppfostran bortlemna en gose $ eller flickebarn omkring u a 3 srs älder $ sä försäkra $ den som iwa $ härä tnde f8 afwakta $ att all niöilig stötsel och öm emwärdna $ ej stall sakna $	Om nägon stulle ästunda att emot ett billigt vris wilia till uppfostran bortlemna ett GoSe » eller Flickebarn omkring u a 3 SrS älder ; sä försäkras a« den som iwa » härä tnde f8 afwakta , att all niöilig stötsel och öm emwärdna » ej stall saknas . 	11	uppfostran
en i a i ärs gammal bar i till uppfostran mot stäliga wilkor $	ett i a i ärs gammalt Bar i till uppfostran mot stäliga wilkor . 	9	uppfostran
och kraftig motsägelse $ som de icke allenast genom den underbar $ ock obcgripliga i fin egen natur hafwa en herrffande makt bfwer den oupplyst menni stosinnet $ ntan äfwen fortplanta denna wälde genom $ ett $ en slag arf ifrln den ena flägtet till den $ ndra $ och ofta ifrän mennistor med men $ $ wärdad uppfostran $ ja äfwen af trycka ffrifter hemta näring och styrka hos $ en enfaldig $	och kraftigare motsägelse , som de icke allenast genom det underbara - ock obcgripliga i fin egen natur hafwa en herrffande makt bfwer det oupplysta menni stosinnet , ntan äfwen fortplanta detta wälde genom .. ett .. ett slags arf ifrLn det ena flägtet till det » ndra , och ofta ifrän mennistor med men » ' wärdad uppfostran , ja äfwen af tryckta ffrifter hemta näring och styrka hoS - de enfaldiga . 	58	uppfostran
språk $ fe en bildyd uppfostran äro s $ v nddwändiga $ $ väg lian smickra sig $ att xvi $ annons fäst förälder $ uppuiärksainhet $	språken ' fer en bildyd uppfostran äro s ; v nddwändiga , » vägar lian smickra sig , att xvi d.nua annons fästa föräldrar » uppuiärksainhet . 	5	uppfostran
gtt fi ca äadjiib $ att est en säker och af en tjligvärtg erfarenhet pröiwad och torde $ sättras $ gru $ $ $ ga hos en barn $ hwilka vara $ bestämhe till en $ stop $ uppfostran $ en för denna $ $	gtt fi ca äadjiib Barn-uppfostrare att ester en säker och af en tjligvärtg erfarenhet pröiwad och tör : SÄttraS met:od gru » !i » ga hos de barn , hwilka är » bestämhe till en wete- stop !igare uppfostran , en för detta ar.&ämå ! 	38	uppfostran
för en wälartad 16 sir yngling $ som erbällit en wärdad uppfostran $ räkna och jkrifwer braf $ kättner tysk spräket temmeligen $ samt bokbällerict $ önska dandelskonditivn mot rum och $ duset hos en hederlig principal $ hr $ $ arfwidtzon motta och lämna nära upplysning i ämne $	För en wälartad 16 sirs Yngling , som erbällit en wärdad uppfostran , räknar och jkrifwer braf , kättner Tyska Spräket temmeligen , samt Bokbällerict , önskas DandelSkonditivn mot rum och mac.i Duset hos en hederlig Principal ; Hr ' Kommerce-Rädet Arfwidtzon mottager och lämnar närmare upplysning i ämnet . 	11	uppfostran
för den billig pris qstnndas till uppfostran en ung flicka ömkring s till 9 vara $ uti en hus $ der ej behofwrt utan ijanan och begär att i denna kall werka $ ge anledning till denna annons $ och der den alfivarfammare tillika med en $ fin bildning $ säga ml ktnistaper $ kunna winnas swar afwaktas uti försegla biljett till e $	För det billigaste pris qstnndas till uppfostran en ung Flicka ömkring s till 9 är , uti ett hus , der ej behofwrt utan ijanan och begäret att i detta kall werka , ger anledning till denna annons , och der den alfivarfammare tillika med de » finare bildning , sa ml ktnistaper , kan winnas Swar afwaktas uti förseglad biljett till E . 	6	uppfostran
l $ öjtnanten iwanoff ha afinenniskotärlek skänka till phi lantropiska societet i petersburg en summa af $ rubel $ hwaraf endast räntorne bord $ anwända $ till $ ga barn $ uppfostran äsweiisom till understöd ftr fattig och sjuk $	L . öjtnanten Iwanoff har afinenniskotärlek skänkt till Phi- lantropiska Societeten i Petersburg en summa af 821,000 Rubel , hwaraf endast räntorne bord » anwända » till falti- ga barn » uppfostran äsweiisom till understöd ftr fattiga och sjuke . 	31	uppfostran
anledning vara att tro den tid wara $ gt $ örbi $ dä endast den enstilta uppfostran äga förtroende $ och att äfwen inom te hög och förmögen stånd dcn önean med hmarje dö ffall blifwa mera allmen $ att för k ung $ flägtct begagna cn publik eller deremot fmarande nnderwisnlng $	Anledning är att tro den tid wara & gt ; örbi , dä endast den enstilta uppfostran ägde förtroende , och att äfwen inom te högre och förmögnare stånden dcn önEan med hmarje dog ffall blifwa mera allmen , att för Ket ung , flägtct begagna cn publik eller deremot fmarande nnderwisnlng . 	16	uppfostran
för en dngling om 15 vara $ mcd utrusta god uppfostran $ som will lära pharmaeeutiffa wettenssapen $ vara nu genast plats ä en apothek i stockholm $	För en Dngling om 15 är , mcd utrustad god uppfostran , som will lära Pharmaeeutiffa Wettenssapen , är nu genast plats ä ett Apothek i Stockholm . 	10	uppfostran
för en förmögen att emot en gansta låg $ wid krigsacadernien besörja sig barn uppfostran och en dermed förena tidig $ char inskränka den enstilda underwisningen $ och minska tillfälle för fattig $ gar att $ som informator i en bra hus $ wistas tvid academien $	för de förmögnare att emot ett gansta lågt pensions-pris wid KrigsAcadernien besörja sina barns uppfostran och en dermed förenad tidigare tour-berakning char inskränkt den enstilda underwisningen , och minskat tillfället för fattiga y-rglin^ gar att , som informatorer i de bättre husen , wistas tvid Academien . 	14	uppfostran
en fruntimmer $ som grundlig nnderwisar i fransk spräket $ musik $ rita samt sömnad $ och hiva m ra till en bilda uppfostran hörer $ önssar sig plats som guvernant nti $ äga o t hederlig hus $	Ett Fruntimmer , som grundligt nnderwisar i Franska spräket , Musik , Rita samt Sömnader , och hivad m ra till en bildad uppfostran hörer , önssar sig plats som Guvernant nti » äg o t hederligt Hus . 	23	uppfostran
ni wälartadt flickebarn $ ej under 2 ars älder $ önska till uppfostran $ moderlig rmwärdnad $ jemte snygghet $ uilofwas $ pris vara billig $ emedan den ej göra blott för winning skulle $	Ert wälartadt Flickebarn , ej under 2 ars älder , önskas till uppfostran ; moderlig rmwärdnad , jemte snygghet , uilofwaS ; priset är billigt , emedan det ej göreS blott för winning skull .. 	12	uppfostran
uppfostran och krigare $ c $ nägra ord om prestwal $	uppfostran och Krigarens , c ) Nägra ord om Prestwal . 	0	uppfostran
nöd $ ända ifvan den fnrstligakarncts retelse $ ineii ds $ gt $ ag i nart tidrhwarftanker jag en furstlig uppfostran $ som bära rul föremal att hilda prins till dc första incdboraare inom en fattig land $ s8 finna jag ingalunda hioilrrn öka $ $	nöden , ända ifvan det FnrstligaKarncts retelse ] ineii dS & gt ; ag i nart tidrhwarftanker mig en Furstlig uppfostran , som bar rUl föremal att Hilda Prinsar till dc första incdboraare inom ett fattigt land , s8 finner jag ingalunda hioilrrn öka » . 	20	uppfostran
j $ $ $ be han gaf hon en god uppfostran $	j ' «ort , ber han gaf henne en god uppfostran . 	10	uppfostran
swar torde inlemna i hr arfwidsons kryddbod $ vid stor nygatan $ i biljet till $ z $ $ en hederlig $ barnkart folk åslundar err bra man barn till uppfostran $ omkring en eller balftannat år $	Swar torde inlemnas i Hr Arfwidsons Kryddbod » vid stora Nygatan , i biljet till ( Z . W. Ett hederligt , barnkart Folk åslundar err bättre manS Barn till uppfostran , omkring ett eller balftannat år . 	30	uppfostran
lctober 1809 $ ämna han derföre i förening med nägra för uppfostran nitälska man böria utgifwa en sädant magasin $ som stall innehslla $ 1 $ äshandlingar i uppfostring och underwisningsläran $ rörande barn behandling wid olik äldrar $ meo olik böjelse och anlag $ om bra methoder wid särstilta läroämne $	Lctober 1809 ) ämnar han derföre i förening med nägra för Uppfostran nitälskande man böria utgifwa ett sädant Magasin , som stall innehSlla : 1 ) Äshandlingar i Uppfostrings- och Underwisningsläran , rörande Barns behandling wid olika äldrar , meo olika böjelser och anlag ; om bättre methoder wid särstilta läroämnen . 	11	uppfostran
att wibröra all $ utan att bringa nägot till fullkomlighet eller en nyttig än $ damal $ denna vara den rädande ton i wär modern uppfostran $	Att wibröra allt , utan att bringa nägot till fullkomlighet eller ett nyttigt än » damal , detta är den rädande ton i wär moderna uppfostran . 	25	uppfostran
en yngling frän land $ med god uppfostran och stark kroppsbyggnad $ gärna en som tjent en eller flert vara $ gt $ viktnaliehandcl $ fär kondition dä han anmäla sig i ahlboms viktnaliebod wid stor bada söka yngling i viktualiehandel kunna anmäla sig uti sockerständet wid nybrohamnen för att erhälla adreh hwarest de fä anmäla sig $	En Yngling frän Landet , med god uppfostran och stark kroppsbyggnad , helst en som tjent ett eller flert är & gt ; Viktnaliehandcl , fär kondition dä han anmäler sig i AhlbomS Viktnaliebod wid stora Bad- Sökande Ynglingar i Viktualiehandel kunna anmäla sig uti Sockerständet wid Nybrohamnen för att erhälla adreh hwarest de fä anmäla sig . 	7	uppfostran
om en hederlig och stadgadt fruntimmer $ som sjelf fatt en wärbad bra uppfostran $ skola wllia ilta fig tillsyn ä en enkling kusdäll $ samt att bandleda och unterwifa han dotter i en för de nödig dela $ kunna nära öfwerenskommelse dero $ $ le $ dä fruntimmer behaga genom föra $	Om ett hederligt och stadgadt Fruntimmer , som sjelf fatt en wärbad bättre uppfostran , skulle wllia iltaga fig tillsynen ä en Enklings KuSdäll , samt att bandleda och unterwifa hans Döttrar i de för dem nödige delar , kan närmare öfwerenskommelse dero !ii ( le , dä Fruntimret behagar genom förs . 	13	uppfostran
