sentence_lemma	target_index	cluster	lemma	sentence_token	identifier
d Versklavung d zu 70 Prozent von Kreole und Mestize $ zu 27 Prozent von Mulatte und Neger bewohnt Land werden für d Volk immer unerträglich $	15	0	Mulatte	Die Versklavung des zu 70 Prozent von Kreolen und Mestizen , zu 27 Prozent von Mulatten und Negern bewohnten Landes wird für das Volk immer unerträglicher .	2532889X_1971-08-05_01_101.tcf.xml-14-15
$ verzeihen sie d Störung $ Maestro $ klingen eine angenehm Stimme $ und eine Gesicht treten in d Lichtschein d Morgensonne $ fremdartig und dunkel $ d Antlitz eine Mulatte $	30	0	Mulatte	„ Verzeihen Sie die Störung , Maestro . klang eine angenehme Stimme , und ein Gesicht trat in den Lichtschein der Morgensonne , fremdartig und dunkel — das Antlitz eines Mulatten .	26120215_1952_03_23_01_046.tcf.xml-11-30
und sein nicht d Mulatte in seine Begleitung $ die tückisch Antlitz sie $ als sie gestern abend d Balsa verlassen $ sehen und d sie unter Tausend wiedererkennen wollen $	4	0	Mulatte	Und war nicht der Mulatte In seiner Begleitung , dessen tückisches Antlitz sie , als sie gestern abend die Balsa verließ , gesehen und den sie unter Tausenden wiedererkennen wollte ?	26120215_1952_05_17_01_215.tcf.xml-4-4
mit diese Roman $ Flucht nach Santarim $ $ er werden in diese Jahr im Militärverlag erscheinen $ schließen sie nach $ Hochzeit mit d Tod $ und $ Mordkommando $ weiß Wind $ $ d Geschichte d Mulatte Orestes $ eine Hafenarbeiter aus Brasilien $ ab $	38	0	Mulatte	Mit diesem Roman „ Flucht nach Santarim " , er wird in diesem Jahr im Militärverlag erscheinen , schließen Sie nach „ Hochzeit mit dem Tod " und „ Mordkommando . Weißer Wind ' " die Geschichte des Mulatten Orestes , eines Hafenarbeiters aus Brasilien , ab .	26120215_1985_04_13_01_109.tcf.xml-10-38
mein Vater sein Mulatte $ d roßvater Neger und d Ur roßvater Affe $	3	0	Mulatte	Mein Vater war Mulatte , der roßvater Neger und der Ur roßvater Affe .	2532889X_1966-10-22_01_285.tcf.xml-5-3
aus d Tür d Kombüse schauen eine Kopf mit d weiß Mütze eine Koch heraus $ und gleich danach erscheinen eine flink Mulatte $ die ich meine Koffer abnehmen und sie in d für ich reserviert Kabine bringen $	22	0	Mulatte	Aus der Tür der Kombüse schaute ein Kopf mit der weißen Mütze eines Kochs heraus , und gleich danach erschien ein flinker Mulatte , der mir meine Koffer abnahm und sie in die für mich reservierte Kabine brachte .	26120215_1950_01_21_01_041.tcf.xml-73-22
Fortunato entgehen d Blick nicht $ die d Mulatte wie unwillkürlich dabei nach Jacinta hinüberschweifen lassen $ ohne daß d Bursche dabei eine Miene verziehen haben $	8	0	Mulatte	Fortunato entging der Blick nicht , den der Mulatte wie unwillkürlich dabei nach Jacinta hinüberschweifen ließ , ohne daß der Bursche dabei eine Miene verzogen hätte .	26120215_1952_05_17_01_215.tcf.xml-62-8
d Kritik in d Artikel $ $ d Mulatte $ in d Meisterstufoe $ kommen für unsere Kombinat im recht Moment $	8	0	Mulatte	Die Kritik in dem Artikel „ . Der Mulatte ' in der Meisterstufoe " kam für unser Kombinat im rechten Moment .	2532889X_1970-12-14_01_145.tcf.xml-7-8
$ wenn sie s denn mit klar Wort hören wollen $ $ brummen d Mulatte $ $ so können ich d auch recht sein $	14	0	Mulatte	„ Wenn Ihr s denn mit klaren Worten hören wollt " , brummte der Mulatte , „ so kann mir 's auch recht sein .	26120215_1952_06_01_01_032.tcf.xml-18-14
heute Verörfent leihen wir d zweit Antwort auf unsere kritisch Beitrag $ d Mulatte in d Meisterstube $ $	13	0	Mulatte	Heute verörfent liehen wir die zweite Antwort auf unseren kritischen Beitrag „ Der Mulatte in der Meisterstube " .	2532889X_1970-09-21_01_057.tcf.xml-1-13
sie klagen über d Hitze $ über Da3 -Afrikanische Klima Brasilien $ diese unzivilisiert Klimaj d nur für Neger und Mulatte schaffen sein $ $	20	0	Mulatte	Sie klagte über die Hitze , über da3 -afrikanische Klima Brasiliens , dieses unzivilisierte Klimaj das nur für Neger und Mulatten geschaffen ist " .	2532889X_1955-04-27_01_122.tcf.xml-18-20
neben er d riesig Mulatte auf eine Pferd $ mit die er d General fast um eine ganz Körperlänge überragen $	4	0	Mulatte	Neben ihm der riesige Mulatte auf einem Pferde , mit dem er den General fast um eine ganze Körperlänge überragte .	26120215_1952_05_30_01_041.tcf.xml-12-4
in d Stadt Port Elizabeth stoßen eine 24-jahrig Mulatte auf seine Fahrrad mit eine Lastwagen zusammen und bleiben mit schwer Verletzung liegen $	8	0	Mulatte	In der Stadt Port Elizabeth stieß ein 24jähriger Mulatte auf seinem Fahrrad mit einem Lastwagen zusammen und blieb mit schweren Verletzungen liegen .	2532889X_1955-12-07_01_073.tcf.xml-4-8
tatsachelich entstehen die erst $ ernsthaft Zerwürfnis mit meine Teilhaber $ die zu meine Austritt aus d Geschäft führen $ durch $ inen Zwischenfall diese Art. Me- Orab haben eine Schar ausgezeichnet Leute aus Nord-Carolina mitbringen $ darunter eine ungewöhnlich hübsch jung Frau mit eine niedlich klein Junge $ die gerade $ u sprechen anfangen $ sehr hell Mulatte $ Gie haben wirklich als Weiße $ reiten können $	58	0	Mulatte	Tatsachlich entstand das erst « ernsthafte Zerwürfnis mit meinen Teilhabern , das zu meinem Austritt aus dem Geschäft führte , durch « inen Zwischenfall dieser Art. Me- Orab hatte eine Schar ausgezeichneter Leute aus Nord-Carolina mitgebracht , darunter eine Ungewöhnlich hübsche junge Frau mit einem niedlichen kleinen Jungen , der gerade « U sprechen anfing — sehr helle Mulatten , gie hätten wirklich als Weiße « reiten können .	26120215_1954_06_10_01_032.tcf.xml-21-58
$ da schlagen d Knall d beide abgefeuert Gewehr an sein Ohr $ die sein d verabredet Zeichen eine drohend Gefahr $ und Major Barbadoes schauen in Verzweiflung zu d leer Fenster hinauf $ denn wie eine Blitz sein d klein Mulatte zurückspringen $ um in seine Uniform zu fahren und seine Säbel umschnallen $	41	0	Mulatte	— Da schlug der Knall der beiden abgefeuerten Gewehre an sein Ohr — das war das verabredete Zeichen einer drohenden Gefahr , und Major Barbadoes schaute in Verzweiflung zu dem leeren Fenster hinauf , denn wie ein Blitz war der kleine Mulatte zurückgesprungen , um in seine Uniform zu fahren und seinen Säbel umzuschnallen .	26120215_1952_06_22_01_263.tcf.xml-44-41
ermutigen Durch^das $ Bejt spielen d amerikanisch $ Negerdichter lang hughes $ spuren Guillen d kulturell Widerstand auf $ die in d populär Sons $ d Tanzlied d Mulatte $ stecken $	28	0	Mulatte	Ermutigt durch^das , BeJt spiel des amerikanischen ^ Negerdichters Längsten Hughes , spurt Guillen den kulturellen Widerstand auf , der in den populären Sons , den Tanzliedern der Mulatten , steckt .	2532889X_1982-07-10_01_068.tcf.xml-9-28
unter d direkt Einfluß d französisch Revolution von 1789 entwickeln sich in west- Haiti eine stark Unabhangigkeitsbeweaung $ die 1790 mit d Erhebung d Mulatte gegen d weiß Plantagenbesitzer beginnen und von 1794 ab in d zweit bürgerlich-demokratisch Revolution $ d Negersklave $ ihr Höhepunkt erreichen $	24	0	Mulatte	Unter dem direkten Einfluß der Französischen Revolution von 1789 entwickelte sich in West- Haiti eine starke Unabhangigkeitsbeweaung , die 1790 mit der Erhebung der Mulatten gegen die weißen Plantagenbesitzer begann und von 1794 ab in der zweiten bürgerlich-demokratischen Revolution ( der Negersklaven ) ihren Höhepunkt erreichte .	26120215_1983_01_21_01_124.tcf.xml-20-24
$ Verrat $ $ zischen d riesig Mulatte zwischen d Zahn $	7	0	Mulatte	„ Verrat ! " zischte der riesige Mulatte zwischen den Zähnen .	26120215_1952_06_20_01_208.tcf.xml-12-7
$ diejenige $ die d Boden bebauen $ sollen auch sein Besitzer sein II t_ __i_ p* $ j. 1— $ und d Mulatte Claudionor tauchen * Uf und brummen überzeugen $	23	0	Mulatte	„ Derjenige , der den Boden bebaut , soll auch sein Besitzer sein II T_ __i_ P* ¦ J. 1— . Und der Mulatte Claudionor tauchte * uf und brummte überzeugt :	2532889X_1955-06-05_01_078.tcf.xml-11-23
auch Indianer mögen sich in diese Gruppe befinden haben $ aber d meiste sein $ Mulatte und Schwarze $ $	15	0	Mulatte	Auch Indianer mögen sich in dieser Gruppe befunden haben , aber die meisten waren „ Mulatten und Schwarze " .	2532889X_1951-06-02_01_163.tcf.xml-9-15
in diese Nd-Diskussion werden am 30. August in d Beitrag $ $ d Mulatte $ $ in d Meisterstube $ an ich d Frage stellen $	13	0	Mulatte	In dieser ND-Diskussion wurde am 30. August in dem Beitrag „ . Der Mulatte ' . in der Meisterstube " an mich die Frage gestellt :	2532889X_1970-09-13_01_059.tcf.xml-6-13
wenn jedoch d d Empfang sein $ welche d francosch Uniform hier im Land bevorstehen $ dann haben sich d Mulatte wohl vergebens auf Triumphbogen $ Illumination und Ehrenpforte freuen $	20	0	Mulatte	Wenn jedoch das der Empfang ist , welcher der Francoschen Uniform hier im Lande bevorsteht , dann hat sich der Mulatte wohl vergebens auf Triumphbogen , Illumination und Ehrenpforten gefreut .	26120215_1952_06_13_01_226.tcf.xml-49-20
es garantieren d 75000 Miskitos $ 182000 Mestize $ 26000 Mulatte $ 9000 Sumo $ 1750 Garifonen und 850 Rama nicht zuletzt die kulturell Eigenständigkeit $	10	0	Mulatte	Es garantiert den 75000 Miskitos , 182000 Mestizen , 26000 Mulatten , 9000 Sumos , 1750 Garifonen und 850 Ramas nicht zuletzt deren kulturelle Eigenständigkeit .	26120215_1987_10_21_01_147.tcf.xml-8-10
mit diese Wort entlassen ich d Mulatte $ schließen d Tur und denken über d Gehörte nach $	6	0	Mulatte	Mit diesen Worten entließ Ich den Mulatten , schloß die Tur und dachte über das Gehörte nach .	26120215_1950_01_22_01_039.tcf.xml-17-6
d ober Diener in d Gasthof $ eine groß $ stattlich $ sanft Mulatte $ doch sehr dürftig und schmutzig kleiden $ scheinen aus irgendeine Grund $ vielleicht weil ich höflich zu er sein $ eine Vorliebe für mich zu haben nach d Essen rufen er mich beiseite und fragen ich $ ob ich d Gentleman kennen $ die ich bei Tisch gegenüber sitzen haben $	13	0	Mulatte	Der oberste Diener in dem Gasthof , ein großer , stattlicher , sanfter Mulatte , doch sehr dürftig und schmutzig gekleidet , schien aus irgendeinem Grunde — vielleicht weil ich höflich zu ihm war — eine Vorliebe für mich zu haben Nach dem Essen rief er mich beiseite und fragte mich , ob ich den Gentleman kenne , der mir bei Tisch gegenüber gesessen habe .	26120215_1954_06_09_01_303.tcf.xml-32-13
d flandrisch Malerei sein durch d $ Kleopatra $ $ d $ Artemis $ und noch ander Werk von Rubens vertreten $ und etwa zur gleich Zeit haben Frans Hals mit unerhört malerisch Können seine $ Mulatte $ schaffen $	36	0	Mulatte	Die flandrische Malerei ist durch die „ Kleopatra " , die „ Artemis " und noch andere Werke von Rubens vertreten , und etwa zur gleichen Zeit hat Frans Hals mit unerhörtem malerischen Können seine „ Mulatten " geschaffen .	2532889X_1958-08-16_01_074.tcf.xml-25-36
soviel zur erst Reaktion auf unsere kritisch Beitrag $ d Mulatte in d Meisterstube $ $	10	0	Mulatte	Soviel zur ersten Reaktion auf unseren kritischen Beitrag „ Der Mulatte in der Meisterstube " .	2532889X_1970-09-13_01_063.tcf.xml-14-10
d historisch Stück zeigen unterdrückt Mulatte und Neger $ d korrupt Aristokratie mit ihr Trägheit und falsch Frömmigkeit $ ihr Extravaganz und ihr Stolz $	5	0	Mulatte	Das historische Stück zeigt unterdrückte Mulatten und Neger , die korrupte Aristokratie mit ihrer Trägheit und falschen Frömmigkeit , ihren Extravaganzen und ihrem Stolz .	26120215_1974_09_04_02_097.tcf.xml-6-5
eine paar Schritt abseits stehen $ eine erlöschen Zigarette im Mundwinkel $ eine helläugig Mulatte $ offenbar d Chef d Gruppe $	14	0	Mulatte	Ein paar Schritte abseits stand — eine erloschene Zigarette im Mundwinkel — ein helläugiger Mulatte ( offenbar der Chef der Gruppe )	2532889X_1955-02-18_01_133.tcf.xml-46-14
d 2.7 Million Einwohner 70 Prozent von sie sein Kreole und Mestize $ 27 Prozent Neger und Mulatte $ leben in ihr Masse unter Bedingung bitter Armut $	17	0	Mulatte	Die 2.7 Millionen Einwohner 70 Prozent von ihnen sind Kreolen und Mestizen , 27 Prozent Neger und Mulatten — leben in ihrer Masse unter Bedingungen bitterer Armut .	2532889X_1970-06-07_01_587.tcf.xml-5-17
nachdem einmal in eine Versammlung d Partei Zwischenrufer auftreten sein $ geifern es am 13. 9. 1969 in tausendjahrig bewährt Manier über diese $ westdeutsch Kryptokommunist übrigens sehen man auch Mulatte und Neger unter sie $ $	30	0	Mulatte	Nachdem einmal in einer Versammlung der Partei Zwischenrufer aufgetreten waren , geiferte es am 13. 9. 1969 in tausendjährig bewährter Manier über diese „ westdeutschen Kryptokommunisten übrigens sah man auch Mulatten und Neger unter ihnen " .	26120215_1970_11_15_01_075.tcf.xml-14-30
es geben etwa 20 ethnisch Gruppe und eine Minderheit von Mulatte $	10	0	Mulatte	Es gibt etwa 20 ethnische Gruppen und eine Minderheit von Mulatten .	26120215_1980_12_02_01_049.tcf.xml-5-10
erst als Henriqueta $ von d Unterhaltung und einige Whisky anregen $ Suzana zeigen $ wie d echt Samba tanzen werden $ die vom Hügel d Neger und Mulatte $ d Samba d Favela und d Mangusira $ da leben d Dichter auf $	28	0	Mulatte	Erst als Henriqueta , von der Unterhaltung und einigen Whiskys angeregt , Suzana zeigte , wie die echte Samba getanzt wird , die vom Hügel der Neger und Mulatten , die Samba der Favela und der Mangusira , da lebte der Dichter auf .	2532889X_1955-04-07_01_077.tcf.xml-39-28
20 Prozent Mulatte $ fünf Prozent Inder und eine Prozent Weiße $	2	0	Mulatte	20 Prozent Mulatten , fünf Prozent Inder und ein Prozent Weiße .	26120215_1980_01_23_01_143.tcf.xml-8-2
Dos Land zählen nahezu 10 Million Einwohner $ von die 70 Prozent Kreole $ 17 Prozent Mulatte $ 12 Prozent Afro-Amerikaner und 1 Prozent asiatisch Abstammung sein $	16	0	Mulatte	Dos Land zählt nahezu 10 Millionen Einwohner , von denen 70 Prozent Kreolen , 17 Prozent Mulatten , 12 Prozent Afro-Amerikaner und 1 Prozent asiatischer Abstammung sind .	2532889X_1983-03-12_01_097.tcf.xml-2-16
Siger Länderei in Mato Grosso $ seine Unwissenheit übertreffen an Umfang noch seine Besitzung $ $ und d Poet Cesar Guilherme Shopel $ eine ungewöhnlich fett Mulatte $ d Ausführung d Bankier $	26	0	Mulatte	siger Ländereien in Mato Grosso ( seine Unwissenheit übertraf an Umfang noch seine Besitzungen ) , und der Poet Cesar Guilherme Shopel , ein ungewöhnlich fetter Mulatte , den Ausführungen des Bankiers .	2532889X_1955-02-08_01_044.tcf.xml-41-26
am 30. August vergangen Jahr kritisieren wir in unsere Beitrag $ d Mulatte in d Meisterstube $ $ daß im Leipziger Stammbetrieb d VEB Kombinat Gtsag d Kultur eine Stiefkind sein $	12	0	Mulatte	Am 30. August vergangenen Jahres kritisierten wir in unserem Beitrag „ Der Mulatte in der Meisterstube " , daß im Leipziger Stammbetrieb des VEB Kombinat Gtsag die Kultur ein Stiefkind ist .	2532889X_1971-05-15_01_057.tcf.xml-5-12
d einzig was ich nicht begreifen können $ sein d Ursache von Malvecas Desertation und Flores zu veranlassen $ um sich diese schuftig Mulatte zuwenden $	23	0	Mulatte	Das einzige was ich nicht begreifen kann , ist die Ursache von Malvecas Desertation und Flores zu veranlassen , um sich diesem schuftigen Mulatten zuzuwenden .	26120215_1952_07_19_01_043.tcf.xml-26-23
Unterstützung finden sie bei d Masse d Mulatte $ die sich unbedingt von d Neger fernhalten wollen $ ja selbst zum Teil schon Sklave ausbeuten $	7	0	Mulatte	Unterstützung finden sie bei der Masse der Mulatten , die sich unbedingt von den Negern fernhalten wollen , ja selbst zum Teil schon Sklaven ausbeuten .	2532889X_1961-08-19_01_095.tcf.xml-32-7
$ nicht mehr nehmen $ $ rufen d Mulatte $	8	0	Mulatte	„ Nicht mehr nehmen ? " rief der Mulatte ,	26120215_1952_06_28_01_030.tcf.xml-39-8
aber d Steward scheinen in Ordnung $ zu sein $ eine ganz brav Mulatte $ er haben früh bei ich auf d ,erigon dienen $ _. ii j. ii es klingen lächerlich $ aber ich müssen gestehen $ daß ich rühren sein $	13	0	Mulatte	Aber der Steward scheint in Ordnung . zu sein , ein ganz braver Mulatte ; er hat früher bei mir auf der ,Erigon gedient . _. ii j. ii Es klingt lächerlich , aber ich muß gestehen , daß Ich gerührt war .	26120215_1950_01_21_01_041.tcf.xml-39-13
nur eine d Entrechtete $ d Mulatte Toao $ wagen eine nachts d Auflehnung $	6	0	Mulatte	Nur einer der Entrechteten , der Mulatte Toao , wagt eines Nachts die Auflehnung :	2532889X_1964-07-11_01_146.tcf.xml-21-6
in eine Interview bezeichnen d Rektor d Universität $ Noel Salomon $ Guillen als $ d Stimme d lateinafrikanisch Amerika d 1902 gebären Dichter gelten als d bedeutend Vertreter d 1930 auf d Antillen entstehen sogenannt Poesia Negra $ die an d folkloristisch Tradition d Neger und Mulatte anknüpfen $	47	0	Mulatte	In einem Interview bezeichnete der Rektor der Universität , Noel Salomon , Guillen als „ die Stimme des lateinafrikanischen Amerika Der 1902 geborene Dichter gilt als der bedeutendste Vertreter der 1930 auf den Antillen entstandenen sogenannten Poesia Negra , die an die folkloristischen Traditionen der Neger und Mulatten anknüpfte .	26120215_1977_01_11_01_055.tcf.xml-2-47
seine rund 400000 Einwohner $ zu 90 Prozent analphabetisch Bauer $ umfassen $ Malinke $ wolof $ fulbe und Mulatte $	19	0	Mulatte	Seine rund 400000 Einwohner , zu 90 Prozent analphabetische Bauern , umfassen , Malinke , Wolof , Fulbe und Mulatten .	2532889X_1972-02-21_01_251.tcf.xml-4-19
d Bevölkerung von St. Sebastian $ Südafrika $ werden auf hundert- und zwanzigtausend Seele schätzen $ wovon zwei Drittheile Sclaven und d übrig Europäer und Mulatte sein $	25	0	Mulatte	Die Bevölkerung von St. Sebastian ( Südafrika ) wird auf hundert- und zwanzigtausend Seelen geschätzt , wovon zwei Drittheile Sclaven und die übrigen Europäer und Mulatten sind .	2532889X_1968-01-20_01_237.tcf.xml-2-25
für Doca Fagundes sein d Kommunismus $ von d Nestor und d Mulatte Claudionor so viel spra *	12	0	Mulatte	Für Doca Fagundes war der Kommunismus , von dem Nestor und der Mulatte Claudionor so viel spra *	2532889X_1955-06-05_01_078.tcf.xml-29-12
Miskitos $ 18200 Mestize $ 26000 Mulatte $ 9000 Sumo $ 1750 Garifunen und 850 Rama nicht zuletzt die kulturell Eigenständigkeit $	6	0	Mulatte	Miskitos , 18200 Mestizen , 26000 Mulatten , 9000 Sumos , 1750 Garifunen und 850 Ramas nicht zuletzt deren kulturelle Eigenständigkeit .	2532889X_1987-11-06_01_143.tcf.xml-7-6
6. Samara $ 8. Mulatte $ 9. Bau $ 10. Semester $	4	0	Mulatte	6. Samara , 8. Mulatte , 9. Bau , 10. Semester .	26120215_1961_05_04_01_156.tcf.xml-6-4
d 23jähriee Usa-Student Whitfield $ eine Mulatte $ laufen im strömend Regen über 800 M olympisch Rekord mit 1:49,2 Min. und vermögen sowohl d langbeinig Jamaika-Neger Wint als auch d $ fliegend Sportjournalist $ Marcel Hansenne $ Frankreich $ zu schlagen $	6	0	Mulatte	Der 23jähriee USA-Student Whitfield , ein Mulatte , lief im strömenden Regen über 800 m olympischen Rekord mit 1:49,2 Min. und vermochte sowohl den langbeinigen Jamaika-Neger Wint als auch den „ fliegenden Sportjournalisten " Marcel Hansenne ( Frankreich ) zu schlagen .	26120215_1948_08_03_01_037.tcf.xml-2-6
dazu zählen d Gemälde $ d sieben Lebensalter d Weib $ von Hans Baidung $ nennen Grien $ und $ d Mulatte $ von Frans Hals d. Ä $ $	21	0	Mulatte	Dazu zählen die Gemälde „ Die sieben Lebensalter des Weibes " von Hans Baidung , genannt Grien , und „ Der Mulatte " von Frans Hals d. Ä . .	2532889X_1981-08-24_01_071.tcf.xml-23-21
d im Boxring so erfolgreich Mulatte werden aber d Boxsnort aufleben müssen	5	0	Mulatte	Der im Boxring so erfolgreiche Mulatte wird Aber den Boxsnort aufleben müssen	2532889X_1946-11-12_01_120.tcf.xml-29-5
$ neun Mann haben auf er schießen $ und d Kanaille sollen Unserupft davonkommen sein $ $ d Hauptmann verstehen etwas $ $ versichern d Mulatte $ $ er haben s aus seine Buch lernen und haben d Solon hleb- und schußfest damit machen $	25	0	Mulatte	„ Neun Mann haben auf ihn geschossen , und die Kanaille sollte unserupft davongekommen sein ?* „ Der Hauptmann versteht etwas " , versicherte der Mulatte , „ er hat s aus seinen Büchern gelernt und hat den Solon hleb- und schußfest damit gemacht .	26120215_1952_06_04_01_045.tcf.xml-25-25
auch d Held diese Roman sein eine d Unglücklichen $ und wenn Hildreth er eine weiß Sklave nennen $ so heißen die nur daß es sich um eine sehr hellhäutig Mulatte	30	0	Mulatte	Auch der Held dieses Romans ist einer der Unglücklichen , und wenn Hildreth ihn einen weißen Sklaven nennt , so heißt das nur daß es sich um einen sehr hellhäutigen Mulatten	26120215_1954_03_19_01_179.tcf.xml-5-30
d dauernd Niederlassung von Farbige $ Neger $ Madagasse $ Indochinesen $ Mulatte $ in Frankreich dürfen grundsätzlich nicht gedulden werden $	12	0	Mulatte	Die dauernde Niederlassung von Farbigen ( Negern , Madagassen , Indochinesen , Mulatten ) in Frankreich darf grundsätzlich nicht geduldet werden .	2532889X_1961-06-06_01_024.tcf.xml-13-12
im nächst Moment treffen d Stahl Elnei d Reiter d breit gelb Stirn d Mulatte und werfen er aus d Sattel $ und über er hin gehen d Hufe d nachstürmend Pferd $	14	0	Mulatte	Im nächsten Moment traf der Stahl elnei der Reiter die breite gelbe Stirn des Mulatten und warf ihn aus dem Sattel , und über ihn hin gingen die Hufe der nachstürmenden Pferde ,	26120215_1952_06_25_01_237.tcf.xml-11-14
unter d Farbige wollen viel Mulatte nicht mit d Schwarze verkehren $	5	0	Mulatte	Unter den Farbigen wollen viele Mulatten nicht mit den Schwarzen verkehren .	26120215_1950_01_29_01_058.tcf.xml-44-5
es handeln sich um Neger und Mulatte $ die außer als Dienstbote keine Zugang zu Luxushotel $	6	0	Mulatte	Es handelt sich um Neger und Mulatten , die außer als Dienstboten keinen Zugang zu Luxushotels .	26120215_1973_03_18_01_067.tcf.xml-62-6
Matisse und Picasso und auch solch berühmt Werk wie d $ Gothaer Liebespaar $ $ $ d Lasttragei von Meumer $ $ d Mulatte $ von Frans Hals $ $ d Auferstehung d Lazarus $ von Tintoretto und viel andere $	23	0	Mulatte	Matisse und Picasso und auch solche berühmten Werke wie das „ Gothaer Liebespaar " , „ Der Lasttragei von Meumer , „ Der Mulatte " von Frans Hals , „ Die Auferstehung des Lazarus " von Tintoretto und viele andere .	2532889X_1958-11-08_01_107.tcf.xml-7-23
$ d Märchen $ $ rufen d Mulatte tückisch $	7	0	Mulatte	„ Das Märchen ' " rief der Mulatte tückisch .	26120215_1952_06_01_01_032.tcf.xml-31-7
in Bilddokument und Statistik zeigen d polnisch Mensch in d als Museum erhalten Lager d Vorläufer von Auschwitz $ d Vernichtung d Bure durch d Brite $ imperialistisch Massaker gegen unterdrückt und Kolonialvolk $ d amerikanisch Verbrechen an Neger $ Mulatte usw $	40	0	Mulatte	In Bilddokumenten und Statistiken zeigen die polnischen Menschen in dem als Museum erhaltenen Lager die Vorläufer von Auschwitz : die Vernichtung der Buren durch die Briten , imperialistische Massaker gegen unterdrückte und Kolonialvölker , die amerikanischen Verbrechen an Negern , Mulatten usw .	2532889X_1952-08-12_01_051.tcf.xml-38-40
sie verstehen ich nicht $ $ lachen aber d klein Mulatte vergnügen vor sich hin $ $ nun dann wollen ich es sie deutlich sagen $ es werden d ander Herr da auch interessieren $ $	10	0	Mulatte	Sie verstehen mich nicht ? " lachte aber der kleine Mulatte vergnügt vor sich hin , „ nun dann will ich es Ihnen deutlicher sagen ; es wird die anderen Herren da auch interessieren . —	26120215_1952_06_06_01_037.tcf.xml-31-10
so eine revolutionär Held wie Toussaint L' Ouverture $ auf die sie auch in d neu Erzählung Bezug nehmen $ die Idee und Tat d Neger und Mulatte auf Jamaika aufrütteln $ müssen sie zur literarisch Gestaltune herausfordern $	27	0	Mulatte	So ein revolutionärer Held wie Toussaint L' Ouverture , auf den sie auch in der neuen Erzählung Bezug nimmt , dessen Ideen und Taten die Neger und Mulatten auf Jamaika aufrüttelten , mußte sie zur literarischen Gestaltune herausfordern .	2532889X_1961-08-19_01_095.tcf.xml-59-27
wenn sie d eine Brief an Malveca übergeben $ die er nur zu bestellen haben $ so können sie sicher darauf rechnen $ daß Ei in d Hand d Mulatte fällen	29	0	Mulatte	Wenn Sie dem einen Brief an Malveca übergeben , den er nur zu bestellen hat , so können Sie sicher darauf rechnen , daß ei in die Hände des Mulatten fällt	26120215_1952_06_15_01_337.tcf.xml-8-29
Leutnant $ $ gut mmer fröhlich Mulatte $ die uns Le erst Einführung geben $ sein 2 Jahr alt $	6	0	Mulatte	Leutnant ) , gut mmer fröhlicher Mulatte , der uns le erste Einführung gibt , Ist 2 Jahre alt .	26120215_1962_11_13_01_209.tcf.xml-16-6
d literarisch Gestalt arm Weiße $ sozial abgesinken Nachkomme einstig Plantagenbesitzer $ Afro-Amerikaner $ Mulatte und Indianer $ die ihr Dasein als Farmer $ landlos Pächter $ Sägemühlenarbeiter oder Jager fristen $ Sindi tief in diese Land und seine Geschichte verwurzeln $	14	0	Mulatte	Die literarischen Gestalten arme Weiße , sozial abgesunkene Nachkommen einstiger Plantagenbesitzer , Afro-Amerikaner , Mulatten und Indianer , die ihr Dasein als Farmer , landlose Pächter , Sägemühlenarbeiter oder Jager fristen — sindi tief in diesem Land und seiner Geschichte verwurzelt .	2532889X_1982-05-22_01_252.tcf.xml-10-14
Meter groß Insel leben reichlich eine Million Mensch $ über 50 Prozent sein Neger und Mulatte $ 40 Prozent Inder $	15	0	Mulatte	meter großen Inseln leben reichlich eine Million Menschen — über 50 Prozent sind Neger und Mulatten , 40 Prozent Inder .	26120215_1970_04_24_01_399.tcf.xml-10-15
