sentence_lemma	sentence_token	target_index	original_word
bröllop fira i torsdag i brud föräldrahem i jönköping mellan provi hannes molin och fröken ellon astberg $ dotter $ $	Bröllop firades i Torsdags i brudens föräldrahem i Jönköping mellan provisorn Hannes Molin och fröken Ellon Astberg , dotter till-sf . 	0	brllop
samla sig denna gud kärlek stråle och sist till en knippe rik och full utaf ljus $ när afton skymma komma $ lyse ni väg $ till salem port $ där vänta stå han $ som vilja port slå upp till den hus $ hvars glans ej kunna nämna $ som vilja fira med ni för evig en gyllene bröllop $ som vilja sluta i älskande famn $ guldbröllopspar $	Samle sig dessa Guds kärleks strålar och sist till ett knippe Rikt och fullt utaf ljus , när aftonen skymmande kommer , Lyse Er väg — till Salems port , där väntande står Han , Som vill porten slå upp till det hus , hvars glans ej kan nämnas , Som vill fira med Eder för evigt ett gyllene bröllop , Som vill sluta i älskande famnen — guldbröllopsparet . 	59	brllop
på ångare $ svea $ på resa från trelleborg till karlshamn medfölja häromdagen såsom passagerare kamrerare vid skåne enskild bank afdelningskontor i eslöf hans bern och han maka $ föda persson $ hvilka i onsdag fira bröllop och nu befunno sig på sig bröllopsresa $	på ångaren ” Svea ” på resa från Trelleborg till Karlshamn medföljde häromdagen såsom passagerare kamreraren vid Skånes enskilda banks afdelningskontor i Eslöf Hans Bern och hans maka , född Persson , hvilka i onsdags firade bröllop och nu befunno sig på sin bröllopsresa . 	36	brllop
ea sån redovisning biel ock med tillhjälp at ort klockare $ men utvisa $ $ till myndling som hon man stor förvåning $ att af den vänta arfvet finna blott obetydlig kvar $ enär stor del påstå hafva åtgå till betäcka af kostnad för föda och klä der under systerdotter vistelse hos morbror $ äfvensom till utstyrsel för hon bröllop $	Ea sådan redovisning biel ock med tillhjälp at ortens klockare uppsatt men utvisade , såväl till myndlingens som hennes mans stora förvåning , att af det väntade arfvet fanns blott obetydligt kvar , enär större delen påstods hafva åtgått till betäckande af kostnaderna för föda och klä der under systerdotterns vistelse hos morbrodern , äfvensom till utstyrsel för hennes bröllop . 	59	brllop
denna ha mot all förväntan och beräkning dra ut på tid $ så att bröllop komma hota nära och knapp mera kunna undvika $	Detta hade mot all förväntan och beräkning dragit ut på tiden , så att bröllopet kommit hotande nära och knappast mera kunde undvikas . 	14	brllop
stackars sylvia i jag se hon aldrig efter bröllop $	Stackars Sylvia I Jag såg henne aldrig efter bröllopet . 	8	brllop
$ den dansa på jag bröllop $ och så skola den äfven ske på jag dotter $ $ genom den öppen dörr från sig ram få han sålanda ännu en gång	» Det dansades på mitt bröllop , och så skall det äfven ske på min dotters ! » Genom den öppna dörren från sitt ram fick han sålanda ännu en gång 	5	brllop
bröllop fira i förgår i brud f $ iråtdrahem i allarp mellan grosshandl $	Bröllop firades i förgår i brudens f ' iråtdrahem i Allarp mellan grosshandl . 	0	brllop
vild bröllopslif föra af visssa åskådare $ som $ sig för att efter vanlighet $ se brud $ vid en bröllop $ som häromdagen hålla å en ställe under ström ägendom i bohuslän berätta $ bohuslänning $ $	Vildt bröllopslif fördes af visssa åskådare , som infunnit sig för att efter vanligheten » se bruden » vid ett bröllop , som häromdagen hölls å ett ställe under Ströms ägendom i Bohuslän berättar » Bohuslänningen » . 	20	brllop
bröllop fira i torsdag i mariestad mellan tlkalen i svea hofi ätt louis ameen och fröken anna sjöcrona $ dotter till landshöfding i skaraborg län c $	Bröllop firades i torsdags i Mariestad mellan tLkalen i Svea hofi ätt Louis Ameen och fröken Anna Sjöcrona , dotter till landshöfdingen i Skaraborgs län C . 	0	brllop
en bröllop jrägick just i en gärd nära båtbrygga och ben ung $ wackra brud med hel sig $ följe $ komma emot oh pä brygga $ dä ängar nalkas $ antagligen för att läka passagerarne se pä stäten $	Ett bröllop jrägick just i en gärd nära båtbryggan och ben unga , wackra bruden med hela sitt " följe " kom emot oh pä bryggan , dä ängaren nalkades , antagligen för att läka passagerarne se pä stäten . 	1	brllop
böjelse och protestera mot att tolstoj $ som själf lefver i äktenskap $ förbjuda den för an dra $ aftågade en ung arm i arm från chavief och höllö bröllop i nära stad $	böjelse och protesterat mot att Tolstoj , som själf lefver i äktenskap , förbjuder det för an dra , aftågade de unga arm i arm från Chavief och höllö bröllop i närmaste stad . 	29	brllop
en stor bröllop egde rum i gå å gods ekenäs $ då bruksdisponent axel ekman $ finspong $ sammanviga med fröken marianne klingspor $ dotter till ledamot af riksdag första kammare $ grefve philip klingspor och han maka $ föda sjögréen $	Ett större bröllop egde rum i går å godset Ekenäs , då bruksdisponenten Axel Ekman , Finspong , sammanvigdes med fröken Marianne Klingspor , dotter till ledamoten af riksdagens Första kammare , grefve Philip Klingspor och hans maka , född Sjögréen . 	2	brllop
emellertid blef bröllop mellan den rik bondson ooh den fager ros $	Emellertid blef bröllop mellan den rike bondsonen ooh den fagra rosen . 	2	brllop
troligen vara man rädd för att komma för sen till bröllop $ men den vara farlig att köra så fort på den dålig väg $	Troligen var man rädd för att komma för sent till bröllopet , men det var farligt att köra så fort på den dåliga vägen . 	10	brllop
bröllop fira den 5 denna mellan regementsintendent vid kronoberg regemente aron petersson och enkefru louise påhlman $ dotter af gods frih $	Bröllop firades den 5 dennes mellan regementsintendenten vid Kronobergs regemente Aron Petersson och enkefru Louise Påhlman , dotter af godsegaren frih . 	0	brllop
blef emellertid enka dag efter bröllop $ då mattsson drunkna under badning $	blef emellertid enka dagen efter bröllopet , då Mattsson drunknade under badning . 	5	brllop
bjudnlngskort och brof till begrafnlngar och bröllop $ visitkort m $ m $	BJudnlngskort och Brof till begrafnlngar och bröllop , Visitkort m . m . 	6	brllop
såsom all för handel och industri behöflig blankett $ järnvägsfraktsedel och adresslapp $ papper och kuvert med firmaståmpling bröllop och begrafningskort $ visitkort och nyårskort m $ m $	såsom alla för handel och industri behöfliga blanketter , järnvägsfraktsedlar och adresslappar ; papper och kuvert med firmaståmpling bröllops- och begrafningskort , visitkort och nyårskort m . m . 	18	brllop
såsom all för handel och industri behöflig blankett $ jämvägsfraktsedlar och adresslapp $ papper oell kuvert med firmastämpling $ bröllop oell begrafningskort $ visitkort och nyårskort m $ m $	såsom alla för handel och industri behöfliga blanketter , jämvägsfraktsedlar och adresslappar ; papper oell kuvert med firmastämpling ; bröllops- oell begrafningskort , visitkort och nyårskort m . m . 	19	brllop
då vilja jag hålla bröllop $ eller af rättning $	då vill jag hålla bröllop — eller af rättning . 	4	brllop
bröllop fira i fredag i lund mellan läroverksadjunkt i ystad a $	Bröllop firades i fredags i Lund mellan läroverksadjunkten i Ystad A . 	0	brllop
bröllop skola vara liten och enkel $ familj krön ha ännu sorg $	Bröllopet skall vara litet och enkelt , familjen Krönen har ännu sorg . 	0	brllop
då talar vara på resa i egypten $ hålla der en bröllop $ som räcka i flere dag $ och till hvilket brud komma först på tredje dag afton $	Då talaren var på resa i Egypten , hölls der ett bröllop , som räckte i flere dagar , och till hvilket bruden kom först på tredje dagens afton . 	11	brllop
och skola just till att passera lyngssuen $ då man af kamrat utbrista $ $ komma den åt hval der $ $ han dansa ju $ som vara han på bröllop $	och skulle just till att passera Lyngssuen , då en af kamraterna utbrast : „Hvad kommer det åt hvalen der , ' han dansar ju , som vore han på bröllop . 	30	brllop
y formulär kontrakt diplom affisch program bjudningskort tili bröllop och begrafning $	y Formulär Kontrakt Diplomer Affischer Program Bjudningskort tili Bröllop och Begrafningar etc. 	8	brllop
svensk luthersk gustaf adolfskyrkan i newyork bräde i början af månad den förut bebåda bröllop mellan öfverste john fletcher hobbs konung öfver ulika ö $ ti lhörande ny hebriderna $ och vi landsmaninna fröken ella oollin $	svensk lutherska Gustaf Adolfskyrkan i Newyork brädes i början af månaden det förut bebådade bröllopet mellan öfverste John Fletcher Hobbs konung öfver Ulika Öarne ( ti lhörande Nya Hebriderna ) och vår landsmaninna fröken Ella Oollin . 	14	brllop
med anledning af text berättelse om att den warit brist pä win pä bröllop i kana och att jesus der förwandlade watt till win tala predikant ganska omständlig om bruk af win $ berätta hemlandsposten $	Med anledning af textens berättelse om att det warit brist pä win pä bröllopet i Kana och att Jesus der förwandlade watten till win talade predikanten ganska omständligt om bruket af win , berättar HemlandsPosten . 	13	brllop
kristina nilsson ha redan äta lemna swerige $ dit hon denna gäng komma icke sör att sjunga $ utan endast sör att närwara wid en bröllop $	Kristina Nilsson har redan äter lemnat Swerige , dit hon denna gäng kom icke sör att sjunga , utan endast sör att närwara wid ett bröllop . 	25	brllop
formulär kontrakt diplom affisch program bjudningskort tili bröllop och begrafning $	Formulär Kontrakt Diplomer Affischer Program Bjudningskort tili Bröllop och Begrafningar etc. 	7	brllop
full af komik åter och af $ $ blanda nied godmodig malice $ vara den första berättelse $ $ en bröllop på capri $ $	Full af komik åter och af lefDud-dust , blandad nied godmodig malice , är den första berättelsen , » Ett bröllop på Capri » . 	20	brllop
hon kunna icke se en ung man och en ung flicka tillsammans $ utan att genast tänka på en liten kärlekshistoria $ sluta med bröllop $	Hon kunde icke se en ung man och en ung flicka tillsammans , utan att genast tänka på en liten kärlekshistoria , slutande med bröllop . 	24	brllop
formulär kontrakt diplom affisch program bjudningskort tm bröllop och begrafning $	Formulär Kontrakt Diplomer Affischer Program Bjudningskort tm Bröllop och Begrafningar etc. 	7	brllop
såsom all för handel och industri behöflig blankett $ järn vägsfraktsedlar och adresslapp $ papper och kuvert nied lirmastämpling $ bröllop och begrafningskort $ visitkort och nyårskort m $ m $	såsom alla för handel och industri behöfliga blanketter , järn vägsfraktsedlar och adresslappar ; papper och kuvert nied lirmastämpling ; bröllops- och begrafningskort , visitkort och nyårskort m . m . 	20	brllop
formulär kontrakt diplom affisch program bjudningskort tili bröllop och begrafning $ visitkcyt m $ m $	Formulär Kontrakt Diplomer Affischer Program Bjudningskort tili Bröllop och Begrafningar etc. Visitkcyt m . m . 	7	brllop
ur $ figaros bröllop $ $ utföra af klubb medlem $	ur » Figaros bröllop » , utförda af klubbens medlemmar . 	3	brllop
redan för en år sedan blef lvsning till äktenskap afkunna mellan hon och stenberg $ men en vecka före bröllop blef hon sinnesrubbad och måste inta å upsala hospital $ derifrån hon den 30 sisth juni utskrefs som frisk $	Redan för ett år sedan blef lvsning till äktenskap afkunnad mellan henne och Stenberg , men en vecka före bröllopet blef hon sinnesrubbad och måste intagas å Upsala hospital , derifrån hon den 30 sisth juni utskrefs som frisk . 	19	brllop
prinsessa af wales med dotter och bärtigen af york skola sannolik resa till köpenhamn för att öfvervara bröllop peter nansen $	Prinsessan af Wales med döttrar och bärtigen af York skola sannolikt resa till Köpenhamn för att öfvervara bröllopet Peter Nansen . 	17	brllop
tre år efter sig bröllop sälja lorents tschambor till en polsk magnat $	Tre år efter sitt bröllop sålde Lorents Tschambor till en polsk magnat . 	4	brllop
se för kärlig på jag eller på någon annan sätt visa hvad vi ha vi emellan $ alltnog skule börja en ohöfvisk skämtan oell fråga boge bland annan $ örn han börja rusta till bröllop och sån $ t $	sett för kärligt på mig eller på något annat sätt visat hvad vi hade oss emellan , alltnog Skule började en ohöfvisk skämtan oell frågade Boge bland annat , örn han börjat rusta till bröllop och sån ’ t . 	34	brllop
hr bern ha just i eslöf fira sig bröllop och befinna sig på bröllopsfärd med sig ung mana ombord å ångare $ svea11 $	Hr Bern hade just i Eslöf firat sitt bröllop och befann sig på bröllopsfärd med sin unga mana ombord å ångaren “ Svea11 . 	8	brllop
hon berätta däri $ att madeline skola ha bröllop $	Hon berättade däri , att Madeline skulle ha bröllop . 	8	brllop
lugna hon $ och sedan höra hon lugn på jag $ när jag tala örn en nödvändig $ jag göra utan att hänsyfta på själfva bröllop hvarken då eller sen $ när jag ta afsked af hon $	lugna henne , och sedan hörde hon lugnt på mig , när jag talade örn de nödvändiga .förberedelser jag gjort utan att hänsyfta på själfva bröllopet hvarken då eller senare , när jag tog afsked af henne . 	25	brllop
jjindbergska sällskap börja i gå sig föreställning å vasateatern mod uppförande af $ bröllop på ulfåsa $ $	Jjindbergska sällskapet började i går sina föreställningar å Vasateatern mod uppförandet af » Bröllopet på Ulfåsa » . 	13	brllop
nyligen en ling flicka med hjälp af tre andra vän ninor sig fästman kort före bröllop $	nyligen en ling flicka med hjälp af tre andra vän ninor sin fästman kort före bröllopet . 	15	brllop
afton förut fira sig bröllop med en fröken frida carlsson $ som inneha kafé i närhet af fiskhamn $	aftonen förut firat sitt bröllop med en fröken Frida Carlsson , som innehar kafé i närheten af fiskhamnen . 	4	brllop
tillbringa den för bröllop bestämd dag i fängelse $ ransaka den 7 april 1758 och hänga fyra dag sen $	tillbringa den för bröllopet bestämda dagen i fängelset , ransakades den 7 april 1758 och hängdes fyra dagar senare . 	3	brllop
så må vi då stå med vi land omgjorda och vira ljus brinna lik människa $ sorn vänta sig herre $ när han skola komma hem från bröllop $	Så må vi då stå med våra länder omgjordade och vira ljus brinnande lika människor , sorn vänta sin herre , när han skall komma hem från bröllopet . 	27	brllop
$ jag förälder vilja inte låta jag bära de före bröllop $ derför att jag vara bara en bondflicka $ $ säga hon $ $ men när jag blifvit gift med afanasi $ kunna jag klä $ jag som stadsbo bruka $ $	” Mina föräldrar vilja inte låta mig bära dem före bröllopet , derför att jag är bara en bondflicka , ” sade hon ; ” men när jag blifvit gift med Afanasi , kan jag klä ’ mig som stadsbor bruka . " 	10	brllop
sig död $ då låta en döpa sig barn samt fira sig bröllop och gå till nattvard $	sina döda , då låta de döpa sina barn samt fira sina bröllop och gå till nattvarden . 	12	brllop
af hvad jag påstå $ men hon vilja lika liten återvända till krånge $ utun då lång gärna genast gifta sig mod pettersson $ som omedelbar derpå till en lysa bröllop $ och i glädjan gaf han den prestman $ sorn sammanviga den älska par $ 60 öro för han besvär $	af hvad jag påstått , men hon ville lika litet återvända till Krånge , utun då långt hellre genast gifta sig mod Pettersson , som omedelbart derpå tillstälde ett lysande bröllop , och i glädjan gaf han den prestman , sorn sammanvigde det älskande paret — 60 öro för hans besvär . 	30	brllop
emellertid under vinter lopp bortsnatta af ordförande vanartig son $ som användt de att vid bröllop och andra högtid i östersund fästa ihop gammal beskådande dam kjortel $ föreslå en uttaxering för att inköpa fångstmedel $	emellertid under vinterns lopp bortsnattats af ordförandens vanartige son , som användt dem att vid bröllop och andra högtider i Östersund fästa ihop äldre beskådande damers kjortlar , föreslogs en uttaxering för att inköpa fångstmedel . 	15	brllop
bedröfva vara en ung teolog $ hvilkens bröllop skola stå på lördag $ bjudning voro utfärda och brudklädningeu sy $ mi få han ligga i läger med landtvärn i ställ för att fara på bröllopsresa $	bedröfvad var en ung teolog , hvilkens bröllop skulle stå på lördag ; bjudningarna voro utfärdade och brudklädningeu sydd — mi får han ligga i läger med landtvärnet i stället för att fara på bröllopsresa . 	7	brllop
den grad söndergnagd $ att egaren $ som gömma den för att härmed betala omkostnad för sig förestå bröllop $ knapp torde kunna få ersättning för den i bank $	den grad söndergnagd , att egaren , som gömt den för att härmed betala omkostnaderna för sitt förestående bröllop , knappast torde kunna få ersättning för den i banken . 	18	brllop
län och haus maka $ årsdag af sig bröllop $ i krets af barn ocb barnbarn $	län och haus maka 50:e årsdagen af sitt bröllop , i kretsen af barn ocb barnbarn . 	8	brllop
bröllop fira i tisdag den 17 denna i sodciåkra prostgård $ cå fröken selma dahlström $ dotter af kontraktsprost ra $	Bröllop firades i tisdags den 17 dennes i Sodciåkra prostgård , cå fröken Selma Dahlström , dotter af kontraktsprosten ra . 	0	brllop
hel den föregående tid efter de bröllop ha bernhard ha nog karaktär att ej gå på en enda bjudning $ där fruntimmer voro närvara $ då lisette ej vara bjuda med $	hela den föregående tiden efter deras bröllop hade Bernhard haft nog karaktär att ej gå på en enda bjudning , där fruntimmer voro närvarande , då Lisette ej var bjuden med . 	6	brllop
$ ni kunna vara lugn $ säde doktor $ och fortsätta förberedelse för ni bröllop $	— Ni kan vara lugn , säde doktorn , och fortsätta förberedelserna för ert bröllop . 	14	brllop
sig första hvilostation på en mer än vanlig sträfsam bana ta hon häromåret $ då hon fira sig bröllop i stockholm med en vinhandlande med så raffinera lyx $ att en jag kollega glöda skil dring i landsortspress af den äfven för stockholmsförhållanden märklig och exotisk fest väcka en sån uppseende $ att den för smålandspost vidkomman de rendera en insändare från en tro person i moheda $ som med flere analog ställe i uppenbarelseboken be visa att hon vara $ man af en där om tala $ mera framstå potentat $	Sin första hvilostation på en mer än vanligt sträfsam bana tog hon häromåret , då hon firade sitt bröllop i Stockholm med en vinhandlande med så raffinerad lyx , att en min kollegas glödande skil dring i landsortspressen af den äfven för Stockholmsförhållanden märkliga och exotiska festen väckte ett sådant uppseende , att den för Smålandspostens vidkomman de renderade en insändare från en troende person i Moheda , som med flere analoga ställen i Uppenbarelseboken be visade att hon var — en af de där om talade , mera framstående potentaterna . 	18	brllop
såsom all för handel och industri beköfliga blankett $ järnvägsfraktsedel och adresslapp $ papper och kuvert med firmastämpllng $ bröllop och begrafningskort $ visitkort och nyårskort m $ m $	såsom alla för handel och industri beköfliga blanketter , järnvägsfraktsedlar och adresslappar ; papper och kuvert med firmastämpllng ; bröllops- och begrafningskort , visitkort och nyårskort m . m . 	19	brllop
ge om fredag $ lördag och söndag föreställning härstädes $ då bland annan $ bröllop på ulfåsa $ komma att uppföra $	ger om fredag , lördag och söndag föreställningar härstädes , då bland annat ” Bröllopet på Ulfåsa ” kommer att uppföras . 	14	brllop
bära den slöja $ som hon moder begagna på sig bröllop $	bar den slöja , som hennes moder begagnat på sitt bröllop . 	10	brllop
efter jul samma år återkomma han dit för att fira sig bröllop $	Efter julen samma år återkom han dit för att fira sitt bröllop . 	11	brllop
bröllop fira i lördag a stor hotell i linköping $ dä handlande $ petersson frän linköping sammanwigdes med fröken lotten abel frän säfsjö $	Bröllop firades i lördags a Stora hotellet i Linköping , dä handlanden O. Petersson frän Linköping sammanwigdes med fröken Lotten Abel frän Säfsjö . 	0	brllop
ha bröllop $ men då nygift bruka dra sig lidigt tillbaka $ tro jag $ att jag skola vara lycklig nog att träffa han vid den hår tid $	haft bröllop , men då nygifta bruka draga sig lidigt tillbaka , trodde jag , att jag skulle vara lycklig nog att träffa honom vid den hår tiden . 	1	brllop
bröllop fira i tisdag afton i linköping mellan komminister emil leonard frölinder i östra ed och fröken maria adlerz $ dotter till framliden kyrkoherde i kuddby adlerz och han maka $	Bröllop firades i tisdags afton i Linköping mellan komministern Emil Leonard Frölinder i Östra Ed och fröken Maria Adlerz , dotter till framlidne kyrkoherden i Kuddby Adlerz och hans maka . 	0	brllop
ha lysa tre gång och bröllop skola ega ruin vid han hemkomst varga i stor flock uppträda liten hvarstädes i jämtland $ skrif $ $	hade lyst tre gånger och bröllopet skulle ega ruin vid hans hemkomst Vargar i stora flockar uppträda litet hvarstädes i Jämtland , skrifver Jämtl.P:n . 	5	brllop
sig annandag bröllop fira löjtnant nils stenholm och han ung brud å österås sistliden söndag qväll på en värdig sätt genom en storartad fest för gård all arbetare $ tillsammans omkring 50 person $	Sitt annandags bröllop firade löjtnant Nils Stenholm och hans unga brud å Österås sistlidne söndags qväll på ett värdigt sätt genom en storartad fest för gårdens alla arbetare , tillsammans omkring 50 personer . 	2	brllop
beställning å bröllop $ bill $ middag $ $ supé och sexa emotta tacksam $	Beställningar å Bröllop , Biller , Middagar , ( Supéer och Sexor emottagas tacksamt . 	2	brllop
$ vi voro samman på en bröllop för en tid sedan $	— Vi voro samman på ett bröllop för en tid sedan . 	6	brllop
företa sig att klättra upp för en stupränna å småland nation hus i afsigt att få en inblick i nationssalen $ hvarest bröllop fira $	företog sig att klättra upp för en stupränna å Smålands nations hus i afsigt att få en inblick i nationssalen , hvarest bröllop firades . 	22	brllop
dotter till fabrikör schander och han nu aflidna maka $ föda skoog $ bröllop $ som vara $ till $ dag $ den 24 denna $ ha till följd af den hastig inträffa djup sorg uppskjuta till den 27 denna $ och komma vigsel då att ske i den trång familjekrets $	dotter till fabrikör Schander och hans nu aflidna maka , född Skoog , Bröllopet , som var utsatt till Kristina- dagen , den 24 dennes , har till följd af den hastigt inträffade djupa sorgen uppskjutits till den 27 dennes , och kommer vigseln då att ske i den trängre familjekretsen . 	13	brllop
fira bröllop på den korrekt sätt $ och tidning omtala $ denna som den föregå lysa fest på den dag $ då kontrakt underteckna $	firades bröllopet på det korrektaste sätt , och tidningarna omtalade såväl detta som den föregående lysande festen på den dag , då kontraktet undertecknades . 	1	brllop
en storartadt bröllop fira den 23 d å hemman spångalyckan i småland $ då en par bonddotter viga $ iklä silfverkronor $	Ett storartadt bröllop firades den 23 d:s å hemmanet Spångalyckan i Småland , då ett par bonddöttrar vigdes , iklädda silfverkronor . 	2	brllop
tunnbindareiormamien vid cementbolag n $ hägg dotter anna med sig brudgum j $ mattiasson vid samma tillfälle fira hr hägg och han hustru sig silfverbröllop samt hr hägg svärförälder guld bröllop högtidlighet gå af stapel i lomma missionshusv	tunnbindareiormamien vid Cementbolaget N . Häggs dotter Anna med sin brudgum J . Mattiasson Vid samma tillfälle firade hr Hägg och hans hustru sitt silfverbröllop samt hr Häggs svärföräldrar guld bröllop Högtidligheten gick af stapeln i Lomma missionshusv 	30	brllop
till den illa beryktad hus beträffa $ vara denna uppgift en ren orimlighet $ någon som bland annan torde framgå af att han för kort tid sedan fira sig bröllop $ till hvilket $ $ vara invitera $	till det illa beryktade huset beträffar , är denna uppgift en ren orimlighet , något som bland annat torde framgå af att han för kort tid sedan firade sitt bröllop , till hvilket dir. S. var inviterad . 	29	brllop
bröllop fira i lördag i grand hotell haglund i göteborg mellan redaktör ernst sewerin oeh fröken edith maud georgii $ dotter till gross $	Bröllop firades i lördags i Grand Hotell Haglund i Göteborg mellan redaktör Ernst Sewerin oeh fröken Edith Maud Georgii , dotter till grosshandl . 	0	brllop
formulär kontrakt diplom affisch program bjudningskort tili bröllop och begrafning $	Formulär Kontrakt Diplomer Affischer Program Bjudningskort tili Bröllop och Begrafningar etc. 	7	brllop
prinsessa heienes af orleans bröllop skola ega rum den 13 maj $	prinsessan Heienes af Orleans bröllop skall ega rum den 13 maj . 	4	brllop
t stor och liten festvåning vila för baier $ bröllop $ middag och sammanträde $	T Större och mindre festvåning vilan för Baier , Bröllop , Middagar och Sammanträden . 	9	brllop
