sentence_lemma	sentence_token	target_index	original_word
hålla nämligen derstädes då bröllop tor den rik lapp jon jakobsson $ som för tredje gång ingå äktenskap $ nu med elisabeth jonsson från ovikens lappby $	höll nämligen derstädes då bröllop tor den rike lappen Jon Jakobsson , som för tredje gången ingick äktenskap , nu med Elisabeth Jonsson från Ovikens lappby . 	4	brllop
bröllop fira i söndag i motala $ då fröken ida pereswetoff morath $ dotter till kammarherre c $ $ pereswetoff morath och han maka $ föda forsgrén $ sammanviga med disponent m $ dahlqvist från skeninge $	Bröllop firades i söndags i Motala , då fröken Ida Pereswetoff Morath , dotter till kammarherre C . W. Pereswetoff Morath och hans maka , född Forsgrén , sammanvigdes med disponenten M . Dahlqvist från Skeninge . 	0	brllop
när brudgum strax före bröllop af sig vän b jude på $ svensexa $ $ hvarför skola inte brud väninna kunna egen en likna afskedsgärd $	När brudgummen strax före bröllopet af sina vänner b judes på » svensexa » , hvarför skulle inte brudens väninnor kunna egna en liknande afskedsgärd . 	4	brllop
enskildt påstå $ att ingeniör berglund först 2 år efter bröllop inviga i den hemsk förtroende $	Enskildt påstås , att ingeniör Berglund först 2 år efter bröllopet invigts i det hemska förtroendet . 	10	brllop
ta å grafkransar $ bröllop $ present och begrafningsbuketter samt kotiljong $ bröstoch servietbuketter olik fason till plats billig pris $	tagas å Grafkransar , Bröllops , Present- och Begrafningsbuketter samt Kotiljongs , Bröstoch Servietbuketter olika fasoner till platsens billigaste priser . 	4	brllop
bröllop fira påskdag i vestervik $ då fabriksidkare a $ lothigius från stockholm sammanviga med fröken alma ljungqvist $ ung dotter till $ $ sjökapten fredrik $ ljungqvist $	Bröllop firades påskdagen i Vestervik , då fabriksidkaren A . Lothigius från Stockholm sammanvigdes med fröken Alma Ljungqvist , yngsta dottern till f. d. sjökaptenen Fredrik E:son Ljungqvist . 	0	brllop
hertig af aosta och prinsessa héléne af oileans fira den 25 juni sig bröllop i england i den lilia ort $ $	Hertigen af Aosta och prinsessan Héléne af Oileans firade den 25 juni sitt bröllop i England i den lilia orten Kingston-on-Thames . 	13	brllop
såsom all för handel och industri behöflig blankett $ järnvägsfraktsedel och adresslapp $ papper oell kuvert med firmastämpling $ bröllop och begrafningskort $ visitkort och nyårskort m $ m $	såsom alla för handel och industri behöfliga blanketter , järnvägsfraktsedlar och adresslappar ; papper oell kuvert med firmastämpling ; bröllops- och begrafningskort , visitkort och nyårskort m . m . 	19	brllop
hon anta lord johnny frieri oell gitta sig med han af pur förargelse el trots $ men på den hel ta vara ion $ lycket lycklig $ lio ha formligen njuta af sig egen bröllop $ ha uppföra sig slynaktigt mot sig man högvälboren slägting $ göra narr af erkebiskop midt för ban näsa $ $ flirta $ öppen oell påtaglig nied tvenne prins af blod $ äta kolossal portion af sig egen bröllopskaka oell nästan reta lil veta ur taute jinny $ oell lord johnny be åse denna nied oblandad beundran oell m d en mili af stolt ogan 1 orätt $	Hon antog lord Johnnys frieri oell gitte sig med honom af pur förargelse elier trots , men på det hela taget var Ion » lycket lycklig , lion hade formligen njutit af sitt eget bröllop , hade uppfört sig slynaktigt mot sin mans högvälborna slägtingar , gjort narr af erkebiskopen midt för bans näsa , " flirtat " öppet oell påtagligt nied tvenne prinsar af blodet , ätit kolossala portioner af sin egen bröllopskaka oell nästan retat lil vet ur taute Jinny , oell lord Johnny bade åsett detta nied oblandad beundran oell m d en mili af stolt ogan 1 orätt . 	34	brllop
bröllop fira i söndag i solna kyrka mellan $ $ hofrättsnotarien $ $ claes breitholz och fröken ida edling $ dotter till framliden apotekare fredr $	Bröllop firades i söndags i Solna kyrka mellan e. o. hofrättsnotarien jur. kand. Claes Breitholz och fröken Ida Edling , dotter till framlidne apotekaren Fredr . 	0	brllop
bröllop $ i den en af förening medlem järnarbetare august lindgren dä sammanwigdes därstädes med jungfru klara andersdotter $	bröllop , i det en af föreningens medlemmar järnarbetaren August Lindgren dä sammanwigdes därstädes med jungfrun Klara Andersdotter . 	0	brllop
föräldrarne $ sedan de uttömma sig i hotelse och i vänlig öfvertala $ gingo in på $ för att undvika skandal $ att hålla bröllop $ och eftersom den nu en gång höra till de grundsats $ att aldrig försumma någon tillfälle att visa sig och sig rikedom $ så voro tidning spalt under flera vecka uppfullda med beskrifning på förberedelse till $ denna stor händelse $	föräldrarne , sedan de uttömt sig i hotelser och i vänligt öfvertalande , gingo in på — för att undvika skandal — att hålla bröllopet , och eftersom det nu en gång hörde till deras grundsatser , att aldrig försumma något tillfälle att visa sig och sin rikedom , så voro tidningarnes spalter under flera veckor uppfullda med beskrifningen på förberedelserna till “ denna stora händelse . 	24	brllop
skola köpa $ den kunna ju ske efter bröllop i ali skön lugn lika bra sorn före $	skulle köpa , det kan ju ske efter bröllopet i ali sköns lugn lika bra sorn före . 	8	brllop
$ hvilket betyda så mycket $ anmärka detektiv torr $ som att denna flicka vara i hus den kväll ni fira ni bröllop $ utan att annan än tjänstefolk ana den $	— Hvilket betyder så mycket , anmärkte detektiven torrt , som att denna flicka var i huset den kväll ni firade ert bröllop , utan att andra än tjänstefolket anade det . 	22	brllop
jag tillägga $ att han majestät icke komma att ta någon notis örn bröllop $	Jag tillägger , att hans majestät icke kommer att taga någon notis örn bröllopet . 	13	brllop
bjudningskort tifl du bröllop med $ ago person $ simma $ om du sä will $	bjudningskort tifl ditt bröllop med » agon person , sam , om du sä will . 	3	brllop
j $ $ bröllop i gårdsby kyrka $ där biskop lindström förrätta vigsel $	J . Nilssons- bröllop i Gårdsby kyrka , där biskop Lindström förrättade vigseln . 	3	brllop
bröllop $ i $ sammattvigdes å näfveqvarns bruk ingeniör e $	Bröllop , I går sammattvigdes å Näfveqvarns bruk ingeniören E . 	0	brllop
ydén i vislanda $ återvända vid 5 tid på morgon trä en bröllop i hjortsberga $	Ydén i Vislanda , återvände vid 5 tiden på morgonen trän ett bröllop i Hjortsberga . 	12	brllop
putsa i korrektur $ och den för boktryckare eller förläggare dyr ovana afskaffa skola ej falla de på läpp $ och han $ som sitta och finger på klaviatur $ få akta sig för både bröllop och lik och äfven för bokstafsfel $ ty annars bli den omsättning af hel rad $ kanske hel styck $	putsa i korrekturet , och den för boktryckaren eller förläggaren dyra ovanans afskaffande skall ej falla dem på läppen , och han , som sitter och fingrar på klaviaturen , får akta sig för både bröllop och lik och äfven för bokstafsfel , ty annars blir det omsättning af hela raden , kanske hela stycket . 	35	brllop
