sentence_lemma	sentence_token	target_index	original_word
$ gt $ liverpool $ central $ $ $ $ $ edinburgh $ gt $ $ $ både i göteborg och hull emotta vara på genomtrakt till ort inom och utom sverige och england $	& gt ; Liverpool , Central , • 11,35 » » Edinburgh & gt ; 7,35 » Både i Göteborg och Hull emottagas varor på genomtrakt till orter inom och utom Sverige och England . 	5	central
hr gyberg finna den vara i hög grad oriktig att slopa kungelfs sjukhus $ hvilket ligga mycket central $	Hr Gyberg fann det vara i hög grad oriktigt att slopa Kungelfs sjukhus , hvilket ligger mycket centralt . 	17	central
en elegant $ modern $ ytterst beqväm och central belägen våning örn 8 rum $ serveringsrum $ kök $ badrum $ piskbalkong m $ m $ $ att hyra den 1 oktober $	En elegant , modern , ytterst beqväm och centralt belägen Våning örn 8 rum , serveringsrum , kök , badrum , piskbalkong m . m . , att hyra den 1 Oktober . 	8	central
gång begärdee $ i fall inbjudning anta $ dansk regering medverkan samt anvisa af en myndighet $ med hvilken utställning central i stockholm kunna trä i direkt underhandling i afseende å blifvande anordning för do dansk utställarne $	gång begärdee , i fall inbjudningen antogs , danska regeringens medverkan samt anvisande af en myndighet , med hvilken utställningens centralkomité i Stockholm kunde träda i direkt underhandling i afseende å blifvande anordningar för do danska utställarne . 	20	central
ha stad båda grannsocken $ rebbelberga i norr och höja i söder $ i dylik syfte $ sig i $ engelholm mejeriförening $ och såsom lämplig $ och central bygnadsplats ha styrelse tänka sig någon punkt utmed å nedom engelholm kyrka $ där väg gå till station $	ha stadens båda grannsocknar , Rebbelberga i norr och Höja i söder , i dylikt syfte sammanslutit sig i » Engelholms mejeriförening " och såsom lämplig - och central bygnadsplats hade styrelsen tänkt sig någon punkt utmed ån nedom Engelholms kyrka , där vägen går till stationen . 	28	central
en stor $ central belägen fastighet $ å $ eller östermalm $ köpa $ $ örn i liqvid tagea stor $ ograverad landtegendom $ naturskön belägen $ jag $ skog $ fullständig inventarier m $ m $ yidarif nnderråttelser i jti 87 regeringsgatan $ 2 $ upp $ $	En större , centralt belägen Fastighet , å No^ eller Östermalm , köpe » , örn i liqvid tagea större , ograverad landtegendom , naturskönt belägen , mej •tor skog , fullständiga inventarier m . m . Yidarif nnderråttelser i Jti 87 Regeringsgatan , 2 tr. upp , , 	3	central
rum med central läge önska hyra från 1 november $	rum med centralt läge önskas hyra från 1 November . 	2	central
lyda $ central nödbjälpskomitén ha anse sig böra bringa till allmänhet kännedom $ att $ enligt i $ gångna tillförlitlig $	lyder : Centrala Nödbjälpskomitén har ansett sig böra bringa till allmänhetens kännedom ‘ att , enligt i : gångna tillförlitliga underrät¬ 	2	central
o a allmän teletonföreningens central orsaka skada å ledning och inventarier till belopp af $ $ $ och å i hus boende person bohag till värde af omkring $ $ $ hvarjämte en del skada ännu icke hinna värdera $	O A Allmänna Teletonföreningens Central orsakades skada å ledningar och inventarier till belopp af 13,323 kr. , och å i huset boende personers bohag till värde af omkring 10,800 kr. , hvarjämte en del skador ännu icke hunnit värderas . 	4	central
alhnäu publicistförening $ böra råd gustrin framhålla i en lång anförande denna förening $ på hvilket sätt el äu må 1 denna fråga stor intresse ftir all målsman och komma till stånd $ vara organisera i vilja $ att rektor skola ena om att låta kretsföreniugar under gemensam central $ $ $ $ $ $ ffal $ få underbetyg stvrelse $	alhnäu publicistförening , börande rådet Gustrin framhöll i ett längre anförande denna förening , på hvilket sätt elen äu må 1 denna frågas stora intresse ftir alla målsmän och komma till stånd , vara organiserad i ville , att rektorerne skulle enas om att låta kretsföreniugar under gemensam central- H^a , 1.a .a l:irjut ] ffaL H0™ fått underbetyg stvrelse . 	48	central
slutligen rusa vi genom en väldig tunnel $ jag tro på $ $ $ mil $ och $ 12 stanna vi på central i liwerpool $	Slutligen rusade vi genom en väldig tunnel , jag tror på * / , mil , och kl. 12 stannade vi på centralen i Liwerpool . 	22	central
central på $ eller östermalm $ köpa till pris af $ kr $	centralt på Norr- eller Östermalm , köpes till pris af 200,000 kr . 	0	central
vara hel kort och innehålla en tillstyrkande $ ehuru fördelningsch ef en förklara sig icke kunna full uppskatta fördel af den första revision förläggande till fördelningsmtendenturerna $ då domsrätt i all besvär och anmärkningsmål skola förblifva centralisera hos den central styrelse $	är helt kort och innehåller ett tillstyrkande , ehuru fördelningsch ef en förklarar sig icke kunna fullt uppskatta fördelen af den första revisionens förläggande till fördelningsmtendenturerna , då domsrätten i alla besvärs- och anmärkningsmål skulle förblifva centraliserad hos den centrala styrelsen . 	39	central
jemte förrådskällare central belägen i hörn af kung och vasagata i umeå uthyra från 1 okt $	jemte förrådskällare centralt belägen i hörnet af Kungs- och Vasagatorna i Umeå uthyres från 1 Okt . 	2	central
