sentence_lemma	target_index	cluster	lemma	sentence_token	identifier
för någon vecka sedan gå genom press en notis $ som på en ganska slå sätt belysa $ huru vi svensk landtmän försumma man af jordbruk naturlig binäring $ tyvärr kunna nog rätt många motstycke till denna notis uppleta för att emellertid nu hålla vi uteslutande till denna $ gå den ut på att lemna en öfverblick på den sen årtionde statistik rörande vi export och import af ägg $ de för vi ganska sorglig siffra $ sig därvid på följa sätt $ import $ export $	37	0	notis	För några veckor sedan gick genom pressen en notis , som på ett ganska slående sätt belyste , huru våra svenska landtmän försumma en af jordbrukets naturligaste binäringar — tyvärr kunna nog rätt många motstycken till denna notis uppletas För att emellertid nu hålla oss uteslutande till denna , gick den ut på att lemna en öfverblick på det senaste årtiondets statistik rörande vår export och import af ägg ; de för oss ganska sorgliga siffrorna tedde sig därvid på följande sätt : Import , Export . 	bib11653838_19001012_147024_41_0004_alto.xml-61-37
u bi mycket glad $ då fru perri6s och fröken burdenne kommo på besök för att få höra nära detalj örn den notis $ som stå att läsa i dag tidning $ hvilken vara allmän samtalsämne i hel wesborough $	22	0	notis	Una biet mycket glad , då fru Perri6s och fröken Burdenne kommo på besök för att få höra närmare detaljer örn den notis , som stått att läsa i dagens tidning , hvilken var allmänt samtalsämne i hela Wesborough . 	bib19277277_18950530_147683_145_0002_alto.xml-32-22
ia finna kort i hon ficka $ $ han torka bort från panna en tung svettdropparne och genomläsa ånyo notis $	19	0	notis	ia funnit kortet i hennes ficka ! » Han torkade bort från pannan de tunga svettdropparne och genomläste ånyo notisen . 	bib11653811_18980711_145317_104_0003_alto.xml-143-19
konung omgifning vara sträng förbjuda att meddela tidning notis om när h $ $ konferera med den hemlig utskott $	8	0	notis	Konungens omgifning är strängt förbjuden att meddela tidningarna notiser om när h . m:t konfererar med det hemliga utskottet . 	bib15761097_18950413_145020_44_0003_alto.xml-29-8
passagerare från london $ som ämna resa med hullångare till göteborg $ behöfva ej lämna london förrän på lördag morgon $ hvarom vi erinra $ då af misstag i förra notis härom stå söndag morgon $	30	0	notis	Passagerare från London , som ämna resa med Hullångare till Göteborg , behöfva ej lämna London förrän på lördags morgon , hvarom vi erinra , då af misstag i förra notisen härom stod söndags morgon . 	bib19225758_18950416_144022_87_0002_alto.xml-187-30
vara namn på en liten hem $ om hvars tillvaro handelstidning läsare genom en notis $ såvida den ej undgå uppmärksamhet $ redan få någon kännedom $	14	0	notis	är namnet på ett litet hem , om hvars tillvaro Handelstidningens läsare genom en notis , såvida den ej undgick uppmärksamheten , redan fått någon kännedom . 	bib19225758_18950601_144022_126_0007_alto.xml-64-14
afven af herr $ storkirch ha man kun nat vänta $ att han skola inse $ att en $ notis jägare $ sträfsamma yrke kunna vara full lika hedervärd och gagna som $ $ m $ en hofmarskalk $	19	0	notis	Afven af herr v. Storkirch hade man kun nat vänta , att han skulle inse , att en » notis jägares » sträfsamma yrke kan vara fullt lika hedervärdt och gagnande som t. o. m . en hofmarskalks . 	bib11653811_18990703_145317_99_0002_alto.xml-17-19
med god tidningsmannased $ att den blad $ som först meddela en notis $ få inta rättelse deraf om sån vara nödvändig $ då vi i vi ordning med citera af samma källa kunna göra den efter $	12	0	notis	med god tidningsmannased , att det blad , som först meddelat en notis , får intaga rättelsen deraf om sådant är nödvändigt , då vi i vår ordning med citerande af samma källa kunna göra det efter . 	bib11653811_18950726_145317_113_0002_alto.xml-82-12
nödvändig den vara att hafva lämplig räddningsredskap till hands visa i $ $ då som i notis här nedan omförmäla $ i härvarande hamn en liten flicka hålla på att drunkna midt för öga på hundratal person $ hvilka hel viss vilja göra all för att rädda hon $ men nu i brist på nödig redskap måste stå der och overksam åse den hjärtslitande dödskamp där ute bland isstycke $	16	0	notis	nödvändigt det är att hafva lämplig räddningsredskap till hands visades i går , då som i notisen här nedan omförmäles , i härvarande hamn en liten flicka höll på att drunkna midt för ögonen på hundratals personer , hvilka helt visst ville göra allt för att rädda henne , men nu i brist på nödig redskap måste stå der och overksamma åse den hjärtslitande dödskampen där ute bland isstyckena . 	bib11653830_18970107_146968_2_0002_alto.xml-27-16
nyligen ha $ eller hvad säga örn följan de notis i den sen nummer $	9	0	notis	nyligen haft , eller hvad sägs örn följan de notis i dess senaste nummer ! 	bib11653790_18980923_145648_73_0006_alto.xml-38-9
derjemte innehålla nummer en hel del folkskola beröra artikel och notis $	10	0	notis	Derjemte innehåller numret en hel del folkskolan berörande artiklar och notiser . 	bib15761570_18950131_146176_21_0003_alto.xml-54-10
samt notis från svensk $ norsk och dansk fotografisk förening m $ m $	1	0	notis	samt notiser från svenska , norska och danska fotografiska föreningar m , m . 	bib15873936_18950219_147385_22_0002_alto.xml-33-1
berättelse $ över evne $ bringa en tysk litteraturanmälare följa dråplig notis i munchener allgemeine zeitung $ som bekant en af en $ $ världsbladen $	11	0	notis	berättelse » Över Evne » bringar en tysk litteraturanmälare följande dråpliga notis i Munchener Allgemeine Zeitung , som bekant ett af de s. k. världsbladen : 	bib15650814_18951224_146365_301_0002_alto.xml-62-11
anhålla $ att en tidning $ sorn åter nämda notis $ äfven må inta denna beriktiga $	9	0	notis	Anhålles , att de tidningar , sorn återgifvit nämda notis , äfven måtte intaga detta beriktigande . 	bib15873936_18950119_147385_9_0003_alto.xml-78-9
bihang innehälla en beskrifning pä fjäderhammare vulkanus med illustration $ notis $ $ $ inalles pryda häfte af 12 illustration $	10	0	notis	Bihanget innehäller en beskrifning pä fjäderhammaren Vulkanus med illustration , notiser o. f. w. Inalles prydeS häftet af 12 illustrationer . 	bib19277180_18951125_147374_96_0003_alto.xml-129-10
$ tryckfrihetsdtal ha väcka mot tidning jämtlandspostens utgifvare $ $ hugo wickström $ för en notis om en dödsfall $ som hemmans n $ johansson i valla $ hvars fader notis gälla $ anse för sig kränka $	30	0	notis	♦ Tryckfrihetsdtal har väckts mot tidningen Jämtlandspostens utgifvare , d:r Hugo Wickström , för en notis om ett dödsfall , som hemmansegaren N . Johansson i Valla , hvars fader notisen gällde , ansett för sig kränkande . 	bib11653790_18970827_145648_67_0002_alto.xml-113-30
upplaga $ som komma att föra sig ogen särskilta följetong och företrädesvis uppta artikel och notis som hufvudsakligen intressera landsbygd $ vara nedsatt till för hel år 50 öre $ för half år 40 öre $	15	0	notis	upplaga , som kommer att föra sin ogen särskilta följetong och företrädesvis upptaga artiklar och notiser som hufvudsakligen intressera landsbygden , är nedsatt till för helt år 50 öre , för halft år 40 öre , 	bib11653830_18961228_146968_104_0001_alto.xml-46-15
äfven björnbärgs grufaktiebolag ha besluta att lämna 2 öre för hvarje ton bruten malm till pensionsfond $ hvilket vi meddela till komplettera af vi notis i tisdagsnummer $	24	0	notis	Äfven Björnbärgs grufaktiebolag har beslutit att lämna 2 öre för hvarje ton bruten malm till pensionsfonden , hvilket vi meddela till kompletterande af vår notis i tisdagsnumret . 	bib11653790_19020620_145648_48_0003_alto.xml-30-24
på grund af en notis i $ maj månad samt åtskillig annons $ innehålla att ny ångslupsbolaget skola $ $ m $ i sommar öppna en ny linie och dagligen anlöpa $ bland andra ställe $ fiskebäck $ hyra en del familj därstädes $	4	0	notis	På grund af en notis i sistl. Maj månad samt åtskilliga annonser , innehållande att Nya Ångslupsbolaget skulle fr. o. m . i sommar öppna en ny linie och dagligen anlöpa , bland andra ställen , Fiskebäck , hyrde en del familjer därstädes . 	bib19225758_18950620_144022_141_0003_alto.xml-213-4
redaktionssekreterare $ eriksson $ hvilken i norrlandsposten på sig tid skrifvit den första notis om sak $ vittna $ att predikant norberg för han $ då den gälla att telefonledes kontrollera notis riktighet $ upp $ att han se hanna under hel den tid hon springa $ att han se hvarje hon fall $ äfven den sista $ och att hanna vara död $ då norberg komma fram till plats $	31	0	notis	Redaktionssekreteraren O. Eriksson , hvilken i Norrlandsposten på sin tid skrifvit den första notisen om saken , vittnade , att predikanten Norberg för honom , då det gällt att telefonledes kontrollera notisens riktighet , uppgifvit , att han sett Hanna under hela den tid hon sprang , att han sett hvarje hennes fall , äfven det sista , och att Hanna varit död , då Norberg kommit fram till platsen . 	bib11653790_18970716_145648_55_0003_alto.xml-63-31
denna notis ha emellertid larsson sjelf fabricera och lyckas få in i en numera $ tidning i göteborg $	1	0	notis	Denna notis hade emellertid Larsson sjelf fabricerat och lyckats få in i en numera nedlagd tidning i Göteborg . 	bib19227291_18960421_145289_48_0003_alto.xml-105-1
som ofta meddela landsortstidning notis örn person på landsbygd $ hvilka förena en mängd olik yrke $	4	0	notis	som oftast meddela landsortstidningarna notiser örn personer på landsbygden , hvilka förena en mängd olika yrken . 	bib11653811_18970529_145317_82_0002_alto.xml-158-4
finna vi följa notis $ $ en arrendator under vrams gunnarstorp $ som i år få ny kontrakt $ ha förbinda sig att vid högtidlig tillfälle hissa den svensk flagga på gård $ $ den vara ju $ skrifver $ $ $ mycket vacker att hissa sig land flagga vid högtidlig tillfälle $	3	0	notis	finna vi följande notis : ” De arrendatorer under Vrams Gunnarstorp , som i år fått nya kontrakt , ha förbundit sig att vid högtidliga tillfällen hissa den svenska flaggan på gårdarna . ” Det är ju , skrifver St. T. , mycket vackert att hissa sitt lands flagga vid högtidliga tillfällen . 	bib11653838_19000615_147024_24_0002_alto.xml-171-3
med anledning af en notis i onsdag morgon $ tidning $ att genom beslut af svensk familj $ journal svea styrelse $ svea $ skola upphöra att1 utkomma och uppgå i tidning $ för svensk hern $ $ $ anhålla jag att få upplysa $ att nämna uppgift $ hvad don sen del angå $ icke vara med sanning öfverensstämmande $	4	0	notis	Med anledning af en notis i onsdagens morgon , tidningar , att genom beslut af Svenska Familj- , Journalen Sveas styrelse » Svea » skall upphöra att1 utkomma och uppgå i tidningen » För svenska hern » , ' anhåller jag att få upplysa , att nämnda uppgift , hvad don senare delen angår , icke är med sanningen öfverensstämmande . 	bib19277277_18951209_147683_336_0006_alto.xml-177-4
i att någon man kunna garantera uppgift riktighet $ anse vi vi dock $ sorn en observandum åtminstone $ böra efter en tysk facktidning anföra följa notis $	26	0	notis	i att någon män kunna garantera uppgiftens riktighet , anse vi oss dock — sorn ett observandum åtminstone — böra efter en tysk facktidning anföra följande notis . 	bib19277277_18950727_147683_201_0007_alto.xml-61-26
anteckning om finsk universitet lärare $ $ och tjenstemän $ $ vid en bibliografisk öfversigt af $ finland periodisk litteratur 1771 $ 1871 $ $ en $ stamtafla öfver slägt runeberg $ samt en $ förteckning öfver filosofieomagistrar $ promovera vid universitet i åbo 1643 $ 1827 $ med kort biografisk notis $	51	0	notis	anteckningar om finska universitetets lärare , embets- och tjenstemän » , vidare en bibliografisk öfversigt af » Finlands periodiska litteratur 1771 — 1871 » , en » Stamtafla öfver slägten Runeberg » samt en » Förteckning öfver filosofieomagistrar , promoverade vid universitetet i Åbo 1643 — 1827 » med korta biografiska notiser . 	bib19227462_18951214_147640_292_0003_alto.xml-213-51
i denna dag ha genom den svensk press gå en från falu län tidning hemtad notis $ hur en stackars $ kokerska vid cellfängelse måste falla fattigvård till last $ sedan hon afdanka med en obetydlig nådegåfva $	15	0	notis	I dessa dagar har genom den svenska pressen gått en från Falu läns tidning hemtad notis , hur en stackars utsläpad kokerska vid cellfängelset måst falla fattigvården till last , sedan hon afdankats med en obetydlig nådegåfva . 	bib11653811_19011111_145317_175_0002_alto.xml-62-15
hufvudinnehållet i all upplaga densamma $ men en del notis af mera lokal inträsse $ kyrklig uppgift och därtill särskildt beordra annons inflyta endast i den för vederböra ort afse upplaga $	9	0	notis	hufvudinnehållet i alla upplagorna detsamma , men en del notiser af mera lokalt inträsse , kyrkliga uppgifter och därtill särskildt beordrade annonser inflyta endast i den för vederbörande ort afsedda upplagan . 	bib11653790_19021230_12541_101_0002_alto.xml-28-9
ej i ni notis $ då der stå rätt och slät $ att $ arbetare $ svara $ $ $ arbete i fråga utföra af dels vanlig hamnarbetare $ dels kolbärare $ hvilka sen alltid veta skaffa sig någon hög betalning och i följd deraf hög lifsställning än en förra $	3	0	notis	ej i eder notis , då der står rätt och slätt , att » arbetarne » svarade o. s. v. Arbetet i fråga utföres af dels vanlige hamnarbetare , dels kolbärare , hvilka senare alltid vetat skaffa sig något högre betalning och i följd deraf högre lifsställning än de förre . 	bib19227462_18951209_147640_287_0003_alto.xml-216-3
som icke kunna bli af med sig vara $ sitta dyster nedlutad öfver en tidning $ dä iian plötsli gen tick öga på en notis örn att en gammal rik baron $ bekant för sig kärlek till rehnska vin $ ha aflida $	24	0	notis	som icke kunde bli af med sin vara , satt dystert nedlutad öfver en tidning , dä iian plötsli gen tick ögonen på en notis örn att en gammal rik baron , bekant för sin kärlek till rehnska viner , hade aflidit . 	bib15760600_18950919_146401_111_0004_alto.xml-63-24
armékommandot anse denna notis vara skadlig genom att ge upplysning örn land försvarsorganisation och anta att den komma till tidning kännedom genom att någon bru sig gifna tysthetslöfte $	3	0	notis	Armékommandot ansåg denna notis vara skadlig genom att ge upplysningar örn landets försvarsorganisation och antog att den kommit till tidningens kännedom genom att någon bru sitt gifna tysthetslöfte . 	bib15761570_18950709_146176_112_0003_alto.xml-106-3
olof eriksson $ hvilken i $ norrlandsposten $ på sig tid skrifvit den första notis i sak $ vittna $ att predikant norberg för han $ då den gält $ att telefonledes kontrollera notis riktighet $ uppgifvit $ att han se hanna under hel den tid hon springa $ att han se hvarje hon fall $ äfven den sista $ samt att hanna vara död $ då norberg komma fram till plats $	33	0	notis	Olof Eriksson , hvilken i » Norrlandsposten » på sin tid skrifvit den första notisen i saken , vittnade , att predikanten Norberg för honom , då det gält , att telefonledes kontrollera notisens riktighet , uppgifvit , att han sett Hanna under hela den tid hon sprang , att han sett hvarje hennes fall , äfven det sista , samt att Hanna varit död , då Norberg kommit fram till platsen . 	bib11653811_18970716_145317_107_0004_alto.xml-11-33
mod anledning af vi notis häromdagen under denna rubrik lär nu den omtala värnpliktig anton frid $ som ehuru äf hög	4	0	notis	Mod anledning af vår notis häromdagen under denna rubrik lär nu den omtalade värnpliktige Anton Frid , som ehuru äf högsta 	bib11653815_18960718_146944_57_0002_alto.xml-67-4
ningen östgöte bruka förse sig notis med motto $ innehålla tank och uttalande af stor man och antagligen åsyfta att angifva den inre andemening i de med motto förse notis $	29	0	notis	ningen Östgöten brukar förse sina notiser med motto , innehållande tankar och uttalanden af store män och antagligen åsyftande att angifva den inre andemeningen i de med motto försedda notiserna . 	bib19227462_18950423_147640_93_0004_alto.xml-61-29
fullständigande af vi notis härom i ons dag nummer kunna vi nu nämna $ att förslag till diskussionsämne skola inom juli månad utgång insända till redaktör g $ $ iledvali $ till hvilken äfven anmälan till deltagande i möte böra insända $	3	0	notis	fullständigande af vår notis härom i ons dagens nummer kunna vi nu nämna , att förslag till diskussionsämnen skola inom juli månads utgång insändas till redaktör G . F. Iledvali , till hvilken äfven anmälan till deltagande i mötet bör insändas . 	bib19227462_18950705_147640_153_0003_alto.xml-10-3
sorn bevittna denna i hög grad upprörande $ i den åberopa notis fullkomlig sanningsenlig skildra tilldragelse $ beklaga $ att en sån otrolig rå uppträde kunna förekomma hos vi annars så vänlig och fridsam granne $ dansk $	11	0	notis	sorn bevittnade denna i högsta grad upprörande , i den åberopade notisen fullkomligt sanningsenligt skildrade tilldragelsen , beklagar , att ett sådant otroligt rått uppträde kan förekomma hos våra annars så vänliga och fridsamma grannar , danskarne . 	bib19225758_18950622_144022_143_0007_alto.xml-150-11
nu sen ha $ innehålla en i en hel del andra tidning återgifven notis under rubrik $ ny ottenbyhistorier $ $ skrifven äfen person $ som $ plär hålla sig till faktum $ $	13	0	notis	Nu senast har Smål.-P:n innehållit en i en hel del andra tidningar återgifven notis under rubrik » Nya Ottenbyhistorier » , skrifven äfen person , som » plär hålla sig till fakta » . 	bib11653811_18971117_145317_178_0003_alto.xml-60-13
läsa i tidning nyligen ordagrann följa $ som välkoms $ hälsning betrakta telni igen hårdsmält notis $ $ ruttna äpple förstöra sig kamrat $ $ $ franklin $ $	15	0	notis	lästes i tidningen nyligen ordagrant följande , som välkoms ' hälsning betraktad telni igen hårdsmälta notis : .Del ruttna äpplet förstör sina kamrater . » ( Franklin ) . 	bib19349359_18950509_148383_55_0003_alto.xml-131-15
lämna notis $ hvars ofullständighet må hända kunna gifva anledning till skefva omdöme $ hvarför jag anhålla att få meddela $ att i orsa socken väl finna en liten fåtal till metodistsamfundet utträda person $ bland hvilka befinna sig den i notis åsyf tade aflidne $ men att där icke finna någon enligt $ förordning af den 31 okt $	41	0	notis	lämnad notis , hvars ofullständighet må hända kan gifva anledning till skefva omdömen , hvarför jag anhåller att få meddela , att i Orsa socken väl finnes ett litet fåtal till metodistsamfundet utträdda personer , bland hvilka befann sig den i notisen åsyf tade aflidne , men att där icke finnes någon enligt k. förordningen af den 31 okt . 	bib11653790_18990414_145648_28_0003_alto.xml-102-41
med anledning af en notis örn en kvinlig inträdessökande vid institut $ hvilken anta vara den första i sig slag $ ha den påstå $ att den första k vinliga elev vid denna institut vara en fröken g $ $ som gå vid institut år 1837 $	4	0	notis	Med anledning af en notis örn en kvinlig inträdessökande vid institutet , hvilken antagits varit den första i sitt slag , har det påståtts , att den första k vinliga eleven vid detta institut var en fröken G . , som gick vid institutet år 1837 . 	bib15873936_18961201_147385_140_0003_alto.xml-151-4
gustafsson i nå $ hedemora $ att anställa $ för hvilket vi redan i $ i en lång notis redogöra $	18	0	notis	Gustafsson i Nås , Hedemora , att anställa , för hvilket vi redan i fjol i en längre notis redogjorde . 	bib11653790_18980506_145648_34_0002_alto.xml-90-18
kunna spara genom att hålla tidning tillsammans med annan vara knapp nämnvärdt i förhållande till den besvär $ som vara före nadt med tidning sändning eller hämtning $ samt all obehag $ som lätt kunna uppstå genom kompaniskap $ i den att tidning skada eller förkomma $ $ $ den vara ju också treflig att $ oberoende af andra $ kunna välja tid för sig tidningsläsning $ och mången gång vara den af stor viga att ha tidning till hands äfven sedan den blifvit $ $ när man vilja uppsöka en notis eller annons i en gammal nummer $	91	0	notis	kan spara genom att hålla tidningen tillsammans med andra är knappt nämnvärdt i förhållande till det besvär , som är före nadt med tidningens sändning eller hämtning , samt alla obehag , som lätt kunna uppstå genom kompaniskapet ; i det att tidningar skadas eller förkomma o. s. v. Det är ju också trefligt att , oberoende af andra , kunna välja tiden för sin tidningsläsning , och mången gång är det af största vigt att ha tidningen till hands äfven sedan den blifvit lä-d , när man vill uppsöka en notis eller annons i ett äldre nummer . 	bib11653815_18970714_146944_79_0004_alto.xml-1-91
notis sm den sedan 1892 tills nu päqäende rusdryckssörbudsomröstningen $ att resultat i hwarje sall mäste betrakta säsom särdeles otillfredsställande $	0	0	notis	notis sm den sedan 1892 tills nu päqäende rusdryckssörbudsomröstningen , att resultatet i hwarje sall mäste betraktas säsom särdeles otillfredsställande . 	bib15760690_18950227_145050_33_0002_alto.xml-51-0
$ här vara en notis om en olyckshändelse hos grönboms $	4	0	notis	— Här är en notis om en olyckshändelse hos Grönboms . 	bib11653811_18971009_145317_156_0003_alto.xml-91-4
göteborg mycket spridd illustrera veckotidning $ innehålla pigg notis $ en välvårdad novellafdelning $ 3 följetong $ däraf en i original $ samt en pikant skämtafdelning $	8	0	notis	Göteborgs mest spridda illustrerade veckotidning , innehåller pigga notiser , en välvårdad novellafdelning , 3 följetonger ( däraf en i original ) samt en pikant skämtafdelning . 	bib15650814_18951230_146365_304_0004_alto.xml-71-8
vi återge följa utdrag $ jag läsa en dag i public library göteborg handelstidning för den 14 och 15 april och finna $ bland annan $ en notis örn att mellan $ å 700 svensk ungdom ha inskeppa sig för att resa till amerika $ och jag upptända af en brinna lust att säga någon i fråga till en hemmavarande $ som ämna sig hit $ men ännu dröja $	27	0	notis	vi återge följande utdrag : Jag läste en dag i public library Göteborgs Handelstidning för den 14 och 15 april och fann , bland annat , en notis örn att mellan 6- å 700 svenska ungdomar hade inskeppat sig för att resa till Amerika , och jag upptändes af en brinnande lust att säga något i frågan till de hemmavarande , som ämna sig hit , men ännu dröja . 	bib11653811_19030617_145317_92_0004_alto.xml-40-27
titansyra ingå nämligen till stor mängd uti en i dag norsk notis åsyfta mineral $	11	0	notis	Titansyra ingår nämligen till stor mängd uti de i dan norska notisen åsyftade mineralen . 	bib19227462_18950410_147640_84_0002_alto.xml-112-11
hufvudinnehållet i all upplaga densamma $ men en del notis af mera lokal inträsse $ kyrklig uppgift och därtill särskildt beordra annons inflyta endast i den för vederböra ort afse npplagan $	9	0	notis	hufvudinnehållet i alla upplagorna detsamma , men en del notiser af mera lokalt inträsse , kyrkliga uppgifter och därtill särskildt beordrade annonser inflyta endast i den för vederbörande ort afsedda npplagan . 	bib11653790_19030310_12541_19_0001_alto.xml-7-9
då till vi kännedom komma $ att i en notis uppgifvits den den under sorglig omständighet omkommen kamrerare h $ bern från eslöf skola vara försäkra i $ thule $ men att denna bolag på grund af en med dödsfall förknippa omständighet icke anse sig böra till full belopp inlösa försäkring $ få vi härmed förklara $ att bemälde kamrer bern klee någonsin vara försäkra i bolag thule $ utan att förmodligen någon af vi oiycksfallsförsäkringsbolag i notis i fråga afse $	9	0	notis	Då till vår kännedom kommit , att i en notis uppgifvits det den under sorgliga omständigheter omkomne kamreraren H . Bern från Eslöf skulle varit försäkrad i Lifförsäkrings-Aktiebolaget Thule , men att detta bolag på grund af de med dödsfallet förknippade omständigheterna icke ansett sig böra till fulla beloppet inlösa försäkringen , få vi härmed förklara , att bemälde kamrer Bern klee någonsin varit försäkrad i bolaget Thule , utan att förmodligen något af våra oiycksfallsförsäkringsbolag i notisen i fråga afses . 	bib15975090_18961024_148377_133_0003_alto.xml-112-9
att få veta $ hvad ni heta $ jag skola skicka en notis till tidning örn brand $	12	0	notis	att få veta , hvad ni heter ; jag skall skicka en notis till tidningarna örn branden . 	bib11653790_18990217_145648_13_0004_alto.xml-17-12
vi hafva $ lojal $ $ förklara den värd organ $ införa en notis $ med stor stil $ om hr b dementi $ $ men äro alls ej sinnad att tillåta $ att åsigt $ i hvilka vi icke äro af samma mening $ insmugglas $ $ $	13	0	notis	Vi hafva » lojalt » , förklarar det värda organet , infört en notis » med stor stil » om hr B:s dementi , » men äro alls ej sinnade att tillåta , att åsigter , i hvilka vi icke äro af samma mening , insmugglas ( ? ) 	bib19227462_18950227_147640_49_0003_alto.xml-58-13
