sentence_lemma	sentence_token	index_lemma	index_token	lemma
stälda resgods $ hvarom här vara fråga $ förvara i särskild vagn eller af tullkammare i malmö för ändamål godkänd vagns $ hvari nämda tullkammare meddela behörig plombering samt med angifvande af icke blott vagn eller vagnsafdelning märke och nummer $ utan äfven deraf $ att innehåll utgöra af icke undersöka resgods $ meddela förpassning i två exemplar af hvilka den ena skola åtfölja gods och den andra med först afgå post försända till vederböra tullförvaltning i bestämmelseort m $ m $ $ dels äfven att fraktgods $ utgöra hel vagnslast och af beskaffenhet $ att hinder jemlikt $ 1 $ 3 i gälla tullstadga icke möta för den uppläggning å transitupplag $ hvilket med ångfärja anlända från kö till malmö för att utan omlastning genom omedelbar transitoförsändning befordra vid med jernväg till ort i norge $ der tullkammare finna och förtullning få ega rum $ må å ångfärians märkrulla uppta såsom en kolli och jemväl såsom en kolli angifvas i vanlig ordning hos tullkammare i malmö och af nämda tullkammare förpassa till destinationsort $ under vilkor att i en och samma vagn icke må förvara gods $ som skola på ifrågavarande sätt försända till mer än en emottagare i destinationsort $ så vidt gods icke vara emballeradt m $ m $ $ äfvensom att $ för den händelse $ $ $ i enlighet med hvad medicinalstyrelse och generaltullstyrelsen hemställa $ tillåta $ att med ångfärja mellan köbenhavn och malmö inkomma jernvägsmateriel må tullfri disponera $ $ $ tillika må medgifva $ att sålunda införa jernvägsmateriel må $ derest den sedermera föra öfver gräns till norge $ derifrån återinföra hit till rike titan undergå af någon tullbehandling $	stälda resgodset , hvarom här är fråga , förvaras i särskild vagn eller af tullkammaren i Malmö för ändamålet godkänd vagnsafdelning , hvari nämda tullkammare meddelar behörig plombering samt med angifvande af icke blott vagnens eller vagnsafdelningens märke och nummer , utan äfven deraf , att innehållet utgöres af icke undersökt resgods , meddelar förpassning i två exemplar af hvilka det ena skall åtfölja godset och det andra med först afgående post försändas till vederbörande tullförvaltning i bestämmelseorten m . m . ; dels äfven att fraktgods , utgörande hel vagnslast och af beskaffenhet , att hinder jemlikt § 1 mom. 3 i gällande tullstadga icke möter för dess uppläggning å transitupplag , hvilket med ångfärja anländer från Köbenhavn till Malmö för att utan omlastning genom omedelbar transitoförsändning befordras vidare med jernväg till ort i Norge , der tullkammare finnes och förtullning får ega rum , må å ångfärians märkrulla upptagas såsom ett kolli och jemväl såsom ett kolli angifvas i vanlig ordning hos tullkammaren i Malmö och af nämda tullkammare förpassas till destinationsorten , under vilkor att i en och samma vagn icke må förvaras gods , som skall på ifrågavarande sätt försändas till mer än en emottagare i destinationsorten , så vidt godset icke är emballeradt m . m . ; äfvensom att , för den händelse k. m:t , i enlighet med hvad medicinalstyrelsen och generaltullstyrelsen hemställt , tillåter , att med ångfärja mellan Köbenhavn och Malmö inkommande jernvägsmateriel må tullfritt disponeras , k. m:t tillika måtte medgifva , att sålunda införd jernvägsmateriel må , derest den sedermera förts öfver gränsen till Norge , derifrån återinföras hit till riket Titan undergående af någon tullbehandling . 	109	109	upplggning
liten varuparti emotta till uppläggning å $ nederlag som frimagasin $	Mindre varupartier emottagas till uppläggning å såväl nederlag som frimagasin . 	4	4	upplggning
minstbjudande upplåta framkörning och uppläggning af $ $ is $	minstbjudande upplåtes framkörning och uppläggning af 19,000 kub.-fot is . 	4	4	upplggning
$ sig $ $ $ 438 $ omfatta direkt och från tullbehandla vara jemte uppläggning på åeriag $ men ej fortullningar derifrån $	» sej » 91,000 — 438 * Omfattande direkt och från tullbehandlade varor jemte uppläggningar på åeriag , men ej fortullningar derifrån . 	14	14	upplggning
för han besvär med uppsätta af förslag till en ny stadgarne och uppläggning af förening räkenskapsbok $	för hans besvär med uppsättande af förslag till de nya stadgarne och uppläggning af föreningens räkenskapsböcker . 	12	12	upplggning
skicklig i såväl fin sorn enkel matlagning $ uppläggning ooh dekorering $ önska sig plats i göteborg $	skicklig i såväl finare sorn enklare matlagning , uppläggning ooh dekorering , önskar sig plats i Göteborg . 	8	8	upplggning
behaga sammanträda onsdag den 16 mars 1898 klocka 5 $ för behandling af följa ärende $ $ $ hamndirektion skrifvelse i ärende angående ifrågasätta utvidgning och reglering af kalmar hamn $ $ $ från sen sammanträde hvilande ärende angående hamndirektion skrifvelse rörande plats för uppläggning af mudder och fyllningsämnen $ $ $ drätselkammare skrifvelse rörande än dring i byggnadsritningarne för den till den besluta vattenledning höra vattentorn $ $ $ drätselkammare anhållan om lönebidrag till vikarie för drätselkammare kamrerare $ $ $ drätselkammare utlåtande öfver styrelse för kalmar $ torsås jernvägsaktiebolag framställning örn aflemna afmotförbindelse såsom säkerhet för stad borgen för en bolag lån $ $ $ drätselkammare yttrande öfver arrendator frans andersson ansökan att å arrendelott mo 24 få uppföra tvenne boningshus $ $ $ fattigvårdsstyrelse hemställan om bemyndigande för drätselkammare att i ny fattigvårdsinrättning å falkenberg få inlägga tidsenlig $ och torkinrättning $ $ $ fattigvårdsstyrelse förslag till ledig plats för en frielev vid fröbergska itppfostringsanstalten $ $ $ gasverksstyrelsens berättelse örn förvaltning af stad gasverk under år 1897 $ $ $ vederbörande revisor berättelse öfver verkstäld granskning af grandinska välgörenhetsfond räkenskaper och förvaltning för år 1897 $ lim $ handlande lino petersson ansökan att få arrendera en plan vid elevatorskajen till upplagsplats $ $ $ johanna andersson sjögrens och gustafva lindström hvar för sig göra ansökan att få inköpa nordöstra hälft af tomt mo 45 på engö $ $ $ åkare e $	behagade sammanträda onsdagen den 16 mars 1898 klockan 5 e.m. för behandling af följande ärenden : l:o ) Hamndirektionens skrifvelse i ärendet angående ifrågasatt utvidgning och reglering af Kalmar hamn ; 2:o ) Från senaste sammanträdet hvilande ärendet angående Hamndirektionens skrifvelse rörande plats för uppläggning af mudder och fyllningsämnen ; 3:o ) Drätselkammarens skrifvelse rörande än dring i byggnadsritningarne för det till den beslutade vattenledningen hörande vattentornet ; 4:o ) Drätselkammarens anhållan om lönebidrag till vikarien för Drätselkammarens kamrerare ; 5:o ) Drätselkammarens utlåtande öfver Styrelsens för Kalmar — Torsås jernvägsaktiebolag framställning örn aflemnande afmotförbindelse såsom säkerhet för stadens borgen för ett bolagets lån ; 6:o ) Drätselkammarens yttrande öfver Arrendatorn Frans Anderssons ansökan att å arrendelotten mo 24 få uppföra tvenne boningshus ; 7:o ) Fattigvårdsstyrelsens hemställan om bemyndigande för Drätselkammaren att i nya fattigvårdsinrättningen å Falkenberg få inlägga tidsenlig ångtvätt- och torkinrättning ; 8:o ) Fattigvårdsstyrelsens förslag till ledig plats för en frielev vid Fröbergska ITppfostringsanstalten ; 9:o ) Gasverksstyrelsens berättelse örn förvaltningen af stadens gasverk under år 1897 ; 10:o ) Vederbörande revisorers berättelse öfver verkstäld granskning af Grandinska välgörenhetsfondens räkenskaper och förvaltning för år 1897 ; lim ) Handlanden lino Peterssons ansökan att få arrendera en plan vid Elevatorskajen till upplagsplats ; 12:o ) Johanna Andersson Sjögrens och Gustafva Lindströms hvar för sig gjorda ansökan att få inköpa nordöstra hälften af tomten mo 45 på Engö ; 13:o ) Åkaren E . 	44	44	upplggning
2 $ när fartyg ankomma från eller afgår till utländsk ort $ skola $ med en undantag $ hvarom nedan säga $ lotspenningar enligt taxa jemte hemvägsersättniug enligt lotsledsiörteckning erlägga vid ingående för all en lotsled $ som passera från öppen sjö före ankomst till första lossning eller lastningsort äfvensom till plats $ som anlöpa för order eller uppläggning $ och vid utgåonde från sista lastningsort eller $ örn fartyg vara barlastadt $ från sista afgångsorteu genom all en lotsled $ som passera $ der den icke vara öppen sjö $	2 ) När fartyg ankommer från eller afgår till utländsk ort , skola , med de undantag , hvarom nedan säges , lotspenningar enligt taxa jemte hemvägsersättniug enligt lotsledsiörteckning erläggas vid ingående för alla de lotsleder , som passeras från öppen sjö före ankomsten till första lossnings- eller lastningsort äfvensom till plats , som anlöpes för order eller uppläggning , och vid utgåonde från sista lastningsorten eller , örn fartyget är barlastadt , från sista afgångsorteu genom alla de lotsleder , som passeras , der det icke är öppen sjö . 	58	58	upplggning
ull $ ofärgad och färga $ $ $ väfnad $ all slag $ gt $ $ $ $ $ s00 $ omfatta direkt och från transitonpplag tullbehandla vara jemte uppläggning på nelluingar derifrån $	Ull , ofärgad och färgad » 11,900 — Väfnader , alla slag & gt ; 958,300 + 390,800 929,000 S00 218,500 Omfattande direkt och från transitonpplag tullbehandlade varor jemte uppläggningar på nelluingar derifrån . 	29	29	upplggning
komma ej snö eller åtminstone så mycket käle i mark $ att man kunna begagna drög för virke uppläggning vid farbar väga $ måste säkerligen stor parti lämna kvar i skog öfver sommar $ ty få denna blid väderlek fortfara $ komma vårbruk i år en hel månad tidig än vanlig $	Kommer ej snö eller åtminstone så mycket käle i marken , att man kan begagna drögar för virkets uppläggning vid farbara väger , måste säkerligen stora partier lämnas kvar i skogen öfver sommaren , ty får denna blida väderlek fortfara , kommer vårbruket i år en hel månad tidigare än vanligt . 	18	18	upplggning
att fatta beflut $ $ $ i anledning af kyrkorädets hemställan om uppläggning af ny tak ä prestgärden och densamma päbyggnad $ $ $ rörande folkstolläraren e $	att fatta beflut : l:o ) I anledning af kyrkorädets hemställan om uppläggning af nytt tak ä prestgärden och densammas päbyggnad ; 2:o ) Rörande Folkstolläraren E . 	12	12	upplggning
liten varuparti emotta till uppläggning å såväl nederlag sorn frimagasin $	Mindre varupartier emottagas till uppläggning å såväl nederlag sorn frimagasin . 	4	4	upplggning
vid böra flottning 1 regel afsluta tidig på höst äu hittills $ hvarförutom uppläggning af virke vintertid å lax lekplats böra så vidt möjlig undvika $ särskildt beträffande obarkadt virke $	Vidare bör flottningen 1 regel afslutas tidigare på hösten äu hittills , hvarförutom uppläggning af virke vintertid å laxens lekplatser bör så vidt möjligt undvikas , särskildt beträffande obarkadt virke . 	13	13	upplggning
tulibehandlingen af gods $ sorn i jernvägsvagnar inkomma på ångfärja från köpenhamn till malmö för vid befordran till norge $ förordna $ en $ s att resgods $ som med ångfärja anlända från köpenhamn till malmö $ må $ utan afvisitering och tullbehandling i malmö och utan att hvarje särskildt kolli derstädes väga och plombera $ direkt befordra till städerne fredrikshald och kristiania i norge $ under vilkor bland annan $ att den till hvardera destina tionsorten stälda resgods $ hvarom här vara fråga $ förvara i särskild vagn eller af tullkammare i malmö för ändamål godkänd vagns $ hvari nämda tullkammare meddela behöiig plombering samt med angifvande af icke blott v3gnens eller vagnsafdelning märke och nummer $ utan äfven deraf $ att innehåll utgöra af icke undersöka resgods $ meddela förpassning i två exemplar $ af hvilka den ena skola åtfölja gods och den andra med först afgå post försända till vederböra tullförvaltning i bestämmelseort m $ m $ $ dels äfven att fraktgods $ utgöra hel vagnslast och af beskaffenhet $ att hinder iemlikt $ 1 $ 3 i gälla tallstadga icke möta för den uppläggning å transitonpplag $ hvilket med ångfärja anlända från köpenhamn till malmö för att utan omlastning genom omedelbar transitoförsändning befordra vid med jernväg till ort i norge $ der tullkammare finna och förtnllning få ega ram $ må å ångfärjan märkrnlla uppta såsom en kolli och jemväl såsom en kolli angifvas i vanlig ordning hos tullkammare i malmö och af nämda tullkammare förpassa till destinationsort $ under vilkor att i en och samma vagn icke må förvara gods $ som skola på ifrågavarande sätt försändab till mer än en emottogare i destinationsort $ för så vidt gods icke vara emballe rädt $ m $ m $ äfvensom att $ för den händelse k $	tulibehandlingen af gods , sorn i jernvägsvagnar inkommer på ångfärja från Köpenhamn till Malmö för vidare befordran till Norge , förordna : de ’ s att resgods , som med ångfärja anländer från Köpenhamn till Malmö , må , utan afvisitering och tullbehandling i Malmö och utan att hvarje särskildt kolli derstädes väges och plomberas , direkt befordras till städerne Fredrikshald och Kristiania i Norge , under vilkor bland annat , att det till hvardera destina tionsorten stälda resgodset , hvarom här är fråga , förvaras i särskild vagn eller af tullkammaren i Malmö för ändamålet godkänd vagnsafdelning , hvari nämda tullkammare meddelar behöiig plombering samt med angifvande af icke blott V3gnens eller vagnsafdelningens märke och nummer , utan äfven deraf , att innehållet utgöres af icke undersökt resgods , meddelar förpassning i två exemplar , af hvilka det ena skall åtfölja godset och det andra med först afgående post försändas till vederbörande tullförvaltning i bestämmelseorten m . m . ; dels äfven att fraktgods , utgörande hel vagnslast och af beskaffenhet , att hinder iemlikt § 1 mom. 3 i gällande tallstadga icke möter för dess uppläggning å transitonpplag , hvilket med ångfärja anländer från Köpenhamn till Malmö för att utan omlastning genom omedelbar transitoförsändning befordras vidare med jernväg till ort i Norge , der tullkammare finnes och förtnllning får ega ram , må å ångfärjans märkrnlla upptagas såsom ett kolli och jemväl såsom ett kolli angifvas i vanlig ordning hos tullkammaren i Malmö och af nämda tullkammare förpassas till destinationsorten , under vilkor att i en och samma vagn icke må förvaras gods , som skall på ifrågavarande sätt försändaB till mer än en emottogare i destinationsorten , för så vidt godset icke är emballe rädt , m . m ; äfvensom att , för den händelse K . 	187	187	upplggning
man till svar $ $ ryssby ha nu linie $ $ $ skola telefon blifva till någon verklig nytta för vi ljungbybor måste telegrafverk gå i författning om ny linie uppläggning åtminstone mellan ljungby och vislanda $ men för öfrig vara den ej ur väg att linie sträcka ända fram till vexiö $	man till svar : » Ryssby har nu linien upptagen . » Skall telefonen blifva till någon verklig nytta för oss Ljungbybor måste telegrafverket gå i författning om ny linies uppläggning åtminstone mellan Ljungby och Vislanda , men för öfrigt vore det ej ur vägen att linien sträcktes ända fram till Vexiö . 	30	30	upplggning
restaurantvan hushäuerska $ skicklig i fin matlagning och uppläggning $ söka plats genom göteborg flatsbyrå $ magasinsgatan 13 $	Restaurantvan hushäUerska , skicklig i finare matlagning och uppläggningar , söker plats genom Göteborgs Flatsbyrå , Magasinsgatan 13 . 	8	8	upplggning
liten varuparti emotta till uppläggning å $ nederlag som frimagasin $	Mindre varupartier emottagas till uppläggning å såväl nederlag som frimagasin . 	4	4	upplggning
vid uppläggning af segelbåt $ segel reparera billig $ önska ny segelställ eller rigg $ utföra äfven denna billig $	Vid uppläggning af segelbåtar : Segel repareras billigt , önskas nya segelställ eller rigg , utföres äfven detta billigt . 	1	1	upplggning
en duglig och bra kokerska $ full hemmastadd i $ enkel som fin matlagning samt vand vid uppläggning $ erhålla den 24 instunda april förmäulig anställning i landsortsstad $	En duglig och bra kokerska , fullt hemmastadd i såväl enklare som finare matlagning samt vand vid uppläggning , erhåller den 24 instundande April förmäulig anställning i landsortsstad . 	17	17	upplggning
$ omfatta direkt och från transitonpplag tullbehandla vara jemte uppläggning på nelerlag $ men ej förtullnidgar derifrån $	* Omfattande direkt och från transitonpplag tullbehandlade varor jemte uppläggningar på nelerlag , men ej förtullniDgar derifrån . 	9	9	upplggning
meddela undervisning i tysk och engelsk språk $ verkställa öfversättning samt ombesörja räkenskaper uppläggning ocb afslutning $	meddelar undervisning i Tyska och Engelska språken , verkställer öfversättningar samt ombesörjer räkenskapers uppläggning ocb afslutning . 	13	13	upplggning
eljest ha vid bok första uppläggning mångå olägenhet $ som sedan yp pats $ knnnat förebygga $	Eljest hade vid böckernas första uppläggning mångå olägenheter , som sedan yp pats , knnnat förebyggas . 	5	5	upplggning
revision $ bokafslutningar $ uppläggning och föring af all slag räkenskaper verkställa noggrann $ fort och billig af	Revisioner , bokafslutningar , uppläggning och föring af alla slags räkenskaper verkställas noggrant , fort och billigt af 	4	4	upplggning
de revidering och afslut samt uppläggning af ny höcker $ kunna mot billig arfvode erhålla biträde af underteckna $ sorn med tacksamhet motta arbete $	deras revidering och afslutning samt uppläggning af nya höcker , kunna mot billigt arfvode erhålla biträde af undertecknad , sorn med tacksamhet mottager arbete . 	5	5	upplggning
uppläggning 1892 $ till en sån omfång $ att under viss bokstäfver namn uppta ej föga än 60 helsida $	uppläggning 1892 utsvält till ett sådant omfång , att under vissa bokstäfver namnen upptaga ej mindre än 60 helsidor . 	0	0	upplggning
omfatta såväl uppläggning born afslutriing af handelsbok $ $ sig dertill skicklig person $	omfattande såväl uppläggning Born afslutriing af handelsböcker , åtager sig dertill skicklig person . 	2	2	upplggning
de revidering och afslutning samt uppläggning af ny bok $ kunna mot billig arfvode erhålla biträde af underteckna $ sorn meck tacksamhet motta arbete $	deras revidering och afslutning samt uppläggning af nya böcker , kunna mot billigt arfvode erhålla biträde af undertecknad , sorn meck tacksamhet mottager arbete . 	5	5	upplggning
kunnig i matlagning och uppläggning $ önska atl gå bort i familj att biträda vid $ $	kunnig i matlagning och uppläggning , önskar atl gå bort i familjer att biträda Vid bjudningar.^Adr . 	4	4	upplggning
hushällerska som vara skicklig i fin matlagning och uppläggning $ och som ha betyg frän fin restanranter $ söka plats till badort eller hotell $	Hushällerska som är skicklig i finare matlagning och uppläggningar , och som har betyg frän finare Restanranter , söker plats till Badort eller Hotell . 	8	8	upplggning
restaurantvan hushållerska $ skicklig i fin matlagning och uppläggning $ söka plats genom göteborg l $ latsbyr $ $ magasinsgatan 13 $	Restaurantvan hushållerska , skicklig i finare matlagning och uppläggningar , söker plats genom Göteborgs l * latsbyr & , Magasinsgatan 13 . 	8	8	upplggning
full van att förestå stor hnshåll samt vara kun $ niga 1 fin matlagning $ uppläggning och syltning $	fullt van att förestå större hnshåll samt vara kun * nig 1 finare matlagning , uppläggning och syltning . 	15	15	upplggning
$ $ ordentlig $ daglig och vana vid första $ klass $ $ fullkomlig hemmastadd i nutid fordran vid uppläggning $ erhålla förmånlig plats 1 maj $ 30 sept 1896 i storrå residensstad i mellersta sverige $	spar.amma , ordentliga , dagliga och vana vid första ' klassens sommar-re.tanrant , fullkomligt hemmastadda i nutidens fordringar vid uppläggningar , erhålla förmånliga platser 1 Maj — 30 Sept 1896 i storrå residensstad i mellersta Sverige . 	19	19	upplggning
hushållerska $ kunnig i fin och enkel matlagning $ uppläggning m $ m $ $ söka plats $	Hushållerska , kunnig i finare och enklare matlagning , uppläggning m . m . , söker plats . 	9	9	upplggning
i öfrig förekomma inemot en hundratal illustration för nppfkärning $ dukning $ uppläggning dekorering m $ m $	I öfrigt förekommer inemot ett hundratal illustrationer för nppfkärning , dukning , uppläggning dekorering m . m . 	12	12	upplggning
2 $ när fartyg ankomma från eller afgår till utländsk ort $ skola $ med en undantag $ hvarom nedan säga $ lots enligt taxa jämte hem vägsersättning enligt lotsledsförteckning erlägga vid ingående tor all en lotsled $ som passera från öppen sjö före ankomst till första lossning eller lastningsort äfvensom till plats $ som anlöpa för order eller uppläggning $ och vid utgå från sista lastningsort eller $ om fartyg vara barlastadt $ från sista afgångsorten genom all en lotsled $ som passera $ där den icke vara öppen sjö $	2 ) När fartyg ankommer från eller afgår till utländsk ort , skola , med de undantag , hvarom nedan sägs , lotspänningar enligt taxa jämte hem vägsersättning enligt lotsledsförteckning erlägges vid ingående tor alla de lotsleder , som passeras från öppen sjö före ankomsten till första lossnings- eller lastningsort äfvensom till plats , som anlöpes för order eller uppläggning , och vid utgående från sista lastningsorten eller , om fartyget är barlastadt , från sista afgångsorten genom alla de lotsleder , som passeras , där det icke är öppen sjö . 	59	59	upplggning
i öfrig förekomma inemot en hundratal illustration för uppskärning $ 6 $ 1 dukning $ uppläggning $ dekorering m $ m $	I öfrigt förekomma inemot ett hundratal illustrationer för uppskärning , 6 ' 1 dukning , uppläggning , dekorering m . m . 	15	15	upplggning
alf dä snö falla i sadan mängd $ att allmän rörelse ä gata och torg förswäras eller förhindra $ den öswerflödiga snö stall undanstottas och bortföra $ att den mä wara husegare tillläte att intill sig fastighet flott en del öfwerflödig snö $ derwid dock böra iaktta $ att den sälunda uppstötta snö packa och lägga till lik höjd och bredd utefter hel fastighet $ att ä trottoairer dylik uppläggning af snö ej mä förekomma utan stola densamma jemte gata i öfrig städse hälla i den stick att snöbetäckningen bilda en jemn yta utan stor grop $ att den äligger husegare att $ dä polismyndighet sä nödig pröfwar $ befria tak och ränna frän snö och is $ wid werkställighet häraf böra noga tillse att färch derigenom ej uppkomma för förbigäende och att ingen eller sä ringa olägenhet som möjlig derigenom tillskynda den trafikera allmänhet $ att der snö inne ä gärd stulle ligga i sädan myckenhet $ att den kunna wara till hinder för eldsiäckningsarbete $ sädan snö $ der polismyndighet vröiwar den nödig $ sä snar som möjlig bortstaffas $ samt att wederbörande hafwa att ställa sig till efterrättelse hwad polismyndighet till fullgöra af denna bestämmelse mä kunna förestrifwa $	alf dä snö faller i sadan mängd , att allmänna rörelsen ä gator och torg förswäras eller förhindras , den öswerflödiga snön stall undanstottas och bortföras ; att det mä wara husegare tillätet att intill sin fastighet flotta en del öfwerflödig snö , derwid dock bör iakttagas , att den sälunda uppstöttade snön packas och lägges till lika höjd och bredd utefter hela fastigheten ; att ä trottoairer dylik uppläggning af snö ej mä förekomma utan stola desamma jemte gatorna i öfrigt städse hällas i det stick att snöbetäckningen bildar en jemn yta utan större gropar ; att det äligger husegare att , dä polismyndigheten sä nödigt pröfwar , befria tak och rännor frän snö och is ; wid werkställighet häraf bör noga tillses att färch derigenom ej uppkommer för förbigäende och att ingen eller sä ringa olägenhet som möjligt derigenom tillskyndas den trafikerande allmänheten ; att der snö inne ä gärd stulle ligga i sädan myckenhet , att den kan wara till hinder för eldsiäckningsarbete , sädan snö , der polismyndigheten vröiwar det nödigt , sä snart som möjligt bortstaffas , samt att wederbörande hafwa att ställa sig till efterrättelse hwad polismyndigheten till fullgörande af dessa bestämmelser mä kunna förestrifwa . 	69	69	upplggning
vid uppläggning af segelbåt $ segel reparera billig $ önska ny segelställ eller rigg $ utföra äfven denna billig $	Vid uppläggning af segelbåtar : Segel repareras billigt , önskas nya segelställ eller rigg , utföres äfven detta billigt . 	1	1	upplggning
