sentence_lemma	sentence_token	index_lemma	index_token	lemma
ångfartyg njord $ som efter sig uppläggning under vinter undergå diverse smärre reparation vid södra varfvet $ bära efter undergång prof och besigtningsresa samt kompassjustering angöra vid sig gammal tilläggningsplats vid skeppsbrokajen och ha från och med i lördag på morgon börja inta last samt komma att deu i juni göra sig första resa för år till haparanda med anlöpa af en del mellanstation i nedre och öfre norrland $	Ångfartyget Njord , som efter sin uppläggning under vintern undergått diverse smärre reparationer vid södra varfvet , bar efter undergången prof- och besigtningsresa samt kompassjustering angjort vid sin gamla tilläggningsplats vid Skeppsbrokajen och har från och med i lördags på morgonen börjat intaga last samt kommer att deu i juni göra sin första resa för året till Haparanda med anlöpande af en del mellanstationer i nedre och öfre Norrland . 	6	6	upplggning
liten varuparti emotta till uppläggning ä $ nederlag som frimagasin $	Mindre varupartier emottagas till uppläggning ä såväl nederlag som frimagasin . 	4	4	upplggning
liten varuparti emotta till uppläggning å $ nederlag som frimagasin $	Mindre varupartier emottagas till uppläggning å såväl nederlag som frimagasin . 	4	4	upplggning
$ omfatta direkt och från transitopuplag tullbehandla vara jemte uppläggning på nederlag $ men ej förtullning derifrån $	* Omfattande direkt och från transitopuplag tullbehandlade varor jemte uppläggningar på nederlag , men ej förtullningar derifrån . 	9	9	upplggning
liten varuparti emotta till uppläggning å $ nederlag som frimagasin $	Mindre varupartier emottagas till uppläggning å såväl nederlag som frimagasin . 	4	4	upplggning
liten varuparti emotta till uppläggning å $ nederlag som frimagasin $	Mindre varupartier emottagas till uppläggning å såväl nederlag som frimagasin . 	4	4	upplggning
liten varuparti emotta till uppläggning å $ nederlag som frimagasin $	Mindre varupartier emottagas till uppläggning å såväl nederlag som frimagasin . 	4	4	upplggning
uppläggning och uttagning ombesörja efter anmodan $ göteborg $ $ magasinsqvarteret $ 4 $	Uppläggning och uttagning ombesörjes efter anmodan , Göteborgs Magasins-Aktiebolag , Magasinsqvarteret N:o 4 . 	0	0	upplggning
skicklig i all hvad till en stor kök hörer $ i fin matlagning som uppläggning m $ m $ önska att hos familj tillaga middag $ supeer efter nutid fordran $ och torde ära fru godhetsfull ihågkomma hon $	skicklig i allt hvad till ett större kök hörer såväl i finare matlagning som uppläggning m . m , önskar att hos familjer tillaga middagar , supeer efter nutidens fordringar , och torde ärade fruar godhetsfullt ihågkomma henne . 	14	14	upplggning
att dä snö falla i sädan mängd $ att allmän rörelse ä gata och torg förswäras eller förhindra $ den öfwerflödiga snöa stall undanstottas och bortföra $ att den mä wara husegare tillläte att intill sig fastighet flott en del $ snö $ derwid dock böra iaktta $ att den sälunda uppstötta snö packa och lägga till lik höjd och bredd utefter hel fastighet $ att ä trottoairer dylik uppläggning af snö ej mä förekomma utan stola densamma jemte gata i öfrig städse hälla i den stick att snöbetäckningen bilda en jemn yta utan stor grop $ att den äligger husegare att $ dä polismyndighet sä nödig pröfwar $ befria tak och ränna frän snö och is $ wid werkställighet häraf böra noga tillse att fara derigenom ej uppkomma för förbigäende och att ingen eller sä ringa olägenhet som möjlig derigenom tillskynda den trafikera allmänhet $ att der snö inne ä gärd stulle ligga i sädan myckenhet $ att den kunna wara till hinder för eldfläckningsarbete $ sädan snö $ der polismyndighet pröfwar den nödig $ sä snar som möjlig bortskaffa $ samt att wederbörande hafwa att ställa sig till efterrättelse hwad polismyndighet till fullgöra af denna bestämmelse mä kunna förestrifwa $	att dä snö faller i sädan mängd , att allmänna rörelsen ä gator och torg förswäras eller förhindras , den öfwerflödiga snöa stall undanstottas och bortföras ; att det mä wara husegare tillätet att intill sin fastighet flotta en del öfwerfl.dig snö , derwid dock bör iakttagas , att den sälunda uppstöttade snön packas och lägges till lika höjd och bredd utefter hela fastigheten ; att ä trottoairer dylik uppläggning af snö ej mä förekomma utan stola desamma jemte gatorna i öfrigt städse hällas i det stick att snöbetäckningen bildar en jemn yta utan större gropar ; att det äligger husegare att , dä polismyndigheten sä nödigt pröfwar , befria tak och rännor frän snö och is ; wid werkställighet häraf bör noga tillses att fara derigenom ej uppkommer för förbigäende och att ingen eller sä ringa olägenhet som möjligt derigenom tillskyndas den trafikerande allmänheten ; att der snö inne ä gärd stulle ligga i sädan myckenhet , att den kan wara till hinder för eldfläckningsarbete , sädan snö , der polismyndigheten pröfwar det nödigt , sä snart som möjligt bortskaffas , samt att wederbörande hafwa att ställa sig till efterrättelse hwad polismyndigheten till fullgörande af dessa bestämmelser mä kunna förestrifwa . 	69	69	upplggning
liten varuparti emotta till uppläggning å såväl nederlag sorn frimagasin $	Mindre varupartier emottagas till uppläggning å såväl nederlag sorn frimagasin . 	4	4	upplggning
liten varuparti emotta till uppläggning å $ nederlag som frimagasin $	Mindre varupartier emottagas till uppläggning å såväl nederlag som frimagasin . 	4	4	upplggning
hvarje föremål $ sorn lemnäs till förvaring i parasiticidas enkom derför inreda rymlig magasiner $ undergå före uppläggning fullständig desinfektion och rengöring $ hvarigenom den möjlighet att sjukdomsfrön kunna öfverföra från en föremål till en annan $ absolut förekomma $	Hvarje Föremål , sorn lemnäs till förvaring i Parasiticidas enkom derför inredda rymliga magasiner , undergår före uppläggningen fullständig desinfektion och rengöring , hvarigenom den möjligheten att sjukdomsfrön kunna öfverföras från ett föremål till ett annat , absolut förekommes . 	17	17	upplggning
skola örlogs verksamhet inskränka till underhåll $ ut och afrustningj samt uppläggning af deu sjökrigsmateriel $ sorn tor närvara tillhöra $ eller som framdeles komma att erhålla sig ständig förlägguingsort härstädes $ i och för försvar af hufvudstad och stockholm skärgård $ samt till tillverkning af mina och annan materiel så väl för den fast som för den rörlig mia försvar $	skulle örlogsvarfvets verksamhet inskränkas till underhåll , ut- och afrustningj samt uppläggning af deu sjökrigsmateriel , sorn tor närvarande tillhörde Stockholms-stationen eller som framdeles komme att erhålla sin ständiga förlägguingsort härstädes , i och för försvaret af hufvudstaden och Stockholms skärgård , samt till tillverkning af minor och annan materiel så väl för det fasta som för det rörliga mia försvaret . 	11	11	upplggning
uppläggning iaktta $ att band ände böja tillräcklig för att bilda hatt och kunna ligga kvar $ att de lägga tät intill hvarandra samt att axände lägga åt den sida $ hvarifrån vind företrädesvis komma $	uppläggning iakttages , att bandets ändar böjas tillräckligt för att bilda hatt och kunna ligga kvar , att de läggas tätt intill hvarandra samt att axändarna läggas åt den sida , hvarifrån vinden företrädesvis kommer . 	0	0	upplggning
hvarje föremål $ som lemnäs till förvaring i parasiticidas enkom derför inreda rymlig magasiner $ undergå före uppläggning fullständig desinfektion och rengöring $ hvarigenom den möjlighet att sjukdomsfrön kunna öfverf öra från en föremål till en annan $ a b so snäf förekomma $	Hvarje föremål , som lemnäs till förvaring i Parasiticidas enkom derför inredda rymliga magasiner , undergår före uppläggningen fullständig desinfektion och rengöring , hvarigenom den möjligheten att sjukdomsfrön kunna öfverf öras från ett föremål till ett annat , a b so Snäf förekommes . 	17	17	upplggning
hvarje föremål $ son lemnäs till förvaring i parasiticidas enkom derför inreda rymlig magasiner $ undergå före uppläggning fullständig desinfeelion och rengöring $ hvarigenom den möjlighet $ att sjukdomsfrön kunna öfverföra från en föremål till en annan $ absolut förekomma	Hvarje föremål , son lemnäs till förvaring i Parasiticidas enkom derför inredda rymliga magasiner , undergår före uppläggningen fullständig desinfeelion och rengöring , hvarigenom den möjligheten , att sjukdomsfrön kunna öfverföras från ett föremål till ett annat , absolut förekom- 	17	17	upplggning
redaktion torde godhetsfull inta följa i tidning $ tacka för observatör upplysning rörande trävara uppläggning å barlastholmens kaj $ kunna man ju icke annan än lyckönska träexportör att stad afgiftsfritt till de upplåta sig kaj $ ty herre vedgårdsegare ha ju då den stor fördel att icke alls behöfva begagna egen plan $ enär stad lemna fri sån $	Redaktionen torde godhetsfullt intaga följande i tidningen : Tackande för Observatörs upplysningar rörande trävarors uppläggning å barlastholmens kajer , kan man ju icke annat än lyckönska träexportörerna att staden afgiftsfritt till dem upplåter sina kajer , ty herrar vedgårdsegare har ju då den stora fördelen att icke alls behöfva begagna egna planer , enär staden lemnar fria sådana . 	14	14	upplggning
liten varuparti emotta till uppläggning ä $ nederlag som frimagasin $	Mindre varupartier emottagas till uppläggning ä såväl nederlag som frimagasin . 	4	4	upplggning
liten varuparti emotta $ till uppläggning å såväl nederlag sorn frimagasin $	Mindre varupartier emottaga » till uppläggning å såväl nederlag sorn frimagasin . 	5	5	upplggning
som i hamn upplägga sig fartyg och icke inom åtta dag efter uppläggning betala hamnumgälder för inkommande $	som i hamnen upplägger sitt fartyg och icke inom åtta dagar efter uppläggningen betalar hamnumgälder för inkommandet . 	12	12	upplggning
öfre våning såsom magasinsrum få samma tillgänglighet och värde som den nedre $ man ha inom en ringa grundyta och under en tak dubblera upplagsutrymmet och lätta uppläggning genom alt betydlig minska transportlängd $ med handkraft $ i vågled $ men i ställ så mycket mera tillgodogöra kran mekanisk kraft för transport i lod led $	öfre våningen såsom magasinsrum fått samma tillgänglighet och värde som den nedre , man har inom en ringa grundyta och under ett tak dubblerat upplagsutrymmet och lättat uppläggningen genom alt betydligt minska transportlängderna , med handkraft , i vågled , men i stället så mycket mera tillgodogöra kranarnas mekaniska kraft för transport i lod led . 	27	27	upplggning
liten varuparti emotta till uppläggning å $ nederlag som frimagasin $	Mindre varupartier emottagas till uppläggning å såväl nederlag som frimagasin . 	4	4	upplggning
eller torr magasin önska hyra nu genast i närhet af fredsgatan $ att använda fara uppläggning af manufakturvara $	eller torrt magasin önskas hyra nu genast i närheten af Fredsgatan , att användas for uppläggning af manufakturvaror . 	15	15	upplggning
en person $ som någon tid af sommar vara ledig $ önska för att få vistas på land $ arbete med handeisböckers uppläggning oell afslutuing $ samt reda trasslig oell felförda $	En person , som någon tid af sommaren är ledig , önskar för att få vistas på landet , arbete med handeisböckers uppläggning oell afslutuing , samt reda trassliga oell felförda . 	22	22	upplggning
passande för uppläggning och tappning af vin $ önska hyra $	passande för uppläggning och tappning af viner , önskas hyra . 	2	2	upplggning
$ omfatta direkt och från transitonpplag tullbehandla vara jemte uppläggning på nederlag $ men ej förtu ilning derifrån $	• Omfattande direkt och från transitonpplag tullbehandlade varor jemte uppläggningar på nederlag , men ej förtu Ilningar derifrån . 	9	9	upplggning
äfvenså vara den lotspligtigt $ då den $ komma från utländsk ort $ anlöpa plats för uppläggning eller $ örn den inneha last $ för inhemtande af order likasom ock $ då den vara barlastadt $ från sista afgångsorten $	Äfvenså är det lotspligtigt , då det , kommande från utländsk ort , anlöper plats för uppläggning eller , örn det innehar last , för inhemtande af order likasom ock , då det är barlastadt , från sista afgångsorten . 	16	16	upplggning
vid forsling $ förvaring eller uppläggning af kött $ fläsk $ korf eller andra saluhållen matvara $ äfvensom kubb och bänk $ hvarpå kött eller fläsk å allmän saluplats stycka $ samt redskap $ som därvid använda $ skola hålla väl ren $	vid forsling , förvaring eller uppläggning af kött , fläsk , korf eller andra saluhållna matvaror , äfvensom kubbar och bänkar , hvarpå kött eller fläsk å allmän saluplats styckas , samt redskap , som därvid användas , skola hållas väl rena . 	5	5	upplggning
därpå tänka monsieur dututel $ medan han gå uppför trappa $ på att furste nyligen klandra uppläggning af en kallrätt $ han tänka också på en soppa som vara för salt och en rådjursstek $ som han sjelf tycka vara något seg $ och slutligen tänka han också på att öfverstelöjtnant l $ estrange rynka panna så märkvärdig $ då han sen gå $ räkning för köksdepartementet $	Därpå tänkte monsieur Dututel , medan han gick uppför trapporna , på att fursten nyligen klandrat uppläggningen af en kallrätt , han tänkte också på en soppa som varit för salt och en rådjursstek , som han sjelf tyckte varit något seg , och slutligen tänkte han också på att öfverstelöjtnant L ’ Estrange rynkat pannan så märkvärdigt , då han senast gick igenom räkningarne för köksdepartementet . 	16	16	upplggning
liten varuparti emotta till uppläggning å $ nederlag som frimagasin $	Mindre varupartier emottagas till uppläggning å såväl nederlag som frimagasin . 	4	4	upplggning
liten varuparti emotta till uppläggning å $ nederlag som frimagasin $	Mindre varupartier emottagas till uppläggning å såväl nederlag som frimagasin . 	4	4	upplggning
passande för uppläggning af torr vara $ önska hyra $	passande för uppläggning af torra varor , önskas hyra . 	2	2	upplggning
i öfrig förekomma inemot en hundratal illustration för uppskärning $ dukning $ uppläggning $ dekorering m $ m $	I öfrigt förekommer inemot ett hundratal illustrationer för uppskärning , dukning , uppläggning , dekorering m . m . 	12	12	upplggning
liten varuparti emotta till uppläggning å såväl nederlag sora frimagasin $	Mindre varupartier emottagas till uppläggning å såväl nederlag sora frimagasin . 	4	4	upplggning
redogörelse för uppläggning å nederlag $ $ och båk samt lastpenningar $	redogörelse för uppläggning å nederlag , fyr- och båkafgifter samt lastpenningarna . 	2	2	upplggning
liten varuparti emotta till uppläggning å $ nederlag som frimagasin $	Mindre varupartier emottagas till uppläggning å såväl nederlag som frimagasin . 	4	4	upplggning
2 $ när fartyg ankomma från eller afgår till utländsk ort $ skola $ med en undantag $ hvarom nedan säga $ lotsponningar enligt taxa jomte hemvägsersättning ooligt lotsledsförtockning erlägga rida ingående för all en lotsled som passera från öppen sjö före ankomst till första lossning eller lastning $ ort äfvensom till plats $ spm anlöpa för order eller uppläggning $ och vid utgå från sista lastningsort eller $ örn fartyg vara barlastadt $ från sista afgångsorten genom all en lotsled $ som passera $ der den icke vara öppen sjö $	2 ) När fartyg ankommer från eller afgår till utländsk ort , skola , med de undantag , hvarom nedan sägs , lotsponningar enligt taxa jomte hemvägsersättning ooligt lotsledsförtockning erläggas rid ingående för alla de lotsleder som passeras från öppen sjö före ankomsten till första lossnings- eller lastnings ' ort äfvensom till plats , spm anlöpes för order eller uppläggning , och vid utgående från sista lastningsorten eller , örn fartyget är barlastadt , från sista afgångsorten genom alla de lotsleder , som passeras , der det icke är öppen sjö . 	59	59	upplggning
liten varuparti emotta till uppläggning å $ nederlag som frimagasin $	Mindre varupartier emottagas till uppläggning å såväl nederlag som frimagasin . 	4	4	upplggning
$ omfatta direkt och från transitou $ tullbehandla vara jemte uppläggning p derlag $ men ej förtullning deri $	• Omfattande direkt och från transitou ; tullbehandlade varor jemte uppläggningar p derlag , men ej förtullningar derinan . 	10	10	upplggning
destinationsort ställa resgods $ hvarom här vara fråga $ förvara i särskild vagn eller af tullkam maren i malmö för ändamål godkänd vagnsafdel $ ning $ hvari nämna tullkammare meddela behörig plombering samt med angifvande af icke blott vagn eller vagnsafdelningens märke och nummer $ utan uf deraf $ att innehåll utgöra af icke undersöka resgods meddela förpassning i två exemplar $ af hvilka den ena skola åtfölja gods och den andra med först afgå post försända till vederböra tuliförvaltning i bestämmelseort m $ m $ $ dels äfven att fraktgods $ utgöra hel vagnslast och af beskaffenhet $ att hinder jemlikt $ 1 $ 3 i gälla tullstadga icke möta för den uppläggning å transitupplag $ hvilket med ångfärja anian der från köpenhamn till malmö för att utan örn lastning genom omedelbar transitoförsändning befordra vid med jernväg till ort i norge $ der tullkammare finna och förtullning få ega rum $ må å ångfärjan märkrulla uppta såsom en kolli ooh jemväl såsom en kolli angifvas i vanlig ordning hos tullkammare i malmö och af nämna tullkammare förpassa till destinationsort $ under vilkor att i on och umira vagn icke må förvara gods $ som skola pä ifrå $ nvnrande sätt försända till $ fin en mottnfu $ i destinationsort $ för så vidt gods icke vara euiualleradt $ m $ m $ $ äfvensom att $ för den händelse k $	destinationsorten ställda resgodset , hvarom här är fråga , förvaras i särskild vagn eller af tullkam maren i Malmö för ändamålet godkänd vagnsafdel ' ning , hvari nämnda tullkammare meddelar behörig plombering samt med angifvande af icke blott vagnens eller vagnsafdelningens märke och nummer , utan Ufven deraf , att innehållet utgöres af icke undersökt resgods meddelar förpassning i två exemplar , af hvilka det ena skall åtfölja godset och det andra med först afgående post försändas till vederbörande tuliförvaltning i bestämmelseorten m . m . ; dels äfven att fraktgods , utgörande hel vagnslast och af beskaffenhet , att hinder jemlikt § 1 mom. 3 i gällande tullstadga icke möter för dess uppläggning å transitupplag , hvilket med ångfärja anian der från Köpenhamn till Malmö för att utan örn lastning genom omedelbar transitoförsändning befordras vidare med jernväg till ort i Norge , der tullkammare finnes och förtullning får ega rum , må å ångfärjans märkrulla upptagas såsom ett kolli ooh jemväl såsom ett kolli angifvas i vanlig ordning hos tullkammaren i Malmö och af nämnda tullkammare förpassas till destinationsorten , under vilkor att i on och umira vagn icke må förvaras gods , som skall pä ifrå : nvnrande sätt försändas till m«r fin en mottnfU * i destinationsorten , för så vidt godset icke är euiualleradt , m . m . ; äfvensom att , för den händelse K . 	113	113	upplggning
liten varuparti emotta till uppläggning å $ nederlag som frimagasin $	Mindre varupartier emottagas till uppläggning å såväl nederlag som frimagasin . 	4	4	upplggning
i öfrig förekomma inemot en hundratal illustration för uppflärning $ dukning $ uppläggning $ dekorering m $ m $ äcbetet utlofwas fullständig i ungefär 12 häfte i flyta af januari eller början af februari 1896 $	I öfrigt förekommer inemot ett hundratal illustrationer för uppflärning , dukning , uppläggning , dekorering m . m . Äcbetet utlofwas fullständigt i ungefär 12 häften i flutet af januari eller början af februari 1896 . 	12	12	upplggning
jag vilja med anledning häraf be få upplysa $ ordningsvän $ om en sak $ nemligen den att träkaj $ $ som öfrig kaj i vi god stad $ vara till för uppläggning af vara $ in som utgå $	Jag vill med anledning häraf bedja få upplysa » ordningsvän » om en sak , nemligen den att träkajen , såväl som öfriga kajer i vår goda stad , är till för uppläggning af varor , in- som utgående . 	32	32	upplggning
omfatta såväl uppläggning sora nfslutning af liandelsböckor $ $ sig dertill skicklig person $	omfattande såväl uppläggning sora nfslutning af liandelsböckor , åtager sig dertill skicklig person . 	2	2	upplggning
liten varuparti emotta till uppläggning å $ nederlag som frimagasin $	Mindre varupartier emottagas till uppläggning å såväl nederlag som frimagasin . 	4	4	upplggning
vara $ i dock att vara $ sorn äro $ underl tullväsen kontroll och som inom lopp af j 30 dag efter uppläggning sjöväg åter utföra till utland $ $ sig direkt eller $	varor ; i dock att varor , sorn äro upplagda underl tullväsendets kontroll och som inom loppet af j 30 dagar efter uppläggningen sjövägen åter utföras till utlandet , vare sig direkt eller äf- 	22	22	upplggning
liten varuparti emotta till uppläggning å $ nederlag som frimagasin $	Mindre varupartier emottagas till uppläggning å såväl nederlag som frimagasin . 	4	4	upplggning
liten varuparti emotta till uppläggning å $ nederlag som frimagasin $	Mindre varupartier emottagas till uppläggning å såväl nederlag som frimagasin . 	4	4	upplggning
förse med mira en hundratal illustration för nppskärning $ dukning $ uppläggning $ dekorering m $ m $	förses med mira ett hundratal illustrationer för nppskärning , dukning , uppläggning , dekorering m . m . 	11	11	upplggning
$ meter eller så omkring $ bero på tillgång på band och hel stukan uppläggning $	1,5 meter eller så omkring , beroende på tillgång på band och hela stukans uppläggning . 	14	14	upplggning
liten varuparti emotta till uppläggning å såväl nederlag sorn frimagasin $	Mindre varupartier emottagas till uppläggning å såväl nederlag sorn frimagasin . 	4	4	upplggning
van att förestå stor hushåll samt vara kunnig i fin matlagning $ uppläggning och syltning $	van att förestå större hushåll samt vara kunnig i finare matlagning , uppläggning och syltning . 	12	12	upplggning
$ omfatta direkt och från transitoupplag tullbehandla vara jemte uppläggning pa nederlag $ men ej förtullning derifrån $	• Omfattande direkt och från transitoupplag tullbehandlade varor jemte uppläggningar pa nederlag , men ej förtullningar derifrån . 	9	9	upplggning
verksamhet skola inskränka till underhåll $ ut och afrustning samt uppläggning af den sjökrigsmateriel $ som tillhördo slockholmsstationen eller som komma att erhålla sig 6tän diga förläggningsort här $ i och för försvar af hufvudstad och den skärgård $ samt till tillverkning af mina och annan materiel så väl för den fast som för den rörlig minför svar $	verksamhet skulle inskränkas till underhåll , ut- och afrustning samt uppläggning af den sjökrigsmateriel , som tillhördo Slockholmsstationen eller som komma att erhålla sin 6tän diga förläggningsort här , i och för försvaret af hufvudstaden och dess skärgård , samt till tillverkning af minor och annan materiel så väl för det fasta som för det rörliga minför svaret . 	10	10	upplggning
önska för att få vistas på land $ arbete med handelsböckers uppläggning och afslut $ samt reda trasslig och felförda $	önskar för att få vistas på landet , arbete med handelsböckers uppläggning och afslutning , samt reda trassliga och felförda . 	11	11	upplggning
af helsovårdsnämden väcka och af stadsfullmäktige besluta förslag angående antagande af stadgar om förbud mot uppläggning af orenlighet å område vid och omkring blifvande pumpverk för stad vattenledning ha af k $	af helsovårdsnämden väckta och af stadsfullmäktige beslutade förslaget angående antagande af stadgar om förbud mot uppläggning af orenlighet å området vid och omkring blifvande pumpverket för stadens vattenledning har af K . 	15	15	upplggning
