sentence_lemma	sentence_token	index_lemma	index_token	lemma
betänkande innehålla bland annan en öfversikt af den utländsk lagstiftning i ämne och statistisk tabell öfver sverige direkt sjöfart och handelsförbindelse med andra land $ öfver uppläggning å nederlag $ $ cch båk samt lastpänningarna $ utarbeta af amanuens å kommerskollegium statistisk afdelning fil $	Betänkandet innehåller bland annat en öfversikt af den utländska lagstiftningen i ämnet och statistiska tabeller öfver Sveriges direkta sjöfarts- och handelsförbindelser med andra land , öfver uppläggning å nederlag , fyr- cch båkafgifter samt lastpänningarna , utarbetade af amanuensen å kommerskollegiets statistiska afdelning fil . 	26	26	upplggning
de revidering och afslutning samt uppläggning af ny bok $ kunna mot billig arfvode erhålla biträde af underteckna $ sorn meck tacksamhet motta arbete $	deras revidering och afslutning samt uppläggning af nya böcker , kunna mot billigt arfvode erhålla biträde af undertecknad , sorn meck tacksamhet mottager arbete . 	5	5	upplggning
$ stadsdel v list skola i höst vid uppläggning af ny kyrkobok och vid mantalsskrifning gatunamn införa i ställ för lflgenhetsnamnen $	/ stadsdelen V lister skola i höst vid uppläggning af nya kyrkoböcker och vid mantalsskrifningarna gatunamnen införas i stället för lflgenhetsnamnen . 	8	8	upplggning
att dä snö falla i sädan mängd $ att allmän rörelse ä gata och torg förswäras eller förhindra $ den öfwerflödiga snö skola undansiottas och bortföra $ en 1 $ $ m2 vara husegare tillläte att intill sig fastighet flott en del öfwerflödig snö $ derwid dock böra iaktta $ att den sälunda uppflottade snö packa och lägga till lik höjd och bredd utefter hel fastighet $ att ä trot $ otter dylik uppläggning af snö ej mi förekomma utan siola densamma jemte ga toi $ öfrigj städse hälla i den flick att snöbe $ äcknttgen bilda en jemn yta utan stor grop $ att dr $	att dä snö faller i sädan mängd , att allmänna rörelsen ä gator och torg förswäras eller förhindras , den öfwerflödiga snön skall undansiottas och bortföras ; ett 1 : * m2 vara husegare tillätet att intill sin fastighet flotta en del öfwerflödig snö , derwid dock bör iakttagas , att den sälunda uppflottade snön packas och lägges till lika höjd och bredd utefter hela fastigheten : att ä trot , otter dylik uppläggning af snö ej mi förekomma utan siola desamma jemte ga toi , öfrigj städse hällas i det flick att snöbe : äcknttgen bildar en jemn yta utan större gropar ; att dr ! 	73	73	upplggning
att med vederböra träffa aftal om uppläggning af den fyllning $ som kunna få vid upprensning af sund $ och dervid anvisa plats der denna upplag få ske $	att med vederbörande träffa aftal om uppläggning af den fyllning , som kan fås vid upprensning af sundet , och dervid anvisa plats der detta upplag får ske . 	6	6	upplggning
