sentence_lemma	target_index	cluster	lemma	sentence_token	identifier
er als Merkur ironisieren immerzu seine göttlich Vorgesetzte $ sie als Leda ironisieren $ zwar ihrerseits Liebeshungrig $ aber abgebrüht d betulich Alkmene $	19	0	abgebrht	Er als Merkur ironisiert immerzu seinen göttlichen Vorgesetzten ; sie als Leda Ironisiert — zwar ihrerseits liebeshungrig , aber abgebrüht die betuliche Alkmene .	26120215_1957_10_30_01_131.tcf.xml-30-19
d Bekanntschaft mit eine abgebrüht Ganove $ aufwendig Gaststättenbesuch und eine reizvoll Frau führen er auf eine Weg $ die zu eine böse Ende führen müssen $	4	0	abgebrht	Die Bekanntschaft mit einem abgebrühten Ganoven , aufwendige Gaststättenbesuche und eine reizvolle Frau führen ihn auf einen Weg , der zu einem bösen Ende führen muß .	26120215_1966_05_25_01_169.tcf.xml-16-4
d Blatt schreiben $ $ d Montagsvorstellung im Bundestag müssen selbst d abgebrüht Beobachter erschüttern $ $	12	0	abgebrht	Das Blatt schreibt , „ die Montagsvorstellung im Bundestag mußte selbst die abgebrühtesten Beobachter erschüttern " .	2532889X_1963-03-21_01_008.tcf.xml-8-12
d Einbrecher Icar allerdings nicht abgebrüht $ sondern $ stocktaub $	5	0	abgebrht	Der Einbrecher icar allerdings nicht abgebrüht , sondern — stocktaub .	26120215_1965_04_07_01_070.tcf.xml-3-5
diese jedoch nicht aus böse Absicht $ und so sagen ich er denn auch $ daß ich keine Feird $ keine abgebrüht Kollaborateur und keine Ultra sein $	21	0	abgebrht	Dies jedoch nicht aus böser Absicht , und so sagte ich ihm denn auch , daß ich kein Feird . kein abgebrühter Kollaborateur und kein Ultra wäre .	26120215_1972_05_07_01_184.tcf.xml-27-21
Kein Zuschauer $ sein er abgebrüht Premierentiger oder Theaterneuling $ entgehen Denr Bann eine $ Spiel $ die Geheimnis wohl darin bestehen $ daß es Natur und Kunst zu beglückend Einheit zusammenführen $	5	0	abgebrht	Kein Zuschauer , sei er abgebrühter Premierentiger oder Theaterneuling , entgeht denr Bann eines '' Spiels , dessen Geheimnis wohl darin besteht , daß es Natur und Kunst zu beglückender Einheit zusammenführt .	2532889X_1960-06-24_01_050.tcf.xml-54-5
Jules $ aber Georges $ sie sein noch nicht abgebrüht genug $ um d ganz Wahrheit vertragen zu können $	9	0	abgebrht	Jules : Aber Georges : Sie sind noch nicht abgebrüht genug , um die ganze Wahrheit vertragen zu können .	2532889X_1956-02-05_01_105.tcf.xml-67-9
doch abgebrüht $ wie er sein $ wollen er auch weiterhin d sozialistisch Arbeiterbewegung diskreditieren $	1	0	abgebrht	Doch abgebrüht , wie er ist , will er auch weiterhin die sozialistische Arbeiterbewegung diskreditieren .	2532889X_1947-04-18_01_029.tcf.xml-13-1
in d Besuchszelle $ wo diese $ Treffen stattfinden $ wollen d wachen und Wächterin von Sinc-Sing $ gewiß abgebrüht Leute $ keine Dienst verrichten $ d Szene sein zu grausam $	19	0	abgebrht	In der Besuchszelle , wo diese » Treffen stattfindet , wollen die Wachtet und Wächterinnen von Sinc-Sing , gewiß abgebrühte Leute , keinen Dienst verrichten •— die Szene ist zu grausam .	26120215_1953_06_10_01_018.tcf.xml-131-19
Liselotte Reimann machen aus d nach Leben haschend Stella $ in abgebrüht wißend Mädchen $	11	0	abgebrht	Liselotte Reimann macht aus der nach Leben haschenden Stella « In abgebrühtes wissendes Mädchen .	2532889X_1949-02-24_01_063.tcf.xml-21-11
diejenige $ die ihr Politik damit begründen oder die es in Verfassung garantieren $ sein zum groß Teil schon so abgebrüht $ daß sie es nicht mehr stören $ wenn ihr Tat ihr Wort diametral entgegensetzen sein $	20	0	abgebrht	Diejenigen , die ihre Politik damit begründen oder die es in Verfassungen garantieren , sind zum großen Teil schon so abgebrüht , daß sie es nicht mehr stört , wenn ihre Taten ihren Worten diametral entgegengesetzt sind .	2532889X_1954-06-06_01_019.tcf.xml-3-20
in d Hetze gegen unsere Staat und d sozialistisch Lager sein auch d abgebrüht Mörder satisfaktionsfähig $ nicht wahr $ Herr Bischof $	13	0	abgebrht	In der Hetze gegen unseren Staat und das sozialistische Lager ist auch der abgebrühteste Mörder satisfaktionsfähig , nicht wahr , Herr Bischof ?	2532889X_1961-06-03_01_032.tcf.xml-46-13
manch eine schmecken eine besonders $ weil er so abgebrüht sein $	9	0	abgebrht	Manch einer schmeckt einem besonders , weil er so abgebrüht ist .	26120215_1985_02_23_01_462.tcf.xml-5-9
d Protestbewegung gegen d replanten Mord an d Ehepaar Rosenberg $ die sich Million anständig Mensch anschließen haben $ haben d $ Welt d Arbeit $ $ d Sprachrohr d recht Dgb-Führer $ in ihr Ausgabe vom 18. Januar zu eine $ Bericht $ veranlassen $ die jede ehrlich westdeutsch Gewerkschafter d Schamröte ins Gesicht treiben was nicht einmal d abgebrüht amerikanisch Zeltung wagen $ da Ethel und Julius Rosenberg konsequent ihr Unschuld erklären $ d $ Welt d Arbeit $ schaffen es $ sie lügen unverfroren $ d Rosenberga $ gestehen freiwillig ihr Verrat $ $	60	0	abgebrht	Die Protestbewegung gegen den Replanten Mord an dem Ehepaar Rosenberg , der sich Millionen anständiger Menschen angeschlossen haben , hat die „ Welt der Arbeit " , das Sprachrohr der rechten DGB-Führer , in ihrer Ausgabe vom 18. Januar zu einem „ Bericht " veranlaßt , der jedem ehrlichen westdeutschen Gewerkschafter die Schamröte ins Gesicht treibt Was nicht einmal die abgebrühtesten amerikanischen Zeltungen wagten , da Ethel und Julius Rosenberg konsequent Ihre Unschuld erklären , die „ Welt der Arbeit " schafft es : Sie lügt unverfroren , die Rosenberga „ gestanden freiwillig ihren Verrat " .	26120215_1953_01_17_01_130.tcf.xml-2-60
auch eine ganz Anzahl von Arbeiter aus d demokratisch Berlin diese abgebrüht Menschenhandeler damals auf $ d Leim gehen sein $	11	0	abgebrht	auch eine ganze Anzahl von Arbeitern aus dem demokratischen Berlin diesem abgebrühten Menschenhandler damals auf " den Leim gegangen war .	2532889X_1956-11-11_01_073.tcf.xml-9-11
diese gelehrt Dame d Doktortitel führen d Tagung eine Höhepunkt $ über d selbst abgebrüht Geisterbeschwörer staun- sie berichten nämlich $ daß sie mit dorn Geist d berüchtigt Obernazi Ernst Rohm unterhalten haben $ diese Geist haben sie erzählen $ daß sich Hitler drüben nicht etwa im Paradies $ Sonin d wirklich feurig Hölle befinden $	14	0	abgebrht	Diese gelehrte Dame dem Doktortitel führte die Tagung einem Höhepunkt , über den selbst abgebrühten Geisterbeschwörer staun- Sie berichtete nämlich , daß sie mit dorn Geist des berüchtigten Obernazis Ernst Rohm unterhalten habe . dieser Geist habe ihr erzählt , daß sich Hitler drüben nicht etwa im Paradies , sonin der wirklichen feurigen Hölle befinde !	26120215_1951_10_12_01_036.tcf.xml-5-14
Bogart gelingen dann immer wieder d Kunststück $ durch d verschieden Charakter seine Persönlichkeit durchschimmern zu lassen und so d unverwechselbar Figur eine abgebrüht individualistisch Abenteurer zu formen $ mit eine Anhauch von Idealismus hinter d rauh Fassade $ eine Philosoph im Trenchcoat $	23	0	abgebrht	Bogart gelang dann immer wieder das Kunststück , durch die verschiedenen Charaktere seine Persönlichkeit durchschimmern zu lassen und so die unverwechselbare Figur eines abgebrühten individualistischen Abenteurers zu formen , mit einem Anhauch von Idealismus hinter der rauhen Fassade , ein Philosoph im Trenchcoat .	26120215_1989_12_16_01_134.tcf.xml-25-23
Pickler sein gewiß abgebrüht $ er riskieren viel $ aber so bodenlos frech $	3	0	abgebrht	Pickler war gewiß abgebrüht , er riskierte viel , aber so bodenlos frech ?	26120215_1966_11_11_01_073.tcf.xml-81-3
¥ Tnter außergewöhnlich Anteil- $ nehmen d deutsch und international Öffentlichkeit haben am Montag im wahr Sinn d Wort eine Weltprozeß gegen d Mann beginnen $ die abgebrüht und kaltherzig im Auftrag d deutsch Imperialismus vom sicher Schreibtisch aus d Grundlage für d fürchterlich Massenmord d Weltgeschichte schaffen $	27	0	abgebrht	¥ Tnter außergewöhnlicher Anteil- *-' nähme der deutschen und internationalen Öffentlichkeit hat am Montag im wahrsten Sinne des Wortes ein Weltprozeß gegen den Mann begonnen , der abgebrüht und kaltherzig im Auftrag des deutschen Imperialismus vom sicheren Schreibtisch aus die Grundlagen für den fürchterlichsten Massenmord der Weltgeschichte schuf .	26120215_1963_07_09_01_005.tcf.xml-2-27
er sein bloß in seine Gefühl vom Faschismus tödlich verwunden werden $ und deshalb zeigen er $ auch politisch scheinbar abgebrüht $ keine menschlich Bereitschaft für d ander $	20	0	abgebrht	Er Ist bloß In seinen Gefühlen vom Faschismus tödlich verwundet worden , und deshalb zeigt er , auch politisch scheinbar abgebrüht ; keine menschliche Bereitschaft für den anderen .	2532889X_1961-09-02_01_130.tcf.xml-29-20
Se Het d abgebrüht Buhlig wissen zuerst nicht $ sein er dagegen oder dafür $ und müssen zu d Schluß kommen $ daß er bei diese gewiegt Taktiker etwas Ernen können $ fortsetzunq tolgt $	3	0	abgebrht	Se het der abgebrühte Buhlig wußte zuerst nicht , war er dagegen oder dafür , und mußte zu dem Schluß kommen , daß er bei diesem gewiegten Taktiker etwas ernen konnte ( Fortsetzunq tolgt )	2532889X_1953-08-15_01_095.tcf.xml-101-3
aber d groß Teil d Arbeiter kommen aus d Binnenland $ aus Sachsen $ aus d verschieden Beruf $ ganz unerfahren in d hafen- und Fischarbeit $ es sein allerlei abgebrüht Bursche darunter $	30	0	abgebrht	Aber der größte Teil der Arbeiter kam aus dem Binnenland , aus Sachsen , aus den verschiedensten Berufen , ganz unerfahren in der Hafen- und Fischarbeit ; es waren allerlei abgebrühte Burschen darunter .	26120215_1956_04_22_02_105.tcf.xml-65-30
Hetärengespräch $ die d abgebrüht hamburger Strichmädchen vor Scham erröten lassen werden $	4	0	abgebrht	Hetärengespräche , die das abgebrühteste Hamburger Strichmädchen vor Scham erröten lassen würden .	26120215_1962_05_30_01_050.tcf.xml-22-4
$ wir sein ja auch abgebrüht $ aber d Kaffee können eine doch immer wieder hochkommen $	5	0	abgebrht	.. wir sind ja auch abgebrüht , aber der Kaffee kann einem doch immer wieder hochkommen .	26120215_1946_12_21_01_040.tcf.xml-7-5
ich haben bis zu diese Augenblick eigentlich ich selbst immer für eine ziemlich abgebrüht Mensch halten $ aber was Evertier jetzt bieten $ die sein d Gipfel $	13	0	abgebrht	Ich hatte bis zu diesem Augenblick eigentlich mich selbst immer für einen ziemlich abgebrühten Menschen gehalten , aber was Evertier jetzt bot , das war der Gipfel !	26120215_1971_02_23_01_109.tcf.xml-10-13
oft nkbt man es $ daß d Betrüger mit abgebrüht Frechheit vor d Schranke d Gericht stehen und höhnisch bi richten $ wie sie in Saus und Braus leben haben und in welche dunkel Kanal d westlich Schieberwelt sie die $ was d fleißig Arbeiter an d Wcrkbink schaffen $ bringen haben $	9	0	abgebrht	Oft nkbt man es . daß die Betrüger mit abgebrühter Frechheit vor den Schranken des Gerichts stehen und höhnisch bi richten , wie sie in Saus und Braus Gelebt haben und in welche dunklen Kanäle der westlichen Schieberwelt sie das , was der fleißige Arbeiter an der Wcrkbink schuf , gebracht haben .	26120215_1953_05_27_01_094.tcf.xml-4-9
Krckodilslränen $ diese treffend Bild haben d abgebrüht Kriegshetzer vielleicht noch $ schlucken $ $	7	0	abgebrht	Krckodilslränen — dieses treffende Bild hätten die abgebrühten Kriegshetzer vielleicht noch „ geschluckt " .	26120215_1959_09_03_01_190.tcf.xml-12-7
d abgebrüht Salvatorelli $ eine bürgerlich italienisch Journalist ND $ protestieren mit Schaum vor d Mund gegen d $ Einseitigkeit $ d in Berlin getreffen Maßnahme $	1	0	abgebrht	Der abgebrühte Salvatorelli ( ein bürgerlicher italienischer Journalist ND ) protestiert mit Schaum vor dem Mund gegen die „ Einseitigkeit " der in Berlin getroffenen Maßnahmen .	2532889X_1961-08-25_01_112.tcf.xml-31-1
es geben d unterschiedlich Angabe Iiber Startplatz und Flugroute $ besonders abgebrüht Lügner erzählen Märchen von eine ominös Funkleitstrahl $ auf die d Maschine $ möglicherweise in d Osten locken $ werden $	11	0	abgebrht	Es gibt die unterschiedlichsten Angaben iiber Startplatz und Flugroute , Besonders abgebrühte Lügner erzählen Märchen von einem ominösen Funkleitstrahl , auf dem die Maschinen „ möglicherweise In den Osten gelockt " wurden .	2532889X_1961-09-16_01_007.tcf.xml-137-11
in d menschlich Mistgrube seine $ Beziehung $ zu diese Kind zu graben $ kotzen selbst d abgebrüht Gerichtsberichter an $	17	0	abgebrht	In der menschlichen Mistgrube seiner „ Beziehungen " zu diesen Kindern zu graben , kotzt selbst den abgebrühtesten Gerichtsberichter an .	26120215_1957_05_19_02_149.tcf.xml-23-17
$ schließlich bleiben 1918 doch nur noch klein Gruppe abgebrüht Bursche vorn $ Leute $ die meist schon eine paarmal verwunden sein $	9	0	abgebrht	„ Schließlich blieben 1918 doch nur noch kleine Gruppen abgebrühter Burschen vorn , Leute , die meist schon ein paarmal verwundet waren .	2532889X_1947-10-04_01_046.tcf.xml-35-9
Erwin Biegel als d fröhlich-melancholisch Trinker $ Franz Stein als Muriel Vater $ Ilya Guenten als d um eigen Familienglück 'betrogene $ alt Jungfer $ $ Ulrich Hoffmann $ d $ smart Studiosus $ und Otto Matthies $ d abgebrüht Kellner $ schaffen besonders lebensvoll Charakterstudlen $	39	0	abgebrht	Erwin Biegel als der fröhlich-melancholische Trinker , Franz Stein als Muriels Vater , Ilya Guenten als die um eigenes Familienglück 'betrogene „ alte Jungfer " , Ulrich Hoffmann , der • smarte Studiosus , und Otto Matthies , der abgebrühte Kellner , schufen besonders lebensvolle Charakterstudlen .	2532889X_1947-07-06_01_083.tcf.xml-23-39
irgendeine dumm Freude $ in eine verfänglich Lage eine gut Rat finden zu haben $ steigen in d abgebrüht Lagerkommandant auf $ und so machen er mit d sicher Bewegung d Geste d Unteroffizier nach $	18	0	abgebrht	Irgendeine dumme Freude , in einer verfänglichen Lage einen guten Rat gefunden zu haben , stieg in dem abgebrühten Lagerkommandanten auf , und so machte er mit der sichersten Bewegung die Geste des Unteroffiziers nach .	2532889X_1955-12-25_01_118.tcf.xml-118-18
nicht alle können so abgebrüht sein wie ihr Führer $	4	0	abgebrht	Nicht alle können so abgebrüht sein wie Ihre Führer .	26120215_1952_06_05_01_017.tcf.xml-48-4
Winfried schütteln fassungslos d Kopf $ im unklar $ ob hier d Naivität eine Schlingel oder d Dreistigkeit eine abgebrüht Soldat sprechen $	19	0	abgebrht	Winfried schüttelte fassungslos den Kopf , im unklaren , ob hier die Naivität eines Schlingels oder die Dreistigkeit eines abgebrühten Soldaten sprach .	26120215_1949_10_29_01_046.tcf.xml-53-19
diese Akt sein mit Sicherheit voraussehen $ und doch haben er einiges Erstaunen auslösen $ denn für so borniert haben selbst abgebrüht westdeutsch Journalist d Bonner Regierung nicht halten $	21	0	abgebrht	Dieser Akt war mit Sicherheit vorauszusehen , und doch hat er einiges Erstaunen ausgelöst ; denn für so borniert hatten selbst abgebrühte westdeutsche Journalisten die Bonner Regierung nicht gehalten .	2532889X_1956-06-24_01_051.tcf.xml-2-21
$ entweder sein d Mann eine groß Schauspieler oder abgebrüht wie kaum eine $	9	0	abgebrht	„ Entweder ist der Mann ein großer Schauspieler oder abgebrüht wie kaum einer .	26120215_1967_06_28_01_098.tcf.xml-46-9
$ kapitalistisch Presseorgan $ die Ij As müssen sogar d Vertreter gewiß abgebrüht und kaltschnäuzig genug sein $ um menschlich Empfindung nicht über ihr Auftrag und ihr Vorurteil triumphieren zu lassen $	12	0	abgebrht	*-' kapitalistischer Presseorgane , die IJ as mußten sogar die Vertreter gewiß abgebrüht und kaltschnäuzig genug sind , um menschliche Empfindungen nicht über ihren Auftrag und ihre Vorurteile triumphieren zu lassen .	2532889X_1961-09-09_01_018.tcf.xml-5-12
vorher müssen alle Pilz mit heiß Wasser abgebrüht werden $	7	1	abgebrht	Vorher müssen alle Pilze mit heißem Wasser abgebrüht werden .	26120215_1977_10_20_01_265.tcf.xml-13-7
bevor man Pilz einfrosten können $ müssen sie mit heiß Wasser abgebrüht werden $	11	1	abgebrht	Bevor man Pilze einfrosten kann , müssen sie mit heißem Wasser abgebrüht werden .	26120215_1977_08_16_01_150.tcf.xml-28-11
Getreideprodukt und geben sie an alle Gemüse $ die vorher aber $ blanchieren $ $ die heißen abgebrüht oder abgekocht oder restlos auswässern werden $	17	1	abgebrht	Getreideprodukte und gibt sie an alle Gemüse , die vorher aber „ blanchieret " , das heißt abgebrüht oder abgekocht oder restlos ausgewässert werden .	2532889X_1957-02-17_01_113.tcf.xml-35-17
man nehmen sie zu Suppe und Sauce $ die außerdem noch vielfach mit Rahm und Ei legieren werden $ man kochen mit sie Getreideprodukt und geben sie an alle Gemüse $ die vorher aber blanchieren $ die heißen abgebrüht oder abgekocht oder restlos auswässern werden $	38	1	abgebrht	Man nahm sie zu Suppen und Saucen , die außerdem noch vielfach mit Rahm und Eiern legiert wurden , man kochte mit ihnen Getreideprodukte und gab sie an alle Gemüse , die vorher aber blanchiert , das heißt abgebrüht oder abgekocht oder restlos ausgewässert wurden .	26120215_1961_12_24_01_483.tcf.xml-31-38
allerdings dürfen d Gemüse nicht $ wie es vielfach geschehen $ vor d Zubereitung abgebrüht werden $	14	1	abgebrht	Allerdings darf das Gemüse nicht , wie es vielfach geschieht , vor der Zubereitung abgebrüht werden !	2532889X_1956-06-24_01_161.tcf.xml-4-14
d da hinterm Lenkrad $ die sein nicht mehr d liebenswürdig Dagobert $ die sein eine finster Herr mit d hart Blick eine abgebrüht Schellfisch $	23	2	abgebrht	Der da hinterm Lenkrad , das war nicht mehr der liebenswürdige Dagobert , das war ein finsterer Herr mit dem harten Blick eines abgebrühten Schellfisches .	26120215_1963_02_10_01_145.tcf.xml-31-23
doch da er stets Kredit beziehen $ verbringen er frech $ froh $ abgebrüht eine ausgeborgt Leben	13	2	abgebrht	doch da er stets Kredit bezieht . verbringt er frech , froh , abgebrüht ein ausgeborgtes Leben	26120215_1963_12_08_01_177.tcf.xml-15-13
