sentence_lemma	sentence_token	target_index	original_word
if either the united state or one of its ally be attack by nuclear weapon $ this retaliatory force will certainly be employ in retribution for the attack $	If either the United States or one of its allies is attacked by nuclear weapons , this retaliatory force will certainly be employed in retribution for the attack .	27	attack
air attack $ destroy the radar there $ though so far the russian have not launch a ground attack as expect $	air attacks , destroying the radar there , though so far the Russians had not launched a ground attack as expected .	18	attack
birdie tebbetts may have bolster the cleveland attack by use ray barker $ who go to camp on the portland roster $ at first base $	Birdie Tebbetts may have bolstered the Cleveland attack by using Ray Barker , who went to camp on the Portland roster , at first base .	7	attack
the attack that really lend urgency to lon nol's request for outside military aid $ see the nation $ be a show of communist power and cambodian impotence at saang $ a handsome french provincial town only 15 mile south of phnom-penh on the west bank of the bassac river $	The attack that really lent urgency to Lon Nol's requests for outside military aid ( see THE NATION ) was a show of Communist power and Cambodian impotence at Saang , a handsome French provincial town only 15 miles south of Phnom-Penh on the west bank of the Bassac River .	1	attack
albert respond to the attack by beat up the white man $ a crime so severe for a black youth that he flee union spring $ terrify that he would be lynch $	Albert responded to the attack by beating up the white man , a crime so severe for a black youth that he fled Union Springs , terrified that he would be lynched .	4	attack
the duty officer have program it to pass on word of the report attack and have add the information that shubra plan to respond to the call for help $	The duty officer had programmed it to pass on word of the reported attack and had added the information that Shubra planned to respond to the call for help .	13	attack
man $ the literary romantic as much as the philosopher $ have be interested in overcome the modern long before the attack on pearl harbor $	men , the literary romantics as much as the philosophers , had been interested in overcoming the modern long before the attack on Pearl Harbor .	21	attack
develop an adequate passive defense in the form of shelter $ civil-defense organization $ and mean of rehabilitate the nation after attack $	Develop an adequate passive defense in the form of shelters , civil-defense organizations , and means of rehabilitating the nation after attack .	21	attack
faisal under attack with the exception of heavy algerian and sudanese involvement $ the degree of other arab militancy drop rapidly in direct proportion to distance from israel $	Faisal under attack With the exception of heavy Algerian and Sudanese involvement , the degree of other Arab militancy drops rapidly in direct proportion to distance from Israel .	2	attack
watson describe his own shortcoming of laziness and lack of direction $ his narrow escape from physical attack by a female crystallographer when he challenge her theory $ the abrasive personality of talented co-worker crick $ an incredible high school-level error by brilliant chemist linus pauling that temporarily throw him off course $ enable watson and crick to win the dna race $	Watson describes his own shortcomings of laziness and lack of direction ; his narrow escape from physical attack by a female crystallographer when he challenged her theories ; the abrasive personality of talented Co-worker Crick ; an incredible high school-level error by brilliant Chemist Linus Pauling that temporarily threw him off course , enabling Watson and Crick to win the DNA race ;	17	attack
without such temperature sebsitivity $ the vaccine virus could well cause an infection at least as virulent as a natural attack $	Without such temperature sebsitivity , the vaccine viruses could well cause an infection at least as virulent as a natural attack .	20	attack
the day be save and the indian rout only by the skill of colonel bouquet $ who feign a retreat $ lure the indian to the attack and $ with a cunning that rival that of his enemy $ launch a countercharge by man hide on the indian ' flank $	The day is saved and the Indians routed only by the skill of Colonel Bouquet , who feigns a retreat , lures the Indians to the attack and , with a cunning that rivals that of his enemy , launches a countercharge by men hidden on the Indians ' flank .	26	attack
begin be basic argument be that israel must protect itself against attack $ and it be reinforce last week when palestinian terrorist strike a kibbutz along the israeli-lebanese border $	Begin's basic argument is that Israel must protect itself against attack , and it was reinforced last week when Palestinian terrorists struck a kibbutz along the Israeli-Lebanese border .	10	attack
after a heart attack four year ago $ carrozzi testify at his trial last week $ he visit his native village $ camarda in the abruzzi mountain and bring back a packet of canapa seed $	After a heart attack four years ago , Carrozzi testified at his trial last week , he visited his native village , Camarda in the Abruzzi Mountains and brought back a packet of canapa seeds .	3	attack
## for the next decade $ whenever there be a terrorist attack anywhere in the world $ there will be those blame it on america $ if only america have not be distract from the war on terrorism by the war in iraq $ if only america have not stir muslim resentment and increased al-qaeda recruitment by invade iraq $	@@379087 For the next decade , whenever there is a terrorist attack anywhere in the world , there will be those blaming it on America : if only America had not been distracted from the war on terrorism by the war in Iraq , if only America had not stirred Muslim resentment and increased al-Qaeda recruitment by invading Iraq .	11	attack
refer to the recent mayoral campaign in new york city $ the republican leader accuse the democrat of $ dema- ' gogic $ attack and $ make a political football $ out of rent control $	Referring to the recent mayoral campaign in New York City , the Republican leader accused the Democrats of " dema- ' gogic " attacks and " making a political football " out of rent control .	23	attack
// a west german intelligence official say there be strong indication that the arab be prepare an attack on behalf of libya $ but	// A West German intelligence official said there were strong indications that the Arabs were preparing an attack on behalf of Libya , but	17	attack
after israeli police and palestinian demonstrator clash on jerusalem's temple mount a year ago and 21 arab be shoot dead $ a number of palestinian retaliate with knife attack on jew inside israel proper $	After Israeli police and Palestinian demonstrators clashed on Jerusalem's Temple Mount a year ago and 21 Arabs were shot dead , a number of Palestinians retaliated with knife attacks on Jews inside Israel proper .	28	attack
indeed $ they be widely see to be an excuse for ongoing american and british bomb of iraq $ the target have no relation to prevent iraqi attack against vulnerable minority $	Indeed , they are widely seen to be an excuse for ongoing American and British bombing of Iraq ; the targets have no relation to preventing Iraqi attacks against vulnerable minorities .	27	attack
engel be already align the attack periscope as gericke swing his glass to focus on the two frigate $	Engel was already aligning the attack periscope as Gericke swung his glasses to focus on the two frigates .	5	attack
among the attack involve chili's family that will be probe at this week's hearing be that against lerothodi ikaneng $ a defector from the football club who go to the chili family for help and be a friend of chili's son sibusiso $	Among the attacks involving Chili's family that will be probed at this week's hearings is that against Lerothodi Ikaneng , a defector from the football club who went to the Chili family for help and was a friend of Chili's son Sibusiso .	2	attack
tightness and breathlessness $ attack of shortness of breath after strenuous activity $ and be wake by an attack of shortness of breath $ table 2 $ $	tightness and breathlessness , attacks of shortness of breath after strenuous activity , and being woken by an attack of shortness of breath ( table 2 ) .	18	attack
