sentence_lemma	target_index	cluster	lemma	sentence_token	identifier
then the chairman $ who be very much like by everyone $ say in his pleasant way $ $ could n't we invite mrs.- roosevelt $	2	0	chairman	Then the chairman , who was very much liked by everyone , said in his pleasant way , " Could n't we invite Mrs. Roosevelt ?	fic_1971_10542.txt-4137-2
the convention 's keynote speaker $ dr.-i john kenneth galbraith $ national chairman of american for democratic action and former ambassador to india $ favor a step-by-step de-escalation $ there be logic $ $ he say $ $ on the side of those who say we should simply withdraw $	12	0	chairman	The convention 's keynote speaker , Dr. John Kenneth Galbraith , national chairman of Americans for Democratic Action and former Ambassador to India , favored a step-by-step de-escalation " There is logic , " he said , " on the side of those who say we should simply withdraw .	mag_1967_488137.txt-89-12
they know that senator spocker $ chairman of the congressional science committee $ have be involved in every meeting $ but senator spocker be unavailable $	6	0	chairman	They knew that Senator Spocker , chairman of the Congressional Science Committee , had been involved in every meeting , but Senator Spocker was unavailable .	fic_1960_4460.txt-49-6
as for the drum $ mr.- richard luce $ the benign $ white-haired chairman of the optical division of the amateur astronomer association $ explain them to us at once $ $	13	0	chairman	As for the drums , Mr. Richard Luce , the benign , white-haired chairman of the Optical Division of the Amateur Astronomers Association , explained them to us at once . "	mag_1961_490589.txt-57-13
a still early analogue can be find in a device invent by the chinese communist $ now $ of course $ sweep away by the cult of chairman mao $ $	27	0	chairman	A still earlier analogue can be found in a device invented by the Chinese Communists ( now , of course , swept away by the cult of Chairman Mao ) ?	mag_1970_488059.txt-94-27
after the election $ many member call for the resignation of chairman ichio asukata $ 68 $ who have lead the group since 1977 $	11	0	chairman	After the election , many members called for the resignation of Chairman Ichio Asukata , 68 , who had led the group since 1977 .	mag_1983_321305.txt-19-11
compare governor winthrop to chairman mao have a two-way efficacy $ it make the easy point that think control be a game anybody can play $ and it credit	4	0	chairman	Comparing Governor Winthrop to Chairman Mao has a two-way efficacy : it makes the easy point that thought control is a game anybody can play , and it credits	mag_1972_494816.txt-40-4
rubin rabinowitz $ chairman of the company ' s atlantic industry unit $ which make chemical use in dye textile $ file a form show that his wife buy 5 $ 000 share <nul> 16 $	3	0	chairman	Rubin Rabinowitz , chairman of the company ' s Atlantic Industries unit , which makes chemicals used in dyeing textiles , filed a form showing that his wife bought 5 , 000 shares Nov. 16 .	news_1989_670293.txt-49-3
## $ we be not go to be able to eat more hot dog than rockefeller $ $ say a new york democratic county chairman last week $ $	24	0	chairman	@@243711 " We 're not going to be able to eat more hot dogs than Rockefeller , " said a New York Democratic county chairman last week . "	mag_1962_243711.txt-0-24
a pro -- fessional investor and money manager name alan slifka $ who be the chairman of the board of the big apple circus $ say $ $ anna mae be either the first- or second-smartest ele -- phant in the country -- i be not sure which $ $	15	0	chairman	A pro -- fessional investor and money manager named Alan Slifka , who is the chairman of the board of the Big Apple Circus , said , " Anna Mae is either the first- or second-smartest ele -- phant in the country -- I 'm not sure which . "	mag_1982_490865.txt-257-15
possible war have cause air jamaica to put off indefinitely plan for a second daily flight from los angeles to jamaica $ say gordon $ butch $ stewart $ chairman $	29	0	chairman	Possible war has caused Air Jamaica to put off indefinitely plans for a second daily flight from Los Angeles to Jamaica , says Gordon " Butch " Stewart , chairman .	news_2003_603992.txt-33-29
in a press conference yesterday $ tbs chairman ted turner say $ $ cartoon $ like movie $ cross cultural line very well and translate easily into other language $	7	0	chairman	In a press conference yesterday , TBS chairman Ted Turner said : " Cartoons , like movies , cross cultural lines very well and translate easily into other languages .	news_1992_605826.txt-45-7
lauder greenway $ chairman $ and george s.-a moore $ president of the metropolitan opera association $ announce the postponement of the opening follow a meeting of the executive committee of the association 's board $	3	0	chairman	Lauder Greenway , chairman , and George S. Moore , president of the Metropolitan Opera Association , announced the postponement of the opening following a meeting of the executive committee of the association 's board .	news_1969_728042.txt-22-3
house way and mean chairman al ullman and the carter administration claim to be adamant that there should be some taxation of investment profit that	4	0	chairman	House Ways and Means Chairman Al Ullman and the Carter administration claim to be adamant that there should be some taxation of investment profits that	mag_1978_493859.txt-58-4
vice chairman $ gerald <nul> levin editorial director $ richard <nul> stolley corporate editor $ gilbert rogin time inc $	1	0	chairman	Vice Chairman : Gerald M. Levin Editorial Director : Richard B. Stolley Corporate Editor : Gilbert Rogin TIME INC .	mag_1989_328173.txt-1-1
mark canton $ who be hire as president of columbia picture in october 1991 $ be promote to chairman of columbia tri-star motion picture company in january 1994 $	18	0	chairman	Mark Canton , who was hired as president of Columbia Pictures in October 1991 , was promoted to chairman of Columbia Tri-Star Motion Picture Companies in January 1994 .	news_1997_652844.txt-87-18
// by refuse to meet arafat halfway $ the us have also weaken his position vis-a-vis plo extremist $ who will remind the plo chairman that his moderation do not pay off $ other arab source say $	24	0	chairman	// By refusing to meet Arafat halfway , the US has also weakened his position vis-a-vis PLO extremists , who will remind the PLO chairman that his moderation did not pay off , other Arab sources say .	news_1988_669692.txt-19-24
when rockefeller take over as chairman from george champion in 1969 $ he inherit one big mistake-the chase 's	5	0	chairman	When Rockefeller took over as chairman from George Champion in 1969 , he inherited one big mistake-the Chase 's	mag_1976_287161.txt-19-5
davidson $ the new chairman $ be an alumnus of stanford university $ former managing director of time international and publisher of time magazine for six year $ during which it prosper handsomely $ $	4	0	chairman	Davidson , the new chairman , is an alumnus of Stanford University , former managing director of TIME International and publisher of TIME magazine for six years , during which it prospered handsomely . "	mag_1980_323107.txt-23-4
hall $ consider by many to be the more controversial and vituperative of the two $ be a former city councilman and transit authority chairman $ with more than 18 year in elect or appoint public office $	24	0	chairman	Hall , considered by many to be the more controversial and vituperative of the two , is a former city councilman and transit authority chairman , with more than 18 years in elected or appointed public office .	news_1998_626809.txt-10-24
gerard evans $ the county 's democratic chairman $ say mill have not respond to attempt by party leader to reach out to her since her loss in the democratic primary for county executive $	7	0	chairman	Gerard Evans , the county 's Democratic chairman , said Mills has not responded to attempts by party leaders to reach out to her since her loss in the Democratic primary for county executive .	news_1994_606753.txt-47-7
chairman of revlon $ the head of the cosmetic and health-care giant be fight to fend off pantry pride $ the corporate vehicle mr.- perelman be use in his <nul>	0	0	chairman	chairman of Revlon , The head of the cosmetic and health-care giant is fighting to fend off Pantry Pride , the corporate vehicle Mr. Perelman is using in his $1.	news_1985_671507.txt-4-0
so do humphreyman joseph rauh $ vice chairman of american for democratic <nul>	7	0	chairman	So did Humphreyman Joseph Rauh , vice chairman of Americans for Democratic Action.	mag_1960_204760.txt-19-7
the man who tell taylor about fcc chairman wiley 's invitation be richard jencks $ the cbs vice-president who serve as the company 's top washington lobbyist $	7	0	chairman	The man who told Taylor about FCC Chairman Wiley 's invitation was Richard Jencks , the CBS vice-president who served as the company 's top Washington lobbyist .	nf_1975_774042.txt-3621-7
david kearns $ chairman and ceo of xerox corporation $ say $ $ american public school be $ by and large $ a monopoly provider $	3	0	chairman	David Kearns , chairman and CEO of Xerox Corporation , says , " American public schools are , by and large , a monopoly provider .	mag_1991_421435.txt-34-3
house-state department stance $ <nul> j.-a <nul> fulbright $ d $ of arkansas $ influential chairman of the senate foreign relation committee $ say $ $ we would not concede anything $ $	15	0	chairman	House-State Department stance , Sen. J. W. Fulbright ( D ) of Arkansas , influential chairman of the Senate Foreign Relations Committee , says , " We would not concede anything . "	news_1963_722929.txt-9-15
victor <nul> smith $ republican state chairman $ say there will be a $ smashing victory $ with <nul> everett <nul> dirksen sweep the state by upwards of 400,000 vote $	6	0	chairman	Victor L. Smith , Republican state chairman , said there will be a " smashing victory " with Sen. Everett M. Dirksen sweeping the state by upwards of 400,000 votes .	news_1962_722756.txt-15-6
ronald j.-a gidwitz $ chairman $ illinois state board of education $ springfield safety before saving as illinois physician who practice anesthesiology $ we commend jim ritter and the chicago sun-times for their thorough reporting $ <nul> 25 $ about the tremendous advance make in the safety of anesthesiology $	4	0	chairman	Ronald J. Gidwitz , chairman , Illinois State Board of Education , Springfield Safety before savings As Illinois physicians who practice anesthesiology , we commend Jim Ritter and the Chicago Sun-Times for their thorough reporting ( Jan. 25 ) about the tremendous advances made in the safety of anesthesiology .	news_2000_633263.txt-34-4
every week the chairman of our committee write a paper say that we have a meeting $ that we have 100 percent attendance $ that we act on this $ discuss that $	3	0	chairman	Every week the chairman of our committee writes a paper saying that we had a meeting , that we had 100 percent attendance , that we acted on this , discussed that .	news_1979_734211.txt-94-3
the chairman be able to recruit taylor $ who have no previous police record or employment problem $ by offer him a cut of $28 million $	1	0	chairman	The Chairman was able to recruit Taylor , who had no previous police record or employment problems , by offering him a cut of $28 million .	mag_1988_338240.txt-22-1
// in her position as chairman of the subcommittee on child $ family $ drug $ and alcoholism $ she have urge mandatory $ 20-year sentence for large-scale drug importer $ along with expand power for the us custom service to make <nul>	5	0	chairman	// In her position as chairman of the subcommittee on children , family , drugs , and alcoholism , she has urged mandatory , 20-year sentences for large-scale drug importers , along with expanded powers for the US Customs service to make arrests.	news_1986_669549.txt-23-5
on the house judiciary committee $ republican be expect to be $ more persistent $ in promote anticrime legislation $ according to rep. william <nul> mcculloch of ohio $ the committee 's $ shadow chairman $ $	34	0	chairman	On the House Judiciary Committee , Republicans are expected to be " more persistent " in promoting anticrime legislation , according to Rep. William M. McCulloch of Ohio , the committee 's " shadow chairman . "	news_1967_726722.txt-23-34
he be a former chairman and president of fifth avenue coach and life in greenwich $ conn $	4	0	chairman	He is a former chairman and president of Fifth Avenue Coach and lives in Greenwich , Conn .	news_1968_727273.txt-11-4
on capitol hill $ meanwhile $ legislation to block decontrol of oil price be introduce by the chairman of the senate energy committee $ senator henry <nul> jackson $ democrat of washington $ who contend that the cost to the economy ' would be too great to justify the move $	17	0	chairman	On Capitol Hill , meanwhile , legislation to block decontrol of oil prices was introduced by the chairman of the Senate Energy Committee , Senator Henry M. Jackson , Democrat of Washington , who contended that the cost to the economy ' would be too great to justify the move .	news_1979_734153.txt-6-17
the company have have no leader since the february suicide of chairman eli <nul> black $ who have create united brand in 1970 by merge his own amk corp $	11	0	chairman	The company has had no leader since the February suicide of Chairman Eli M. Black , who had created United Brands in 1970 by merging his own AMK Corp .	mag_1975_290155.txt-13-11
on 22 january 1946 $ and again on 6 february $ barnes meet the railway chairman but a profitable dialogue do not follow $	15	0	chairman	On 22 January 1946 , and again on 6 February , Barnes met the railway chairmen but a profitable dialogue did not follow .	nf_1987_773764.txt-30-15
