sentence_lemma	sentence_token	index_lemma	index_token	lemma
she open her eye against the sun $ and she laugh $ a small $ rather surprisingly cynical laugh $ then after a moment's contemplation $ she raise the hand nearest to me from where it dangle to tin ground and place it between the leg of my trouser $ directly on my penis $	She opened her eyes against the sun , and she laughed , a small , rather surprisingly cynical laugh ; then after a moment's contemplation , she raised the hand nearest to me from where it dangled to tin ground and placed it between the legs of my trousers , directly on my penis .	24	24	contemplation
out of that isolation in motion come every inspiration $ from contemplation $ langston hughes ' $ the negro speak of river $ $ to adventure $ hemingway's story $ to despair $	Out of that isolation in motion comes every inspiration , from contemplation ( Langston Hughes ' " The Negro Speaks of Rivers " ) to adventure ( Hemingway's stories ) to despair .	11	11	contemplation
she could find that place if she need to $ but for now she just lighten her grip on the steering wheel $ then stare in contemplation at the recessed chrysler	She could find that place if she needed to , but for now she just lightened her grip on the steering wheel , then stared in contemplation at the recessed Chrysler	26	26	contemplation
nishioka $ many adult leader of young people be so desperate for contemplation that they immediately assume the young people must love it as well $	NISHIOKA : Many adult leaders of young people are so desperate for contemplation that they immediately assume the young people must love it as well .	12	12	contemplation
the prelude be a retrospective account of the stage by which wordsworth's mind mature $ pass from the revolutionary ardour of // youth $ through disillusionment $ to withdrawal into a life of contemplation $	The Prelude is a retrospective account of the stages by which Wordsworth's mind matured , passing from the revolutionary ardour of // youth , through disillusionment , to withdrawal into a life of contemplation .	33	33	contemplation
present stage of change $ exercise $ contemplation $ stage 2 $ $ diet $ maintenance $ stage 5 $ challenge $ $ since i be little i have have uncontrollable craving for cake and pastry $	Present Stage of Change : exercise , Contemplation ( Stage 2 ) ; diet , Maintenance ( Stage 5 ) Challenge : " Since I was little I've had uncontrollable cravings for cakes and pastries .	7	7	contemplation
additional gallows humor might be draw from contemplation of the average american $ with a $10,000 medical bill $ a not unusual circumstance these day $ $ be ask to pay with the glib	Additional gallows humor might be drawn from contemplation of the average American , with a $10,000 medical bill ( a not unusual circumstance these days ) , being asked to pay with the glib	7	7	contemplation
question to him focus on topic range from the proper education suit for a gentleman to the appropriate education for young woman $ although the latter group be not $ a subject of systematic contemplation $ for jefferson $ lipscomb and bergh 1903 $ 5 $ 185-88 $ 15 $ 165-67 $ $	Questions to him focused on topics ranging from the proper education suited for a gentleman to the appropriate education for young women , although the latter group was not " a subject of systematic contemplation " for Jefferson ( Lipscomb and Bergh 1903 , 5 : 185-88 , 15 : 165-67 ) .	34	34	contemplation
for his refusal to soften her suffer $ for his silent contemplation of the reality of her father's condition $ the girl be grateful $ she be both weaken and strengthen $	For his refusal to soften her suffering , for his silent contemplation of the reality of her father's condition , the girl is grateful ; she is both weakened and strengthened .	11	11	contemplation
it be inconceivable that he should have share hamilton's satisfaction at the contemplation of woman and child $	It is inconceivable that he should have shared Hamilton's satisfaction at the contemplation of women and children ?	12	12	contemplation
they be frown $ but it seem to him that the frown be expression of contemplation $ not hostility $	They were frowning , but it seemed to him that the frowns were expressions of contemplation , not hostility .	15	15	contemplation
the breast look ridiculous $ and after a moment of contemplation she decide to try to sculpt them into a more realistic shape $	The breasts looked ridiculous , and after a moment of contemplation she decided to try to sculpt them into a more realistic shape .	10	10	contemplation
slowly $ in her contemplation of fabian and of his pleasure in be with her $ manuela succumb to a realization that if he be not threaten by the form and shape of her pleasure $ it need not pose a barrier to her $	Slowly , in her contemplation of Fabian and of his pleasure in being with her , Manuela succumbed to a realization that if he was not threatened by the form and shape of her pleasure , it need not pose a barrier to her .	4	4	contemplation
in the hour of contemplation $ we rest in that assurance and can commit our care to god's steadfast	In the hour of contemplation , we rest in that assurance and can commit our cares to God's steadfast	4	4	contemplation
that vein begin in the 1920s as a confrontation between the asian art of contemplation and the western art that celebrate man $	That vein began in the 1920s as a confrontation between the Asian arts of contemplation and the Western arts that celebrate man .	14	14	contemplation
the bright side of the humiliating gaffe be the hour of pure $ unadulterated self -- contemplation it afford one $	The bright side of the humiliating gaffe is the hours of pure , unadulterated self -- contemplation it affords one .	16	16	contemplation
he have devote his adult life to the contemplation of god $	He had devoted his adult life to the contemplation of God .	8	8	contemplation
naturally he hope that his lord be satisfy with his work over the year $ but he have never dream of be give his own castle to command $ especially one so important as lydford $ and every now and again a quick smile crack the serious expression on his face as his glee momentarily flare $ quench his nervous contemplation $	Naturally he hoped that his lords were satisfied with his work over the years , but he had never dreamed of being given his own castle to command , especially one so important as Lydford , and every now and again a quick smile cracked the serious expression on his face as his glee momentarily flared , quenching his nervous contemplation .	60	60	contemplation
ch'eng-yin mean $ seal of purity $ and may mean $ seal of ch'eng-kuan or pure contemplation	Ch'eng-yin means " seal of purity " and may mean " seal of Ch'eng-kuan or Pure Contemplation	16	16	contemplation
minnesota $ but my $ how different those two minnesotas be $ $ it provide an easy tool for contextualize the small story $ red american love a certain stage show in vegas $ but blue american don't $ or for spin the big story $ john walker lindh $ the american who fight for the taliban $ be from california and therefore a reflection of blue-state value $ $ and it justify countless usa today $ style contemplation of who we american really be $ mean mainly investigation of the burning usual-what we american like to listen to $ watch on tv $ or buy at the supermarket $	Minnesota , but my , how different those two Minnesotas are ) ; it provided an easy tool for contextualizing the small stories ( red Americans love a certain stage show in Vegas , but blue Americans don't ) or for spinning the big stories ( John Walker Lindh , the American who fought for the Taliban , was from California and therefore a reflection of blue-state values ) ; and it justified countless USA Today - style contemplations of who we Americans really are , meaning mainly investigations of the burning usual-what we Americans like to listen to , watch on TV , or buy at the supermarket .	78	78	contemplation
gold be good at daydream and give himself up to the contemplation of what it would be like to work with ralph for the president $ marry andrea $ share her apartment in washington $ fuck her rich and even more attractive friend $ serve on a presidential commission on education $ and be an overpay professor of urban study $	Gold was good at daydreaming and gave himself up to the contemplation of what it would be like to work with Ralph for the President , marry Andrea , share her apartment in Washington , fuck her richer and even more attractive friends , serve on a Presidential Commission on education , and be an overpaid professor of Urban Studies .	11	11	contemplation
but when bob leffingwell $ after another dip in the pool and a few more minute of somber contemplation of the great white city sprawl along the potomac $ go finally to answer the insistent telephone $ it be not the jason he expect who be on the line $ $	But when Bob Leffingwell , after another dip in the pool and a few more minutes of somber contemplation of the great white city sprawled along the Potomac , went finally to answer the insistent telephone , it was not the Jason he expected who was on the line . "	18	18	contemplation
in the first half of the ' ' 80s $ whether you be count on the valiity of expressive representation or a disabuse contemplation of the simulacrum $ early ' ' 80s histrionics or mid- ' ' 80s cool $ the advancement of modernist self-reflection or an opening to topical content such as the incipient aids crisis $ you could find something in bleckner's work to support your position $	In the first half of the ' ' 80s , whether you were counting on the valiity of expressive representation or a disabused contemplation of the simulacrum , early ' ' 80s histrionics or mid- ' ' 80s cool , the advancement of modernist self-reflection or an opening to topical content such as the incipient AIDS crisis , you could find something in Bleckner's work to support your position .	23	23	contemplation
one night he awake $ and go into a state of deep contemplation $	One night he awoke , and went into a state of deep contemplation .	12	12	contemplation
unfortunately $ the schedule don't leave much time for contemplation $ $	Unfortunately , the schedule didn't leave much time for contemplation . "	9	9	contemplation
a man with a woman ought to be single in purpose $ intent on the one act $ not weaken and hurry by contemplation beyond the limit of <nul>	A man with a woman ought to be single in purpose , intent on the one act , not weakened and hurried by contemplations beyond the limits of bcd.	23	23	contemplation
adrian have call it his $ retreat $ $ and have spend most of his leisure here among $ my beloved book $ my dear companion $ $ yet it do not possess that peculiar atmosphere of contemplation and profound communion and repose that distinguish the true library $ the true study $ of an intellectual man $	Adrian had called it his " retreat , " and had spent most of his leisure here among " my beloved books , my dearest companions , " yet it did not possess that peculiar atmosphere of contemplation and profound communion and repose that distinguishes the true library , the true study , of an intellectual man .	37	37	contemplation
$ china will instill a new dimension in a body that be al slip more and more away from reality and into the contemplation of its own image $	, China will instill a new dimension in a body that was al slipping more and more away from reality and into the contemplation of its own image .	23	23	contemplation
in the ignatian exercise have give him the facility of project himself out of the term of time and space into a solitude of contemplation $	in the Ignatian exercises had given him the facility of projecting himself out of the terms of time and space into a solitude of contemplation .	24	24	contemplation
