sentence_lemma	sentence_token	target_index	original_word
in the meantime $ most of the troop and 25% of the supply fly to saudi arabia be travel on wide- body plane lease from commercial airline $	In the meantime , most of the troops and 25% of the supplies flying to Saudi Arabia are traveling on wide- body planes leased from commercial airlines .	22	plane
all be kill $ their body crush against one another in the front of the plane $	All were killed , their bodies crushed against one another in the front of the plane .	15	plane
really want to take off in your plane $ if you know what i mean $ $	really want to take off in your plane , if you know what I mean . "	7	plane
$ when the stewardess fold down the tray table in front of us to serve dinner on the plane back to new york $ henny tuck his napkin under his chin $ look back at the day so far $ and sing $ to the tune of $ three blind mouse $ $ $ three free meal $	" When the stewardess folded down the tray tables in front of us to serve dinner on the plane back to New York , Henny tucked his napkin under his chin , looked back at the day so far , and sang , to the tune of " Three Blind Mice , " " Three free meals !	18	plane
with the plane $ researcher be able to range far and wide in search of storm $	With the plane , researchers are able to range far and wide in search of storms .	2	plane
she be a woman i meet on a plane from kansas city to minneapolis $ and whom in the space of an afternoon $ a dinner $ and	She was a woman I met on a plane from Kansas City to Minneapolis , and whom in the space of an afternoon , a dinner , and	8	plane
the himalayan flight be touchy because no large plane like the queen's boac britannia have ever skim mt $	The Himalayan flight was touchy because no large plane like the Queen's BOAC Britannia had ever skimmed Mt .	8	plane
she have insist on iron his linen suit herself $ place one of her monogrammed handkerchief between the searing hot iron and the material $ because she don't want him look rumple on the plane $ and she say the maid always end up leave scorch marks on his father's clothes $	She'd insisted on ironing his linen suit herself , placing one of her monogrammed handkerchiefs between the searing hot iron and the material , because she didn't want him looking rumpled on the plane , and she said the maid always ended up leaving scorch marks on his father's clothes .	33	plane
at once the plane become even more difficult to handle $ and close realize why he have leave it so late $ $	At once the plane became even more difficult to handle , and Close realised why he had left it so late . "	3	plane
