sentence_lemma	sentence_token	index_lemma	index_token	lemma
acquirement thus make will feed itself $ circle will be add to circle by the strengthen impulse of gratify curiosity $ the conformity to nature will make the acquisition more substantial and the	Acquirement thus made will feed itself : circle will be added to circle by the strengthening impulse of gratified curiosity : the conformity to nature will make the acquisition more substantial and the	7	7	circle
as the river $ far flow $ in the high hill have birth $ as the banyan $ broad growing $ oftenest bow its head to earth $ $ so the noble mind press onward $ channel far of good to trace $ so the large heart bend downward $ circle all the human race $ thus $ by iron's aid $ pursue through the earth their plan of love $ man our father's will be do $ here $ as angel do above $	As the rivers , farthest flowing , In the highest hills have birth ; As the banyan , broadest growing , Oftenest bows its head to earth , -- So the noblest minds press onward , Channels far of good to trace ; So the largest hearts bend downward , Circling all the human race ; Thus , by Iron's aid , pursuing Through the earth their plans of love , Men our Father's will are doing , Here , as angels do above !	50	50	circle
they shall not say that when the fire circle the hunted herd $ his sire weep like the roebuck when he fly $ end note $ 1kb and die as warrior never die $	They shall not say that when the fire Circled the hunted herd , his sire Wept like the roebuck when he flies , End note : 1Kb And died as warrior never dies .	8	8	circle
circle mountain $ purple beaming $ lure his soul to constant dream $ $ ever dream $ ever scheme $ $ on and upward be his gaze $	Circling mountains , purple beaming , Lured his soul to constant dreaming , -- Ever dreaming , ever scheming , -- On and upward was his gaze .	0	0	circle
a woman in distress affect most mind more strongly than a suffering angel $ and this scene of purely human character serve as a pretty touchstone $ to try the sympathy of the many who circle the gallery $	A woman in distress affects most minds more strongly than a suffering angel ; and this scene of purely human character served as a pretty touchstone , to try the sympathies of the many who circled the gallery .	35	35	circle
the language $ $ as he say of richter $ $ groan with indescribable metaphor and allusion to all thing $ human and divine $ flow onward $ not like a river $ but like an inundation $ circle in complex eddy $ chafe and gurgling $ now this way $ now that $ $ but in carlyle $ $ the proper current $ never $ sink out of sight amid the boundless uproar $ $	The language , " as he says of Richter , " groans with indescribable metaphors and allusions to all things , human and divine , flowing onward , not like a river , but like an inundation ; circling in complex eddies , chafing and gurgling , now this way , now that ; " but in Carlyle , " the proper current " never " sinks out of sight amid the boundless uproar . "	38	38	circle
whose door we now for social worship first unfold $ to thee the suppliant throng shall bow $ while circle year on year be roll $	whose doors we now For social worship first unfold , To thee the suppliant throng shall bow , While circling years on years are rolled .	19	19	circle
to notice how the world have be circle $ by the government of the world $ to watch the transit of venus $ though the knowledge thus acquire could not affect the legislation of any congress $ in any country $	to notice how the world has been circled , by the governments of the world , to watch the transit of Venus , though the knowledge thus acquired could not affect the legislation of any congress , in any country .	7	7	circle
they be not aware that the spirit of a nightingale be circle round them and would pass into the soul of their infant son $ whom they name felix mendelssohn $	They were not aware that the spirit of a nightingale was circling round them and would pass into the soul of their infant son , whom they named Felix Mendelssohn .	11	11	circle
warrior portray $ in tale of other clime $ numidia $ arcady or syrian realm $ the splendor of the spoil $ the gem and gold $ the perfume $ luxury and regal robe $ fair slave and diamond $ waft from the shore of the orient $ in homage to the diadem that circle nation $	Warriors portrayed , in tales of other climes , Numidia , Arcady or Syrian realms , The splendor of the spoil , the gems and gold , The perfumes , luxuries and regal robes , Fair slaves and diamonds , wafted from the shores Of the Orient , in homage to the diadem That circled nations .	54	54	circle
$ then we have circle not the round reef wholly $ $ say babbalanja $ $ but make of it a segment $	" Then we have circled not the round reef wholly , " said Babbalanja , " but made of it a segment .	4	4	circle
you may see them stand in the street $ circle round wayaniko $ the light above their head $ the dark town all around $ $	You may see them stand in the street , circling round Wayaniko , the lights above their head , the dark town all around . "	9	9	circle
the strong trade wind $ meet in its course by these elevation $ circle and eddy about their summit $ and be sometimes drive down the steep ravine and sweep across the	The strong trade wind , met in its course by these elevations , circled and eddied about their summits , and was sometimes driven down the steep ravine and swept across the	13	13	circle
sometimes one would circle round and round me in the wood a few foot distant as if tether by a string $ when probably i be near its egg $	Sometimes one would circle round and round me in the woods a few feet distant as if tethered by a string , when probably I was near its eggs .	3	3	circle
on come herreiro still $ and for an instant's space it seem as though the shock of his charger at full speed must have bear down the slight andalusian $ but scarcely have he parry that home thrust before $ with a quick motion of the bridle hand $ so quick $ indeed $ that it be scarce perceptible $ and a slight corresponding pressure of the spur on the flank opposite $ hernando wheel his charger to the leave $ feint a thrust at his foe's face $ and $ circle quite around him $ deliver a full sweeping cut against the back part of his neck $	On came Herreiro still -- and for an instant's space it seemed as though the shock of his charger at full speed must have borne down the slighter Andalusian ; but scarcely had he parried that home thrust before , with a quick motion of the bridle hand -- so quick , indeed , that it was scarce perceptible -- and a slight corresponding pressure of the spur on the flank opposite , Hernando wheeled his charger to the left ; feinted a thrust at his foe's face ; and , circling quite around him , delivered a full sweeping cut against the back part of his neck .	91	91	circle
and the wave that circle round the eternal mount on high $ bore an everlasting sound to the soul that can not die $	And the waves that circled round The eternal mount on high , Bore an everlasting sound To the soul that can not die .	4	4	circle
the infant hudson wind through it $ circle in its deepest bend one little fairy isle $ with wood enough for a single bower $ and a beauty that fill and characterize $	The infant Hudson winds through it , circling in its deepest bend one little fairy isle , with woods enough for a single bower , and a beauty that fills and characterizes ,	7	7	circle
halleck have beautifully describe similar scenery $ $ tall spire $ and glitter roof $ and battlement $ and banner float in the sunny air $ and white sail over the calm blue water bend $ green isle $ and circle shore $ be blend there in wild reality $ $	Halleck has beautifully described similar scenery -- " Tall spire , and glittering roof , and battlement , And banners floating in the sunny air , And white sails o'er the calm blue waters bent ; Green isles , and circling shores , are blended there In wild reality ! "	40	40	circle
nay $ even grant the senate should stand firm $ where be the people $ the sertorian band who cling around him with unwavering love $ like the fond ivy twine round the oak or life's warm eddy circle through the heart $ in conquest and defeat $	Nay , even grant the senate should stand firm , Where are the people -- the Sertorian band Who cling around him with unwavering love , Like the fond ivy twining round the oak Or life's warm eddies circling through the heart -- In conquest and defeat !	38	38	circle
these grasp $ the young god stand in the breach of circle tree $ with eye that fiercely glance $ nostril expand $ lip press $ foot advance $ and arrow at the string $ when lo $	These grasping , the young god stood in the breach Of circling trees , with eye that fiercely glanced , Nostril expanded , lip pressed , foot advanced , And arrow at the string ; when lo !	11	11	circle
then it rise $ rock to the surface $ and $ for a moment $ be toss and whirl like a bubble circle in the eddy of a pool $	Then it rose , rocking to the surface ; and , for a moment , was tossed and whirled like a bubble circling in the eddies of a pool .	22	22	circle
pour upon me thy soft beam $ and circle me with heavenly stream $	pour upon me thy soft beams , And circle me with heavenly streams .	8	8	circle
with thine own voyager thou hast hear the sound of that vast ocean $ waveless $ rayless $ dread $ where time's perpetual tribute $ circle round $ drop silent in $ all passionless and dead $	With thine own voyager thou hast heard the sound Of that vast ocean , waveless , rayless , dread , Where time's perpetual tribute , circling round , Drops silent in , all passionless and dead .	25	25	circle
it be not many minute before the first return $ bear the tiding that they be close at hand $ halt $ as it seem $ for the evening $ in a small green savannah $ half circle by a swampy streamlet $	It was not many minutes before the first returned , bearing the tidings that they were close at hand , halted , as it seemed , for the evening , in a small green savannah , half circled by a swampy streamlet .	37	37	circle
ye liege all advance $ and circle join in merry morrice dance $ $	ye lieges all advance , And circling join in merry Morrice dance . "	6	6	circle
a wide and circle flame glare on their eye for a moment $ even above the fire of the wood $ and a loud report follow $	A wide and circling flame glared on their eyes for a moment , even above the fire of the woods , and a loud report followed .	3	3	circle
edouard jess have be a favourite with us these two year $ and be still admire for the beautiful flower $ of a bright red circle by a pale tint $ delightfully fragrant $	Edouard Jess has been a favourite with us these two years , and is still admired for the beautiful flowers , of a bright red circled by a pale tint , delightfully fragrant .	25	25	circle
when the smooth ocean sleep unstirred $ and $ like a silver band $ the molten water circle gird the island's rim of sand $ she run her tiny foot to lave $ and break the liquid chain $ then laugh to feel the shiver wave coil down to rest again $	When the smoothed ocean sleeps unstirred , And , like a silver band , The molten waters circling gird The island's rim of sand , She runs her tiny feet to lave , And breaks the liquid chain ; Then laughs to feel the shivered wave Coil down to rest again .	17	17	circle
the violent shock shatter to vapor the descending sheet $ a cloudy whirlwind fill the gulf $ and heave the mighty pyramid of circle mist to heaven $	The violent shock Shatters to vapor the descending sheets : A cloudy whirlwind fills the gulf , and heaves The mighty pyramid of circling mist To heaven .	23	23	circle
when brother be at variance $ could they think on one tear a mother shed on them $ that wake their slumber $ while their infant arm circle each other's neck $ ' t would surely quench all spark of strife within their breast for ever $	When brothers are at variance , could they think On one tear a mother shed on them , That woke their slumbers , while their infant arms Circled each other's neck , ' t would surely quench All sparks of strife within their breasts for ever .	27	27	circle
and then his soul be trouble like the lake beside the tasselled reed-isle $ where the fawn $ all beautiful $ beneath the blade $ awake $ do watch the eddyings of the milky swan upon the placid water $ circle on $ as from her breast forever do arise the music of her billows $ which $ upon the shore break into language $ like the sigh of his soft breast $ whose heaving burst forth in his eye $	And then his soul was troubled like the lake Beside the tasselled reed-isle , where the fawn , All beautiful , beneath the blades , awake , Doth watch the eddyings of the milky swan Upon the placid waters , circling on ; As from her breast forever doth arise The music of her billows , which , upon The shore breaks into language , like the sighs Of his soft breast , whose heavings burst forth in his eyes .	40	40	circle
i love to see him track the street $ with his wary eye and active foot $ and i often watch him as he spring $ circle the steeple with easy wing $ till across the dial his shade have pass have $ and the belfry edge be gain at last $ '	I love to see him track the street , With his wary eye and active feet ; And I often watch him as he springs , Circling the steeples with easy wings , Till across the dial his shade has pass'd , And the belfry edge is gained at last . '	26	26	circle
how each of her coming $ like the orient sun $ outrun the expectation $ and her go leave after it a radiance which bedim all other splendours $ till she reappear with fresh wonder circle $	How Each of her comings , like the orient sun , Outruns the expectation ; and her going Leaves after it a radiance which bedims All other splendours , till she re-appears With fresher wonders circled .	35	35	circle
his head be cover with mat iron-grey elf lock $ which circle and twist in every direction $ like a nest of rattlesnake $ the nail of his hand and foot be long and crooked $ like vulture's talon $ he have a basket on his arm $ and hold a long pole in his right hand $	His head was covered with matted iron-grey elf locks , which circled and twisted in every direction , like a nest of rattlesnakes ; the nails of his hands and feet were long and crooked , like vulture's talons ; he had a basket on his arm , and held a long pole in his right hand .	11	11	circle
till near the grave $ like a rush wave $ the spectral huntsman halt $ and circle round $ each shadowy hound bay loudly $ as at fault $	Till near the grave , like a rushing wave , The spectral huntsmen halt , And circling round , each shadowy hound Bays loudly , as at fault .	16	16	circle
come a broad and circle glare $ blind the pale daylight $ a sharp stunning roar $ succeed by an awful rush sound $ and the rock reel like drunken man $	came a broad and circling glare , blinding the pale daylight ; a sharp stunning roar , succeeded by an awful rushing sound -- and the rocks reeled like drunken men !	4	4	circle
the officer bow and retire $ and soon after $ the man be see take down their boarding-pikes from the mast and boom $ with which they be circle $ and their basket-handled sword $ which be stick round the capstan and long-boat $ and their short $ broad dagger $ resemble the bowie-knife $ and these they proceed to grind and polish $ preparation dismal enough for their end $ but engage in with the more alacrity by the man $ for the grog they have just drunk	The officer bowed and retired , and soon after , the men were seen taking down their boarding-pikes from the masts and booms , with which they were circled , and their basket-handled swords , which were stuck round the capstan and long-boat , and their short , broad daggers , resembling the bowie-knife ; and these they proceeded to grind and polish , preparations dismal enough for their end , but engaged in with the more alacrity by the men , for the grog they had just drunk	28	28	circle
so the doge's tradition $ thus bello's $ $ age ago $ dominora be circle by a reef $ which expanding in proportion to the extension of the isle's naval dominion $ in due time embrace the entire lagoon $ and this marriage ring zon all the world $	So the Doge's tradition ; thus Bello's : -- Ages ago , Dominora was circled by a reef , which expanding in proportion to the extension of the isle's naval dominion , in due time embraced the entire lagoon ; and this marriage ring zoned all the world .	14	14	circle
thus they circle until they fall upon the recent trail of a fox $ for a wise hound will forsake everything else for this $	Thus they circle until they fall upon the recent trail of a fox , for a wise hound will forsake everything else for this .	2	2	circle
a part of his man circle the dwell and gallop up a lane which would lead them directly across the lawn toward the front door of the house $ while the rest $ wheel off among the meadow $ present themselves at the same time in the rear $	a part of his men circled the dwelling and galloped up a lane which would lead them directly across the lawn toward the front door of the house , while the rest , wheeling off among the meadows , presented themselves at the same time in the rear .	5	5	circle
tall spire $ and glitter roof $ and battlement $ and banner float in the sunny air $ and white sail over the calm blue water bend $ green isle $ and circle shore $ be blend there $ in wild reality $	Tall spire , and glittering roof , and battlement , And banners floating in the sunny air , And white sails o'er the calm blue waters bent , Green isle , and circling shore , are blended there , In wild reality .	32	32	circle
this angel $ who be once in heaven above $ whose live heartstring be a lute $ this star which circle in the court of love $ for whose long absence now the rest be mute $ be here on earth $	This Angel , who was once in Heaven above , Whose living heartstrings are a lute ; This Star which circled in the Courts of Love , For whose long absence now the rest are mute -- Is here on earth !	20	20	circle
and many be the smile that circle the table $ but winthrop $ apprehensive of a storm $ interpose $ $	and many were the smiles that circled the table , but Winthrop , apprehensive of a storm , interposed . "	6	6	circle
the noise of run water $ the large grassy meadow $ from which the spot take its name $ and the green hill which circle it round-all tend to captivate the eye and please the sense of the way-worn $ voyageur $ $	The noise of running water , the large grassy meadows , from which the spot takes its name , and the green hills which circle it round-all tend to captivate the eye and please the senses of the way-worn " voyageur . "	24	24	circle
laramie creek $ circle before our camp $ half inclose us $ it sweep along the bottom of a line of tall white cliff that look down on us from the far bank $	Laramie Creek , circling before our camp , half inclosed us ; it swept along the bottom of a line of tall white cliffs that looked down on us from the farther bank .	3	3	circle
lie soon see within ken a glorious angel stand $ the same whom john see also in the sun $ his back be turn $ but not his brightness hide $ of beaming sunny ray a golden tiar circle his head $ nor less his lock behind illustrious on his shoulder fledge with wing lay wave round $ on some great charge employ he seem $ or fix in cogitation deep $ $	lie soon Saw within ken a glorious Angel stand , The same whom John saw also in the sun : His back was turned , but not his brightness hid ; Of beaming sunny rays a golden tiar Circled his head , nor less his locks behind Illustrious on his shoulders fledge with wings Lay waving round ; on some great charge employed He seemed , or fixed in cogitation deep . "	38	38	circle
it be in the left hand try-pot of the pequod $ with the soapstone diligently circle round me $ that i be first indirectly strike by the remarkable fact $ that in geometry all body glide along the cycloid $ my soapstone for example $ will descend from any point in precisely the same time $	It was in the left hand try-pot of the Pequod , with the soapstone diligently circling round me , that I was first indirectly struck by the remarkable fact , that in geometry all bodies gliding along the cycloid , my soapstone for example , will descend from any point in precisely the same time .	15	15	circle
thy hand invest in their azure robe $ thy breath make buoyant $ yonder circle globe $ that bind and blaze along the elastic wire $ that viewless vibrate on celestial lyre $ and in that high and radiant concave tremble $ beneath whose dome adoring host assemble $ to catch the note $ from those bright sphere that flow $ which mortal dream of $ but which angel know $	Thy hand invested in their azure robes , Thy breath made buoyant , yonder circling globes , That bound and blaze along the elastic wires , That viewless vibrate on celestial lyres , And in that high and radiant concave tremble , Beneath whose dome adoring hosts assemble , To catch the notes , from those bright spheres that flow , Which mortals dream of , but which angels know .	14	14	circle
brief not thy course at that either $ for thou hast often see the son of cloud prospect $ leap to the high seat that power yield $ carry thine eye unseal and wary to scan mankind $ for it will be a convoy for thy relief $ let not the glib and stealthy tongued prater $ with his o'erfull breast of friendship circle nothing $ spear thy heart to that condition $	Brief not thy course at that either , for thou hast often seen the son of clouded prospect , leap to the highest seat that power yields , carry thine eye unsealed and wary to scan mankind , for it will be a convoy for thy relief : let not the glib and stealthy tongued prater , with his o'erfull breast of friendship circling nothing , spear thy heart to that condition ,	63	63	circle
the alders be separate more widely from each other $ and grow more in scattered clump $ which sometimes form green islet $ circle with a fringe of scarlet $ wherever their red root be wash and polish by the flow water $	The alders are separated more widely from each other , and grow more in scattered clumps , which sometimes form green islets , circled with a fringe of scarlet , wherever their red roots are washed and polished by the flowing waters .	23	23	circle
euphas circle with christian sword $ stand wait thy behest $	Euphas Circled with Christian swords , Stands waiting thy behest !	1	1	circle
graceful rainbow $ now arch over our head $ and now circle in the vapour at our foot $ still fly before us as we move $	graceful rainbow , now arching over our heads , and now circling in the vapour at our feet , still flew before us as we moved .	11	11	circle
so she stand in this palace of pleasure $ circle round by the swan of delight $	So she stood in this Palace of Pleasure , Circled round by the Swans of Delight .	9	9	circle
giant oak $ not more than twenty in number $ circle on a space some three hundred yard square $	Giant oaks , not more than twenty in number , circled on a space some three hundred yards square .	10	10	circle
's reason to raise and refine $ while lift $ untroubled $ his gaze to the sky $ he welcome the presence divine $ $ then $ course an orbit that circle the whole $ come saturn $ like patience $ untired $ and through its broad range give light to the soul of man $ a calm wisdom inspire $ $ and all these fair planet in harmony move round the sun $ as their center of light $ life and love $	's reason to raise and refine , While lifting , untroubled , his gaze to the sky , He welcomed the Presence Divine ; -- Then , coursing an orbit that circled the whole , Came Saturn , like Patience , untired , And through its broad range giving light to the soul Of Man , a calm wisdom inspired ; -- And all these fair Planets in harmony move Round the Sun , as their centre of light , life and love .	31	31	circle
and even through the blue sky $ he could look up $ and see these spirit $ or to speak in language which may be more intelligible $ these man and woman of a pure and divine creation $ circle in myriad throng of light and darkness $	And even through the blue sky , he could look up , and see these spirits -- or to speak in language which may be more intelligible -- these Men and Women of a purer and diviner creation , circling in myriad throngs of light and darkness .	39	39	circle
outline of man $ arm with spear $ circle around the whole cell $	outlines of men , armed with spears , circling around the whole cell .	8	8	circle
he have not dare use his pencil before this day $ he do not dare again $ the ghost have usurp his province $ but he feel now that if he might $ his brain in this great heat would strike off glowing thought $ to circle $ like fresh planet $ in an immortality of their own $	He had not dared use his pencils before this day ; he did not dare again ; the Ghost had usurped his province ; but he felt now that if he might , his brain in this great heat would strike off glowing thoughts , to circle , like fresh planets , in an immortality of their own .	46	46	circle
thy pleasant spot of birth be sad without thee $ and an ancient head circle with year and blessing as a crown bow low with the first pang thou e'er do cause a father's bosom $	Thy pleasant spot of birth Is sad without thee , and an ancient head Circled with years and blessings as a crown Bows low with the first pang thou e'er didst cause A father's bosom .	14	14	circle
