sentence_lemma	sentence_token	index_lemma	index_token	lemma
if any one besides his master go into the field and try to catch ned $ he be sure to have a troublesome time of it $ and if he succeed in his object before circle the field a dozen time in pursuit of the horse $ he might think himself lucky $	If any one besides his master went into the field and tried to catch Ned , he was sure to have a troublesome time of it ; and if he succeeded in his object before circling the field a dozen times in pursuit of the horse , he might think himself lucky .	35	35	circle
as we glide nearer $ the stranger show french colour from his peak $ and by the eddy cloud of vulture sea-fowl that circle $ and hover $ and swoop around him $ it be plain that the whale alongside must be what the fisherman call a blast whale $ that be $ a whale that have die unmolested on the sea $ and so float an unappropriated corpse $	As we glided nearer , the stranger showed French colours from his peak ; and by the eddying cloud of vulture sea-fowl that circled , and hovered , and swooped around him , it was plain that the whale alongside must be what the fishermen call a blasted whale , that is , a whale that has died unmolested on the sea , and so floated an unappropriated corpse .	23	23	circle
at the catastrophe $ mrs.- gambril cease her flight $ but after the manner of the cossack of the don $ or the mahratta cavalry $ keep circle round the enemy $ out of striking distance $ yet within hail $ $	At the catastrophe , Mrs. Gambril ceased her flight , but after the manner of the Cossacks of the Don , or the Mahratta cavalry , kept circling round the enemy -- out of striking distance , yet within hail . "	27	27	circle
child $ very old $ over wave $ toward the house of maternity $ the land of migration $ look afar $ look off the shore of my western sea $ have arrive at last where i be $ the circle almost circle $ for come westward from hindustan $ from the vale of kashmere $ from asia $ from the north $ from the god $ the sage $ and the hero $ from the south $ from the flowery peninsula $ and the spice island $ now i face the old home again $ look over to it $ joyous $ as after long travel $ growth $ and sleep $ but where be what i start for $ so long ago $	child , very old , over waves , toward the house of maternity , the land of migrations , look afar , Look off the shores of my Western Sea -- having arrived at last where I am -- the circle almost circled ; For coming westward from Hindustan , from the vales of Kashmere , From Asia -- from the north -- from the God , the sage , and the hero , From the south -- from the flowery peninsulas , and the spice islands , Now I face the old home again -- looking over to it , joyous , as after long travel , growth , and sleep ; But where is what I started for , so long ago ?	40	40	circle
it be in a lone chamber $ where the dark wall arch above and circle around $ unrelieved by tapestry or wainscot $ be render yet more dark and gloomy by the fitful flash of a	It was in a lone chamber , where the dark walls arching above and circling around , unrelieved by tapestry or wainscotting , were rendered yet more dark and gloomy by the fitful flashes of a	14	14	circle
when compel to rise they would sometimes circle round and round and over the pond at a considerable height $ from which they could easily see to other pond and the river $ like black mote in the sky $ and $ when i think they have go off thither long since $ they would settle down by a slant flight of a quarter of a mile on to a distant part which be leave free $ but what beside safety they get by sail in the middle of walden i do not know $ unless they love its water for the same reason that i do	When compelled to rise they would sometimes circle round and round and over the pond at a considerable height , from which they could easily see to other ponds and the river , like black motes in the sky ; and , when I thought they had gone off thither long since , they would settle down by a slanting flight of a quarter of a mile on to a distant part which was left free ; but what beside safety they got by sailing in the middle of Walden I do not know , unless they love its water for the same reason that I do	7	7	circle
ere the startle multitude have stir from their first surprise position $ the tempest come down in its fury $ sweeping $ tornado-like $ from west to east $ and then into one grand gyration circle the whole horizon $	Ere the startled multitudes had stirred from their first surprised position , the tempest came down in its fury , sweeping , tornado-like , from West to East , and then into one grand gyration circling the whole horizon .	35	35	circle
the wine circle gaily $ and the song and just pass merrily round $	The wine circled gaily , and the song and jest passed merrily round .	2	2	circle
or sometimes i watch a pair of hen-hawks circle high in the sky $ alternately soaring and descending $ approach $ and leave one another $ as if they be the embodiment of my own thought $	Or sometimes I watched a pair of hen-hawks circling high in the sky , alternately soaring and descending , approaching , and leaving one another , as if they were the embodiment of my own thoughts .	8	8	circle
turret tremble with peal bell $ joy loudly wind his bugle horn $ and the heart of a nation proudly swell when an heir to royalty be born $ but $ greet by a strain more wild $ leap from its fount the mountain-child $ old piny grove a mellow roar from their mysterious depth outpour commingled with the panther's scream $ murmur of torrent $ and the cry of the gray eagle circle high $ meet welcome for a stream that dash down $ in youthful force $ from the green hill to run its course $	Turrets tremble with pealing bells -- Joy loudly winds his bugle horn , And the heart of a nation proudly swells When an heir to royalty is born ; But , greeted by a strain more wild , Leaps from its fount the mountain-child : Old piny groves a mellow roar From their mysterious depths outpour Commingled with the panther's scream -- Murmur of torrents , and the cry Of the gray eagle circling high -- Meet welcome for a stream That dashes down , in youthful force , From the green hills to run its course .	73	73	circle
methought i journey over a boundless plain unbroke by vale or hill $ on all side stretch $ like circle ocean $ to the low-browed sky $ save in the midst a verdant mount whose side flower of all hue and fragrant breath adorn $	Methought I journeyed o'er a boundless plain Unbroke by vale or hill , on all sides stretched , Like circling ocean , to the low-browed sky ; Save in the midst a verdant mount whose sides Flowers of all hues and fragrant breath adorned .	19	19	circle
the diner be meanwhile fairly embark $ the stream of mirth be full $ as it flow up and down the board it sometimes attain a rapid head $ carry all before it $ in a general glee $ or pause in little eddy and islet of drinker $ where it tarry and circle round and round within itself $	The diners were meanwhile fairly embarked -- the stream of mirth was full : as it flowed up and down the board it sometimes attained a rapid head , carrying all before it , in a general glee ; or paused in little eddies and islets of drinkers , where it tarried and circled round and round within itself .	53	53	circle
in some chink of the wall the cricket chirp $ the same quick short sound $ over and over to itself $ and about the candle circle and	In some chink of the wall the cricket chirped , the same quick short sound , over and over to itself , and about the candle circled and	26	26	circle
by his wild rule of whirl vortex and circle sphere $ ' he construct the earth $ the planet $ the sun $ and the heaven $ and after such prodigy of execution $ where be the // wonder $ that he should affirm it to be within the compass cif his power $ have a quantity of matter and motion to produce an animal $ '	By his Wild rule Of whirling vortices and circling spheres , ' he constructed the earth , the planets , the sun , and the heavens ; and after such prodigies of execution , where is the // wonder , that he should affirm it to be within the compass of his power , having a quantity of matter and motion to produce an animal ? '	8	8	circle
bend $ green isle and circle shore $ all blend there $ in wild reality $ $	bent , Green isle and circling shore , all blended there , In wild reality . "	5	5	circle
see how they bear him up upon their wing $ and circle him with glory $	See how they bear him up upon their wings , And circle him with glory !	11	11	circle
and if it harder be $ than e'er before $ to find new clime $ when now our sea have oft be circle by ten thousand prow $ $ much more the glory $	And if it harder be , than e'er before , to find new climes , when now our seas have oft been circled by ten thousand prows , -- much more the glory !	22	22	circle
// from that war the feeble and once-despised navy of 4he united state come out $ its forehead circle and adorn by the laurel it have tear from the brow of the naval genius of england	// From that war the feeble and once-despised navy of the United States came out " its forehead circled and adorned by the laurels it had torn from the brow of the naval genius of England	18	18	circle
$ do i not tell you $ then $ that you be salem's fair daughter $ that in the field and in the house $ by stream and wood and sea-side lonely $ i think of you $ circle your gentle heart with this same arm $ do i not say $ as now i say $ and ever $ ever shall $ i love you $	-- Did I not tell you , then , That you were Salem's fairest daughter , That in the field and in the house , by stream And wood and sea-side lonely , I thought of you -- Circling your gentle heart with this same arm , Did I not say , as now I say , and ever , Ever shall , I love you !	38	38	circle
he laugh so gleefully upon the shift weather-cocks $ and on the tall $ white $ crimson-flooded spire $ which point up to heaven $ and on the wing of snowy pigeon $ cut the blue air $ and circle joyously $ and on the little maiden $ trip on along the street $ toward school $ and laugh merrily	He laughed so gleefully upon the shifting weather-cocks , and on the tall , white , crimson-flooded spires , which pointed up to heaven -- and on the wings of snowy pigeons , cutting the blue air , and circling joyously -- and on the little maiden , tripping on along the street , toward school , and laughing merrily	39	39	circle
the warrior circle three time round the village $ and as each distinguished champion pass $ the old woman would scream out his name in honor of his bravery $ and to incite the emulation	The warriors circled three times round the village ; and as each distinguished champion passed , the old women would scream out his name in honor of his bravery , and to incite the emulation	2	2	circle
thus fix have $ a dreadful hour i past $ and now i hear $ as from a blast $ a voice pronounce my name $ nor long upon my ear it dwell $ when round me ' gan the air to melt $ and motion once again i feel quick circle over my frame $	Thus fix'd , a dreadful hour I past , And now I heard , as from a blast , A voice pronounce my name : Nor long upon my ear it dwelt , When round me ' gan the air to melt , And motion once again I felt Quick circling o'er my frame .	51	50	circle
a broad-brimmed $ low-crowned and long-napped white hat $ set forth assuredly to the best advantage his rotund $ rubicund $ good-humored phiz $ a clean white handkerchief circle his sturdy neck $ on the volumnious fold of which repose in placid dignity the mighty collops of his double chin $	A broad-brimmed , low-crowned and long-napped white hat , set forth assuredly to the best advantage his rotund , rubicund , good-humored phiz ; a clean white handkerchief circled his sturdy neck , on the volumnious folds of which reposed in placid dignity the mighty collops of his double chin .	28	28	circle
those pleasantly swell slope of our farm $ descend towards the wide meadow $ through which sluggishly circle the brimful tide of the charles $ bath the long sedge on its hither and far shore $ the broad $ sunny gleam over the wind water $ that peculiar picturesqueness of the scene where cape and headland put themselves boldly forth upon the perfect level of the	Those pleasantly swelling slopes of our farm , descending towards the wide meadows , through which sluggishly circled the brimful tide of the Charles , bathing the long sedges on its hither and farther shores ; the broad , sunny gleam over the winding water ; that peculiar picturesqueness of the scene where capes and headlands put themselves boldly forth upon the perfect level of the	17	17	circle
$ let me $ while the sun linger $ still pour out my soul on this paper $ let me indulge a pleasing $ dreadful think $ shall i $ ere circle time bring back this hour $ become thy $ and shall my heart $ after its dreadful languors $ its excruciating agony $ know once more $ a rapturous emotion $	-- Let me , while the sun lingers , still pour out my soul on this paper -- Let me indulge a pleasing , dreadful thought -- Shall I , ere circling time bring back this hour , become thy -- And shall my heart , after its dreadful languors , its excruciating agonies , know once more , a rapturous emotion ?	31	31	circle
two $ they circle round the area at full gallop $ each warrior sing his war song as he ride $	two , they circled round the area at full gallop , each warrior singing his war song as he rode .	3	3	circle
distance $ break the silence $ again and again it peal $ louder and louder yet $ till the affright martin $ flutter down from their nest on the minster-towers $ circle $ with startle wing and short shrill cry $ above our head in the lurid torch-light $	distance , broke the silence -- again and again it pealed -- louder and louder yet , till the affrighted martins , fluttering down from their nests on the minster-towers , circled , with startled wing and short shrill cry , above our heads in the lurid torch-light .	31	31	circle
$ ' t be strength $ strong heart $ strong think $ think $ feeling run their length in a wild grandeur $ or they passive lay $ like water circle in a wooded bay $ that take from some slow cloud the quiver light throw from its snowy rift and glitter height $	: ' T was strength , Strong heart , strong thought ; thought , feeling ran their length In a wild grandeur , or they passive lay , Like waters circled in a wooded bay , That take from some slow cloud the quivering lights Thrown from its snowy rifts and glittering heights .	30	30	circle
in some chink of the wall the cricket chirp to itself the same quick short sound $ over and over $ and about the candle circle and flutter the gray-winged moth $	In some chink of the wall the cricket chirped to itself the same quick short sound , over and over , and about the candle circled and fluttered the gray-winged moths ,	25	25	circle
circle over thy bosom of blue the light $ graceful gull be afloat $ and gravelly bluff point loom to view from the deck of our beautiful boat $	Circling over thy bosom of blue The light , graceful gull was afloat , And gravelly Bluff Point loomed to view From the deck of our beautiful boat .	0	0	circle
let 6/ $ be the central hne $ divide it into four part $ and at one fourth make the hne a b across the column $ on c $ make the half circle a e b $ with the distance / 1 $ at the neck of the column $ and on 1 $ on the central hne $ make the point 1 $ 1 $ on the circle $ divide from 1 to c $	Let 6/ , be the central hne ; divide it into four parts , and at one fourth make the hne a b across the column ; on c , make the half circle a e b ; with the distance / 1 , at the neck of the column , and on 1 , on the central hne , make the points 1 , 1 , on the circle ; divide from 1 to c ,	33	33	circle
warm cloak and balance by his poise stick $ disport and mark out curve and fantastic figure on the polished and freeze visage of the lagoon $ now dart along swift as a winged shaft shotten from a bow $ now circle and cleave with rapid heel $ quick as the following of sight itself $ the congeal bosom of the streamlet $ anon shoot hither $ then thitherward as a thing bear by the wanton sweep of the invigorating breeze $ at a moment's will $ take one course $ pursue by his eager fellow $ and again $ like the swoop of the lammer geyer $ round an alpine peak to avoid their playful grasp $ elude the extend hand of his sanguine companion $ he wheel abrupt unto an adverse way $ leave his baulk pursuer $ unwitting of his drift $ to take a wider circuit $ $ all skim away in their revelry $ like a flight of swallow $ cut the cloud in the merriment of their summer life $	warm cloak and balanced by his poised stick , disporting and marking out curves and fantastic figures on the polished and frozen visage of the lagoon -- now darting along swift as a winged shaft shotten from a bow -- now circling and cleaving with rapid heel , quick as the following of sight itself , the congealed bosom of the streamlet , anon shooting hither , then thitherward as a thing borne by the wanton sweep of the invigorating breeze , at a moment's will , taking one course , pursued by his eager fellows , and again , like the swoop of the lammer geyer , round an alpine peak to avoid their playful grasp , eluding the extended hand of his sanguine companion , he wheels abrupt unto an adverse way , leaving his baulked pursuer , unwitting of his drift , to take a wider circuit , -- all skimming away in their revelry , like a flight of swallows , cutting the clouds in the merriment of their summer lives .	41	41	circle
there be an isle $ circle by southern sea $ far in a soft clime of perpetual spring $ where the voluptuous odor-laden	There is an isle , circled by southern seas , Far in a soft clime of perpetual spring , Where the voluptuous odor-laden	5	5	circle
/z/ heaven's wintry canopy cover our sphere $ and the four sister season have circle the year $ return cold december $ with snow	/z/ Heaven's wintry canopy covers our sphere , And the four sister seasons have circled the year ; Returns cold December , with snows	14	14	circle
he say again $ circle back to his favorite maxim $	he said again , circling back to his favorite maxim .	4	4	circle
the flame be circle round the point of the rock below $ and $ unless we can pass there $ our only chance must be over the precipice $	the flames are circling round the point of the rock below , and , unless we can pass there , our only chance must be over the precipice .	3	3	circle
one day my attention be arrest by a very unusual twitter $ and i see him circle round with a large downy feather in his bill $	One day my attention was arrested by a very unusual twittering , and I saw him circling round with a large downy feather in his bill .	16	16	circle
the egyptian $ like the american $ be a mix race $ with some negro blood circle around the throne $ as well as in the mud hovel $	The Egyptians , like the Americans , were a mixed race , with some Negro blood circling around the throne , as well as in the mud hovels .	16	16	circle
