sentence_lemma	sentence_token	target_index	original_word
now $ tom's roarer when there be any thump or fight to be do $ but at lie he an't good $ tom an't $ $ ye see it don't come natural to him $ but $ lord $ if there be a fellow in the country that can swear to anything and everything $ and put in all the circumstance and flourish with a long face $ and carry ' t through better	Now , Tom's roarer when there's any thumping or fighting to be done ; but at lying he an't good , Tom an't , -- ye see it don't come natural to him ; but , Lord , if thar's a feller in the country that can swear to anything and everything , and put in all the circumstances and flourishes with a long face , and carry ' t through better	7	thump
now the tang-tang thump $ big tabala beat $ while the flute and the bell make music sweet $ and the negro girl on the simbing play $ for this be missy's wedding day $	Now the tang-tang thump ; big tabala beat ; While the flute and the bells make music sweet ; And the negro girl on the simbing play , For this be missy's wedding day .	3	thump
at last $ with the crown threat $ up go the spear for an astound thump $ and down come a large piece of the ceiling $ and with it $ a shower of letter $	At last , with the crowning threat , up went the spear for an astounding thump , and down came a large piece of the ceiling , and with it -- a shower of letters .	15	thump
3 four wife require that ali should bestir $ why he soon fall to work as before $ with his hammer $ make as much noise as ever $ yet the neighbour hear it never $ the lady contrive to make a little more than the hammer $ all the thump $ all the knock	3 Four wives requiring that Ali should bestir , Why he soon fell to work as before , With his hammer , Making as much noise as ever ; Yet the neighbours heard it never , The ladies contrived to make a little more Than the hammer : All the thumping , all the knocking	50	thump
he remember a long walk to fulton ferry $ a sort of holiday for him $ he remember a considerable practice in capital $ and write generally $ afterwards $ he remember still more clearly a severe thump upon his head $ give by mr.- blimmer $ very gratuitously $ as jerry think $ $ later in the day $	He remembered a long walk to Fulton Ferry , a sort of holiday for him ; he remembered a considerable practice in capitals , and writing generally , afterwards ; he remembered still more clearly a severe thump upon his head , given by Mr. Blimmer , very gratuitously ( as Jerry thought ) , later in the day .	37	thump
and there be a mighty difference between a live thump and a dead thump $	And there's a mighty difference between a living thump and a dead thump .	8	thump
no $ sir $ the violence of the operation would do his business as expeditiously as a thump over the head with a tomahawk $ which i think $ as you be an indian trader and fighter $ you know something about $	No , sir ; the violence of the operation would do his business as expeditiously as a thump over the head with a tomahawk , which I think , as you are an Indian trader and fighter , you know something about .	17	thump
an $ by the five crasses $ if it ben't for the wapon you have get in your hand $ and poor jamie that i bring here on my back $ and this thump upon my head $ i should say it be all a dhrame clane out $ $	An , by the five crasses , if it wasn't for the wapon you've got in your hand -- and poor Jamie that I brought here on my back -- and this thump upon my head , I should say it was all a dhrame clane out . "	32	thump
and one of the watch on deck $ after a preliminary thump with the large end of a handspike upon the forecastle $ vociferated down the fore scuttle $ $ all the starboard watch $ ahoy $	and one of the watch on deck , after a preliminary thumping with the large end of a handspike upon the forecastle , vociferated down the fore scuttle , " All the starboard watch , ahoy !	11	thump
i give him a thump for be such a fool $ but that only make him cry harder $	I gave him a thumping for being such a fool ; but that only made him cry harder .	4	thump
louis plead as much as he dare $ in dread of a few thump $ friendly in intent $ but vigorous in execution $ from salisbury $ and a second shake from hamilton $ but all in vain $ and they sally forth $	Louis pleaded as much as he dared , in dread of a few thumps , friendly in intent , but vigorous in execution , from Salisbury , and a second shaking from Hamilton , but all in vain , and they sallied forth .	13	thump
the struggle seem to wax hot and hot $ for a short time after michael come to the ground $ and he throw the child about in all direction and posture $ give some of them thump which would have place the ruffle-shirted little darling of the present day $ under the discipline of paregoric and opodeldoc for a week $ but these hardy son of the forest $ seem not to feel them $	The struggle seemed to wax hotter and hotter , for a short time after Michael came to the ground , and he threw the children about in all directions and postures , giving some of them thumps which would have placed the ruffle-shirted little darlings of the present day , under the discipline of paregoric and opodeldoc for a week ; but these hardy sons of the forest , seemed not to feel them .	36	thump
but unfortunately he have make some miscalculation or slip $ for instead of alight square upon the skate $ his heel fly up $ and with a tremendous thump $ down come poor bill upon his back $ $	But unfortunately he had made some miscalculation or slip , for instead of alighting square upon the skates , his heels flew up , and with a tremendous thump , down came poor Bill upon his back . "	28	thump
after loosen the hard soil $ by dint of much thump and pounding $ the yankee jerk one of the root this way and that $ twist it round and round $ and then tug at it horizontally $ $	After loosening the hard soil , by dint of much thumping and pounding , the Yankee jerked one of the roots this way and that , twisting it round and round , and then tugging at it horizontally . "	10	thump
ingeniously disentangle from all pretension to braid $ as respect its brim $ and the sliver start apart $ and stand upright $ give it a blaze air of freedom and defiance $ quite equal to that of any fejee chief $ while the whole brim of andy be be depart bodily $ he rap the crown on his head with a dexterous thump $ and look about well pleased $ as if to say $ $ who say i haven't get a hat $ $	ingeniously disentangled from all pretensions to braid , as respects its brim ; and the slivers starting apart , and standing upright , gave it a blazing air of freedom and defiance , quite equal to that of any Fejee chief ; while the whole brim of Andy's being departed bodily , he rapped the crown on his head with a dexterous thump , and looked about well pleased , as if to say , " Who says I haven't got a hat ? "	62	thump
$ tiddle $ bump $ $ tiddle $ thump $ $ tiddle $ bang $ $	-- tiddle ( bump ) -- tiddle ( thump ) -- tiddle ( bang ! )	8	thump
he have no sooner fairly get it to his eye than he bring his foot down upon the deck with a stout thump and open his countenance with a broad grin of satisfaction $	He had no sooner fairly got it to his eye than he brought his foot down upon the deck with a stout thump and opened his countenance with a broad grin of satisfaction .	22	thump
the next thing i know $ be the loud thump of a handspike on deck as the watch be call again $	The next thing I knew , was the loud thumping of a handspike on deck as the watch was called again .	9	thump
to his great surprise $ therefore $ a few minute afterwards $ he hear a thump sound $ and $ on turn over to see what the cause of it be $ he find that the little door be loose again $ and be swing backward and forward as before $	To his great surprise , therefore , a few minutes afterwards , he heard a thumping sound , and , on turning over to see what the cause of it was , he found that the little door was loose again , and was swinging backward and forward as before .	15	thump
jest then thump go the old bote again something $ and evry woman squall $ and the man stand on ther tip-toe $	Jest then thump went the old bote agin something , and evry woman squalled , and the men stood on ther tip-toes .	2	thump
the bold $ have approach the door to listen $ apply their ear to the keyhole $ and hear as follow $ $ turn out your toe $ forward two $ tol-de-rol-tiddle $ thump $ $ tiddle $ bump $ $ twiddle $ bang $ $	The boldest , having approached the door to listen , applied their ears to the keyhole , and heard as follows : " Turn out your toes -- forward two -- tol-de-rol-tiddle ( thump ) -- tiddle ( bump ) -- twiddle ( bang ! )	33	thump
the occasional clink or thump of something on board a vessel $ or the steady ply of some patient oar $ fall pleasantly on the ear in this calm night $	The occasional clink or thump of something on board a vessel , or the steady plying of some patient oars , falls pleasantly on the ear in this calm night .	4	thump
the hoarse trumpet of the engineer sound $ the hose have be drop in the cistern $ there be a thump of engine-arms $ a thin jet of muddy water rise against the flame $ and the fire bound up $ lively than ever	The hoarse trumpets of the engineers sounded -- the hose had been dropped in the cisterns -- there was a thumping of engine-arms , a thin jet of muddy water rose against the flame , and the fire bounded up , livelier than ever	20	thump
pluck sing $ accompany with a violent thump of his fist on the table $ $ we have a sister scarcely growne $ for she be such a little one that yet no breaste have she $ what thing shall we now undertake to doe for thys our sister's sake if speak for	Pluck sings , accompanied with a violent thumping of his fists on the table , " We have a sister scarcely growne , For she is such a little one That yet no breaste hath she , What thing shall we now undertake To doe for thys our sister's sake If spoken for	7	thump
why $ you know he be the man $ $ $ man $ $ here break in doctor drummummupp $ at the top of his voice $ and with a thump that come near knock the pulpit about our ear $ $ man that be born of a woman have but a short	why , you know he's the man " -- " Man , " here broke in Doctor Drummummupp , at the top of his voice , and with a thump that came near knocking the pulpit about our ears ; " man that is born of a woman hath but a short	29	thump
the consequence be obvious $ michael's head first take the desk $ then the seat $ and finally the ground $ $ for the house be not floor $ $ with three sonorous thump $ of most doleful portent $	The consequence is obvious -- Michael's head first took the desk , then the seat , and finally the ground , ( for the house was not floored , ) with three sonorous thumps , of most doleful portent .	33	thump
why $ crowder $ you be one of those fellow in every party $ who be allow to make a noise in proportion to their real want of confidence and information $ in the same way as poor bill baffin the stevedore thump and whistle and ply his mallet on the outside of a ship on the stock $	Why , Crowder , you are one of those fellows in every party , who are allowed to make a noise in proportion to their real want of confidence and information ; in the same way as poor Bill Baffin the stevedore thumps and whistles and plies his mallet on the outside of a ship on the stocks ,	42	thump
the rest of the company throng around him in his triumphal progress $ march in unison to the bray of trumpet and the thump of drum $ whose rude music sound strangely	The rest of the company thronged around him in his triumphal progress , marching in unison to the braying of trumpets and the thump of drums , whose rude music sounded strangely	23	thump
$ why $ you know he be the man $ $ $ man $ $ here break in doctor drummummupp $ at the top of his voice $ and with a thump that come	-- why , you know he's the man " -- " Man , " here broke in Doctor Drummummupp , at the top of his voice , and with a thump that came	30	thump
see that i remain motionless $ all my limb be dislocate and my head twist on one side $ $ his apprehension begin to be excite $ and arouse the rest of the passenger $ he communicate $ in a very decide manner $ his opinion that a dead man have be palm upon them during the night for a living and responsible fellow-traveller $ here give me a thump on the right eye $ by way of demonstrate the truth of his suggestion $	Seeing that I remained motionless ( all my limbs were dislocated and my head twisted on one side ) , his apprehensions began to be excited ; and arousing the rest of the passengers , he communicated , in a very decided manner , his opinion that a dead man had been palmed upon them during the night for a living and responsible fellow-traveller ; here giving me a thump on the right eye , by way of demonstrating the truth of his suggestion .	69	thump
another give me a diamond as big as a fist $ and you $ it be a thump of the fist you give me $	Another gives me a diamond as big as a fist , and you , it's a thump of the fist you give me .	16	thump
