sentence_lemma	target_index	cluster	lemma	sentence_token	identifier
thus $ thus the ravisher go forth $ like meteor over the cloudy north $ thus $ thus the desperate boy go down $ in splendour over the mountain 's brown $ his vestment stream far behind $ and glitter in the rush wind $ his dancing plumage tip with light $ like eaglet in their lofty flight $ as now he dart on the sight $ and meet the sun 's last ray $ $ now hide in the forest shade $ emerge now $ and now betray by plume that in the sunset play $ and robe that seem to blaze $	48	25	tip	Thus -- thus the ravisher went forth ; Like meteors o'er the cloudy north : Thus -- thus the desperate boy went down , In splendour o'er the mountain 's brown : His vestment streaming far behind , And glittering in the rushing wind : His dancing plumage tipped with light , Like eaglets in their loftiest flight -- As now he darted on the sight , And met the sun 's last rays : -- Now hidden in the forest shade -- Emerging now -- and now betrayed By plumes that in the sunset played ; And robe that seemed to blaze !	fic_1819_8009.txt-1059-48
of my pearl $ come down $ i will form thee a crown $ to encircle thy brow young and fair $ every leaf on thy stem shall be tip with a gem $ every bud sparkle diamond shall wear $	29	25	tip	Of my pearls , coming down , I will form thee a crown , To encircle thy brow young and fair ; Every leaf on thy stem Shall be tipped with a gem , Every bud sparkling diamonds shall wear .	fic_1850_7953.txt-1479-29
the far dim wood be tip with amethyst $ beneath me stretch the town of eld bespangled with its light $ above me $	5	26	tip	The far dim woods Were tipped with amethyst ; beneath me stretched The town of Eld bespangled with its lights ; Above me ,	fic_1855_7489.txt-867-5
and i have better tip this private secretary in the manner describe by gil blas $ when he be confidential secretary of the spanish minister $	4	27	tip	And I had better tip this private secretary in the manner described by Gil Blas , when he was confidential secretary of the Spanish minister .	fic_1855_9098.txt-10084-4
but be you prepare to furnish boozle the mean to tip the member $ $	10	28	tip	But are you prepared to furnish Boozle the means to tip the member ? "	fic_1855_9098.txt-10113-10
charley tip a sly wink at him $ unperceived by arthur $ and answer $ $ we be only go to carrolton $ to stroll through the garden $ that be all $ $	1	29	tip	Charley tipped a sly wink at him , unperceived by Arthur , and answered : " We 're only going to Carrolton , to stroll through the gardens ; that 's all . "	fic_1857_3100.txt-445-1
so $ after the famous christmas-dinner with its nice roast-meats $ and pudding $ and pie $ $ $ after the game of romp with her father $ and the ride on the rocking-horse with her brother $ who $ at last $ from mere mischief $ have tip her off $ and send her cry to her mother $ $ begin to think about go there $	48	30	tip	So , after the famous Christmas-dinner with its nice roast-meats , and puddings , and pies , - - after the game of romps with her father , and the ride on the rocking-horse with her brother , who , at last , from mere mischief , had tipped her off , and sent her crying to her mother , she began to think about going there .	fic_1860_3347.txt-1019-48
the part mouth of tashtego reveal his shark-white tooth $ which strangely gleam as if they too have be tip by corpusants $ while light up by the preternatural light $	19	32	tip	The parted mouth of Tashtego revealed his shark-white teeth , which strangely gleamed as if they too had been tipped by corpusants ; while lit up by the preternatural light ,	fic_1851_746.txt-9276-19
we have n't see hide nor hair of neither of ' em yet $ and they must have tip over come home in the night $	18	39	tip	We have n't seen hide nor hair of neither of ' em yet , and they must have tipped over coming home in the night .	fic_1860_9165.txt-4471-18
as the plank tip $ the body slide off slowly $ and fall with a splash into the sea $	3	39	tip	As the plank tipped , the body slid off slowly , and fell with a splash into the sea .	fic_1847_1094.txt-718-3
my own particular water-sulky $ a $ skeleton $ or $ shell $ race-boat $ twenty- two foot long $ with huge outrigger $ which boat i pull with ten- foot scull $ $ $ alone $ of course $ as it hold but one $ and tip him out $ if he do n't mind what he	47	39	tip	My own particular water-sulky , a " skeleton " or " shell " race-boat , twenty- two feet long , with huge outriggers , which boat I pull with ten- foot sculls , - - alone , of course , as it holds but one , and tips him out , if he does n't mind what he	fic_1859_270.txt-2412-47
with the greatest precaution $ and $ glance every moment towards the bed $ and almost tip himself over in his anxiety to walk softly $ advance to the rude door $ which open with a wooden latch and string $ open it carefully $ and look out $	16	39	tip	with the greatest precaution , and , glancing every moment towards the bed , and almost tipping himself over in his anxiety to walk softly , advanced to the rude door , which opened with a wooden latch and string , opened it carefully , and looked out .	fic_1856_9852.txt-2080-16
well $ the jacksonites take the dose in one hand $ and grab have the huntonites with the other $ and tip their head back $ and be just agoing to pour it down their throat $ when the huntonites fetch a spring and kick it away to the fourth day of april $	21	39	tip	Well , the Jacksonites took the dose in one hand , and grab 'd the Huntonites with the other , and tipped their heads back , and were jest agoing to pour it down their throats , when the Huntonites fetched a spring and kicked it away to the fourth day of April .	fic_1834_7323.txt-918-21
knock he then $ and tip the table $ polly run and scream for fear $ hadley cut as fast as able $ those unearthly knock to hear $	5	39	tip	Knocked he then , and tipped the table ; Polly ran and screamed for fear , Hadley cut as fast as able , Those unearthly knocks to hear .	fic_1854_7839.txt-517-5
we could not see the brig as she come on $ except by tip down the boat $ so we know we could not be see $ and it the boat be discover we hope they would pass it as a drift-boat $ and not take the trouble to heave to for it $	13	39	tip	We could not see the brig as she came on , except by tipping down the boat , so we knew we could not be seen ; and it the boat was discovered we hoped they would pass it as a drift-boat , and not take the trouble to heave to for it .	fic_1847_7124.txt-2094-13
the boat tip over ever so easy $ and do n't you think $ the other day $ when we be out with the girl $ we tip over right where the water be overhead $ and we all have to get onto her bottom $	2	39	tip	The boat tips over ever so easy , and do n't you think , the other day , when we were out with the girls , we tipped over right where the water was overhead , and we all had to get onto her bottom .	fic_1854_9230.txt-1889-2
but the third emir $ now see himself all alone on the quarter-deck $ seem to feel relieve from some curious restraint $ for $ tip all sort of know wink in all sort of direction $ and kick off his shoe $	25	39	tip	But the third Emir , now seeing himself all alone on the quarter-deck , seems to feel relieved from some curious restraint ; for , tipping all sorts of knowing winks in all sorts of directions , and kicking off his shoes ,	fic_1851_746.txt-3044-25
jump into the boat $ patty $ not the least danger in the world of its tip over $ $	16	39	tip	Jump into the boat , Patty ; not the least danger in the world of its tipping over . "	fic_1854_9230.txt-3551-16
if you have n't have come just as you do $ clin $ this chap would have be off like a shot from a shovel $ his young modesty be so shock just by my tell him the state of affair in the house here $ $ say quirk $ tip back in his chair against the wall $ while a sneer mingle in the smile upon his lip $ $	50	39	tip	If you had n't have come just as you did , Clin , this chap would have been off like a shot from a shovel , his young modesty was so shocked just by my telling him the state of affairs in the house here , " said Quirk , tipping back in his chair against the wall , while a sneer mingled in the smile upon his lips . "	fic_1857_3100.txt-2226-50
hearty 's toast be receive with such enthusiastic applause that $ amidst the confusion of the moment and the whisky $ in endeavour to make a dignified descent from the chair $ it tip over $ and he fall to the floor of the boon house $ as many have fall before him $ without the dignity attendant upon csar at the base of pompey 's statue $	33	39	tip	Hearty 's toast was received with such enthusiastic applause that , amidst the confusion of the moment and the whisky , in endeavouring to make a dignified descent from the chair , it tipped over , and he fell to the floor of the Boon House , as many had fallen before him -- without the dignity attendant upon Csar at the base of Pompey 's statue .	fic_1836_7330.txt-962-33
from its anchorage to the wharf its tall mast reach $ and tip with its wavy shadow the countenance of a quiet idler $	12	39	tip	From its anchorage to the wharf its tall mast reached , and tipped with its wavy shadow the countenance of a quiet idler ,	fic_1843_7208.txt-12479-12
you see $ i just tip jim stokes the wink $	5	39	tip	You see , I just tipped Jim Stokes the wink .	fic_1856_9797.txt-4973-5
it be as good as be ever tip over the tongue of king charles $ god help him $ and satan leave off help the queen and his bishop $	7	39	tip	It 's as good as was ever tipped over the tongue of king Charles , God help him , and Satan leave off helping the queen and his bishops .	fic_1824_7037.txt-401-7
th * floor of your room be slope at an angle of twenty or thirty degree $ and i wake every morning wit the belief that some one be tip up my berth	29	39	tip	Th * floor of your room is sloped at an angle of twenty or thirty degrees , and I waked every morning wit the belief that some one was tipping up my berth	mag_1856_566737.txt-60-29
interpose the judge $ tip his glass $ and prepare his appetite for the course of game-broiled partridges $ rice-birds $ and grouse-which be be serve by the waiter $ $	4	39	tip	interposes the Judge , tipping his glass , and preparing his appetite for the course of game-broiled partridges , rice-birds , and grouse-which is being served by the waiters . "	fic_1856_1281.txt-2260-4
soldier tip us the glass first $ dye see $ i like no song $ that go by wind alone $ so let us	1	39	tip	Soldier Tip us the glass first , dye see , I like no song , that goes by wind alone , so let us	fic_1815_8679.txt-689-1
you know that i could get a thousand dollar out of the old man for tip him the wink $ and i can n't afford to lose the rhino $	15	39	tip	You know that I could get a thousand dollars out of the old man for tipping him the wink , and I ca n't afford to lose the rhino .	fic_1860_9165.txt-3887-15
and your tame red skin have conclude to do the same thing $ i reckon $ see as how he get the mitten $ ' add the scout $ tip a know and saucy wink to zilpah $	29	39	tip	And your tame red skin has concluded to do the same thing , I reckon , seeing as how he got the mitten , ' added the scout , tipping a knowing and saucy wink to Zilpah .	fic_1839_7336.txt-2484-29
this last question be put in such a comic manner $ with that one eye tip up towards him $ that guly could not repress a smile $ but he cordially satisfy him on that point $ feel still able $ in spite of his diminish salary $ to pay for a beggar 's dinner $ which be more than many $ with their well fill purse $ can make themselves afford to do $	15	39	tip	This last question was put in such a comic manner , with that one eye tipped up towards him , that Guly could not repress a smile ; but he cordially satisfied him on that point , feeling still able , in spite of his diminished salary , to pay for a beggar 's dinner , which is more than many , with their well filled purses , can make themselves afford to do .	fic_1857_3100.txt-2926-15
go draw the cork $ tip the decanter $ but $ when your great toe shall set you a-roaring $ it will be no affair of mine $	5	39	tip	Go draw the cork , tip the decanter ; but , when your great toe shall set you a-roaring , it will be no affair of mine .	fic_1837_7395.txt-2167-5
a long line of railroad president and superintendent have come to the depot to see him off $ and tip their hat as he glide out into the open air $	19	39	tip	A long line of railroad presidents and superintendents had come to the depot to see him off , and tipped their hats as he glided out into the open air .	fic_1847_2352.txt-1660-19
he inquire $ tip his chair against the bed $ the starry counterpane of which be surmount by the young man 's hat $ $	3	39	tip	he inquired , tipping his chair against the bed , the starry counterpane of which was surmounted by the young man 's hat . "	fic_1853_9040.txt-1508-3
with other accomplishment $ cheesy have learn to smoke $ and often $ in the evening $ you may see him stand in the door-way of some public building $ with his hat tip jauntily one side $ puff his penny cigar $ and ogle the crowd $	33	39	tip	With other accomplishments , Cheesy has learned to smoke ; and often , in the evening , you may see him standing in the door-way of some public building , with his hat tipped jauntily one side , puffing his penny cigar , and ogling the crowd .	fic_1854_9826.txt-9894-33
upon my life $ now $ but you can n't have much comfort aboard here $ $ speak the frisky little man $ in a voice of singular effeminacy $ as he tip the narrow brimmed glaze hat that have cover his narrow head	32	39	tip	Upon my life , now , but you ca n't have much comfort aboard here , " spoke the frisky little man , in a voice of singular effeminacy , as he tipped the narrow brimmed glazed hat that had covered his narrower head	fic_1858_1282.txt-2252-32
all this i do see $ and i see it either while i be on the top of that rock $ hold by the flag-staff $ afraid to move lest the rock should tip over among the house $ and afraid to let go $ lest i should be blow away $ or i see it $ after i have escape $ but furthermore i can not say $ for while i be look about me and wonder at the beauty of the	33	39	tip	All this I did see , and I saw it either while I was on the top of that rock , holding by the flag-staff , afraid to move lest the rock should tip over among the houses , and afraid to let go , lest I should be blown away ; or I saw it , after I had escaped ; but furthermore I can not say , for while I was looking about me and wondering at the beauty of the	fic_1830_7238.txt-330-33
tip over the salt $ and the fat be in	0	39	tip	Tip over the salt , and the fat 's in	fic_1854_7839.txt-1455-0
and as she speak she tip one of the minim off a chair $ offer the vacate seat to the gentleman $ who $ not notice that it be a nursing-chair $ some three or four inch low than usual $ plump into it after a peculiar fashion $ a specimen of bathos far less amusing to the young officer than to the infant larkinses $ who burst into a very natural laugh $ $	5	39	tip	And as she spoke she tipped one of the minims off a chair , offering the vacated seat to the gentleman , who , not noticing that it was a nursing-chair , some three or four inches lower than usual , plumped into it after a peculiar fashion , a specimen of bathos far less amusing to the young officer than to the infant Larkinses , who burst into a very natural laugh . "	fic_1845_7183.txt-3218-5
in the description one or two of the distinctive marks be omit $ such as the white spot below the eye and behind the cheek $ but it appear to correspond to the character which belong to this species in all other respect $ except that it be somewhat long and have its ear // tip with black $ which be a characteristic of the lepus timidus $ or common hare of europe $	55	41	tip	In the description one or two of the distinctive marks are omitted , such as the white spots below the eyes and behind the cheeks , but it appears to correspond to the characters which belong to this species in all other respects , except that it is somewhat longer and has its ears // tipped with black , which is a characteristic of the Lepus Timidus , or common hare of Europe .	mag_1822_553396.txt-163-55
why do not our traveler $ tip em the siller $ $	6	42	tip	Why did not our traveler " tip em the siller ? "	mag_1833_564542.txt-49-6
go draw the cork $ tip the decanter $ but $ when your great toe shall set you a-roaring $ it will be no affair of mine $	5	43	tip	Go draw the cork , tip the decanter ; but , when your great toe shall set you a-roaring , it will be no affair of mine .	mag_1837_554498.txt-233-5
$ sir $ ' say one of the fellow $ pocket his xx_v $ and give the other to his companion $ ' we can n't exactly let you go $ but if you tip us over and run for it $ perhaps we sha n't be able to overtake you $ '	34	43	tip	, sir , ' said one of the fellows , pocketing his V , and giving the other to his companion -- ' we ca n't exactly let you go , but if you tip us over and run for it , perhaps we sha n't be able to overtake you . '	fic_1849_5168.txt-4258-34
i can n't see three sea off $ tip us up an oar there $ and let me on to that $ $	8	43	tip	I ca n't see three seas off ; tip us up an oar there , and let me on to that . "	fic_1851_746.txt-4461-8
it be pleasant $ in the summer forenoons $ $ when the fervent heat $ that almost liquefy the rest of the human family $ merely communicate a genial warmth to their half-torpid system $ $ it be pleasant to hear them chat in the back entry $ a row of them all tip against the wall $ as usual $ while the freeze witticism of past generation be thaw out $ and come bubble with laughter from their lip $	53	43	tip	It was pleasant , in the summer forenoons , -- when the fervent heat , that almost liquefied the rest of the human family , merely communicated a genial warmth to their half-torpid systems , -- it was pleasant to hear them chatting in the back entry , a row of them all tipped against the wall , as usual ; while the frozen witticisms of past generations were thawed out , and came bubbling with laughter from their lips .	fic_1850_4498.txt-189-53
must heave anchor $ for as i tip you a glass or so since $ the little gentleman who be rig in black velvethath ship the province a new ruler $ but the dog be wind bind at catsdown $ and be damn to him $ thof diabolo $ his convoy parting company $ have bring to in the very jaw of the sound $ we slipt her in the fog $ and be it not for policy $ in spite of her iron tooth $ we have muzzle her $ but d'ye see $ they might send the dispatch in a leaden cannister to the sea 's bottom $ so mark me $ dutchman $ without spin a long yarn $ we must have her paper or our jig be up $ for thof we have friend in old england $ as kid say $ who will bring us off $ it be hard to treat with the conqueror after the flag be down $ now ere i steer here $ a canoe row for the creek in which be the king 's messenger $ the galliot herself $ i	7	43	tip	must heave anchor -- for as I tipped you a glass or so since , the little gentleman who 's rigged in black velvethath shipped the province a new ruler -- but the dog is wind bound at Catsdown , and be damned to him : thof diabolo , his convoy parting company , hath brought to in the very jaw of the sound ; we slipt her in the fog , and were it not for policy , in spite of her iron teeth , we 'd muzzle her -- but d'ye see , they might send the despatch in a leaden cannister to the sea 's bottom ; so mark me , Dutchman , without spinning a long yarn , we must have her papers or our jig 's up ; for thof we have friends in Old England , as Kid says , who will bring us off , it is hard to treat with the conqueror after the flag 's down : now ere I steered here , a canoe rowed for the creek in which was the king 's messenger ; the galliot herself , I	fic_1827_7168.txt-796-7
strain be not sorry he have act on the hint of the landlord at casa bianca and propitiate the driver $ for nothing be easy than for them to save themselves and yet $ at the same time $ tip the occupant of the birlocna to hades below $	39	43	tip	Strain was not sorry he had acted on the hint of the landlord at Casa Bianca and propitiated the drivers , for nothing was easier than for them to save themselves and yet , at the same time , tip the occupants of the birlocna to Hades below .	mag_1858_506205.txt-54-39
here be a gentleman will bet with you $ ' he add $ address a crony of his $ and tip him the wink $ i say $ mister $ take this gentleman 's bet $ and $	20	43	tip	Here 's a gentleman 'll bet with you , ' he added , addressing a crony of his , and tipping him the wink ; I say , Mister , take this gentleman 's bet , and ,	fic_1846_7136.txt-1711-20
nor be he a whit behind the major in tip his glass $ and though there be a review on the following day $ to which they have invite the major $ out of sheer respect to his fame	9	43	tip	Nor was he a whit behind the major in tipping his glass ; and though there was a review on the following day , to which they had invited the major , out of sheer respect to his fame	fic_1858_1282.txt-3308-9
he boldly tip the wink to the bar-maid $ at such genteel place as the madison house $ sip $ and pull up his shirt collar with a jaunty air $ and sometimes will sit down to a quiet rubber of whist $ in the back parlor $	2	43	tip	He boldly tips the wink to the bar-maid , at such genteel places as the Madison House -- sips , and pulls up his shirt collars with a jaunty air , and sometimes will sit down to a quiet rubber of whist , in the back parlor .	fic_1850_7222.txt-216-2
this process through the past $ our author trace tip to the point where $ xvith a redundant population $	9	44	tip	This process through the past , our author traces tip to the point where , with a redundant population .	mag_1850_565940.txt-174-9
the whole be enclose with an iron railing tip with gold near the palace $ and terrace have a double row of tile tree be raise along the north and south side $	8	58	tip	The whole is enclosed with an iron railing tipped with gold near the Palace , and terraces having a double row of tile trees are raised along the north and south sides .	nf_1838_747482.txt-1255-8
this be urge on by give them whiskey $ make bet on them $ lay chip on one slave 's head $ and dare another to tip it off with his hand $ and if he tip it off $ it would be call an insult $ and cause a fight $	36	59	tip	This is urged on by giving them whiskey ; making bets on them ; laying chips on one slave 's head , and daring another to tip it off with his hand ; and if he tipped it off , it would be called an insult , and cause a fight .	nf_1849_762578.txt-385-36
there be two species or variety $ <nul> rubra $ with shining red berry $ and <nul> alba $ with milkwhite berry $ tip with red $	23	60	tip	There are two species or varieties : A. rubra , with shining red berries , and A. alba , with milkwhite berries , tipped with red .	nf_1851_747930.txt-1125-23
this be of the same height as the preceding $ flower at the same time $ flower much large $ one variety white $ tip with red $ another yellow $ tip in the same way $ all be easily cultivate in a rich $ loamy soil $	31	61	tip	This is of the same height as the preceding , flowering at the same time ; flowers much larger ; one variety white , tipped with red ; another yellow , tipped in the same way ; all are easily cultivated in a rich , loamy soil .	nf_1851_747930.txt-2962-31
the chamois figure largely $ there be pouch make of chamois skin $ walk stick and alpenstocks tip with chamois horn $ sometimes an entire skin $ horn and all $ hang disconsolately downward $	17	62	tip	The chamois figures largely ; there are pouches made of chamois skin , walking sticks and alpenstocks tipped with chamois horn ; sometimes an entire skin , horns and all , hanging disconsolately downward .	nf_1854_755030.txt-2999-17
