sentence_lemma	target_index	cluster	lemma	sentence_token	identifier
arrah $ now $ master $ be asy $ and just tip a little bit of a prayer $ and a blessing with it $ for me every night $	11	0	tip	Arrah , now , master , be asy -- and just tip a little bit of a prayer , and a blessing with it , for me every night .	fic_1823_7214.txt-408-11
he be of a middling stature $ incline to corpulency $ with a sanguine complexion $ a low forehead deeply shade with bushy black hair $ that absolutely refuse to conform to the sleekness of his order $ a keen gray eye $ which have a peculiarly cunning expression from a trick he have early acquire $ and of which he could never rid himself $ of tip a know wink $ a short thick nose turn upward $ a wide mouth $ with the corner sanctimoniously draw down $ and a prominent fat chin follow the direction of his nose $	67	1	tip	He was of a middling stature , inclining to corpulency ; with a sanguine complexion , a low forehead deeply shaded with bushy black hair , that absolutely refused to conform to the sleekness of his order ; a keen gray eye , which had a peculiarly cunning expression from a trick he had early acquired , and of which he could never rid himself , of tipping a knowing wink ; a short thick nose turning upward ; a wide mouth , with the corners sanctimoniously drawn down , and a prominent fat chin following the direction of his nose .	fic_1824_7277.txt-826-67
splinter $ yet as the person speak of be a tall man $ and warped in the shoulder $ he make out to look down on such petty malice $ so have conquer all thing and opposer at home $ mynheer $ who be not one to lay and rust like a nail $ bethought him of an astonishing idea $ no less than of make a visit to the vaderland $ for the sake of improvement $ and be polish like a gentleman $ so have petition the honorable and awful council of antony colve for permission $ which be grant $ to depart $ with the addition of that excellent warrior be give mynheer a military travel title $ $ though by the by $ he have never handle any weapon except a see or a hammer $ $ he set out $ and after a time return so much edify and smooth by his journey $ that the whole colony be throw in amazement $ without denial $ he be surprisingly alter $ and it be astonishing to hear him tip his daden $ ' that be $	183	2	tip	splinters -- yet as the person spoken of was a tall man , and warped in the shoulders , he made out to look down on such petty malice : so having conquered all things and opposers at home , Mynheer , who was not one to lay and rust like a nail , bethought him of an astonishing idea -- no less than of making a visit to the Vaderland , for the sake of improvement , and being polished like a gentleman : so having petitioned the honourable and awful council of Antony Colve for permission , which was granted , to depart , with the addition of that excellent warrior 's giving Mynheer a military travelling title : ( though by the by , he had never handled any weapon except a saw or a hammer : ) he set out , and after a time returned so much edified and smoothed by his journey , that the whole colony was thrown in amazement : without denial , he was surprisingly altered -- and it was astonishing to hear him tip his daden , ' that is ,	fic_1827_7168.txt-909-183
why $ .... hesitate .... why $ a $ a $ tip him a fee middleton $ say gage in a whisper $	11	3	tip	Why , ... hesitating ... why -- a -- a -- Tip him a fee Middleton , said Gage in a whisper .	fic_1833_7239.txt-2507-11
the word of peace which they have just hear seem to have avail them but little $ for every brow be blacken $ and every tongue tip with oath and execration $	26	4	tip	The words of peace which they had just heard seemed to have availed them but little , for every brow was blackened , and every tongue tipped with oaths and execrations .	fic_1834_2652.txt-2205-26
it be then $ when the $ grim-visaged $ ocean have $ smooth his wrinkled front $ $ $ when the wind of heaven be hush to gentle air $ and the cloudless moon look down upon the scene $ tip the crest of the lazy wave with silver $ $ that the memory and imagination of the wanderer be busy $ it be then that the scene of childhood and of manhood $ the form of friend $ more love because sunder from them by thousands of mile of water and land $ all rise before him in original freshness and beauty $	40	5	tip	It is then , when the " grim-visaged " ocean has " smoothed his wrinkled front , " -- when the winds of heaven are hushed to gentle airs , and the cloudless moon looks down upon the scene , tipping the crests of the lazy waves with silver , -- that the memory and imagination of the wanderer are busy ; it is then that the scenes of childhood and of manhood -- the forms of friends , more loved because sundered from them by thousands of miles of water and land -- all rise before him in original freshness and beauty .	fic_1835_5605.txt-2415-40
$ the moon be in its western field $ white and clear as silver $ with which it tip the burst wave $	18	5	tip	-- The moon was in its western field , white and clear as silver , with which it tipped the bursting waves .	fic_1843_7116.txt-400-18
this be of the same height as the preceding $ flower at the same time $ flower much large $ one variety white $ tip with red $ another yellow $ tip in the same way $ all be easily cultivate in a rich $ loamy soil $	24	5	tip	This is of the same height as the preceding , flowering at the same time ; flowers much larger ; one variety white , tipped with red ; another yellow , tipped in the same way ; all are easily cultivated in a rich , loamy soil .	nf_1851_747930.txt-2962-24
the mourner form a lane from the altar to the door $ each hold a long $ unlighted $ wax taper $ tip at the large end with red $ and ornament with fanciful paper cutting $	22	6	tip	The mourners formed a lane from the altar to the door , each holding a long , unlighted , wax taper , tipped at the larger end with red , and ornamented with fanciful paper cuttings .	fic_1835_7133.txt-1239-22
this say $ cook $ the attorney of the commonwealth $ who sit close to the person of the prisoner $ rise to address the court $ but the king $ have in his hand a staff of ebony $ tip with a little head of silver $ lay it upon his shoulder $ and $ in the deep tone of authority $ command him to $ hold $ $	40	7	tip	This said , Cook , the attorney of the commonwealth , who sat close to the person of the prisoner , rose to address the court ; but the king , having in his hand a staff of ebony , tipped with a little head of silver , laid it upon his shoulder , and , in the deep tones of authority , commanded him to " Hold ! "	fic_1838_7145.txt-1698-40
the major then make a hasty toilet $ and together they enter the western dining room $ the size and splendor of which quite astonish him $ for the wall be inlaid with mirror from the ceiling to the floor $ and reflect the guest and each object with which the table be set out $ while the ceiling overhead be decorate with fresco and stucco work tip with gold $	67	7	tip	The major then made a hasty toilet , and together they entered the western dining room , the size and splendor of which quite astonished him , for the walls were inlaid with mirrors from the ceiling to the floor , and reflected the guests and each object with which the table was set out , while the ceiling overhead was decorated with frescoes and stucco work tipped with gold .	fic_1858_1282.txt-2858-67
<nul> borrusorum rex $ <nul> robustum niveum $ <nul> macanthrum $ white and yellow <nul> $ tip with purple $ and the variety approach purple ae very fine $	16	7	tip	H. borrusorum rex , H. robustum niveum , H. macanthrum , white and yellow variotf.es , tipped with purple , and the varieties approaching purple ae very fine .	nf_1851_747930.txt-6012-16
he could n't look upon their wonderous and perfect mechanism with a cold or unbelieving heart $ but his best and warm affection go upward with their sweet odor $ and be acceptable to him who have tip every petal with a heavenly message $	37	7	tip	He could n't look upon their wonderous and perfect mechanism with a cold or unbelieving heart ; but his best and warmest affections went upward with their sweet odor , and were acceptable to Him who had tipped every petal with a heavenly message .	fic_1856_5515.txt-2714-37
in his right hand he wield $ with an air of mighty importance $ a slender black rod tip with silver $ from which hang at one end a small slip of black crape $ and <nul> narrow leather thong be tie to the other end-symbolical $ it be think $ of the summary course of justice in corea $	18	7	tip	In his right hand he wielded , with an air of mighty importance , a slender black rod tipped with silver , from which hung at one end a small slip of black crape , and a. narrow leather thong was tied to the other end-symbolical , it was thought , of the summary course of justice in Corea .	mag_1828_553914.txt-171-18
we have bring the sun 's ray $ they shall make thee a pen that shall tip as with fire all thy word unto man $ and we will bring thee for paper $ on which thou shall write all thy song of pure joy $ and thy vision of night $ e'en the cloud in our heaven $ in their light and their shade $ with the gleam of pale sunshine that over them stray $	16	7	tip	We have brought the sun 's rays -- they shall make thee a pen That shall tip as with fire all thy words unto men ; And we 'll bring thee for paper , on which thou shalt write All thy songs of pure joy , and thy visions of night , E'en the clouds in our heaven , in their lights and their shade , With the gleams of pale sunshine that over them strayed .	fic_1841_8921.txt-336-16
still he blench not $ but make a desperate lunge with the tough horn tip bow $ full at the open mouth and yawn throat of his assailant $	14	7	tip	Still he blenched not , but made a desperate lunge with the tough horn tipped bow , full at the open mouth and yawning throat of his assailant .	fic_1844_7148.txt-96-14
they expand $ the spotless white of its gaping corolla be exhibit $ with its protruding stamen tip with yellow anther $	17	7	tip	they expand , the spotless white of its gaping corolla is exhibited , with its protruding stamens tipped with yellow anthers .	nf_1851_747930.txt-3721-17
$ the assault irresistible $ $ $ how would you like to go it in uncle billy shakspeare $ and tip the native the last hagony in the tragics $ $	20	8	tip	-- the assault irresistible , -- " how would you like to go it in uncle Billy Shakspeare , and tip the natives the last hagony in the tragics ? "	fic_1838_7250.txt-1578-20
it be smashing work $ but it will n't do for you $ spooney $ you be little $ black-muzzled $ queer in the leg $ and have get a cold $ nature and sleep with the window open have do wonder in make you fit for the hintellectuals $ and you shall tip ' em the sentimental in hamlet $ $	53	8	tip	It 's smashing work , but it wo n't do for you , Spooney ; you 're little , black-muzzled , queer in the legs , and have got a cold ; nature and sleeping with the windows open have done wonders in making you fit for the hintellectuals , and you shall tip ' em the sentimental in Hamlet . "	fic_1838_7250.txt-1616-53
in the rear of the company of spear-men march a strong body of common soldier $ bear the customary mound-builders ' instrument of war $ namely $ vast steel bow six foot or more in length $ and quiver fill with correspondent shaft tip with poison $ and on their left arm bear the usual shield of copper with boss of silver $	43	9	tip	In the rear of the company of spear-men marched a strong body of common soldiers , bearing the customary Mound-builders ' instruments of war , namely , vast steel bows six feet or more in length , and quivers filled with correspondent shafts tipped with poisons , and on their left arms bearing the usual shield of copper with bosses of silver .	fic_1839_7204.txt-433-43
you know $ be not a stoic $ though here one ought to be $ $ beg your permission $ in a few line $ and somewhat less heroic than be these first $ to send you his petition $ $ which humbly showeth $ $ here be four as hearty man as walk the planet $ who be run up a frightful score $ $ ' t be now five day since we begin it $ $ for baked $ stew $ roast $ with mcalif $ footnote $ 1kb and $ as we be earn nothing here $ but eat beef and drink beer $ $ we speak not now of eau de vie $ and rum $ and lemon ratafia $ footnote $ 1kb $ we really begin to fear that we shall all be after meeting $ on our way homeward $ a $ bum-bailiff $ $ with his tip staff $ and civil $ greeting $ $	153	10	tip	you know , is not a stoic ( Though here one ought to be ) , begs your permission , In a few lines , and somewhat less heroic Than are these first , to send you his petition ; -- Which humbly showeth ; -- Here are four As hearty men as walked the planet , Who 're running up a frightful score , ( ' T is now five days since we began it , ) For baked , stewed , roasted , with McAlif ; Footnote : 1Kb And , as we 're earning nothing here , But eating beef and drinking beer , -- We speak not now of eau de vie , And rum , and lemon ratafia , Footnote : 1Kb -- We really begin to fear That we shall all be after meeting , On our way homeward , a " bum-bailiff , " With his tipped staff , and civil " greeting . "	fic_1840_7681.txt-2114-153
though the pen be tip with fire $ to touch the soul $ and teach it to aspire $	4	11	tip	though the pen was tipped with fire , To touch the soul , and teach it to aspire .	fic_1841_8921.txt-435-4
her eye be as bright as star $ and her slender hand $ tip with their pink nail $ as white as the lily $ her tiny foot $ encase in cinderella slipper of rose-hued satin $ peep out from beneath ample turkish trouser $ which be semi-transparent and disclose the outline of her beautifully turn limb $ she wear a close-fitting gilet of pearly silk $ adorn with gilt fringe and cut low $ display her snowy neck and magnificent shoulder $ her arm be encompass but not hide by flow sleeve of filmy gauze as fine as the tissue of a spider 's web $ about her neck flash a collar of brilliant diamond of enormous value $ and on her taper finger be ring of emerald $ ruby and sapphire $ on her head be a red fez $ precisely	13	12	tip	Her eyes were as bright as stars , and her slender hands , tipped with their pink nails , as white as the lily ; her tiny feet , encased in Cinderella slippers of rose-hued satin , peeped out from beneath ample Turkish trousers , which were semi-transparent and disclosed the outlines of her beautifully turned limbs ; she wore a close-fitting gilet of pearly silk , adorned with gilt fringe and cut low , displaying her snowy neck and magnificent shoulders ; her arms were encompassed but not hidden by flowing sleeves of filmy gauze as fine as the tissue of a spider 's web ; about her neck flashed a collar of brilliant diamonds of enormous value , and on her tapering fingers were rings of emerald , ruby and sapphire ; on her head was a red fez , precisely	fic_1844_3928.txt-355-13
tip us a sixpenny then $ miss $ and no blarney $ '	0	13	tip	Tip us a sixpenny then , Miss , and no blarney . '	fic_1844_7081.txt-1439-0
$ and here i have live and work for near five year $ until captain tracy $ and a likely boy he be too $ tip me the wink $ and then i follow him to the war $ and maybe i have n't be a bad thorn in the side of the britisher $ $	25	14	tip	" And here I 've lived and wrought for near five years , until Captain Tracy , and a likely boy he is too , tipped me the wink , and then I followed him to the wars , and maybe I have n't been a bad thorn in the side of the Britishers ? "	fic_1844_7187.txt-489-25
she treasure up all the old tradition $ and though she repeat them truly $ they come from her mouth in brighter picture than from other $ because she tip all the edge with her own golden fancy $	29	15	tip	She treasured up all the old traditions , and though she repeated them truly , they came from her mouth in brighter pictures than from others , because she tipped all the edges with her own golden fancy .	fic_1846_7036.txt-2226-29
his jest $ unlike some jest that we might name $ have nothing in them of a mouldy savor $ but fresh $ and apt $ and tip with point they come $ to put grim melancholy out of favor $ to drive imposture to his den of shame $ to scourge pretense $ and make true merit brave $ so that you grant $ after you have laugh $ though wit have feather $ truth have barbed the shaft $	27	15	tip	His jests , unlike some jests that we might name , Had nothing in them of a mouldy savor ; But fresh , and apt , and tipped with point they came , To put grim Melancholy out of favor ; To drive Imposture to his den of shame , To scourge Pretence , and make true Merit braver : So that you granted , after you had laughed , Though Wit had feathered , Truth had barbed the shaft .	fic_1849_8065.txt-361-27
the young mountaineer now eager to redeem the time $ unslung from his belt a horn $ tip with an agate from the brook $ and sound loud and long for a minute $ restore it to its place $ and follow his dog with athletic bound $ not even turn his eye again in the direction of the moorish cot beneath the tower $	17	16	tip	The young mountaineer now eager to redeem the time , unslung from his belt a horn , tipped with an agate from the brook , and sounding loud and long for a minute , restored it to its place , and followed his dog with athletic bounds , not even turning his eyes again in the direction of the Moorish cot beneath the tower .	fic_1846_7121.txt-955-17
tip us your bone $ say i $ and make yourself welcome $	0	17	tip	Tip us your bone , says I , and make yourself welcome .	fic_1846_8819.txt-1554-0
$ faith $ now $ $ chime in teddy $ tip me the wink $ $ the man that would n't belave all that asy $ would n't belave that the moon be make o ' graan chaase $ nor that metooselah $ blissings on his name of scripter mimory $ $	10	18	tip	" Faith , now , " chimed in Teddy , tipping me the wink , " the man that would n't belave all that asy , would n't belave that the moon 's made o ' graan chaase , nor that Metooselah ( blissings on his name of scripter mimory ! )	fic_1849_7006.txt-1314-10
by the mirror 's show while thou never wilt know thy beauty $ nor proudly thy jewel bear $ every leaf on thy stem shall be tip with a gem $ every bud sparkle diamond shall wear $	26	19	tip	By the mirror 's show While thou ne'er wilt know Thy beauty , nor proudly thy jewels bear , Every leaf on thy stem Shall be tipped with a gem , Every bud sparkling diamonds shall wear !	fic_1850_7953.txt-1480-26
coffee-bean $ - when lawyer take what they would give $ and doctor give what they would take $ - when city father eat to live $ save when they fast for conscience ' sake $ - when one that have a horse on sale shall bring his merit to the proof $ without a lie for every nail that hold the iron on the hoof $ - when in the usual place for rip our glove be stitch with special care $ and guard well the whalebone tip where first umbrella need repair $ - when cuba 's weed have quite forget the power of suction to resist $ and claret-bottles harber not such dimple as would hold your fist $ - when publisher no long steal $ and pay for what they steal before $ - when the first locomotive 's wheel roll through the hoosac tunnel 's bore $ - till then let cumming a blaze away $ and miller 's saint blow up the globe $ but when you see that bless day $ then order your ascension robe $	88	19	tip	coffee-bean , - When lawyers take what they would give , And doctors give what they would take , - When city fathers eat to live , Save when they fast for conscience ' sake , - When one that hath a horse on sale Shall bring his merit to the proof , Without a lie for every nail That holds the iron on the hoof , - When in the usual place for rips Our gloves are stitched with special care , And guarded well the whalebone tips Where first umbrellas need repair , - When Cuba 's weeds have quite forgot The power of suction to resist , And claret-bottles harber not Such dimples as would hold your fist , - When publishers no longer steal , And pay for what they stole before , - When the first locomotive 's wheel Rolls through the Hoosac tunnel 's bore ; - TILL then let Cumming a blaze away , And Miller 's saints blow up the globe ; But when you see that blessed day , THEN order your ascension robe !	fic_1859_270.txt-401-88
another love the spaniard because they have give him a stick tip with silver $	11	19	tip	Another loved the Spaniards because they had given him a stick tipped with silver .	nf_1854_750818.txt-3005-11
vast swell of the omnipotent sea $ the surging $ hollow roar they make $ as they roll along the eight gunwale $ like gigantic bowl in a boundless bowling-green $ the brief suspend agony of the boat $ as it would tip for an instant on the knife-like edge of the sharpe wave $ that almost seem threaten to cut it in two $ the sudden profound dip into the watery glen and hollow $ the keen spurring and goading to gain the top of the opposite hill $ the headlong $ sled-like slide down its other side $ $ all these $ with the cry of the headsmen and harpooneers $ and the shudder gasp of the oarsman $ with the wondrous sight of the ivory pequod bear down upon her boat with outstretched sail $ like a wild hen after her scream brood $ $ all this be thrilling $	42	20	tip	vast swells of the omnipotent sea ; the surging , hollow roar they made , as they rolled along the eight gunwales , like gigantic bowls in a boundless bowling-green ; the brief suspended agony of the boat , as it would tip for an instant on the knife-like edge of the sharper waves , that almost seemed threatening to cut it in two ; the sudden profound dip into the watery glens and hollows ; the keen spurrings and goadings to gain the top of the opposite hill ; the headlong , sled-like slide down its other side ; -- all these , with the cries of the headsmen and harpooneers , and the shuddering gasps of the oarsmen , with the wondrous sight of the ivory Pequod bearing down upon her boats with outstretched sails , like a wild hen after her screaming brood ; -- all this was thrilling .	fic_1851_746.txt-4519-42
he be on his way to the bend meadow $ and passing close by winthrop at the spring $ the opportunity be too good to be resist $ he tip him over into the water $	29	21	tip	He was on his way to the bend meadow , and passing close by Winthrop at the spring , the opportunity was too good to be resisted ; he tipped him over into the water .	fic_1852_2751.txt-85-29
well $ i go back with the beer $ and just as bridget be tip the glass up to her thick lip $ jim bound behind her like a panther $ and hold her arm tight while i take little biddy and scamper into the house $	14	22	tip	Well , I went back with the beer , and just as Bridget was tipping the glass up to her thick lips , Jim bounded behind her like a panther , and held her arms tight while I took little Biddy and scampered into the house .	fic_1853_3465.txt-1988-14
among the $ unrecognized dead $ by the late railroad accident $ be a female child $ about three year of age $ fair complexion and hair $ have on a red dress $ green sack $ white apron $ linen gaiter $ tip with patent leather $ and white woolen stocking $	43	23	tip	Among the " unrecognized dead " by the late RAILROAD ACCIDENT , was a female child , about three years of age ; fair complexion and hair ; had on a red dress , green sack , white apron , linen gaiters , tipped with patent leather , and white woolen stockings .	fic_1853_3465.txt-250-43
and many be the time he be tip aunt fanny 's venerable nose with indigo $	7	24	tip	and many 's the time he 's tipped Aunt Fanny 's venerable nose with indigo .	fic_1853_3465.txt-428-7
the cupid of the ancient hindoos tip his arrow with flower $ and orange bud be the bridal crown with us $ a nation of yesterday $	6	24	tip	The Cupid of the ancient Hindoos tipped his arrows with flowers , and orange buds are the bridal crown with us , a nation of yesterday .	fic_1843_7039.txt-2779-6
those uncomfortable person $ however $ be not yet satisfied $ and tip their tongue with the unkind venom of all $ they begin to talk of a wealthy and accomplished young lady $ somewhere $ whom it be rumor the doctor be shortly to marry $ in spite of little flirtation at home $ that some people think mean something $	12	25	tip	Those uncomfortable persons , however , were not yet satisfied , and tipping their tongues with the unkindest venom of all , they began to talk of a wealthy and accomplished young lady , somewhere , whom it was rumored the doctor was shortly to marry , in spite of little flirtations at home , that some people thought meant something .	fic_1853_9040.txt-443-12
at early dawn $ the day following clifton 's receipt of the challenge $ a row-boat with two oarsman and five passenger might be observe move over the placid surface of the noble river $ towards this picturesque and secluded spot $ and just as the sunbeam tip the summit of the mountain $ the party disembark $ and clifton $ ellingbourne $ matthison $ shafton $ and the surgeon proceed to the execution of their hostile purpose $	47	25	tip	At early dawn , the day following Clifton 's receipt of the challenge , a row-boat with two oarsmen and five passengers might be observed moving over the placid surface of the noble river , towards this picturesque and secluded spot ; and just as the sunbeams tipped the summit of the mountains , the party disembarked ; and Clifton , Ellingbourne , Matthison , Shafton , and the surgeon proceeded to the execution of their hostile purpose .	fic_1839_7067.txt-1486-47
