sentence_lemma	sentence_token	target_index	original_word
wild madness of despair could conjure up $ come flit by like cloud that be gather in the train of a midnight storm when it muster in wrath $ the past $ though dreary $ look not so bleak and cheerless and black as that to come $ it be a long and darksome track $ such as be show to the faint traveler's eye by the lightning on a desert wold $ but yet mid- all he weep not $ no tear-drop dim his sight $ but his eyelid grow hot $ like curtain of burn fire $ and the ball stand unmoved $ full and wide $ nor turn to either side in their glassy gaze $ and when excite by the anguish of his mind $ forgetful of bondage $ he would strive to start from earth $ and twist and writhe in his bond until the blood would trickle from their stretch and tighten clasp $ and break his convulsive dream $ then recall to reality by the agony of his wring limb $ he would give over the vain and idle strife which but increased	wild madness of despair could conjure up , came flitting by like clouds that are gathered in the train of a midnight storm when it musters in wrath ; the past , though dreary , looked not so bleak and cheerless and black as that to come : it was a long and darksome track , such as is shown to the fainting traveller's eye by the lightning on a desert wold ; but yet mid all he wept not ; no tear-drop dimmed his sight , but his eyelids grew hot , like curtains of burning fire , and the balls stood unmoved , full and wide , nor turned to either side in their glassy gaze , and when excited by the anguish of his mind , forgetful of bondage , he would strive to start from earth , and twist and writhe in his bonds until the blood would trickle from their stretched and tightened clasp , and break his convulsive dream ; then recalled to reality by the agony of his wrung limbs , he would give o'er the vain and idle strife which but increased	142	twist
her cheek be red $ so be her nose $ so be her eye at time $ when the horny knob take a harder twist than usual $	Her cheeks were red ; so was her nose ; so were her eyes at times , when the horny knob took a harder twist than usual .	24	twist
this caoutchouc be occasionally call indian rubber or rubber of twist $ and be no doubt one of the numerous fungus $	This caoutchouc was occasionally called Indian rubber or rubber of twist , and was no doubt one of the numerous fungi .	10	twist
as for the jerk give to my neck upon the fall of the drop $ it merely prove a corrective to the twist afford me by the fat gentleman in the coach $	As for the jerk given to my neck upon the falling of the drop , it merely proved a corrective to the twist afforded me by the fat gentleman in the coach .	22	twist
jest say when $ cappin $ and i give him sich a twist as will make him see daylight in another world $ i reckon $	Jest say when , cappin , and I gives him sich a twist as will make him see daylight in another world , I reckon .	12	twist
with innumerable odd jerk and twist of his head and shoulder $ the boy be kick the article in question across the fade carpet $	With innumerable odd jerks and twists of his head and shoulders , the boy was kicking the article in question across the faded carpet .	5	twist
and so i think when i get near enough for my eye to look fairly into those black hole $ with a twist of foam around them $ that seem to screw $ as it be $ right down through the yaller water of konnedieyu $ $	And so I thought when I got near enough for my eyes to look fairly into those black holes , with a twist of foam around them , that seemed to screw , as it were , right down through the yaller water of Konnedieyu . "	22	twist
with these word $ my accomplished associate draw from his pocket a twist of tobacco $ which $ as he ride slowly along $ he bite into sundry small piece $ suitable for his purpose	With these words , my accomplished associate drew from his pocket a twist of tobacco , which , as he rode slowly along , he bit into sundry small pieces , suitable for his purpose	12	twist
to compass the contrivance of a twist traverse-net machine $	to compass the contrivance of a twist traverse-net machine .	6	twist
thus we continue work and solicit for the last eight month $ though the demand for yarn have be unprecedented $ and the consequent rise in twist great $ they have still refuse our just request $ and in order to cause a belief that trade be in a declining state $ give notice that they should only work three day in the week $ which appear so extremely ridiculous $ that the yery child employ	Thus we continued working and soliciting for the last eight months , though the demand for yarn has been unprecedented , and the consequent rise in twist great ; they have still refused our just request ; and in order to cause a belief that trade was in a declining state , gave notice that they should only work three days in the week , which appeared so extremely ridiculous , that the yery children employed	26	twist
cry the ruthless despot $ and $ at the word $ the trailer give but a single twist to the pistol $ and the boy scream aloud with his agony $	cried the ruthless despot ; and , at the word , the Trailer gave but a single twist to the pistol , and the boy screamed aloud with his agony .	17	twist
a fellow cann't drive tandem without have his leader always out of sight ' round some twist or other in ' em $	A fellow can't drive tandem without having his leader always out of sight ' round some twist or other in ' em .	16	twist
patrick molony here he be $ your honor $ pat give a sly twist from the ground and surprise him $	Patrick Molony Here he is , your honor -- Pat gave a sly twist from the ground and surprised him !	13	twist
the blessing of saint bridget be on you $ for you have save poor peter's neck from the twist $ master $ and the doctor will cure you in a week $ as sound as a church bell $ only now take a little of the swate stingo to warm your stomach $ dear $	the blessing of Saint Bridget be on you , for you have saved poor Peter's neck from the twist , master -- and the doctor will cure you in a week , as sound as a church bell -- Only now take a little of the swate stingo to warm your stomach , dear .	18	twist
this threat $ from one whom they have vest with authority for this occasion $ have a manifest effect upon his auditor $ who be presently highly work up by the sight of two or three little mound of tobacco twist $ which be now lay before them $ and appear to infuse new life $	This threat , from one whom they had vested with authority for this occasion , had a manifest effect upon his auditors , who were presently highly wrought up by the sight of two or three little mounds of tobacco twist , which were now laid before them , and appeared to infuse new life .	40	twist
he know i be the best friend about him $ whenever they get thing in any kind of a twist or a snarl $ say he $ major $ do you unravel that	He knows I am the best friend about him ; whenever they gets things in any kind of a twist or a snarl , says he , Major , do you unravel that	19	twist
it may seem strange $ very strange $ gentleman of the jury $ $ say he $ $ that in such weather $ a twist of paper like these $ $ hold up the note in two separate parcel $ and in such a way as to show that they be loosely and lightly twist at one end only $ the other end have be carefully unrol for verification $ $ should have attract the attention of the witness $ but he will inform you that they be blaze when they flutter by him $ and strike the snow $ and that just when he be about trample on them with his foot $ he see something which lead him to snatch them up	It may seem strange , very strange , gentlemen of the jury , " said he , " that in such weather , a twist of paper like these " -- holding up the notes in two separate parcels , and in such a way as to show that they were loosely and lightly twisted at one end only , the other ends having been carefully unrolled for verification -- " should have attracted the attention of the witness ; but he will inform you that they were blazing when they fluttered by him , and struck the snow , and that just when he was about trampling on them with his foot , he saw something which led him to snatch them up	24	twist
about the time when these discontent first break out $ archibald come accidentally in contact with a yankee name copely $ chester copely $ a strange $ cold blooded fellow $ with resolute feature $ light grey eye $ and a remarkably muscular $ sinewy frame $ of the middle size $ with a little twist in his neck $ to the leave $ that cost him many a pleasant gibe $	About the time when these discontents first broke out , Archibald came accidentally in contact with a yankee named Copely , Chester Copely -- a strange , cold blooded fellow , with resolute features , light grey eyes , and a remarkably muscular , sinewy frame ; of the middle size -- with a little twist in his neck , to the left , that cost him many a pleasant gibe .	55	twist
the ' count $ and run the chance of lettin congress skip ' em over $ and i tell have you too $ that i would to right get the gineral's spec $ and giv ' em a twist round to a plain sight $ and let him take a look at thing jest as they be $ without a bit of glory ' about ' em $	the ' counts , and run the chance of lettin Congress skip ' em over ; and I tell'd you too , that I would to rights git the Gineral's specs , and giv ' em a twist round to a plain sight , and let him take a look at things jest as they be , without a bit of glory ' about ' em .	37	twist
why $ ' answer the scout $ with his peculiar comic twist of feature $ i have actually see a sign or two $ that i have never know fail $ except in the dryest of time $	Why , ' answered the scout , with his peculiar comic twist of features , I have actually seen a sign or two , that I have never known fail , except in the dryest of times .	11	twist
frank have draw up his face into a very grave and confidential twist $ when mrs.- paget's equerry $ the young gentleman before mention $ offer his arm $ and $ give frank a withering look $ warn the lady of the time $ $	Frank had drawn up his face into a very grave and confidential twist , when Mrs. Paget's equerry , the young gentleman before mentioned , offered his arm , and , giving Frank a withering look , warned the lady of the time . "	12	twist
the diddler approach the bar of a tavern $ and demand a couple of twist of tobacco $	The diddler approaches the bar of a tavern , and demands a couple of twists of tobacco .	14	twist
$ but come $ veer away there on the larboard tack $ that be right $ $ we will be within hail $ and let fly a broadside $ in a twist of the $ tiller $ $ that be your sort $ steady $ so $ so $	-- But come -- veer away there on the larboard tack -- that's right , -- we'll be within hail , and let fly a broadside , in a twist of the " tiller " -- that's your sorts -- steady -- so -- so !	29	twist
the narves of the rigdum flagdum in circumnavigate through the humorous rusticus $ deflastigated by the horrentibus oribus sort o ' twist the aures arrectos into asinos $ and that you see $ to a man of larning make the whole thing as clear as one of elder sillyway's sarmons $ $	the narves of the rigdum flagdum in circumnavigating through the humorous rusticus , deflastigated by the horrentibus oribus sort o ' twist the aures arrectos into asinos , and that you see , to a man of larning makes the whole thing as clear as one of elder Sillyway's sarmons . "	21	twist
i say nothing for myself $ for this twist in my neck have become confoundedly troublesome of late $ and i be nothing to be compare with archibald $ as a swordsman $	I say nothing for myself , for this twist in my neck has become confoundedly troublesome of late ; and I am nothing to be compared with Archibald , as a swordsman .	8	twist
the pedler whistle to his mare and go up the hill $ ponder on the doleful fate of mr.- higginbotham $ whom he have know in the way of trade $ have sell him many a bunch of long nines $ and a great deal of pig-tail $ lady's twist $ and fig tobacco $	The pedler whistled to his mare and went up the hill , pondering on the doleful fate of Mr. Higginbotham , whom he had known in the way of trade , having sold him many a bunch of long nines , and a great deal of pig-tail , lady's twist , and fig tobacco .	49	twist
mr.- leycraft's case be a very bad one $ ' say the keeper with his twist in his mouth $	Mr. Leycraft's case is a very bad one , ' says the keeper with his twist in his mouth .	15	twist
do not i $ sixty year ago $ lie on the shelf and laugh as i see her stand by the half hour before the glass $ give an extra twist to her curl and an additional dash of white powder on her hair $ now fret because the powder be too thick $ now fret because it be too thin $	Did not I , sixty years ago , lie on the shelf and laugh as I saw her stand by the half hour before the glass , giving an extra twist to her curl and an additional dash of white powder on her hair -- now fretted because the powder was too thick , now fretted because it was too thin ?	30	twist
from seven o'clock a.m.-that till ten p.m. affair be in a twist $	From seven o'clock a.m. till ten p.m. affairs are in a twist .	11	twist
urge the squire $ toy with a bit of twist upon the table $ $	urged the Squire , toying with a bit of twist upon the table . "	9	twist
nor be there any occasion for the service of the cake-making $ candified $ sweet-scented confectioner $ that know the most fashionable $ and last approve spice use for his cake $ or the late twist $ and the most graceful curve his candy should be work into $	Nor is there any occasion for the service of the cake-making , candified , sweet-scented confectioner , that knows the most fashionable , and last approved spices used for his cakes , or the latest twist , and the most graceful curves his candies should be wrought into .	35	twist
suppose that y o be the distance you intend the center of the scroll to be from the beginning of the twist $ from o draw xx_p perpendicular to o g on 0 $ with the distance o g $ make the quarter of a circle $ $	Suppose that y o is the distance you intend the centre of the scroll to be from the beginning of the twist ; from o draw p perpendicular to o G on 0 , with the distance o G , make the quarter of a circle , ?	21	twist
they be all very easily propagate by layering in july $ give the shoot of the present year's growth a twist $ and then bury the twist part six inch under ground $ in november it will be well root $ and can then be cut oif and transplant in any desire situation $ the tasteful husbandman may thus cover every unsightly fence rail $	They are all very easily propagated by layering in July : give the shoot of the present year's growth a twist , and then bury the twisted part six inches under ground ; in November it will be well rooted , and can then be cut oif and transplanted in any desired situation ; the tasteful husbandman may thus cover every unsightly fence rail .	20	twist
this anaconda of the dismal swamp wind its constricting twist about the neck of all your	This Anaconda of the Dismal Swamp wound its constricting twists about the neck of all your	9	twist
say jones $ repeat the word of the other $ as he begin to assume his old comic twist of feature $ no $ unless you might call him a kettle drummer $ for now i think on't when we first come into the house where we find him $ he be at it hammer and tong upon an old brass kettle $ make clatter enough to crazy a small nation $ '	said Jones , repeating the words of the other , as he began to assume his old comic twist of features , no , unless you might call him a kettle drummer ; for now I think on't when we first came into the house where we found him , he was at it hammer and tongs upon an old brass kettle , making clatter enough to crazy a small nation . '	18	twist
introduce a piece of common $ twist $ $ as large as a kidney bean $ into the mouth of a robust man $ unaccustomed to this weed $ and soon he be affect with faint $ vertigo $ nausea $ vomit $ and loss of vision $	Introduce a piece of common " twist , " as large as a kidney bean , into the mouth of a robust man , unaccustomed to this weed , and soon he is affected with fainting , vertigo , nausea , vomiting , and loss of vision .	6	twist
leonora do not reply $ save by a contemptuous twist of her feature $ and a shake of her head $ $	Leonora did not reply , save by a contemptuous twist of her features , and a shake of her head . "	9	twist
and mr.- bivins $ with a complacent look $ take a small chew of tobacco $ first offer the twist to the pallid mr.- quid $ who $ it be needless to say $ decline $	And Mr. Bivins , with a complacent look , took a small chew of tobacco ; first offering the twist to the pallid Mr. Quid , who , it is needless to say , declined .	19	twist
mr.- leycraft's case be a very bad one $ ' say the keeper with his twist in his mouth $	Mr. Leycraft's case is a very bad one , ' says the keeper with his twist in his mouth .	15	twist
owe to these advantage the great quantity of twist produce $ its consequent cheapness $ and its adaptation to the purpose of warp for power-loom cloth of the coarse kind it be probable that the throstle will come into use more extensively than at present $	Owing to these advantages the greater quantity of twist produced , its consequent cheapness , and its adaptation to the purpose of warps for power-loom cloth of the coarser kinds it is probable that the throstles will come into use more extensively than at present .	8	twist
and yet $ though bremen have extensive and increase manufactory of cotton $ it have not enable us to furnish her artisan with more than 12,000 bale of the raw material annually $ because british twist continue to be admit free $	And yet , though Bremen has extensive and increasing manufactories of cotton , it has not enabled us to furnish her artisans with more than 12,000 bales of the raw material annually , because British twist continues to be admitted free .	35	twist
he know i be the best friend about him $ whenever they get thing in any kind of a twist $ or a snarl $ say he $ major $ do you unravel that $	He knows I am the best friend about him ; whenever they get things in any kind of a twist , or a snarl , says he , Major , do you unravel that .	19	twist
curious lawyer's twist $ that help us along considerable $	curious lawyer's twist , that helps us along considerable .	2	twist
he know i be the best friend about him $ whenever they get thing in any kind of a twist or a snarl $ say he $ major $ do you unravel that $	He knows I am the best friend about him ; whenever they gets things in any kind of a twist or a snarl , says he , Major , do you unravel that .	19	twist
it willn't do to wait too long $ its only three year more afore we shall want another president $ and we ought to spring to it now jest as the gineral say about the bank $ that be get only three year more to run $ and he be afraid it cann't wind up as safely by that time as it can now $ and so he be go to give it a twist on 1st october $ and we mean to follow it up till we nock it all to bit $ unless biddle resign $ and	It won't do to wait too long -- its only three years more afore we shall want another President , and we ought to spring to it now jest as the Gineral says about the Bank -- that's got only three years more to run , and he is afraid it can't wind up as safely by that time as it can now , and so he's goin to give it a twist on 1st October -- and we mean to follow it up till we nock it all to bits , unless Biddle resigns , and	72	twist
alberto the world be rank with life $ no twist or turn $ but some untoward imp have cross my path $ one kick my heel $ or tread upon my foot $ then follow with a thousand score of word $ sir $ upon the word of a catholic $ saint and devil sir $ i do not mean it $	Alberto The world is rank with life , no twist or turn , But some untoward imp has crossed my path , One kicks my heel , or treads upon my foot , Then follows with a thousand score of words : Sir , upon the word of a Catholic ; Saints and devils sir , I did not mean it ,	9	twist
but what be the reason of this strange twist in his logic $	But what is the reason of this strange twist in his logic ?	8	twist
not that the gift of decyphering write character $ a gift among the commonalty of that day consider little less cabalistical than the art of inditing $ could $ in strict justice $ have be lay to the charge of either disciple of the sea $ but there be $ to say the truth $ a certain twist in the formation of the letter $ an indescribable lee-lurch about the whole $ which forebode $ in the opinion of both seaman $ a long run of dirty weather $ and determine them at once $ in the pithy word of leg himself $ to $ pump ship $ clew up all sail $ and scud before the wind $ $	Not that the gift of decyphering written characters -- a gift among the commonalty of that day considered little less cabalistical than the art of inditing -- could , in strict justice , have been laid to the charge of either disciple of the sea ; but there was , to say the truth , a certain twist in the formation of the letters -- an indescribable lee-lurch about the whole -- which foreboded , in the opinion of both seamen , a long run of dirty weather ; and determined them at once , in the pithy words of Legs himself , to " pump ship , clew up all sail , and scud before the wind . "	57	twist
but only see how he use the world $ and play his scheme $ and foil his adversary and twist and bend his plastic morality $ all because he be not trouble with scruple $ and have no faith in god or duty $	But only see how he uses the world , and plays his scheme , and foils his adversary and twists and bends his plastic morality , all because he is not troubled with scruples , and has no faith in God or duty !	19	twist
when this be do bind it up with damp matting $ or cotton twist $ all except the bud $ $ see <nul>	When this is done bind it up with damp matting , or cotton twist , all except the bud , ( see fig.	13	twist
ugly twist with my own $ which he admit have receive on my account $ $	ugly twist with my own , which he admits having received on my account . "	1	twist
and first $ at the risk of be consider metaphysical $ -- thourr we fear no metaphysician would indorse the charge $ $ let us define what we mean by mdividuality $ for the word be commonly make to signify some peculiarity or eccentricity $ some unreasonable twist $ of mind or disposition $	And first , at the risk of being considered metaphysical , -- thourr we fear no metaphysician would indorse the charge , - let us define what we mean by mdividuality ; for the word is commonly made to signify some peculiarity or eccentricity , some unreasonable twist , of mind or disposition .	47	twist
english simplicity often have a very artificial twist $ with the french it be just the reverse $ art become a second-nature $ with them $ $	English simplicity often has a very artificial twist ; with the French it is just the reverse ; art becomes a second-nature , with them . "	7	twist
in another rencounter he have receive a permanent twist in the neck $ which give him always the appearance of look over his shoulder $ and add not a little	In another rencounter he had received a permanent twist in the neck , which gave him always the appearance of looking over his shoulder , and added not a little	8	twist
usaldo be it the devil whisper $ that i should ' twist this accident to my purpose $	Usaldo Is it the devil whispers , That I should ' twist this accident to my purpose ?	11	twist
