sentence_lemma	sentence_token	target_index	original_word
$ by my sowl $ sir $ it ben't one $ but two of them i see $ skulk $ like thief from a kilmainham twist $ behind a hay-stack $	" By my sowl , sir , it wasn't one , but two of them I saw , skulking , like thieves from a Kilmainham twist , behind a hay-stack .	25	twist
he who could give to a text the most fanciful twist $ the most recondite allusion $ be esteem the able divine $	He who could give to a text the most fanciful twist , the most recondite allusion , was esteemed the ablest divine .	10	twist
the gineral $ he be stump have $ he look have at me and gin his face a twist $ and then he look have in the cup and shake it $	The Gineral , he was stump'd , he look'd at me and gin his face a twist , and then he look'd in the cup and shook it .	16	twist
$ and d 6 equal to one riser $ divide d 6 in six part $ and draw the line 1 and make 1 a equiil to the distance from the face of the second riser to the beginning of the twist $ make a 3 equal to the distance from a $ on a $ where the twist begin $ to 3 $ where the rail become horizontal $ divide / $ 7 on c $ into seven part $ also f into seven part $ and by intersect the line 3 ft $ the curve of the top rail be give $	, and d 6 equal to one riser ; divide d 6 in six parts , and draw the line 1 and make 1 a equiil to the distance from the face of the second riser to the beginning of the twist ; make a 3 equal to the distance from a , on A , where the twist begins , to 3 , where the rail becomes horizontal ; divide / " 7 on C , into seven parts , also fS into seven parts , and by intersecting the lines 3 fT , the curve of the top rail is given .	41	twist
bough to bough $ and hang in many a dull festoon $ $ there $ peep through thy curtain $ thou mayest catch some ' glimpse of the moon ' $ or $ better $ twist of it a string $ noose in thy neck $ repent $ and $ swing $ $	bough to bough , And hangs in many a dull festoon ; -- There , peeping through thy curtain , thou Mayest catch some ' glimpses of the moon ' ; Or , better , twist of it a string , Noose in thy neck , repent , and -- swing ! "	35	twist
let the graft be carefully hold in it &; due position $ and secure it with cotton twist $ russia matting $ or thread of worsted $ whichever be most convenient $ then cover the bandage with well wrought clay $ or grafting wax $ which be make as follow $ two ounce beeswax $ one ounce tallow $ four ounce common pitch $ twelve ounce burgundy pitch $ all melt together $ and use when warm $ with a brush $	Let the graft be carefully held in it &; due position , and secure it with cotton twist , Russia matting , or threads of worsted , whichever is most convenient ; then cover the bandage with well wrought clay , or grafting wax , which is made as follows : Two ounces beeswax , one ounce tallow , four ounces common pitch , twelve ounces Burgundy pitch , all melted together , and used when warm , with a brush .	17	twist
and when after gain his own deck $ and his own pivot-hole there $ he so vehemently wheel round with an urgent command to the steersman $ it be $ as ever $ something about his not steer inflexibly enough $ $ then $ the already shake ivory receive such an additional twist	And when after gaining his own deck , and his own pivot-hole there , he so vehemently wheeled round with an urgent command to the steersman ( it was , as ever , something about his not steering inflexibly enough ) ; then , the already shaken ivory received such an additional twist	52	twist
draw on one side of it a figure with ball $ and on the other $ two ball only $ then take one of the string between the forefinger and thumb of each hand $ close to $ the card $ twist or twirl it rapidly round $ and according to which pair of string you use $ the figure will seem to be toss two	Draw on one side of it a figure with balls , and on the other , two balls only ; then taking one of the strings between the forefinger and thumb of each hand , close to , the card , twist or twirl it rapidly round , and according to which pair of strings you use , the figure will seem to be tossing two	41	twist
break off his approach marriage with ida $ that he have $ accordingly $ bear a message from elkington $ upon receive which mr.- wyndham have become exceedingly pale and alarmed $ and that $ after have refuse to fight $ although urge to it by provocation which no gentleman could endure $ and still refuse $ he $ the general $ take his $ mr.- wyndham's $ nose between his $ the general be $ fore and middle finger $ and pull the same $ and that the operation have be perform with so little resistance on the part of the operatee $ that he should have repeat it at short interval $ when not otherwise engage $ wherever the say wyndham presume to show the say nose in society $ only he $ the say wyndham $ $ and in this part of the account the general give such huge twist with his body $ and such ghastly contortion of his wound cheek $ as to render the description extremely lively and impressive $ $ $ have have the meanness $ the cowardice $ the $ $ $	breaking off his approaching marriage with Ida ; that he had , accordingly , borne a message from Elkington , upon receiving which Mr. Wyndham had become exceedingly pale and alarmed ; and that , after having refused to fight , although urged to it by provocations which no gentleman could endure , and still refusing , he , the general , took his , Mr. Wyndham's , nose between his , the general's , fore and middle fingers , and pulled the same ; and that the operation had been performed with so little resistance on the part of the operatee , that he should have repeated it at short intervals , when not otherwise engaged , wherever the said Wyndham presumed to show the said nose in society , only he , the said Wyndham " ( and in this part of the account the general gave such huge twists with his body , and such ghastly contortions of his wounded cheek , as to render the description extremely lively and impressive ) , " had had the meanness -- the cowardice -- the -- " (	151	twist
the gineral he be stump have $ he look have at me $ and gin his face a twist $ and then he look have in the cup $ and shake it $	The Gineral he was stump'd ; he look'd at me , and gin his face a twist , and then he look'd in the cup , and shook it .	16	twist
they cherish a certain cultivated frown $ and condemn by a twist of the lip $ and be very sure never to praise any who may come within hear of their praise $ or whose proximity might throw their own stature into the shade $	They cherish a certain cultivated frown , and condemn by a twist of the lip , and are very sure never to praise any who may come within hearing of their praise , or whose proximity might throw their own stature into the shade .	11	twist
endure from the fury $ that $ i might thank my star they have not take a twist of the rope round my neck $ instead of my wrist and ankle $ $	endured from the furies , that " I might thank my stars they had not taken a twist of the rope round my neck , instead of my wrists and ankles ! "	17	twist
$ palsied with this $ he quail at death to night $ who would have curst the heaven yesterday $ in the face of its bright glorious sun $ and wring an infant's neck $ with as little of hesitate conscience $ as twist straw $	, Palsied with this , he quails at death to night , Who would have curst the heavens yesterday , In the face of its bright glorious sun ; And wrung an infant's neck , with as little Of hesitating conscience , as twist straws .	43	twist
the current of fresh air blow down from the open door half rouse him $ broken reflection of the scene float away on the dissipate smoke $ he wonder if man often live so long as he be suffer $ $ the atmosphere become clear again $ and he see miriam take the snake by the tail $ give it a sudden twist and toss upon the distant flag $ where	The current of fresh air blowing down from the open door half roused him ; broken reflections of the scene floated away on the dissipating smoke ; he wondered if men often lived so long as he was suffering ; -- the atmosphere became clear again , and he saw Miriam take the snake by the tail , give it a sudden twist and toss upon the distant flags , where	62	twist
/z/ the fall mould $ d $ be draw in the same manner as the outside falhiig mould $ c $ <nul> its be short $ which be occasion by a difference of length between the inside and outside of the twist part of the rail $	/z/ The falling mould , D , is drawn in the same manner as the outside falHiig mould , C , e.vccpting its being shorter , which is occasioned by a difference of length between the inside and outside of the twist part of the rail .	41	twist
but $ $ she continue $ still read from the letter $ $ if i should say as much to him $ i dare say he would quarrel with me on the spot $ $ here arthur change the tune $ and give another twist in the chair $ $	But , " she continued , still reading from the letter , " if I should say as much to him , I dare say he would quarrel with me on the spot -- " Here Arthur changed the tune , and gave another twist in the chair . "	44	twist
frank and salisbury be both of them seat on the top of a desk $ the former $ generally silent $ relieve himself by sundry twist and contortion $ smack of the lip $ sigh $ and turning of the eye $ vary by a few occasional thump administer to salisbury $ who sit by him $ apparently unconscious of the bellicose attitude of his neighbor $ listen	Frank and Salisbury were both of them seated on the top of a desk ; the former , generally silent , relieved himself by sundry twists and contortions , smacking of the lips , sighs , and turnings of the eyes , varied by a few occasional thumps administered to Salisbury , who sat by him , apparently unconscious of the bellicose attitude of his neighbor , listening	25	twist
what i have hear of bramins sit exposed to four fire and look in the face of the sun $ or hang suspend $ with their head downward $ over flame $ or look at the heaven over their shoulder $ until it become impossible for them to resume their natural position $ while from the twist of the neck nothing but liquid can pass into the stomach $ $ or dwell $ chain for life $ at the foot of a tree $ or measure with their body $ like caterpillar $ the breadth of vast empire $ or stand on one leg on the top of pillar $ even these form of conscious penance be hardly more incredible and astonishing than the scene which i daily witness	What I have heard of Bramins sitting exposed to four fires and looking in the face of the sun ; or hanging suspended , with their heads downward , over flames ; or looking at the heavens over their shoulders " until it becomes impossible for them to resume their natural position , while from the twist of the neck nothing but liquids can pass into the stomach " ; or dwelling , chained for life , at the foot of a tree ; or measuring with their bodies , like caterpillars , the breadth of vast empires ; or standing on one leg on the tops of pillars -- even these forms of conscious penance are hardly more incredible and astonishing than the scenes which I daily witness	56	twist
there be dust in his hair $ $ $ there be a twist in his rein $ $ $ his mane do not lie straight $ $ $ he have not be properly grain $ $ $ his head do not look well $ $ $ his fore-top be not comb out $ $ $ his fetlock have not be properly trim $ $ something be always wrong $	There was dust in his hair ; " " there was a twist in his reins ; " " his mane did not lie straight ; " " he had not been properly grained ; " " his head did not look well ; " " his fore-top was not combed out ; " " his fetlocks had not been properly trimmed ; " something was always wrong .	12	twist
then the immense power of muscle be display in the concentrated energy of the spring $ he fly through the air and settle on the throat $ usually throw his own body over the animal $ while his tooth and claw be fix on the neck $ this be the manner in which the spine of an animal be broken -- by a sudden twist $ and not by a blow $	Then the immense power of muscle is displayed in the concentrated energy of the spring ; he flies through the air and settles on the throat , usually throwing his own body over the animal , while his teeth and claws are fixed on the neck ; this is the manner in which the spine of an animal is broken -- by a sudden twist , and not by a blow .	64	twist
which hang upon his lip $ to sooth that which he deem the irritation of the person who have thus direct his speech to him $ and to free himself from his company $ but his endeavour be fruitless $ the sage be not so easily to be shake off $ neither would he allow utterance to ought that seem to interfere with the purport of his parlance $ and he be truly dogmatical in retain his unwilling listener $ for have gripe him firmly by the sleeve lest he should escape him $ and in spite of the twist and jerk with which ever and anon his hearer strive to loosen the hold by which he be bind $ and all unmindful of the distress attention with which his prolixity be receive $ he pertinaciously continue to persevere in the motley tenor of his speech $ $	which hung upon his lips , to sooth that which he deemed the irritation of the person who had thus directed his speech to him , and to free himself from his company ; but his endeavours were fruitless , the sage was not so easily to be shaken off , neither would he allow utterance to ought that seemed to interfere with the purport of his parlance ; and he was truly dogmatical in retaining his unwilling listener , for having griped him firmly by the sleeve lest he should escape him , and in spite of the twists and jerks with which ever and anon his hearer strove to loosen the hold by which he was bound , and all unmindful of the distressed attention with which his prolixity was received , he pertinaciously continued to persevere in the motley tenor of his speech . "	99	twist
he have so adjust the cord that $ by insert a pistol-butt into a loop of the rope $ he could contract it in a moment by a single twist $ $	He had so adjusted the cord that , by inserting a pistol-butt into a loop of the rope , he could contract it in a moment by a single twist . "	29	twist
i can tell you $ my little man $ $ be the old gentleman's reply $ as he look down upon zeb's queer face $ turn up towards his own $ with a slight inclination to the right $ and a twist of the mouth to the leave $ while the earnest protrusion of his dark sparkle eye $ and the honest confidence express by all his feature in combination $ rivet the stranger's attention to the person of our hero $ though at first overlook in his examination of the traveller who have arrive in the stage $ $	I can tell you , my little man , " was the old gentleman's reply , as he looked down upon Zeb's queer face , turned up towards his own , with a slight inclination to the right , and a twist of the mouth to the left , while the earnest protrusion of his dark sparkling eyes , and the honest confidence expressed by all his features in combination , rivetted the stranger's attention to the person of our hero , though at first overlooked in his examination of the travellers who had arrived in the stage . "	41	twist
to go about run into gutter $ and poke street-pools and rag-heaps $ and i should'nt wonder if it disagree with me so much as to make me twist my face and beat myself $ and do such goings-on $ that every body will say $ fyler have lose his reason $ $	To go about running into gutters , and poking street-pools and rag-heaps -- and I should'nt wonder if it disagreed with me so much as to make me twist my face and beat myself , and do such goings-on , that every body'll say , Fyler has lost his reason . "	28	twist
well $ think i $ if thing look so to the gineral $ as they do to me throw these spec $ i don't wonder so much that he don't always see ' em as other folk do $ and then i go to work $ look into the contrivance $ i give one screw a twist one way $ and the glass	Well , thinks I , if things look so to the Gineral , as they do to me threw these specs , I don't wonder so much that he don't always see ' em as other folks do ; and then I went to work , lookin into the contrivance ; I give one screw a twist one way , and the glasses	56	twist
with a twist of his wrist he have whirl the bow of the boat in the direction of the bank they have just leave $ and be paddle away for dear life $	With a twist of his wrist he had whirled the bow of the boat in the direction of the bank they had just left , and was paddling away for dear life .	2	twist
give each slip a slight twist $ and press it down hard into the needle with your finger $	Give each slip a slight twist , and press it down hard into the needle with your fingers .	5	twist
the coiffure be equally diversify $ ringlet $ crockets $ twist $ tye-tops $ crape cushion $ toupee $ sustain and enrich with brass and gilt clasp $ pin $ silk and velvet fillet $ feather and flower $	The coiffures were equally diversified , ringlets , crockets , twists , tye-tops , crape cushions , toupees , sustained and enriched with brass and gilt clasps , pins , silk and velvet fillets , feathers and flowers .	10	twist
which grasp tightly his neckcloth from behind $ and give it a sudden twist $ curtail his power of respiration to a most annoying degree $	which grasped tightly his neckcloth from behind , and giving it a sudden twist , curtailed his powers of respiration to a most annoying degree .	13	twist
see $ how de road twist round my house $	See , how de road twist round my house .	5	twist
at this the skipper could not help $ in spite of the awe that pervade him at the research and talent of the judge $ rip out a huge swing oath $ and give his mustachios an undaunted and defy twist that make all stare again $ and be about to make an appeal $ but dirk $ interpose $ say he have not yet finish $ for that on account of the complainant be a resident of another county $ he be doubtful of his jurisdiction in the business $ and he therefore suppose that the affair of the cost would be best refer	At this the skipper could not help , in spite of the awe that pervaded him at the research and talents of the judge , ripping out a huge swinging oath , and giving his mustachios an undaunted and defying twist that made all stare again , and was about to make an appeal -- but Dirk , interposing , said he had not yet finished , for that on account of the complainant being a resident of another county , he was doubtful of his jurisdiction in the business , and he therefore supposed that the affair of the costs would be best referred	40	twist
$ and d 6 equal to one riser $ divide d 6 in six part $ and draw the line 1 and make 1 a equiil to the distance from the face of the second riser to the beginning of the twist $ make a 3 equal to the distance from a $ on a $ where the twist begin $ to 3 $ where the rail become horizontal $ divide / $ 7 on c $ into seven part $ also f into seven part $ and by intersect the line 3 ft $ the curve of the top rail be give $	, and d 6 equal to one riser ; divide d 6 in six parts , and draw the line 1 and make 1 a equiil to the distance from the face of the second riser to the beginning of the twist ; make a 3 equal to the distance from a , on A , where the twist begins , to 3 , where the rail becomes horizontal ; divide / " 7 on C , into seven parts , also fS into seven parts , and by intersecting the lines 3 fT , the curve of the top rail is given .	41	twist
and the diminutive hand of the young lady be raise to her own short lock $ which no process of $ bind up $ yet discover $ could possibly have coax into a twist behind her head $	And the diminutive hand of the young lady was raised to her own short locks , which no process of " binding up " yet discovered , could possibly have coaxed into a twist behind her head .	33	twist
analogous $ perhaps $ to these trifling deformity $ be an almost imperceptible twist of every joint $ and the uneven prominence	Analogous , perhaps , to these trifling deformities , was an almost imperceptible twist of every joint , and the uneven prominence	13	twist
truly it be a talisman $ yet if you have look at it $ you would have see nothing in it but a little twist of golden hair tie together with a blue silken thread $	Truly it was a talisman ; yet if you had looked at it , you would have seen nothing in it but a little twist of golden hairs tied together with a blue silken thread .	24	twist
grace forget for once whether she be in company or alone $ forget every thing but the surprising certainty that howard and fenton be the self-same person $ every trace of displeasure vanish from her face $ unmixed delight shine in her brighten eye and glowing cheek $ and without notice the joyful expression of her aunt's face $ the ludicrous twist of william armstead's mouth $ or the sympathy that moisten ellen's eye $ she give fenton her hand $ and in virtue of his be friend $ lover $ or cousin $ one or all $ permit him to devour it with kiss $ $	Grace forgot for once whether she was in company or alone -- forgot every thing but the surprising certainty that Howard and Fenton were the self-same person -- every trace of displeasure vanished from her face , unmixed delight shone in her brightened eye and glowing cheek , and without noticing the joyful expression of her aunt's face , the ludicrous twist of William Armstead's mouth , or the sympathy that moistened Ellen's eye , she gave Fenton her hand , and in virtue of his being friend , lover , or cousin , one or all , permitted him to devour it with kisses . "	61	twist
think how these jolly old cock tower away $ with their shrill whistle $ through the tree-top $ and twist and dodge with an agility of wing and thought-like speed $ scarcely inferior to the snipe's or swallow be $ and fly a half mile if you miss them $ and laugh to scorn the effort of any one to bag them $	Think how these jolly old cocks tower away , with their shrill whistle , through the tree-tops , and twist and dodge with an agility of wing and thought-like speed , scarcely inferior to the snipe's or swallow's , and fly a half mile if you miss them ; and laugh to scorn the efforts of any one to bag them ,	19	twist
jamie have also recognize him $ and remember the abstraction of the twenty dollar note $ begin to feel the fear of suspicion come over him $ and turn his back be shuffling off with his shape so alter by an ingenious twist of his body and a stoop of the shoulder and a bow in of the leg $ that when donald's eye first behold him $ he hesitate in decide whether it be jamie or no $	Jamie had also recognized him , and remembering the abstraction of the twenty dollar note , began to feel the fears of suspicion coming over him , and turning his back was shuffling off with his shape so altered by an ingenious twist of his body and a stooping of the shoulders and a bowing in of the legs , that when Donald's eyes first beheld him , he hesitated in deciding whether it were Jamie or no .	42	twist
now $ ' say i $ gineral $ let me have your spec $ ' say i $ a minit ' $ and i take ' em to the window $ and give the screw a twist	Now , ' says I , Gineral , let me have your specs , ' says I , a minit ' -- and I took ' em to the window , and give the screws a twist	36	twist
a half-smothered groan escape from her uncle's ashy lip as he spring up $ and run his eye over the note once more $ give them a twist $ crush them together $ and fling them into the fire $	A half-smothered groan escaped from her uncle's ashy lips as he sprang up , and running his eye over the notes once more , gave them a twist , crushed them together , and flung them into the fire .	27	twist
one twist o ' the wheel $ wire crooked $ cut $ hole punch $ tooth place $ just like the human finger $ more exact $ when a committee of the national institute be invite to see it $ in paris $ they laugh at the specification $ they say it be impossible $ they see it $	One twist o ' the wheel -- wire crooked -- cut -- holes punched -- teeth placed -- just like the human fingers -- more exact -- when a committee of the national institute were invited to see it , in Paris , they laughed at the specification -- they said it was impossible -- they saw it .	1	twist
pass the weft thread between them by common plyer $ deliver them to other plyer on the opposite side $ then $ after give them a sideways motion and twist $ the thread be repassed back between the next adjoin cord $ the mesh be thus tie in the same way as upon pillow by hand $	passing the weft threads between them by common plyers , delivering them to other plyers on the opposite side ; then , after giving them a sideways motion and twist , the threads were repassed back between the next adjoining cords , the meshes being thus tied in the same way as upon pillows by hand .	29	twist
