sentence_lemma	target_index	cluster	lemma	sentence_token	identifier
i greifswald den tid $ denna $ ännu lyda under sweriges spira $ företoj $ i anledning härai $ i böra $ an af denna århundrade $ att bearbeta moderriket $	28	3	bearbeta	i Greifswald den tid , denna Acadenl^e ännu lydde under Sweriges Spira , företoj , i anledning härai , i bör ' an af detta Århundrade , att bearbeta moderriket ? 	bib11653823_18241214_144010_291_0003_alto.xml-4-28
sig den och bearbeta den till sig fördel $ säsom en upplyst pascha stulle göra $	3	3	bearbeta	sig den och bearbetar den till sin fördel , säsom en upplyst Pascha stulle göra . 	bib11653828_18280119_144028_16_0002_alto.xml-13-3
hwad den trogen land $ upxgifwer s $ få resultat af de hittills $ ösweläggningar $ nemstgen bestjäla angäende all sratsflulders före $ $ till en skuldwasen $ de $ upprättande $ gt $ f en och samma afgiftö $ system för hel sto $ $ her $ $ $ of de binllls frän utstplder $ gedsens staltfrihet $ emot en wist ersättning $ somt fluiugen tillsättande af en ulstott till widare bearbeta cf en plcu i denna ämne $	72	5	bearbeta	hwad den trogna Land !dagen upxgifwer ss » fom resultatet af deras hittills hällr-e ösweläggningar , nemstgen bestulen angäende alla SratsflulderS före , .ande till ett Skuldwasen » de , upprättandet & gt ; f ett och samma afgiftö , system för hela Sto ' - Her igdö-uet , upphäfw-nde of de biNllls frän utstplder frit-gne gedsens staltfrihet , emot en wist ersättning , somt fluiUgen tillsättandet af ett Ulstott till widare bearbetande cf en plcu I detta Ämne . 	bib11653825_18170421_145134_48_0003_alto.xml-1-72
gernandt bearbeta en mekanist inrättning $ som $ sitta i sammanhang med wanligt urwerk $ kunna wisa dag $ datum och mänad $ metz den särstilta uträkning $ att datowisaren $ alwen wid flyta af en mänader $ hwilka ej innehälla gr dag $ sklf förflytta sig till rätt datum $	1	6	bearbeta	Gernandt bearbetat en mekanist inrättning , som , satt i sammanhang med wanligt urwerk , kan wisa dag , datum och mänad , metz den särstilta uträkning , att datowisaren , alwen wid flutet af de mänader , hwilka ej innehälla gr dagar , sklf förflyttar sig till rätta datum . 	bib19223423_18280823_145063_68_0002_alto.xml-16-1
$ ada och $ $ eller tydlig underrättelse l konst $ att förekomma eldswädor $ att stäcka en uppkomma $ $ att rädda lik och egendom $ bearbeta efter parisisk sprut $ $ sen $	27	7	bearbeta	- ads- och Laiids-Församlingar ; eller tydliga underrättelser l konsten , att förekomma eldswädor , att stäcka de uppkomna , ■ att rädda lik och egendom ; bearbetad efter Parisiska Sprut » ' sen ? 	bib15650837_18300526_146391_42_0003_alto.xml-6-27
maj att furstendömenäs ny konstitution $ få sedan 9 månad blifwit bearbeta i bucharest af cn kommitzion moldauijka och wallachiffä bojar $ underteckna af samtlig medlem $ ne den 10 april $ och stall nu med första affändas till $ petersburg $ för att pröfwas af kejsare $	11	9	bearbeta	Maj att furstendömeNäS nya konstitution , fom sedan 9 månader blifwit bearbetad i Bucharest af cn kommitzion moldauijka och wallachiffä bojarer , undertecknades af samtlige medlemmar » ne den 10 April , och stall nu med första affändaS till St. Petersburg , för att pröfwas af Kejsaren . 	bib19277277_18300611_147682_132_0001_alto.xml-19-11
ssrifwit om landtbruk $ denna ämne vara till sig natur sä wida stiijdt ifrän poesi $ att den vara ytterst sällan fanima person gifwct $ en med lik fraingäng $ bearbeta de bäda $	30	10	bearbeta	ssrifwit om landtbruket ; detta ämne är till sin natur sä wida stiijdt ifrän poesien , att det är ytterst sällan fanima person gifwct , ett med lika fraingäng ' bearbeta dem bäda . 	bib11653828_18220429_144028_98_0002_alto.xml-9-30
