sentence_lemma	target_index	cluster	lemma	sentence_token	identifier
mennistosnillet $ att $ pä en grund $ som i denna ämne ärva gälla $ bearbeta de till en hel för tank och minne $ en bemödande $ som $ ehuru icke nödig för den tro hjertat $ hwilket leswer i en hög sfer $ dock vara af migt för $ tankände förständet $ och i den man den lyckas $ icke heller ar alldeles likqilltigt för religiositet $ $	15	0	bearbeta	mennistosnillet , att , pä de grunder , som i dessa ämnen ärv gällande , bearbeta dem till ett helt för tanken och minnet : ett bemödande , som , ehuru icke nödigt för det troende hjertat , hwilket leswer i en högre sfer , dock är af migt för d«t tankände förständet , och i den män det lyckas , icke heller ar alldeles likqilltigt för Religiositeten . " 	bib11653828_18201101_144028_254_0002_alto.xml-11-15
den stund $ d8 kammarn upplösning promnlgerades $ vaflsteliqen i $ verksamhet för att bearbeta allmän opinion efter sig 8sigler $	14	0	bearbeta	den stund , d8 kammarns upplösning promnlgerades , vaflSteliqen i , verksamhet för att bearbeta allmänna opinionen efter sina 8sigler . 	bib13506739_18300604_144030_126_0001_alto.xml-17-14
eller ben egentlig topographien $ alltför liten bearbeta i wärl kand $ och kanste alf de ha gjfna anledning till en noggrann landkännedom $ ehuru r fig sjelfwa en $ bost strö $ kunna en dag bidra till utarbetande äfen mera sammanhänga to $ pographi öfwer skandinavien $ $ wilken $ författa i systematisk ordning och efter weten $ stapliga grund $ kunna bäetre sykla kristen af statistisk kunskap om wärk land $ kun stäp r $ hwilkas wigtighel med hwar dag mera inse $ i ben mäta söljdern $ af bri $ sten derpä bli mg mera kanbara $	7	0	bearbeta	eller ben egentliga Topographien , alltför litet bearbetad i wärl kand , och kanste alf de har gjfna anledningar till en noggrannare landkännedom , ehuru r fig sjelfwa en , bost strödda , kunna en dag bidraga till utarbetandet äfen mera sammanhängande To , pographi öfwer Skandinavien , - wilken , författad i systematisk ordning och efter weten , stapliga grunder , kunde bäetre sykla Kristen af statistiska kunskaper om wärk land — kun stäp r , hwilkas wigtighel med hwar dag mera inse- , i ben mätt söljdern » af bri , sten derpä bli mg Mera kanbara . 	bib11653828_18190122_144028_17_0003_alto.xml-11-7
widare liiier den med stor stil bearbeta fin gammal bergwärk och uptagi ny $ och	6	0	bearbeta	Widare liiier den med största stil bearbeta fina gamla Bergwärk och uptagi nya , och 	bib13506739_17951221_144030_292_0001_alto.xml-1-6
tliseil och en narr $ bearbeta fre barn as grinim $	5	0	bearbeta	Tliseil och en Narr ; bearbetad fre Barn as Grinim . 	bib11653823_18281122_144010_274_0004_alto.xml-8-5
hel listighet denna yrke $ hwilket han nu metz mandom styrka bearbeta och söka att göra allmän nyttig $	11	0	bearbeta	hela listighet detta yrke , hwilket han nu metz mandomens styrka bearbetar och söker att göra allmännare nyttigt . 	bib11653828_18190206_144028_30_0003_alto.xml-5-11
re stall fortfara $ mäsie wi tära $ säiom i mycket a $ nat $ af främmande nationes uppfinninch och flit söka dra en fördel $ som wi he $ st ffulle emottkga af egen landsman $ och för saknad $ god rriqinaler hämia $ er $ sättning frän sorgfällig bearbeta öfwersätt $ ningar $	50	0	bearbeta	re stall fortfara , mäsie wi tär , säiom i mycket a » nat » af främmande Nationes uppfinninch och flit söka draga de fördelar , som wi he ' st ffulle emottKga af egna Landsmän , och för saknaden «s goda rriqinaler hämia n^on er , sättning frän sorgfälligt bearbetade öfwersätt , ningar . 	bib11653806_18160605_145120_61_0001_alto.xml-3-50
hos mellin $ ewerats oumbärlig drandbok för all stadse och landsförsamling $ eller tydlig nnderrättelfer örn konst att förekomma eldswädor $ att fläcka en uppkomma och alt rädt $ lif och egendom $ bearbeta efter pär i si fia sprtttkorpfens grundsats af z $ $ $ petri $ 20 $ $ salanders öfwerfattn $	33	0	bearbeta	Hos Mellin : Ewerats oumbärliga Drandbok för alla Stadse och Landsförsamlingar , eller tydliga nnderrättelfer örn konsten att förekomma eldswädor , att fläcka de uppkomna och alt rädt » lif och egendom , bearbetad efter Pär i si fia Sprtttkorpfens grundsatser af Z . G&gt ; Petri , 20 st. ; Salanders öfwerfattn . 	bib19277346_18300529_147394_22_0004_alto.xml-0-33
hälft i $ lt $ $ fst 6 a 7 dr sedan upplag och bearbeta ierngxuswa med $ $ kg tigganz va rikbaltlg och wälartad malm $	14	0	bearbeta	Hälften i & lt ; » fSt 6 a 7 dr sedan upplagen och bearbetad Ierngxuswa med ?m« » kg tigganz va rikbaltlg och wälartad malm . 	bib13506739_18261101_144030_243_0004_alto.xml-0-14
lare $ hwars blott namn redan borga för den opartiskhet och den sakkännedom s $ $ syncs utur hel han arbete $ ha den sörtjciist att $ genom egen märkrvärda rö $ förena nied en mängd andra ryktbar läkare $ bafwa rikta den ämne hail bearbeta $ och i en wärdig stil framstäldt nr en syupuuct och i en systematist fullständighet $ som $ enligt kännare omdöme $ all ditintills lärer warit saknad $	45	0	bearbeta	lare , hwars blotta namn redan borgar för den opartiskhet och den sakkännedom s ' .n syncS utur hela hans Arbete , har den sörtjciist att , genom egna märkrvärda rön , förenade nied en mängd andra ryktbare Läkares , bafwa riktat det ämne hail bearbetat , och i en wärdig stil framstäldt nr en syupuuct och i en systematist fullständighet , som , enligt kännares omdöme , allt ditintills lärer warit saknad . 	bib11653823_18211025_144010_250_0008_alto.xml-2-45
pund $ $ vara i london inrättadt till bearbeta af bcrgwerken t chill $	8	0	bearbeta	pund st. , är i London inrättadt till bearbetande af bcrgwerken t Chill . 	bib13506739_18250127_144030_21_0002_alto.xml-3-8
skön proportion i den 2 våning hög byggnad $ den prydlig och likväl ädel fördelning af list $ den fulländning $ hvarmed kapitäl på en korintisk pelarena äro bearbeta $ samt ändtligen sten skön hvitgul färg $ gil va hus en likaså vänlig sotn imponera utseende $ och man kunna $ i synnerhet i månsken $ icke föreställa sig någon ting mera grandiöst än den $	28	0	bearbeta	sköna proportion i den 2 våningar höga byggnaden , den prydliga och likväl ädla fördelningen af listen , den fulländning , hvarmed kapitälerna på de korintiska pelarena äro bearbetade , samt ändtligen stenens sköna hvitgula färg , gil va huset ett likaså vänligt sotn imponerande utseende , och man kan , i synnerhet i månskenet , icke föreställa sig någon ting mera grandiöst än det . 	bib11653828_18300429_144028_97_0003_alto.xml-2-28
bankier $ oxenford att formera en bolag till bearbeta af guldgruf $ wörna i provins mina geracs iftän calcutta strifwcs under den iy juli och frän madras under ben 1 augusti $ akt ficndtligbeterna mäst $ i anseenoe till regntid $ tills widare $ birmanerne stsdo stark förstansade $ 1 ramoo inom bengalisk omrädet $	8	0	bearbeta	bankieren E. Oxenford att formera ett bolag till bearbetande af guldgruf » wörna i provinsen Minas Geracs Iftän Calcutta strifwcs under den iy Juli och frän Madras under ben 1 Augusti , akt ficndtligbeterna mäst , i anseenoe till regntiden , tills widare inställas- Birmanerne stsdo starkt förstansade , 1 Ramoo inom Bengaliska omrädet . 	bib11653828_18241216_144028_293_0002_alto.xml-7-8
el $ mcb hl $ floriit underrättelse om canal betel $ början och bearbeta dcrstädes irän gammal tid till en $ ytlig fullbordande wid trollhärran $	13	0	bearbeta	Els , mcb Hl » floriiT underrättelse om Canal betel » början och bearbetande dcrstädes irän äldre tider till de » ytliga fullbordande wid Trollhärran . 	bib13506739_18061014_144030_237_0005_alto.xml-0-13
en generell notis om buonapartes familj $ om han födelse och uppfostrån börja tredje del $ och tycka för den mycken wara bearbeta efter bensons skildring af korfika $	22	0	bearbeta	De generella notiserna om Buonapartes familj , om hans födelse och uppfostrån börja Tredje Delen , och tyckas för det mesta wara bearbetade efter BensonS Skildring af Korfika . 	bib11653828_18270707_144028_156_0001_alto.xml-4-22
den helig skrift berättelse och lära $ öswerfatte och bearbeta af ol $	9	0	bearbeta	Den Heliga Skrifts Berättelser och Läror , öswerfatte och bearbetade af Ol . 	bib11653825_18150105_145134_2_0005_alto.xml-4-9
vara jag sak $ annan än så vida den vara nödvändig för uppfyllande af jag fordran $ böra jag dock $ äfven för denna sistnämnd ändamål $ nämna $ att om man låta aptera sten borrta vid stenbrott $ ej föra de till plats förr än de voro färdig $ då först nedrifvit den gammal sandstensbeklädnad $ $ och sedan uppföra den ny $ skola man bespart sig möda och kostnad att släpa en ohuggen stenmassa genom stad $ och åter borrtföra ailallet $ obehag att göra här en del af ny bro $ der en bit ak slottsbacke $ der åter en stycke af carl $ torg till arbetsrum för stenhuggning $ plockvis bearbeta lejonbacken $ göra den ena ramp färdig $ förr än den andra $ och de båda någon år före mellandel $ nedrifva den gammal beklädnad $ $ lång förr än man vara iärdig att bygga den ny $ och på denna sätt låta $ lott iot i åratal borrtskyrnmas och $ $ pas $	114	0	bearbeta	är min sak , annat än så vida den är nödvändig för uppfyllandet af mina fordringar , bör jag dock , äfven för detta sistnämnda ändamål , nämna , att om man låtit aptera stenarna borrta vid stenbrottet , ej fört dem till platsen förr än de voro färdiga , då först nedrifvit den gamla sandstensbeklädnaden , ' och sedan uppfört den nya » skulle man bespart sig mödan och kostnaden att släpa de ohuggna stenmassorna genom staden , och åter borrtföra ailallet , obehaget att göra här en del af nya bron , der en bit ak Slottsbacken , der åter ett stycke af Carl XIH:s torg till arbetsrum för stenhuggningen , plockvis bearbeta Lejonbacken , göra den ena rampen färdig » förr än den andra , och dem båda några år före mellandelen , nedrifva dess äldre beklädnad , , långt förr än man var iärdig att bygga det nya , och på detta sätt låta » lottets iot i åratal borrtskyrnmas och nedskrä- ' pas . 	bib11653828_18300610_144028_131_0002_alto.xml-11-114
engelsta compagnierna till bcrgwerks drifwande hofwa nu äfwen kasta öga pä delta land $ en af deni ha erbjuda sig att bearbeta guld och sifwergrufworna här i rike nied förbindelse att erlägga en tionde $ del af $ till spansta krona $	21	0	bearbeta	Engelsta compagnierna till Bcrgwerks drifwande hofwa nu äfwen kastat ögonen pä delta land : ett af deni har erbjudit sig att bearbeta guld- och sifwergrufworna här i Riket nied förbindelse att erlägga en tionde ' del af grufwe-afkastningen till Spansta Kronan . 	bib11653823_18250528_144010_120_0002_alto.xml-18-21
$ förur kail tillfälle göra bekanissap $ genom flera af han bearbeta populär medicinsk skrift $	11	0	bearbeta	aämänli.len förur Kail tillfälle göra bekanissap , genom flera af honom bearbetade populärt medicinska skrifter . 	bib13506739_18301224_144030_299_0003_alto.xml-4-11
hwad man dock känna $ vara allmänhet stor mistnöje med en äta engländare bcwiljade privilegium att bearbeta $ bergwerk $ i följa hwaraf dest adla metall id $ gen utwandra till stor brittannien $ och ringa del deraf tillfalla mexicanerne sjelfwe fråga vara följakteligen $ 01 $ $ swärigheter uppstä emot en i hamn redan ligga flera million öfwerförande till england $	16	1	bearbeta	Hwad man dock känner , är allmänhetens stora mistnöje med de ät Engländare bcwiljade privilegier att bearbeta landet- bergwerk , i följd hwaraf dest adla metaller iden » gen utwandra till Stora Brittannien , och ringa del deraf tillfaller Mexicanerne sjelfwe Fråga är följakteligen , 01 » «i swärigheter uppstä emot de i hamnen redan liggande flera millioners öfwerförande till England . 	bib11653823_18260524_144010_117_0002_alto.xml-5-16
att friwillbga atzociationer till bögre och låg läro anstaltcr öfwerallt bilda sig uran den ringast tyngd för $ $ att en listig täflan uppstå $ soni onekligen m8ste till stut bringa uppfostring npp till wetenskap $ de $ ädel vch för menniskosiägttts wäl nyttig $ som kunna bearbeta $	47	1	bearbeta	att friwillbga atzociationer till bögre och lägre Läro anstaltcr öfwerallt bilda sig uran den ringaste tyngd för Stats-easian ; att en listigare täflan uppstår , soni onekligen m8ste till stut bringa Uppfostringen npp till Wetenskap , de » ädlaste vch för menniskosiägtttS wäl nyttigaste , som kan bearbetas . 	bib13506739_18290821_144030_192_0002_alto.xml-8-47
uti windel $ elswen $ der wattfallen i allmänhet ej medföra lik swärigheter $ äro ej föga än iz forsa bearbeta och deraf 5 till hel fin widd rensa $ 6 sä nära sär $ dige $ att blott nägra fä sten äterstä att under lopp af innew $	20	1	bearbeta	Uti Windel - Elswen , der wattfallen i allmänhet ej medfört lika swärigheter , äro ej mindre än iz Forsar bearbetade och deraf 5 till hela fin widd rensade , 6 sä nära sär » dige , att blott nägra fä stenar äterstä att under loppet af innew . 	bib11653828_18190420_144028_89_0002_alto.xml-3-20
efter en sannolik forskning härstamma en från den gammal iberiens urinvånare $ som före celterne och fenicierne $ hvilka ungefär 5oo år före christi födelse inkommo i denna land lör ali bearbeta den guld peli silfver	31	1	bearbeta	Efter de sannolikaste forskningar härstamma de från det gamla Iberiens urinvånare , som före Celterne och Fenicierne , hvilka ungefär 5oo år före Christi födelse inkommo i detta land lör ali bearbeta dess guld- peli silfver- 	bib11653828_18300723_144028_167_0002_alto.xml-21-31
den ända säga wäl liberal $ som $ ltras $ till kentboeriie $ förbereda möte hök $ los bäde ä brnnswickernes $ och anti $ brunswickerues sida $ bwari man $ $ koi om bra sätt att befordra sig anhängare till di $ $ mötesplats $ tidmngar $ e $ efter dcn olik anda $ som lifwar de $ ha all möda ospard att bearbeta allmmna opinion $ och en liberal blad nyttja utan all ikousinal $ $ lire och atlöjets waxen mot $ förnäm ledamot $ fran jrland företa hr shiel en resa till penenden $ för att af all sig förmaga söka fii rekom na någon för han $ ofördelaktig bessut $ äflven hh $ cobbctt och hunt ha begifwit sig dit $ för att tala om $ nödwändigheten af parlament $ reform och tiondens och tarornes afssaffande eller nedsätta $	64	1	bearbeta	den ändan sa wäl liberale , som » ltras , till Kentboeriie ; förberedande möten hök / los bäde ä BrnnSwickernes , och Anti / Brunswickerues sida , bwari man öfw^ens / koin om bästa sättet att befordra sina anhängare till di » utsatta mötesplatsen ; tidmngar » e , efter dcn olika anda , som lifwar dem , hade all möda ospard att bearbeta allmmna opinionen , och de liberala bladen nyttjade utan allt ikouSinal fa&lt ; lirens och atlöjetS waxen mot BninSwick-klubbenS förnämsta ledamöter ; fran Jrland företog Hr Shiel en resa till Penenden , för att af all sin förmaga söka fii rekom na något för hans tt-osförwanter ofördelaktigt bessut ; äflven HH . Cobbctt och Hunt hade begifwit sig dit , för att tala om ' nödwändigheten af parlaments / reform och tiondenS och tarorneS afssaffande eller nedsättande . 	bib13506739_18281106_144030_260_0001_alto.xml-15-64
cortez göra i tenochutlan $ äfwen som ca $ xamarcas och cuzcos förena skatt $ bestå i gull $ och porcos silfwergrufwor i peru $ tascos och tlapujahnas i mexico blefwo föga bearbeta i eortez $ s och pizairos tid $	32	1	bearbeta	Cortez gjorde i Tenochutlan , äfwen som Ca » xamarcas och Cuzcos förenade skatter , bestod i gull ; och Porcos Silfwergrufwor i Peru , Tascos och Tlapujahnas i Mexico blefwo föga bearbetade i Eortez ' s och Pizairos tid . 	bib11653806_18110501_145120_48_0002_alto.xml-6-32
delta med hvad mera i härwid i underdänighet anföra $ hafwa wz lätit ost i räd $ $ och finna de af ni förcflagne smärre dela forstott lill en stor antal af $ jnwänare isy medföra ben nödig säkerhet för tillspnen af $ anwändande till den äspftade ändamälet $ äfwensom en sä $ dag fördelning af $ huswud $ tillgängar ht vara enlig med en för deraanwändande stadga hufwud grunoer $ i anseende huartill mi $ för att sä midt möjlig vara wid denna tillfälle förena en witz anwändandet af beröra hufwud titel medel bestämma willkor $ med $ län behof af understöd $ i röder finna god förordna att i $ som för denna vara hafwcn att päräkna en tillgäng af tio tusende riksdaler $ börén för $ anwändande upgifwa hwilka stor och af mera gemensam nytta warande odling lägenhet $ som inom län finnaoch med $ bearbeta början genall lunde göra $ och dä $ i anseende till swistheten om hwad tom af hwarje är5 statörmehel komma att $ $ he hufwuoe	148	1	bearbeta	Delta med hvad mera I härwid i underdänighet anfört , hafwa WZ lätit Ost i Räder föredraga- , och funnit de af Eder förcflagne smärre delade forstott lill ett större antal af Länet- Jnwänare iste medföra ben nödiga säkerheten för tillspnen af medlen- anwändande till det äspftade ändamälet , äfwensom en sä » dan fördelning af y:de huswud Titeln- tillgängar Ht är enlig med de för deraanwändande stadgade hufwud grunoer , i anseende huartill MI , för att sä midt möjligt är wid detta tillfälle förena de witz anwändandet af berörde hufwud Titels medel bestämde willkor , med Kronoberg- Läns behof af understöd , i Röder funnit godt förordnar att I , som för detta är hafwcn att päräkna en tillgäng af Tio Tusende Riksdaler , börén för dera- anwändande upgifwa hwilka större och af mera gemensam nytta warande Odling- lägenheter » som inom Länet finnaoch med hwilka- bearbetande början genall lunde göras ; Och dä , i anseende till Swistheten om hwad tom af hwarje är5 StatörMehel kommer att - : he Hufwuoe 	bib19277346_18131023_147394_44_0001_alto.xml-2-148
andiffa bcrgrn i $ amerika tro in $ nehälla ofantlig $ $ och $ om de en gäng bearbeta $ skola troligen en het revolution i handel blifwa deraf en följd $	18	1	bearbeta	Andiffa bcrgrn i S. Amerika tros in » nehälla ofantliga silfwer-tillgängar , och , om de en gäng bearbetas , skall troligen en het revolution i handeln blifwa deraf en följd . 	bib19223423_18250518_145063_39_0002_alto.xml-4-18
den nuvarande upplösa sannolik den 1 september $ och sålunda ha ministéren nio månad tid att bearbeta valkollegiei na och shmla röst för sig kandidat $	16	1	bearbeta	Den nuvarande upplöses sannolikt den 1 September , och sålunda har ministéren nio månaders tid att bearbeta valkollegiei na och shmla röster för sina kandidater . 	bib11653828_18300501_144028_99_0001_alto.xml-12-16
den tillämna förslag $ förutsänder iian val den förklaring $ att afsigt ingalunda vara $ att i denna fråga söka bearbeta opinion $ men då man allmängöra sig tank i någon ämne $ så fråga $ hvad afsigt dermed kunna vara $ örn ej att sprida de $ oell söka öfvertyga annan om de rigtighet $	20	1	bearbeta	det tillämnade förslaget , förutsänder Iian val den förklaringen , att afsigten ingalunda är , att i denna fråga söka bearbeta opinionen ; men då man allmängör sina tankar i något ämne , så frågas : hvad afsigten dermed kan vara , örn ej att sprida dem , oell söka öfvertyga andra om deras rigtighet ? 	bib11653828_18291109_144028_260_0001_alto.xml-2-20
efter hwad mi här sagd $ och hwad sjclfwa bok wida bra säga $ lärer ingen läsare iner wara willrädig i sig omdöme öfwer den utmärka rum den kolnmer att inta $ ej endast bland en ny $ men ibland all alster af wär litteratur $ der den bilda $ om icke en alldeles ny $ likwäl en föga bearbeta genre	59	1	bearbeta	Efter hwad mi här sagt , och hwad sjclfwa boken wida bättre säger , lärer ingen läsare iner wara willrädig i sitt omdöme öfwer det utmärkta rum den kolnmer att intaga , ej endast bland de nyare , men ibland alla alstren af wär litteratur , der den bildar , om icke en alldeles ny , likwäl en föga bearbetad genre- 	bib11653828_18250715_144028_160_0004_alto.xml-1-59
pund kapital ha här organisera sig till bearbeta af en stor silfwergrufworna i pasco uti peru $	7	1	bearbeta	punds kapital har här organiserat sig till bearbetande af de stora silfwergrufworna i Pasco uti Peru . 	bib11653828_18250113_144028_9_0002_alto.xml-1-7
den af bröderne som med fin egen hända bearbeta de fäll rolf lid efter annan bortta $ tilläde $ $ hjelpsamhck emot en naturlig fiende vara alltid wädclig och bitr merändels till sig följd ilka mev sielsmord $	8	1	bearbeta	Den af bröderne som med fine egne händer bearbetat de fäll Rolf lid efter annan borttagit , tilläde : " Hjelpsamhck emot en naturlig fiende är alltid wädclig och bitr merändels till sina följder ilka mev sielsmord . 	bib19520388_18120729_147487_31_0003_alto.xml-8-8
epok bearbeta all kunffaperna i masta inom samma hufwuden $ theologie $ moral $ politik $ förnuftslära $ $ $ i den andra clastifierade $ fördclte pä wista faculteter och person inom samma corpser $ i den tredje fördelte emellan särskild corpscr $ sä att de rationell stadnat inom universitetcrna $ och de empiriste merendels inom academierne $	1	2	bearbeta	epoken bearbetades alla kunffaperna i masta inom samma hufwuden , Theologie , Moral , Politik , Förnuftslära , Natur-philofophie ; i den andra clastifierade , fördclte pä wista Faculteter och personer inom samma Corpser ; i den tredje fördelte emellan särskilde Corpscr , sä att de rationelle stadnat inom Universitetcrna , och de empiriste merendels inom Academierne . 	bib11653823_18230408_144010_79_0003_alto.xml-4-1
den 9 april framlägga presidera eändcbädct resultat af förbunösförfemlingcns omröstning angående militairsaken $ och denna resultat erkänna enstämmig för dest besluta hwar och man af en 17 rösterne ha rätt atr namna 1 officer till ledamot i den militairista committé $ hwilkcn vara bestämd att bearbeta den technifla $	45	2	bearbeta	Den 9 April framlade presiderande Eändcbädct resultatet af FörbunösFörfemlingcns omröstning angående Militairsaken , och detta Resultat erkändes enstämmigt för dest besluta Hwar och en af de 17 rösterne har rätt atr namna 1 Officer till Ledamot i den Militairista Committé , hwilkcn är bestämd att bearbeta det technifla . 	bib11653825_18180427_145134_49_0002_alto.xml-5-45
$ o $ $ utter linne till salu för i $ $ banko $ karta öfwer trollhättan med des ny kanal vch $ lt $ pi $ fjat $ samt uifigt af all $ $ jemte en $ öfwer hel göra elf $ med historiik urderrättelst om kanal $ $ böra $ $ och bearbeta derstädes frän gammal tid till deg stutlig $ fullborda wid trollhätlan $	54	2	bearbeta	# o » Mcgi^er Utter linnes till salu för i R:d . Banko : Karta öfwer Trollhättan med deS nya Kanal vch & lt ; Pit ; fjat , samt uifigt af alla Trollhät-efallen , jemte en Genersl^tarta öfwer hela Göra Elf , med Historiik urderrättelst om Kanal ' .Arbeteli bör , «n och bearbetande derstädes frän äldre tider till deg stutlig » fullbordande wid Trollhätlan . 	bib13506739_18051115_144030_265_0005_alto.xml-4-54
deraf ega ruth $ ei endast för bita äterstäende af lagwerket $ utan ock för granskning af wederbörande aumärkningar samt fdr behandling och bearbeta af all hwad med ärendel eger gemenstap $ i följd hwaraf nägot httrande bfwer frägan om förordnänbe af en särskild $ $ itt $ $ ei vara erforderlig $ $ $ huriiwidä nägon mifl lid till lagarbete fullbördande böra $ förelägga $ $	23	2	bearbeta	deraf ega ruth , ei endast för bet äterstäende af Lagwerket , Utan ock för granskning af wederbörandeS aumärkningar samt fdr behandling och bearbetande af allt hwad med ärendel eger geMenstap ; i följd hwaraf nägot httrande bfwer frägan om förordnänbe af en särskild Gransknings-Comx » itt » / ei är erforderligt " 5:S " HUriiwidä nägon Mifl lid till Lagarbetets fullbördande bör Committ«-n föreläggas . " 	bib19277277_18290801_147682_175_0001_alto.xml-0-23
nom en kort och till bchoswct lämpa lärobok $ önsttigt ware $ att man äfwen få motta dylik lärobok $ ur samma synpunct bearbeta $ i artilleri $ topographien och strategi $ sund att en författning sedermera owilkorligt förcstref att ingen sick till första officersgraden tvid nägon corps fbrcstäs $ som ej undergå publik examen i denna larocurstr $	23	3	bearbeta	nom en kort och till bchoswct lämpad Lärobok ; önsttigt ware , att man äfwen fick mottaga dylika Läroböcker , ur samma synpunct bearbetade , i Artilleriet , Topographien och Strategien , sunt att en Författning sedermera owilkorligt förcstref att ingen sick till första Officersgraden tvid nägon Corps fbrcstäs , som ej undergått publik examen i dessa larocurstr . 	bib11653828_18110608_144028_131_0002_alto.xml-4-23
$ $ oaktadt hanö kejserlig majestät bearbeta $ tyst rike ej stnlle wilja bifalla $ $ fransta republik erhälla äfwannämnde gränslinie $ sä förbinda han kejserlig majestät sig formcligen at til riksarmcen icke lemna mera än sig contingent $ hwilken likwal ej sär inlägga i någon fästning $ utan at fred och wänstapen $ som nu $ wik ätcrsialde mellan han majestät och republik derigenom träda pä nägot sätt för nära $	6	3	bearbeta	«m , oaktadt hanö Kejserliga Majestäts bearbetande , Tysta Riket ej stnlle wilja bifalla ' «t Fransta Republiken erhäller äfwannämnde Gränslinie ; sä förbinder Hans Kejserliga Majestät sig formcligen at til RikSArmcen icke lemna mera än sin Contingent , hwilken likwal ej sär inläggas i någon fästning , utan at Freden och Wänstapen , som nu blif^ wik ätcrsialde mellan Hans Majestät och Republiken derigenom trädes pä nägot sätt för nära . 	bib11653828_17990507_144028_102_0002_alto.xml-9-6
