sentence_lemma	target_index	cluster	lemma	sentence_token	identifier
tjenst $ gagn och bra $ än capiten malm och lieutenant burman utmärkt tapper od berömlig forhällande $ hwaruti en med all nit blifwit understödja af lieutenant clement $	2	0	gagn	tjenst » gagn och bästa , än Capiten Malms och Lieutenant Burmans utmärkt tappra od berömliga forhällande , hwaruti de med all nit blifwit understödde af Lieutenant Clement ! 	bib15650837_18080604_146391_45_0002_alto.xml-5-2
pä en sä bestaffadt gagn som utgismarne förtjena den stor erkänfla den stall mdrig anse för en i $ rvcrdnfwct beröm $ att den predikosamling $ hwaraf första del $ i ljus framträdt $ förete en fullkomlig mönster pä wärt fpräk af c $ fain $ andelig waltalighct $ en mönster som stall obesegradt tafla med hwilka som gärna finna i en v bast sdlade spräk $ en mönster för sätt att leda begrepp och bö $ a hjertat till en migtigaste sanning $ och som $ dä författare beklaglig $ $ icke mer ar till $ stall liksom folla $ ställe i merlden genom en förewigad uppbpggelfe $ och en ännu mer wälsignadt an $ minne $	4	0	gagn	pä ett sä bestaffadt gagn som Utgismarne förtjena den största erkänfla Det stall Mdrig anses för ett i ' rvcrdnfwct beröm , att den Predikosamling , hwaraf första Delen „u i ljuset framträdt , företer ett fullkomligt mönster pä wärt fpräk af c » fain , andelig waltalighct , ett mönster som stall obesegradt tafla med hwilka som helst finnas i de v- bast sdlade spräk , ett mönster för sättet att leda begreppet och bö / a hjertat till de migtigaste sanningar , och som , dä Författaren beklaglige » , icke mer ar till , stall liksom folla h^ins ställe i merlden genom en förewigad uppbpggelfe , och ett ännu mer wälsignadt an I-cunhradt minne . 	bib11653828_18100210_144028_34_0001_alto.xml-1-4
dä konung alldeles icke will $ att redlig och upplyst man stola wara hindra frän att ined frimodighet och anständighet offentliggöra stna tank $ olli all hwad forn efter de öfwcrtygclse fair bidra lill den allmän gagn $ fä stall dct icke heller wara nägon förbjuden att yttra sig mening $ angäende hwad dag tro bchöfwa förbättra eller räkta i land lag $ förordning och allmän inrättning $	36	0	gagn	Dä Konungen alldeles icke will , att redlige och upplyste man stola wara hindrade frän att ined frimodighet och anständighet offentliggöra stna tankar , olli allt hwad forn efter deras öfwcrtygclse fair bidraga lill det allmännas gagn ; fä stall dct icke heller wara nägon förbjudet att yttra sin mening , angäende hwad dan tror bchöfwa förbättras eller räktas i Landets Lagar , Förordningar och allmänna inrättningar . 	bib11653823_18210615_144010_137_0010_alto.xml-13-36
en hederlig borgersman som $ en förmonlig rörelse $ med dertill pakande egendom $ ästun $ dag en kompan $ som vara ägare as cirka 6000 rd $ banko sör att utwidga densamma $ oä utom en säker reveny fri rum kunna erhälla $ samt sjelf kunna dageligen fä se och kontrollera nämde rörelse till bada gagn och nytta $ widare underrättelse lemna uti hus $ 39 i på söder och tullportsgatan $ 3 trappa upp $	56	0	gagn	En hederlig Borgersman som inneha^wer en förmonlig Rörelse , med dertill pakande Egendom , ästun » dar en Kompanion , som är ägare as cirka 6000 Rd , Banko sör att utwidga densamma : Oä utom ett säkert reveny fria Rum kunna erhällas , samt sjelf kunna dageligen fä se och kontrollera nämde rörelse till badas gagn och nytta ; widare underrättelse lemnas uti Huset N:o 39 i på Söder och Tullportsgatan , 3 trappor upp . 	bib13506739_18060219_144030_41_0004_alto.xml-12-56
behof vnyitiee $ mm för privat gagn brukbar $ $	6	0	gagn	behof vnyitiee , mm för Privat gagn brukbara , . 	bib11653825_18120512_145134_55_0004_alto.xml-5-6
$ detze jag tank för rike gagn $ för mine trogen uaderfätares walfard $ stola ätfölja utstottets betankande $ jag ha jag an ytterlig förbehällit at efter bestaffenheten af den beslut $ standerne fatta i hwad til de afgöra afgär $ kunna lemna ni och esterwerlden et ny och öswertygande wedcrmale af jag önstan och föresats at befrämja dratzelverkets säkerhet och upratthällande $ sä widt manstlig försigtighet kunna förutse händelfer och misiöden och förmä at de förekomma $	6	0	gagn	— Detze mina tankar för Rikets gagn , för mine trogne Uaderfätares walfard , stola ätfölja Utstottets Betankande ; jag har mig an ytterligare förbehällit at efter bestaffenheten af det Beslut , Standerne fatta i hwad til deras afgörande afgär , kunna lemna Eder och esterwerlden et nytt och öswertygande wedcrmale af min önstan och föresats at befrämja DratzelVerkets säkerhet och upratthällande , sä widt manstlig försigtighet kan förutse händelfer och misiöden och förmä at dem förekomma . 	bib19225772_18000604_148004_62_0007_alto.xml-3-6
enda lill sig regering $ all en sädan rättighet ej mifibrukas $ och att privat nia $ lt $ $ krig lärer understödja uj o krona manssap till företag $ joni ej öro af ckt gifwet och betydlig gagn $ och ej hasna siri grund i annan än leir $ iller ensidig speculaiisncr $	38	0	gagn	ende lill sin Regering , all en sädan rättighet ej mifibrukas , och att privat nian & lt ; ll■ krig lärer understödjas uj o Kronans Manssap till företag , joni ej öro af ckt gifwet och betydligt gagn , och ej hasna siri grund i annat än leir , iller ensidiga speculaiisncr . 	bib11653828_18120219_144028_41_0002_alto.xml-1-38
frzn denna sida synas den ingalunda likgiltig $ om desiucet lipphäfdes $ och man tro $ att en i $ $ $ $ g w gtig vrincrpe ofta re ward mera uppmärksamhet än den alltid $ och osäker $ b $ räkning $ räkning af gagn för den $ $	45	0	gagn	FrZn denna sida syntes det ingalunda likgiltigt , om desiucet lipphäfdes — och man trodde , att en i !in utw.-ci ?ii » g w gtig vrincrpe oftast re ward mera uppmärksamhet än den alltid sw^rr och osäkert uppgjorda b ' räkningen ' räkningen af gagnet för det närwarand».ögonblicket . 	bib13506739_18290328_144030_72_0001_alto.xml-7-45
hälst den böra gjörai swarande mot en sida rätsherres namn och förtjenst c ni rike $ säledes önska jag $ at nägon annan för swenffa historia nitälska medborgare behaga sörssjuta förlag kostnad $ dä jag med nöje ssall åtaga niig $ med $ $ $ gt $ n granstning $ som emot c $ sädant arbete wärdc $ ch gagn swarar $	59	0	gagn	hälst den bör gjörai swarande mot en sidan RätSherres Namn och Förtjenster c ni Riket : säledeS önskade jag , at nägon annan för Swenffa Historien nitälskande Medborgare behagade sörssjuta Förlags- kostnaden ; dä jag med nöje ssall Åtaga niig ulgiiningS-mödan med d&gt ; & gt ; n granstning , som emot c » sädant Arbetes wärdc » ch gagn swarar . 	bib13506739_17960617_144030_135_0002_alto.xml-3-59
wid $ säga $ uma gagn $ som gäsister $ och kunna jenuväl nytljech i lampa i ställ för $ eller tran $	5	0	gagn	wid m«trcdning sa , uma gagn , som gäsister , och kan jenuväl nytljech i lampor i stället för o^a eller tran . 	bib11653828_18110306_144028_55_0003_alto.xml-4-5
sweriges man och denna land tiu gagn $ frid och enighet $	6	0	gagn	Sweriges Män och detta Landet tiU gagn , frid och enighet . 	bib19225772_18290901_148004_98_0004_alto.xml-5-6
armé i tyskland $ ar 1814 $ i norrige $ dels vid armé $ dels såsom commissarie vid storting i christiania $ i sanning ärofull förrättning $ dervid minne af någongång uträtta t allmän gagn $ kunna $ utan egenkärlek $ återhämta $	34	0	gagn	Arméen i Tyskland : ar 1814 , i Norrige , dels vid Arméen , dels såsom Commissarie vid StorTinget i Christiania : i sanning ärofulla förrättningar , dervid minnet af någongång uträttad t allmänt gagn , kan , utan egenkärlek , återhämtas . 	bib11653828_18200224_144028_45_0006_alto.xml-8-34
fall fomine öftvcrsattningsförsöket att sprida obestämd eller origtiga begrepp om för $ städren gudalära $ bedrift och sed $ och ländt dä mera till stava $ än gagn $	27	0	gagn	fall fomine öftvcrsattningsförsöket att sprida obestämda eller origtiga begrepp om för , städrens Gudalära , bedrifter och seder ; och ländt dä mera till stava , än gagn . 	bib11653828_18180414_144028_84_0004_alto.xml-9-27
be ps academien et tal ötwer frsgan $ om llplvsam $ göra en stat mera gagn än skada $	15	0	gagn	ber pS Academien et Tal ötwer FrSgan : Om llplvSam » gör en Stat mera Gagn än Skada ? 	bib13506739_17951113_144030_260_0001_alto.xml-7-15
söka pä all sätt gagn $ jag medborgare $ ärna jag att ifra $ nästkommande april mävadö början $ till augusti mänadö $ flut $ om gud förläna jag helsan $ hwarje $ och helgedag eftermiddag $ efter flutad aftonfäng $ rller frän ti 4 lill6 $ lemna kostnadsfri underwisning uti räkning $ skrifning m $ m $ till gesäll och lärogoffar $ hwilka äro uti knapp wilkor och hafwa lust att lära nägot $	4	0	gagn	söker pä allt sätt gagn , mina Medborgare , ärnar jag att ifra » nästkommande April mävadö början , till Augusti mänadö - flut , om Gud förlänar mig helsan , hwarje Gön- och Helgedags Eftermiddag , efter flutad Aftonfäng , rller frän ti 4 lill6 , lemna kostnadsfri underwisning uti Räkning , Skrifning m . m . till Gesäller och Lärogoffar , hwilka äro uti knappa wilkor och hafwa lust att lära nägot . 	bib19277346_18180320_147394_12_0004_alto.xml-5-4
$ denna dag vara den jag stykdig $ het och stall äfwen wara jag ljufwaste $ tilftedsställelse $ $ tilftedsställelse $ tilftedsställelse $ nt uti alt hwad pä jag ämbets äkgärd kunna ankomma $ söka befordra stad gagn och heder $ nt maka för ordning och säkerhet och för des lugn willigt upoffra mit egen $	37	0	gagn	„Ifrän denna dag är det min stykdig , het och stall äfwen wara min ljufwaste , tilftedsställelse , , tilftedsställelse , tilftedsställelse , nt uti alt hwad pä min Ämbets äkgärd kan ankomma , söka befordra Stadens gagn och heder , nt maka för ordning och säkerhet och för des lugn willigt upoffra mit eget . 	bib11653825_18000227_145134_22_0003_alto.xml-8-37
gagn för den föga bemedla $ $ och de $ hwilka af from suftcher njuta oinwardnad och försorg $ wid proviantcring af ckdcrs $ $ ma $ $ t flotta oästi	0	0	gagn	gagn för den mindre bemedlade folk-elasten , och dem , hwilka af fromma Suftcher njuta oinwardnad och försorg ; wid proviantcring af ckdcrS ^ 0nÖl- Ma , : tS flottaarme- oästi 	bib11653823_18280104_144010_3_0002_alto.xml-5-0
jemn fördeladt arbete swarar emot en stor och ge en stor product $ sä kunna icke den swensta bonde arbete jcmföras med annan under andra förhällande $ $ ch en ögonkast pä charran $ hwar ländcrne äro belägen $ samt kännedom af de upp $ h jning osmer hassytan $ hwilkct tillstrifwts wara den förnäm orsak till climatens olikhet $ torde göra tillfyllest alt utwisa $ med hwad öfwerlägsenhet den ena folkllaget anwänvcr sig kraft till äkerbruk framför en annan $ $ den bra jord $ man och flera gynnande emständigheicr $ hwilka kunna hajma falla pä den ena lolt framför den $ om upphäfwandct af $ och en stor $ styckning till smärre $ ha medföra älffilligt flaga gagn för mennistoflagtet i allmänhet $ tnwcck $ lat den i flerfaldig förhållande $ reta begär $ uppsporrat lankeförmägan $ befara $ drat $ wetenstaper och konst $ sä ta dock böra medgifwas $ att denna stor förändring wer $ kar gansta ofördelaktig till erhällande af en låg spannmälspris $	119	0	gagn	jemnare fördeladt arbete swarar emot ett större och ger en större product , sä kan icke den Swensta Bondens arbete jcmföras med andras under andra förhällanden ; » ch ett ögonkast pä charran , hwar ländcrne äro belägne , samt kännedom af deras upp » h jning osmer hassytan , hwilkct tillstrifwts wara den förnämsta orsaken till climatens olikhet , torde göra tillfyllest alt utwisa , med hwad öfwerlägsenhet det ena folkllaget anwänvcr sina krafter till äkerbruk framför ett annat , ob.räknadt den bättre jord » manen och flera gynnande emständigheicr , hwilka kunna hajma fallit pä det enas lolt framför det andras- Om upphäfwandct af Lif-egcnstapen och de stora landt-egendomarneö styckning till smärre , har medfört älffilligt flags gagn för mennistoflagtet i allmänhet , tnwcck » lat det i flerfaldigare förhållanden , retat begären , uppsporrat lankeförmägan , befor » drat ' wetenstaper och konster , sä tar dock böra medgifwas , att denna stora förändring wer » kar gansta ofördelaktigt till erhällande af ett lågt spannmälspris . 	bib11653828_18180924_144028_220_0003_alto.xml-3-119
zr att $ $ mera till medborgare och egen gagn fä lika oegennyttig helga sig äterstäende leinad $ som ban hittills göra i fädernesland tjenst $	9	0	gagn	Zr att » » mera till medborgares och eget gagn fä lika oegennyttigt helga sin äterstäende leinad , som ban hittills gjort i fäderneslandets tjenst . 	bib13506739_18260703_144030_139_0004_alto.xml-23-9
tid han $ enligt denna wår disposition $ komma att hemman till sig gagn och basta nyttja och brula $ answarande han endaft derföre $ att de $ samma under han $ hand ej må blifwa genom wårdslvsbet winstöit eller $ begrafningskostnad och all andra utgift för sterbhulet $ räkning äga hr kyrkoherde att $ vid sig afträ $ de och wid blifwande flutliga ärfsdelning af sterbhus lillgängar sig godtgöra $ ulan afkortning pä den frukl han af hemmane $ njuta $	13	0	gagn	tid han , enligt denna wår disposition , kommer att Hemmanet till sitt gagn och basta nyttja och brula , answarande han endaft derföre , att de , samma under han » hand ej må blifwa genom wårdSlvSbet winstöit eller förstöidt- BegrafningSkostnad och alla andra utgifter för Sterbhulet » räkning äger Hr Kyrkoherden att » vid sitt afträ » de och wid blifwande flutliga Ärfsdelning af SterbhusetS lillgängar sig godtgöra , ulan afkortning pä den frukl han af Hemmane » njutit . 	bib11653823_18291002_0_228_0003_alto.xml-31-13
$ iorde man kunna anmäla den starf som man genom beswäret och omkostnad med denna inrättning welat offra till fädernesland gagn $	20	0	gagn	" iorde man kunna anmäla den starf som man genom beswäret och omkostnaden med denna inrättning welat offra till Fäderneslandets gagn . 	bib13506739_18100913_144030_214_0002_alto.xml-6-20
den allmän gagn $ font han personlig öfwersigt af flotta angelägenhet otwifwelaktigt böra bereda $ ha man tro sig under denna lrefök finna grunda anledning till den förhoppning $ att förwaltnjngen as $ och befälhafwande $ härstädes hetdanefter torde handla i tuera öfwercnsstanimclse an hittills $ hwilket för flotta angelägenhet utan twiswel more att i hög grad önska $ hälst i en lid då man se enhet inom samma styrclsewerk yrka såsom man säga wigtig nödwandighet $	2	0	gagn	det allmänna gagn , font hans personliga öfwersigt af Flottans angelägenheter otwifwelaktigt bör bereda , har man trott sig under detta lrefök finna grundade anledningar till den förhoppning , att Förwaltnjngen as Sjö-Ärenderne och Befälhafwande Ainirals-Enibetet härstädes hetdanefter torde handla i tuera öfwercnsstanimclse an hittills , hwilket för flottans angelägenheter utan twiswel more att i hög grad önska , hälst i en lid då man sett enhet inom samma Styrclsewerk yrkas såsom en sa wigtig nödwandighet . 	bib15650837_18300623_146391_50_0001_alto.xml-5-2
$ öömen sself hwad gagn i gören i samhälle $ til hiva tjenst $ ära	4	0	gagn	?S öömen sself hwad gagn I gören i samhället , til hivad tjenst I- ären 	bib15650837_17930209_146391_12_0003_alto.xml-2-4
till den af prefessoren äfyftade ändamiil rjcnlige wlitnande ej liten om han $ erfarenhet i barn $ $ örds $ läkare konst $ än han manlig nit för inedmenni $ gagn vch bra $ bwiikct yttrande genom utdrag af protokoll skola professorrn $	30	0	gagn	till det af Prefessoren äfyftade ändamiil rjcnlige wlitnande ej mindre om han » erfarenhet i Barns !&gt ; ördS ; Läkare konsten , än hans manliga nit för inedmenni ?cr« gagn vch bästa ; bwiikct yttrande genom Utdrag af Protokollet skulle Professorrn . 	bib11653806_18031209_145120_134_0004_alto.xml-4-30
desse hingst leo i wär till allmän gagn $ mot erläggande $ f en lunna hafre $ $	7	0	gagn	Desse Hingstar Leo i Wär till allmänt gagn , mot erläggande * f En Lunna Hafre Föl-afgift . 	bib19227291_18270214_145289_7_0005_alto.xml-0-7
vfiver jag medolyckiiges smara öde $ fanste vara denna tuktan ofi och $ andra titt gagn och wälsignelse $ utan för att härigenom hämta anledning att tilläta jag röra hjerta nägot utbrott af ben myckna glädje och ödmjuk tacksamhet den hysa $ för en äbeisinnade znwägare i huswudstaden vch medborgare i otterne som sammanflyta sä betydlig gänvvr till mine ömkadr och ömkanswäide landsman understöd $ vcku för att $ jag wägar hoppa den $ anleda flere godhjerjgde $ medmänniflor att följa fä wackra $ fä $	15	0	gagn	vfiver mina medolyckiiges smara öde — fanste är denna tuktan ofi och .wänga andra titt gagn och wälsignelse — utan för att härigenom hämta anledning att tilläta mitt rörda hjerta nägot utbrott af ben myckna glädje och ödmjukaste tacksamhet det hyser ' för de äbeisinnade Znwägare i huswudstaden vch Medborgare i Otterne som sammanflutit sä betydligt gänvvr till mine ömkadr och ömkanswäide Landsmäns understöd : vckU för att — jag wägar hoppas det — anleda flere godhjerjgde ochchemedla.de medmänniflor att följa fä wackra , fä sällhetgifwan- 	bib11653792_18081001_146919_39_0002_alto.xml-6-15
åtfölja af den lycklig framgäng $ sig elev möjlig bildning och de förälder ut $ aktning $ lian pretention öswerstiga tuipr icke den gagn $ lian tro sig kunna ästadkomma $	23	0	gagn	åtföljd af den lyckligaste framgäng , sina Elevers möjligaste bildning och deras Föräldrars ut !närkta aktning : lians Pretentioner öswerstiga tuipr icke det gagn , lian tror sig kunna ästadkomma . 	bib13506739_18100525_144030_121_0014_alto.xml-2-23
het anmäidte skäl och omständighet $ samt till befrämja af del här i stad $ $ noer wär höglälsteiig $ $ gemälo $ hon moj drottning hög beffydd $ $ tanda institut för bunde rch döfstumme fortfarande nytta och beständ $ finna för god i räd bifrlla och forerdna $ den en kollekt $ till förman för samma in $ rättning $ komma att öswer hel wärk rike uppta för innewarande vara 1822 $ sä ör derföre lill e ni wär näoiga wilja och befallning $ den z dra försorg $ öst ifrägawo $ randa kollekt $ sä sätt och med de undanta författning medgif $ wa $ warder uii lyrkorne inom en ni anförtro församling upphemtad $ hwarwld wi ost i räd tillförse $ att wäe trogen undersätare med wäl och möjlig frikostighet bidra $ aft understödja och fullkomna en inrättning $ hwars wälgvrande gagn af $ och $ fä hög pskallas $	145	0	gagn	het anmäidte skäl och omständigheter , samt till befrämjande af del här i Staden u&gt ; noer Wär Höglälsteiig , , Gemälo , Hennes Moj:t Drottningens Höga Beffydd wa« ' tande Instituts för BUnde rch Döfstumme fortfarande nytta och beständ , funnit för godt i Räder bifrlla och forerdna , det en Kollekt , till förmän för samma In » rättning , kommer att öswer hela Wärk Rike upptagas för innewarande är 1822 ; Sä ör derföre lill E er Wär Näoiga wilja och befallning , det Z dragen försorg , öst ifrägawo , rande Kollekt , sä sätt och med de undantog Författningarne medgif , wa , warder uii Lyrkorne inom de Eder anförtrodde Församlingar upphemtad , hwarwld Wi Ost i Räder tillförse , att Wäe trogne Undersätare med wälwilja och möjlig frikostighet bidraga , aft understödja och fullkomna en Inrättning , hwarS wälgvrande gagn af menfll-gtzet och famhälls-pligk fä högt pSkallaS . 	bib19223423_18200506_145063_36_0001_alto.xml-2-145
som dnutöswer sörtärcs göra mera stada $ än gagn $ och derföre se man sä mänga stor $ itare mager $ och person $ som äta liten $ deremot fet $	8	0	gagn	som dnutöswer sörtärcs gör mera stada , än gagn , och derföre ser man sä mänga stor » itare magra , och personer , som äta litet , deremot feta . 	bib11653828_18190211_144028_34_0001_alto.xml-5-8
ehuru föga lämpeligt den vara $ att här gifwa erforderlig begrepp om deffa spi $ sar $ ha man dock anse sig böra lemna sä mycken underrättelse derom $ att okunnighet och mifftybningsr icke mäge förhindra den betydlig gagn som allmänhet nu börja och framgent under jemn fortskrida stall winna af dest $ kokinrättning antagan $ de till daglig bruk och nyttjande $	38	0	gagn	Ehuru mindre lämpeligt det är , att här gifwa erforderligt begrepp om deffa spi » sar , har man dock ansett sig böra lemna sä mycken underrättelse derom , att okunnighet och mifftybningsr icke mäge förhindra det betydliga gagn som allmänheten nu börjat och framgent under jemnt fortskridande stall winna af dest » kokinrättningars antagan » de till dagligt bruk och nyttjande . 	bib11653828_18080420_144028_90_0001_alto.xml-1-38
hwilken summa $ ehuru ej obetydlig $ directionen tro sig kunna inbespara $ genom den förändring uti prämhästarnes foragering $ som den nu sätta i tillfälle att införa $ vch den gagn häst kunna göra wintertiden wid hamn $ nar en aro der att tillgä $ i stall för att de förut utfodra pä en landtegendom $ hel den tid de ej kunna begagna för mudderwerket $	31	0	gagn	hwilken summa , ehuru ej obetydlig , Directionen tror sig kunna inbespara , genom den förändring uti Prämhästarnes foragering , som den nu sattes i tillfälle att införa , vch det gagn hästarne kunna göra wintertiden wid Hamnen , nar de aro der att tillgä , i stallet för att de förut utfodrats pä en Landtegendom , hela den tiden de ej kunnat begagnas för Mudderwerket . 	bib19227306_18300120_147700_3_0006_alto.xml-7-31
$ $ mifsolierna till sörckommande och afbbiaiide af process och de obe $ hagligheter $ eir $ erfarenhet ha sä bekräfta de owanligt walgörande gagn $ akt man nied skal förundra sig $ att de ännu ingen annorstädes blifwit in $ sörda $	24	0	gagn	ninya-kon , mifsolierna till sörckommande och afbbiaiide af processer och deras obe » hagligheter .. Eir l^ng erfarenhet har sä bekräftat deras owanligt walgörande gagn , akt man nied skal förundrar sig deröfwer^ att de ännu ingen annorstädes blifwit in » sörda . 	bib11653828_18231018_144028_242_0003_alto.xml-4-24
ning $ och alt $ gt $ följd deraf utföra förrättning af stor och allmän gagn $ denna p igt st $ ille dä maia liten ädel $ än de $ $ ait gä hjelphjon och extra drang hos noiionden och grannarnc i trakt $	15	0	gagn	ning , och alt & gt ; följd deraf Utföra förrättningar af stort och allmänt gagn , denna p igt st , ille dä maia mindre ädel , än de » , ait gä hjelphjon och extra drang hos Noiionden och grannarnc i trakten ! 	bib11653828_18120219_144028_41_0003_alto.xml-3-15
af denna omdöme $ ha man ej lztit afffräfa fiq af den nog betydlig kostnad de $ brefs utgifwandc fordrot $ dz man jämte utsikt af en mätielig winst kunna äga den tilfredsställelsen $ at pä nägot sätt bidra til swenssa litteratur gagn och den täiande allmänhet nöje $	42	0	gagn	af detta omdöme , har man ej lZtit afffräfa fiq af den nog betydliga kostnad de ?e BrefS utgifwandc fordrot , dZ man jämte utsikten af en mätielig winst kunde äga den tilfredSställelsen , at pä nägot sätt bidraga til Swenssa Litteraturens gagn och den täiande Allmänhetens nöje . 	bib13506739_17960226_144030_47_0001_alto.xml-3-42
gagn kunna jag mänra af en man $ hwars förntögenhet ar förspilla $ och son $ $ i fall jag inlåter ung med han i samtal $ ej roa jag med glad ämne än sig motgängar och sig hehof $	0	0	gagn	gagn kan jag mänra af en man , hwars förntögenhet ar förspilld » och son » , i fall jag inlåter ung med honom i samtal , ej roar mig med gladare ämnen än sina motgängar och sina hehof ? 	bib11653828_18140119_144028_14_0001_alto.xml-8-0
jo $ de som aro sned och illa wäxt $ kunna hofwa stor gagn af ek snörlif eller en corsett $ som ar pasiande til kropp $ emedan den ond annars tiltager $	13	0	gagn	jo : De som aro sneda och illa wäxt » kunna hofwa stort gagn af ek snörlif eller en Corsett , som ar pasiande til kroppen , emedan det onda annars tiltager . 	bib19225772_17960216_148003_13_0003_alto.xml-6-13
fransk samtal $ till gagn köra resa $ och til underwismng i språk för ungdom $	4	0	gagn	Franska Samtal , till gagn kör resande - och til underwismng i Språken för Ungdom . 	bib13506739_18290424_144030_93_0005_alto.xml-9-4
de mänga finaneeplancr som inkomma $ hafwa göra mera stada $ gagn $	11	0	gagn	De mänga Finaneeplancr som inkommit , hafwa gjort mera stada «n gagn . 	bib11653828_17960111_144028_7_0002_alto.xml-5-11
