sentence_lemma	target_index	cluster	lemma	sentence_token	identifier
de blifwa ej sä hastig färdig med sig studie $	8	0	studie	De blifwa ej sä hastigt färdige med sina Studier , 	bib19277346_18120523_147394_22_0003_alto.xml-1-8
skola ha likwäl delta företag lyckas $ utan bäve lärare och lärjunge betunga $ och utan att tid bliswit bortta för angelägen studie $	22	0	studie	Skola har likwäl delta företag lyckats , utan bäve lärares och lärjungars betungande , och utan att tiden bliswit borttagen för angelägnare studier . 	bib11653828_18181009_144028_233_0001_alto.xml-4-22
en sädan hjelp för sig barn hastig franisteg i studie $ täcka till öfwerenskommelse upp fi $ adretz uti försegl $	9	0	studie	en sädan hjelp för sina barns hastigare franisteg i studier , täcktes till öfwerenSkommelse uppgifwa fi » adretz uti försegl . 	bib13506739_18231029_144030_250_0011_alto.xml-6-9
för att ifrån begynnelse bilda till en $ visit yrke och intet annan $ antingen han ha fallenhet eller ej $ och srvärligcn kunna han sedermera $ $ n de genom studie wackra anlag flulle sä fordra $ andra sig bana $ emedan man blott göra han skicklig att beträda en enda $	31	0	studie	för att ifrån begynnelsen bildas till ett » visit yrke och intet annat , antingen han har fallenhet eller ej ; och srvärligcn kan han sedermera o&gt ; n de genom Studierna wackra anlagen flulle sä fordra , andra sin bana , emedan man blott gjort honom skicklig att beträda en enda . 	bib19227291_18230416_145289_16_0001_alto.xml-4-31
wid fransta invasion war han all för ung $ för att kunna ta nägon utmärkt werksam del i sig fosterland förjwar $ och under den helig allians länga fredsperiod $ ha han ej tillfälle att förwärfwa sig den ersannhet i krigisk operation $ som behösdes $ för att kunna utmärka sig regering med lysa bragd $ säsom fältherre $ deremot underlåta han ej att med ifwer fortsätta sig krigswettenffapliga studie $ under stickliga lärare och erfaren veteran ledning $	69	0	studie	Wid Fransta invasionen war han allt för ung , för att kunna taga nägon utmärkt werksam del i sitt fosterlands förjwar , och under den Heliga Alliansens länga fredsperiod , hade han ej tillfälle att förwärfwa sig den ersannhet i krigiska operationer , som behösdes , för att kunna utmärka sin Regering med lysande bragder , säsom Fältherre ; deremot underlät han ej att med ifwer fortsätta sina krigswettenffapliga studier , under stickliga Lärares och erfarne Veteraners ledning . 	bib19223423_18291104_145063_88_0002_alto.xml-14-69
en ung $ gist man $ som po $ $ $ studie $ samt äfwen kunna biträda wid smärre procter $ önska at emot 2 a z rum och kök $ sä emotta nägon nar $ eller fränwarande $ kommission och affairer $	11	0	studie	En ung ' gist Man , som po ?ederar äes«rder !ige Studier , samt äfwen kan biträda wid smärre Procter , önskade at emot 2 a z Rum och Kök , sä emottaga nägon nar , eller fränwarande Hus-Ägares kommissioner och Affairer . 	bib13506739_17990118_144030_15_0008_alto.xml-6-11
tnssas en någorlunda jemnarig läskamrat till täffan i studie och sedebildning iltt fadren $ få $ mer än 20 åt af sig lefnad med annan barn $ $ derwlsning $ ej $ vårdslösa sig egct $ derom behölwas mäla ej tänkande förälder erinra $ och att bägge gosarna skola dela llka öm omwardnad $ sirftkras helig $	8	0	studie	tnssas en någorlunda jemnarig Läskamrat till täffan i studier och sedebildning iltt Fadren , fom tillbra^t mer än 20 åt af sin lefnad med andras barns , » derwlSning , ej » vårdslösar sitt egct , derom behölwas mäl ej tänkande Föräldrar erinras : och att bägge GoSarna skola dela llka öm omwardnad , sirftkraS heligt . 	bib13506739_18210315_144030_62_0011_alto.xml-18-8
smak för studie och läsning $ hwarigenom jag undgär en nära umgänge med en öfrigv arbetare $ $	2	0	studie	smak för studier och läsning , hwarigenom jag undgär ett närmare umgänge med de öfrigv arbetarne . " 	bib11653828_18150929_144028_226_0003_alto.xml-4-2
och förmögenhet $ utnämna en studerande $ iwänne af hwarjt fa $ rnltek $ som $ under år omlopp $ för säll yut sig cch framsteg i de studie göra sig förtjente of prämier $	28	0	studie	och förmögenhet , utnämna de Studerande , iwänne af hwarjt Fa » rnltek , som , under årets omlopp , för säll yut sitt cch framsteg i deras Studier gjort sig förtjente of prämier . 	bib19520388_18110103_147487_1_0003_alto.xml-7-28
efter flera sr anwänd möda wed studie $ $ kunssa $ och mun stadga ästundar en $ lig dngling i handelsrörelse blifwa engagera $ stulle nägon af herre handla wilja han einploftra $ kunna anmälan derom så hos bokhållare polmgwist wid ny sockerbraket $	6	0	studie	Efter flera Srs anwänd möda wed studier , inhämtad kunssa » och munnen stadga ästundar en ffic« lig Dngling i Handelsrörelsen blifwa engagerad ; stulle nägon af herrar Handlande wilja honom einploftra , kan anmälan derom ste hos Bokhållaren Polmgwist wid Nya Sockerbraket . 	bib15650837_18100105_146391_2_0004_alto.xml-6-6
ined fler hwilkas sarar wore god embetsman i han och rike tienst $ en $ $ o fullkomlig understöd til mängäriga studie ock utrikes resa $ fä i penning son $ uti härabsräntor $	21	0	studie	ined fler- hwilkas sarar wore gode embetsmän i hans och rikets tienst ; de fins&gt ; o fullkomlige understöd til mängäriga studier ock utrikes resor , fä i penningar son , uti Härabsräntor . 	bib11653828_18210303_144028_52_0001_alto.xml-3-21
uti undertecknads $ för c $ och fkrberebande akademist bildning $ emotta mer och föga förstgkvinne gopar $ sör hwilka önstas en alkwarliz handledning i studie $	25	0	studie	Uti undertecknadS Läro-anstalt för c vilt-humanistisk och fkrberebande akademist bildning , emottagaS mer och mindre förstgkvinne Gopar , sör hwilka önstaS en alkwarliz handledning i studier . 	bib19277277_18301223_147682_299_0004_alto.xml-21-25
ung och omogen till re sä widsträckta medicinsk studie $	8	0	studie	unga och omogna till re sä widsträckta medicinska studierna . 	bib11653828_18030819_144028_187_0002_alto.xml-7-8
en annann erindran til anmärkare vara den $ at om han och zllmänheten hafwa näzra anfpräk i anfeende til en artist som $ rikeligen understödja af almanna medel bäde u $ d $ studie $ resa och etablisiement i fädernesland $ äro pligtice at wisa sig wara denna omwärdnad wärdige $ medelst wärdige $ utur de hand $ sä äga man ej samma anspräk hos de som icke kosta zllmänheten nägra sammanstöta $ och aldraminst böra u $ an fordra fullkomligset hos elev 10m $ altid med warsamher handtera för et ej afjfråmié $ ä sig sida ha billig anspräk pä akining $ dä han $ desia stor föpetsg hn $ lka $ oy $ ej genast med önstad sramgäng $ lik genom ihärdighet och öfning tana honvm at blifwa konstnär $ hwärtil ingen hinna $ $ ing blott hälla sig wid eopiering och återtagning $ ech i skulptur allenast wid den prosslerade ansigtel och fnuu wägar tillägga $ jzuiten $ hwilken sistnämd onckeligen ar mästerlig nar han komma $ $ mästarehand $ men lika sä liten tjenar lil bewis pä statuairens talang som copii ving och imitation wittna om en skickelig historlmälate $	33	0	studie	En annann erindran til Anmärkaren är den , at om han och Zllmänheten hafwa näzra anfpräk i anfeende til de Artister som ( rikeligen understödde af almanna medel bäde U " d ?r studier , resor och etablisiement i Fäderneslandet ) äro pligtice at wisa sig wara denna omwärdnad wärdige , medelst wärdige Ko^starbeten utur deras händer ; sä äger man ej samma anspräk hos dem som icke kostat Zllmänheten nägra sammanstött : och aldraminst bör u , an fordra fullkomligset hos Eleven 10m , altid med warsamher handterad för et ej afjfråmié , ä sin sida har billiga anspräk pä akining , dä han .c.ngriper desia större föpetsg hn ' lka , oy , ej genast med önstad sramgäng , likwal genom ihärdighet och öfning Tana honvm at blifwa Konstnär , hwärtil ingen hinner som-i M.l iNg blott häller sig wid eopiering och återtagningen , ech i Skulpturen allenast wid det prosslerade ansigtel och fnuu wägar tillägga ) JZuiten , hwilken sistnämde onckeligen ar mästerlig nar Han kommer » !lur Mästarehand , men lika sä litet tjenar lil bewis pä StatuairenS talang som copii vingar och imitationer wittna om en skickelig HistorLMälate . 	bib11653828_17980525_144028_118_0002_alto.xml-5-33
den stipendiat $ $ som $ utan styrka laga föichall $ linder $ månad $ sammanräkna pä hel år $ uraktlåta att begagna en ntwägar $ chan iippgifwit sig äga $ till sig studie fortsättande wid bergsstolan i falun $ $ institut $ gt $ stockholm $ handeisflvlan i göteborg eller andra dylik $ anstalt $ $ sig $ $ pendrilni svrltistkg $	33	0	studie	Den Stipendiat , - som , utan styrkt laga föichall , linder 2:ne månader , sammanräknade pä hela året , uraktlåter att begagna de ntwägar , chan iippgifwit sig äg » till sina studiers fortsättande wid Bergsstolan i Falun , .Technologista Institutet & gt ; Stockholm , Handeisflvlan i Göteborg eller andra dylika , anstalter , b.lifwer sitt St&gt ; pendrilni svrltistkg . 	bib11653823_18301101_144010_253_0002_alto.xml-15-33
förmana all prest at fortsätta fin studie $ at göra fig bekaitte nied ben ny kiteraturen och lara känna de i sen rida göra anfall emot ben christna religion $ samt de wederlagga $ $	6	0	studie	förmanade alla Prester at fortsatta fina Studier , at göra fig bekaitte nied ben nya kiteraturen och lara känna de i senare rider gjorde anfall emot ben Christna Religionen , samt dem wederlagga " . 	bib11653828_17920221_144028_43_0002_alto.xml-12-6
hos en glft pcestmau i upfala fiinna bra förälder barn i en för all inackordera $ antinoen fara hcla äret eller ock köra en afademista lästecminerna och derjemtc $ om fä önstas $ erhälla tillsy $ och biträle i sig studie $	40	0	studie	HoS en glft Pcestmau i Upfala fiinna bättre Föräldrars barn i ett för allt inackorderas , antinoen for hcla äret eller ock kör de Afademista Lästecminerna och derjemtc , om fä önstaS , erhälla tillsy » och biträLe i sina studier . 	bib13506739_18250917_144030_215_0008_alto.xml-10-40
octzutom wille ni wäläkewörbighet och scholan necior sätfkildk til jag inkomma med förslag oni hwad lil underwisningrns befrämja skola anse wara gagna $ emedlertid sär jag an $ moda ni wälärewördighet $ at wid den anställa $ besörja at om yngling skola finna anklngen häglöse för studie eller lii be andra sörargelsr $ ledig $ en samma frän schola $ $ wisel $ asive $ som rector tiller $ at de tom witz gendirrne icke länka fortfara $ ej länge qwarbliswa tvid schola $ $ än de inhämta en kunskap simma	46	0	studie	Octzutom wille Eder Wäläkewörbighet och Scholans Necior sätfkildk til mig inkomma med Förslag oni hwad lil underwisningrns befrämjande skulle anses wara gagnande : emedlertid sär jag an » moda Eder Wälärewördighet , at wid den anställande Sesivlä-Distkationen besörja at om ynglingar skulle finnas anklngen häglöse för Studier eller lii be andres sörargelsr » ledige , de samme frän Schola » f«n wisel : asive » som Rector tiller , at de tom witz Gendirrne icke länka fortfara , ej längre qwarbliswa tvid Schola » , än de inhämtat de kunskaper sam 	bib19520388_17960817_147487_33_0007_alto.xml-2-46
borda sig musikcliffa studie under en $ ryktbar sala $ och der dm namnkunnig gugliclmi gaf han undervisning i den del af konst $ som vara känd under namn af stil $	3	0	studie	bordade sina musikcliffa studier under de » ryktbara Sala , och der dm namnkunnige Gugliclmi gaf honom undervisning i den delen af konsten , som är känd under namn af stil . 	bib11653828_18190525_144028_118_0003_alto.xml-5-3
efter förlopp as hwarje halst vara böra stipendiat till riddarhnsdirectioncn tnianda wederbörliga betyg ö $ iver en framsteg $ hail göra $ sä ival i knnstapen $ som i be tech $ lista af sig yrke $ lam desintom styrka uppgift pä de $ tid $ han oafbrutet begagna till fortsätta af sine studie $	53	0	studie	Efter förloppet as hwarje halst är bör Stipendiaten till RiddarhnsDirectioncn tnianda wederbörliga Betyg ö , iver de framsteg , hail gjort , sä ival i knnstapen , som i ber tech , lista af sitt yrke , lamt desintom styrkt uppgift pä de » tid , han oafbrutet begagnat till fortsättande af sine studier . 	bib11653823_18300901_144010_201_0003_alto.xml-26-53
en lillg tiensteman me $ sttlländade $ studie $ önstar att mot kost och ivgitbtifwa anta till informator i nägon stilla	7	0	studie	En lillg Tiensteman me » sttlländade Akad.-misti studier , önstar att mot kost och ivgitbtifwa antagen till Informator i nägon stilla 	bib19277277_18290908_147682_207_0004_alto.xml-28-7
$ jemte epräkcn och ilatzista studie lemna underwisiitng i musik och ritkonst $	5	0	studie	^ Jemte Epräkcn och ilatzista studier lemnas underwisiitng i Musik och Ritkonst . 	bib13506739_18171218_144030_293_0011_alto.xml-17-5
en studerande som äga godkänd $ öiirer studie och uppförande $ och redan i 7 vara warit anförtro $ om andra $ $ $ ästundat med den lörsta e $ dylik strtroend $ uti nägot hederligr hu $ $ i brist de önska han att wffja limma om dag undcrwisa i nägot af en gammal spräken $ eller zransta ech tyst $ chiistendomen $ eller nägon wetenstapszel $ emot en mättlig belöning $	7	0	studie	En Studerande som äger godkända b-t^g öiirer studier och uppförande , och redan i 7 är warit anförtrodd wä-den om andra » Ba-N , ästundat med det lörsta e !t dylikt strtroend : uti nägot hederligr Hu » ; i brist deras önskat han att wffja limmat om dagen undcrwisa i nägot af de gamla spräken , eller Zransta ech Tysta , Chiistendomen ' eller nägon WetenstapSZel , emot en mättlig belöning . 	bib13506739_18090404_144030_76_0007_alto.xml-6-7
ickligt uppförande kunna förete $ dä anmälan steka os hökare larston pä stamp i hus $ 50 $ en dngling $ forn nyligen flutat sig studie id härwarande hög lärdomsskola och kunna $	25	0	studie	ickligt uppförande kan företes , dä anmälan stek os Hökaren Larston pä Stampen i Huset N:o 50 ; En Dngling , forn nyligen flutat sina studier id härwarande högre Lärdomsskola och kan . 	bib19225792_18240918_147359_38_0007_alto.xml-3-25
$ försöka örn bi $ mera scieniifikr än economiskt $ uppehålla sig mäst qt bestriiwcr denna inftckens ffapnad $ dest sätt ac samla honingen och waxet $ den förra af mjöl pä bloiiimornes stsminu $ set sen ur de säga kalla dretklrls elier sig glandlar wid blomblad rot $ $ vederlägga den lanka de lära länge ha $ at blers snyte more en pump $ och wisar at honungssaft uphämtas genom läppja och ej genom sugning $ hjelpreda $ för at kunna ratt sömma om förman af england $ $ med frankrike $ här uptages engelsk manufaklurernes wärde lil en summa af 51 $ 410 $ 002 pund sterb $ den förnöja landtmannen $ en liten berättelse $ som wisar at el srkndt begrepp $ utan studie ofta göra nog lil en ringare lycksalighet $ brefwaxling emellan fredric och felicia $ innehålla $ bref $ hwaraf fortsättning $ en smaklig moral $ fin granstning af sed $ recension af $ engelsk bok $ $ $ röra herschel uptackc af man volcaner mil man anföra följande $ han bref derom börja med denna nödig reflexion $ $ när wi pä man yta blifwa warse en half $ til en och en half engelsk mil uphöjningar $ sä hafwa mi rätt at kalla deirr berg $ men när wi nogare undersöka de stapnad $ och finne den likna voleaners $ $ $ $	126	0	studie	— Försök örn Bi - mera Scieniifikr än Economiskt ; uppehåller sig mäst qt bestriiwcr denna inftckens ffapnad , dest sätt ac samla Honingen och Waxet , den förra af mjölet pä Bloiiimornes Stsminu , set senare ur deras sa kallade dretkLrls elier sina glandlar wid blombladens rot ; » vederlägger den lankan de Lärde länge haft , at Blers snyte more en pump , och wisar at honungssaften uphämtas genom läppjande och ej genom sugning — Hjelpreda , för at kunna ratt Sömma om förmanen af Englands stst-r Handels-Tractat med Frankrike : Här uptages Engelska Manufaklurernes wärde lil en Summa af 51 , 410 , 002 pund Sterb — Den förnöjde Landtmannen : en liten Berättelse , som wisar at el srkndt begrepp , utan studier ofta gör nog lil de ringares lycksalighet — Brefwaxling emellan Fredric och Felicia : innehåller Z:ne Bref , hwaraf Fortsättning läfwas- En smaklig Moral ; fin granstning af Sederne — Recension af 2:116 Engelska Böcker , utkomne 1788- Rörande Herschels uptackc af Manens Volcaner mil man anföra följande : Hans Bref derom börjas med denna nödiga reflexion - " När wi pä Manens yta blifwa warse en half , til en och en half Engelsk mils uphöjningar ; sä hafwa mi rätt at kalla deirr Berg ; men när wi nogare undersöke deras stapnad , och finne den likna Voleaners . » * ? 	bib11653828_17901106_144028_258_0001_alto.xml-3-126
upoffcar nägra tima äta studie och metenskaper $ chwilkas ifrig beskyddare han vara $	4	0	studie	upoffcar nägra timar ät Studier och Metenskaper , chwilkas ifrige Beskyddare han är . 	bib11653828_17961028_144028_247_0001_alto.xml-5-4
med en presterliga studie skola wilja förena någon af en medicinsk $ säga synes en wist kännedom af botanik $ samt pä sten höjd sä mycket af medicin som $ en underläkare fordra $ wara all hwad man af en prest i $	3	0	studie	med de presterliga Studierna skulle wilja förena något af de Medicinska , sa synes en wist kännedom af Botanik , samt pä stn höjd sä mycket af Medicinen som «f en Underläkare fordras , wara allt hwad man af en prest i den- 	bib11653828_18100330_144028_75_0001_alto.xml-9-3
deli stipendiat $ sorn $ utan styrka laga förfall $ under $ mänader $ sammanräkna pä hel $ år $ uraktlåta att begagna en utwägar $ han nppgifwit sig äga $ till fin studie fortfättandc ivid bergsstolan i falun $ technologista institut i strakholm $ $ l $ $ eller andra dylik anstalt $ bliswer sig stipendiilin förlustig $	33	0	studie	Deli Stipendiat , sorn , utan styrkt laga förfall , under 2:ne mänader , sammanräknade pä hela , året , uraktlåter att begagna de utwägar , han nppgifwit sig äga , till fine studiers fortfättandc ivid Bergsstolan i Falun , Technologista Institutet i Strakholm , ^andelsMan l Gc-tebrrg , eller andra dylika anstalter , bliswer sitt StipendiIlin förlustig . 	bib11653823_18300901_144010_201_0003_alto.xml-25-33
tjensriökaxde $ att hos någon af hrr bryggare bliswa engagera $ anmäla sig en från landsort nyligen till stock $ holme anländ och med hedra rekommendation förse ungling $ som $ $ $ te idka studie $ äfwen sörwärf $ vara sig kunskap i bokhålleri $	35	0	studie	Tjensriökaxde : Att hos någon af Hrr Bryggare bliswa engagerad , anmäler sig en från Landsorten nyligen till Stock » holm anländ och med hedrande rekommendation försedd Ungling , som , e&gt ; ter idkade studier , äfwen sörwärf » var sig kunskap i Bokhålleri . 	bib13506739_18210614_144030_136_0012_alto.xml-8-35
en studerande ifrän upsala $ som utom andra studie $ äfwen känna franska och tyssan $ sstundar condition i et god och hederlig hus här i stad $	8	0	studie	En Studerande ifrän Upsala , som utom andra Studier , äfwen känner Franskan och Tyssan , Sstundar Condition i et godt och hederligt Hus här i Staden . 	bib13506739_17910801_144030_174_0006_alto.xml-6-8
en studerande wid upsala akademi önstar i sommar pä land fä uuderwisa nkigra liten gostar i en för de behöflig studie $	20	0	studie	En Studerande wid Upsala Akademi önstar i Sommar pä Landet fä uuderwisa nkigra mindre Gostar i de för dem behöflige studier . 	bib13506739_18290617_144030_137_0004_alto.xml-22-20
$ den stor lo dö koni en dag in uti konung eabinett $ dä hans $ war syflosalt med fin studie $	20	0	studie	" Den store Lon dö koni en dag in uti Konungens Eabinett , dä Hans Maj:t war syflosalt med fina studier . 	bib11653828_17930927_144028_221_0004_alto.xml-10-20
häst wäl dressera $ samt att $ af artifierne $ sjelswe hr fouraux $ förmodligen den $ som stär i spets för inrättning $ dansa pä lina $ ensam utan balancerstäng $ med mycken säkerhet och lugn $ att fru baptist fouraux röja en särdeles grace och ledighet bäde i lindansning och ridning $ samt att hr jean fouraux $ $ blott en vngling $ wisar i sig rörelse en djerfhet $ wighet och styrka $ som $ dä de $ genom vara $ studie och öfning hinna utbilda till behag och säkerhet $ lofwa nägot owanligt i denna wäg $	84	0	studie	hästarne wäl dresserade , samt att , af Artifierne , sjelswe Hr Fouraux ( förmodligen den , som stär i spetsen för inrättningen ) dansar pä lina , ensam utan balancerstäng , med mycken säkerhet och lugn ; att Fru Baptist Fouraux röjer en särdeles grace och ledighet bäde i lindansning och ridning , samt att Hr Jean Fouraux , «nnu blott en vngling , wisar i sina rörelser en djerfhet , wighet och styrka , som , dä de , genom är , studier och öfning hinna utbildas till behag och säkerhet , lofwa nägot owanligt i denna wäg . 	bib11653828_18250618_144028_138_0004_alto.xml-9-84
$ $ $ landkort invewänare skola taxera sig sjelfwa $ bwad för en stsr wll $ gärning moro den icke om herre embetsman $ som äro kännare af denna äln $ men $ och därpä hafwa anwänt sig tid och sig studie $ wille i denna $ $ $ orl enstilta blad $ gifwa vi en underittelser som kunna handleda vi till en uniformiie ätminstone innom län $	41	0	studie	: !cflcr , LandkortenS Invewänare skola Taxera sig sjelfwa ; bwad för en stsr wLl , gärning moro det icke om Herrar Embetsman , som äro kännare af dessa Äln » men , och därpä hafwa anwänt sin Tid och sina Studier , wille i detta , Land- » orlens enstilta Blad , gifwa oss de underittelser som kunde handleda oss till en uniformiie ätminstone innom Länet ? 	bib19277346_18101103_147394_42_0003_alto.xml-1-41
natur $ at indela ungdomstid i missa årtal $ och enligt deni tilförordna missa studie $ som stola börja och si utås inom denna period $ lh tid pä hwilken själ förmögenhet utwekla sig $ vara hos ungdom gansta olik $	14	0	studie	naturen , at indela Ungdomstiden i missa årtal , och enligt deni tilförordna missa studier , som stola börjas och si utås inom denna period ; lh tiden pä hwilken själens förmögenheter utwekla sig , är hos Ungdomen gansta olika . 	bib11653828_17940901_144028_198_0002_alto.xml-6-14
tädan war $ hin egen känsla $ och haas studie	9	0	studie	Tädan war äsw-n hins egen känsla , och haas studier 	bib11653828_18170902_144028_202_0002_alto.xml-3-9
$ af gngldnoarne sysselsätta sig här med studie $ audre ösmerlemna sig	7	0	studie	Mai.ge af gngldnoarne sysselsätta sig här med studier , audre Ösmerlemna sig 	bib11653825_18041022_145134_127_0002_alto.xml-5-7
flera år med ifver på studie al kabbala $ för att af denna en mystisk lära skatt hemta någon upplysning $ lasthängande vid den grund $ sätta $ att en helig bok $ jemte sig ordbetydelse $ hafva en annan hemlig och hög $ hvilken vara fördold under den omklädnad liksom själ i kropp $	5	0	studie	flera år med ifver på studierna al Kabbala , för att af denna de mystiska lärornas skatt hemta någon upplysning , lasthängande vid dess grund » satts , att de heliga böckerna , jemte sin ordbetydelse , hafva en annan hemlig och högre , hvilken är fördold under dess omklädnad liksom själen i kroppen . 	bib11653828_18290518_144028_113_0002_alto.xml-8-5
simma $ $ ii $ ma och sitta i sig studie $ blcf ond och repa $ innan han wisile hwem som flod utanföre $ $ hmad ar den för larm $	10	0	studie	sam l&gt ; ii » ma och satt i sina studier , blcf ond och repade , innan han wisile hwem som flod utanföre : " Hmad ar det för larm ? 	bib19223423_18161224_145063_103_0003_alto.xml-9-10
$ för läkare och såltifårcr $ $ band $ häfte $ innehälla skrift om den netta fädernesland kunna hämta af en prcsterliga och medieinsta studie förening $ $ sälies uti juständers beklä $	24	0	studie	Wercnstapk-Jurnal för Läkare och Såltifårcr , i:fla Bandets z:dje Häfte ( Innehäller Skrifter om den netta Fäderneslandet kan hämta af de Prcsterliga och Medieinsta Studiernas förening ) , sälies uti Juständers Bekläda . 	bib13506739_18111126_144030_276_0005_alto.xml-2-24
både lärare $ och sätt ak de utnämna $ och nnderwisningsmcthoden $ och walet as studie $	15	0	studie	både Lärare , och sättet ak dem utnämna , och nnderwisningsmcthoden , och walet as Studier . 	bib11653828_17931206_144028_280_0003_alto.xml-14-15
för en hederlig son $ få vara någorlunda sir sig komma i studie $ ästundas eo studerad $ bessedtig man $ so $ $ bära tillfälle att wiga dag i $ vecka g $ $ $ $ ing i cdristeudome $ samt räkna och flrifwa i $ ni $	12	0	studie	För en hederlig Son , fom är någorlunda sir sig kommen i studier , ästundas eo studerad , bessedtig Man , so ! » bar tillfälle att wiga dagar i » veckan g ' f.ra u.iderwi-S ' ing i Cdristeudome » samt räkna och flrifwa i » ni . 	bib13506739_18170224_144030_45_0011_alto.xml-13-12
6 $ genast efter hwarje termin flut böra stipendiat till riddarhnsdirectionen insända betyg af den ordinarie proletzor $ under hwars speciell tillspn ha $ komma att stä $ hnrawida stipendiat under samma termin göra widare framsteg i studie $ än under en $ $ öst föregående $ samt likaledes striftelig $	37	0	studie	6 ) Genast efter hwarje termins flut bör Stipendiaten till RiddarhnSdirectionen insända betyg af den ordinarie Proletzor , under hwars speciella tillspn ha » kommer att stä , hnrawida Stipendiaten under samma termin gjort widare framsteg i studier , än under de » » öst föregående , samt likaledes striftelig . 	bib11653823_18230501_144010_99_0004_alto.xml-4-37
