sentence_lemma	target_index	cluster	lemma	sentence_token	identifier
diverse äungörelser $ en stadga studerande som vägon tid konditionera som informator $ vch om sig förhållande kunna uopte en fördelaktig betyg $ önska att till fortsätta af sig studie $ fä emot billig wilkor cn eller twenne dnglingar $ som äswen vara $ ämna att biwista llniverstret $ hwilka kunna begagna sig as van sällskap och underwisnina wid de studie $	29	0	studie	Diverse Äungörelser : En stadgad Studerande som vägon tid konditionerat som Informator , vch om sitt förhållande kan uopte de fördelaktigaste Betyg , önskar att till fortsättande af sina Studier , fä emot billiga wilkor cn eller twenne Dnglingar , som äswen är » ämnade att biwista llniverstret , hwilka kunna begagna sig as vans sällskap och underwisnina wid deras Studier . 	bib13506739_18050827_144030_197_0004_alto.xml-20-29
i gustaf i placat wid disting marknad 1541 uppmuntra allmoge oit sakta sig göstar antingen t skola $ säsom wägen till stat och kyrka tienster $ $ etter i aandtwerk $ säsom andra medel till bergning pä älderdomen $ $ hwaraf tydlig synas $ att skola blott moro bestämd för de $ som ägna sig äta studie $ och derföre finga den spfkning $ de ännu i fin grundinrättning bibchälla $	56	0	studie	I Gustaf I Placat wid Distings Marknad 1541 uppmuntras Allmogen oit sakta sina göstar antingen t Skolan ( säsom wägen till Statens och Kyrkans Tienster , ) etter i Aandtwerk ( säsom andra medel till bergning pä älderdomen ) ; hwaraf tydligt synes , att Skolorna blott moro bestämda för dem , som ägnade sig ät studierna , och derföre finga den spfkning , de ännu i fin grundinrättning bibchälla . 	bib11653828_18090626_144028_144_0001_alto.xml-1-56
för att twänne eller trenne sr spsilosätta sig endast med gymnastisk öfning $ och seday ätcrtaga de $ för att bra fatta sbrhällandet emellan de $ de $ som stola fortfara alt göra stäk för ben förhoppning dr gäswo osi i de barndom $ stola erhälla hedra utmärkelse $ och sä snar dk nppnält zo ära siter $ stola mi inviga de i tänkande wetenffap $ i denna hög dialektik $ som böra wara mälet för de första studie och ha till föremäl akt känna ting wäsende mer än de tillwarelfe $ $ $ $	78	0	studie	för att twänne eller trenne Sr spsilosätta sig endast med gymnastiska öfningar , och seday ätcrtaga dem , för att bättre fatta sbrhällandet emellan dem ; de , som stola fortfara alt göra stäk för ben förhoppning dr gäswo osi i deras barndom , stola erhälla hedrande utmärkelser , och sä snart dk nppnält zo ärs Siter , stole mi inviga dem i tänkandets wetenffap , i denna höga dialektik , som bör wara mälet för deras första studier och har till föremäl akt känna tingens wäsende mer än deras tillwarelfe * ) . " 	bib11653828_18261002_144028_228_0003_alto.xml-4-78
den tiväriga gosse gaf den bra hopp om sig $ han ha mycken fallenhet för studie $ en god och öm hjerta $ en stark ihärdighet $ och en fast karakter $	15	0	studie	Den tiväriga gossen gaf det bästa hopp om sig ; han hade mycken fallenhet för studier , ett godt och ömt hjerta , en stark ihärdighet , och en fast karakter . 	bib19225772_18070520_148004_55_0002_alto.xml-18-15
korporation förfarande $ cch for ben enstilda underwisningen $ lika simma hwar och ens enskild studie $ ian ingen lag förestriftvas $	15	0	studie	korporationers förfarande , cch for ben enstilda underwisningen , lika sam hwar och ens enskilda studier , ian ingen lag förestriftvas . 	bib11653828_18200509_144028_106_0003_alto.xml-2-15
uti en hederlig penfion ästnndas 1 eller 2 hclpensionaircr i ställ för de $ som nu hafiva fulländatfina studie $	18	0	studie	Uti en hederlig Penfion ästnndas 1 eller 2 hclpensionaircr i stället för dem , som nu hafiva fulländatfina studier . 	bib11653823_18271115_144010_268_0004_alto.xml-17-18
med fortfara tils han hies 14 vara $ dä försyn omsider öpnade fara han et gynnande tilfälle $ at fä tilsridsställa sig brrnnande häg för studie $	25	0	studie	med fortfara tils han hies 14 är , dä Försynen omsider öpnade for honom et gynnande tilfälle , at fä tilsridSställa sin brrnnande häg för Studier . 	bib11653792_18020717_146919_28_0002_alto.xml-1-25
t mening $ at $ $ jusi egentcligen icke vara ben basta f rbcredelse til en statsminister $ ock tro at en männistja $ hwilken an wäll dt sill tid pä studie och förrättning $ kunna rnöjligtwis äga mera fficklighet at befordra än en af desse $ $ straxt igenkänna man i densamma en ursinnig marat eller $ hwad wärre vara $ en $ dttrar nägon den päsiäende $ at börd och rang icke giswa nägon fordran och rätt til aktning $ med liten de understödja af duglighet och förtjenstcr $ $ sira ropa nia stark pä iacobinisme $ och käler nägon förstä $ al folk röst böra wara furste wigtig och helig $ och at ingen monark vara sä oinskränkt cnwäldsherre $ at j $ mellan han och han folk ar ek tyst inbördes contract $ han stjäla regera klok och wal $ dä höra man strax $	31	1	studie	ten mening , at Page-rch Kammarjunkare-lcfnaden jusi egentcligen icke är ben basta f rbcredelse til en Statsminister , ock tro at en Männistja , hwilken an wäll dt sill tid pä Studier och Förrättningar , kunde rnöjligtwis äga mera fficklighet at befordras än en af desse ; — straxt igenkänner man i densamma en ursinnig Marat eller , hwad wärre är , en payne- Dttrar nägon det päsiäende , at Börd och Rang icke giswa nägon fordran och rätt til Aktning , med mindre de understödjas af Duglighet och Förtjenstcr ; — sirar ropar nian starkt pä Iacobinisme ; och käler nägon förstä , al Folkets röst bör wara Fursten wigtig och helig , och at ingen Monark är sä oinskränkt Cnwäldsherre » at j » mellan honom och hans Folk ar ek tyst inbördes Contract «t han stal regera klokt och wal — dä hör man strax ! 	bib11653828_17940321_144028_66_0003_alto.xml-0-31
$ 3 sr gammal $ forn ästnnda att idka studie motta i penston $ mok en betalning af $ $ $ ärligen för bwardera $	9	1	studie	» 3 Sr gamla , forn ästnnda att idka Studier mottagas i Penston , mok en betalning af 20« R:dr B:co ärligen för bwardera . 	bib11653823_18250302_144010_50_0004_alto.xml-0-9
e $ pngling $ förse m $ hedra intyg sä öfwer studie som wandel $ som staderåt wid gymnasium ock $	11	1	studie	E » Pngling , försedd m ?d hedrande intyg sä öfwer studier som wandel , som staderåt wid Gymnasium ock . 	bib13506739_18290305_144030_53_0004_alto.xml-23-11
af tryck ha utkomma $ poetista studie af $ hammar stöld $ sälses i te fl $	6	1	studie	Af trycket har utkommit : Poetista Studier af k. Hammar stöld ; sälseS i te fl . 	bib11653828_18130902_144028_202_0004_alto.xml-6-6
