sentence_lemma	target_index	cluster	lemma	sentence_token	identifier
innan vi gå vid $ stanna vi en ögonblick vid en nära fem fintryckta sida 158 $ 163 $ som inrymma en exposé af den harnackska uppfattning af apostolicum $	26	0	uppfattning	Innan vi gå vidare , stanna vi ett ögonblick vid de nära fem fintryckta sidorna 158 — 163 , som inrymma en exposé af den Harnackska uppfattningen af apostolicum . 	bib19227462_18950130_147640_25_0003_alto.xml-1-26
den måste erkänna $ och otvifvelaktig porträttlik $ men likväl af tämligen prosaisk uppfattning och säga vi jusi ingenting $	13	0	uppfattning	det måste erkännas , och otvifvelaktigt porträttlikt , men likväl af tämligen prosaisk uppfattning och säger oss jusi ingenting . 	bib19277277_18950512_147683_128_0005_alto.xml-104-13
af en dylik tillkännagifvande $ offentliggjordt på sjelfva den hög födelsedag $ vara den rätt naturlig att en mången skola få den uppfattning $ att konung med varm hand skänka $ krona till den välgörande ändamål och för en viss uppgifvet fall eventuel utlofva en lika stor summa $	22	0	uppfattning	Af ett dylikt tillkännagifvande , offentliggjordt på sjelfva den höga födelsedagen , var det rätt naturligt att de flesta skulle få den uppfattningen , att konungen med varm hand skänkt 20,000 kronor till det välgörande ändamålet och för ett visst uppgifvet fall eventuelt utlofvat en lika stor summa . 	bib15975090_18960213_148377_20_0002_alto.xml-62-22
der ha man måhända nära och med stor ifver än i någon annan politisk centrum studera den orientalisk fråga i den laser $ och den utbyte af åsigt $ som nyligen egt rum mellan ryssland oell $ leda man $ gifver uppfattning i donaustaden en särskild betydelse $	41	0	uppfattning	Der har man måhända närmare och med större ifver än i något annat politiskt centrum studerat den orientaliska frågan i dess laser , och det utbyte af åsigter , som nyligen egt rum mellan Rysslands oell Österrike-Ungerns ledande män , gifver uppfattningen i Donaustaden en särskild betydelse . 	bib19227291_18970525_145289_62_0003_alto.xml-123-41
den vara i japan den allmän uppfattning $ att krig icke vara öfverståndet $	6	0	uppfattning	Det är i Japan den allmänna uppfattningen , att kriget icke är öfverståndet . 	bib11653830_18950823_146968_96_0003_alto.xml-119-6
$ då böra ni ha bra uppfattning af hon son $ tycka jag $	6	0	uppfattning	— Då borde ni ha bättre uppfattning af hennes son , tycker jag . 	bib15761570_18951008_146176_166_0003_alto.xml-166-6
dels $ på grund af den ovanlig ringa barnantal och dels till följd af lärare hög ålder $ och blef denna skolråd uppfattning af stämma gilla och anta $ till församlingsombud vid den till den 30 maj $ ekonomisk besiktning å $ och klockareboställena utsågos nises lars andersson i åkerö ooh nygårds lars olsson i nor $ fråga örn intagning och lästid m $ m $ $ som stämma för den blifvande skolreglemente egde att bestämma $ uppskjuta tills vid $ ångbåtstrafik ä siljan ärm snar i full gång $ i den att ångare gustaf wasa nu uppta sig tur mellan mora och insjö $ och flottningsbolag ångare nu börja sig verksamhet för år $ ångare rättvik vänta till leksand den 16 maj för $ gång i år $ men antaglig vara $ att den till följd af den inåt rättvik drifna is måste ännu någon dag uppskjuta resa $ skrifves den 15 denna till länstidningen $	22	0	uppfattning	dels * på grund af det ovanligt ringa barnantalet och dels till följd af lärarens höga ålder , och blef denna skolrådets uppfattning af stämman gillad och antagen , Till församlingsombud vid den till den 30 maj utsatta ekonomiska besiktningen å komministers- och klockareboställena utsågos Nises Lars Andersson i Åkerö ooh Nygårds Lars Olsson i Noret , Frågan örn intagning och lästid m . m . , som stämman för det blifvande skolreglementet egde att bestämma , uppsköts tills vidare , Ångbåtstrafiken ä Siljan ärm snart i full gång , i det att ångaren Gustaf Wasa nu upptagit sina turer mellan Mora och Insjön , och flottningsbolagets ångare nu börjat sin verksamhet för året , Ångaren Rättvik väntades till Leksand den 16 maj för första gången i år , men antagligt är , att den till följd af den inåt Rättviken drifna isen måste ännu några dagar uppskjuta resan — skrifves den 15 dennes till Länstidningen . 	bib11653790_19000518_145648_39_0003_alto.xml-32-22
i nineteenth century kritisera gladstone för någon tid sedan mrs besants skildring af den konventionell ortodox försoningsteori $ han söka vederlägga hon uppfattning ooh fram sig egen i tolf punkt $	22	0	uppfattning	I Nineteenth Century kritiserade Gladstone för någon tid sedan mrs Besants skildring af den konventionella ortodoxa försoningsteorien ; han sökte vederlägga hennes uppfattning ooh framstälde sin egen i tolf punkter . 	bib19225758_18950622_144022_143_0006_alto.xml-53-22
sedan hon lemna kupé $ emellertid ej direkt till expedition utan i riktning mot norra utgångsgrinden $ hvadan konduktör häraf få den uppfattning $ att hon ämna utan vid aflägsna sig $	22	0	uppfattning	sedan hon lemnat kupén , emellertid ej direkt till expeditionen utan i riktning mot norra utgångsgrinden , hvadan konduktören häraf fick den uppfattning , att hon ämnade utan vidare aflägsna sig . 	bib11653838_19010816_147024_33_0001_alto.xml-176-22
när man lefver ensam i rukhen $ få man en annan uppfattning än förut af mången saka och ting $	11	0	uppfattning	När man lefver ensam i rukhen , får man en annan uppfattning än förut af många sakar och ting . 	bib11653815_18970908_146944_103_0003_alto.xml-124-11
men om denna få sig något egendomlig uppfattning af hvad en ordning upprätthållare egna korrigera $ därom veta nia intet $	7	0	uppfattning	Men om denne fått sin något egendomliga uppfattning af hvad en ordningens upprätthållare egnar korrigerad , därom vet nian intet . 	bib11653790_18980107_145648_2_0005_alto.xml-47-7
torde erinra sig $ att för icke många år bodag uppohöll sig här i wien en kinesisk statsman $ till hvil hen beröm man säga $ att linn egde en stor menniskokännedom och en riktig uppfattning nf förhållande $	35	0	uppfattning	torde erinra sig , att för icke många år Bodan uppohöll sig här i Wien en kinesisk statsman , till hvil hens beröm man sagt , att linn egde en stor menniskokännedom och en riktig uppfattning nf förhållandena . 	bib19277277_18950703_147683_177_0005_alto.xml-82-35
under den sålunda sverige rusta sig för att med tillbörlig kraft kunna inplanta sig uppfattning af unionsfråga i norrman $ kunna man väl icke rimligtvis begära $ att denna skola med arm i kors betrakta hvad som ske här hemma $	14	0	uppfattning	Under det sålunda Sverige rustar sig för att med tillbörlig kraft kunna inplanta sin uppfattning af unionsfrågan i norrmännen , kan man väl icke rimligtvis begära , att dessa skulle med armarne i kors betrakta hvad som sker här hemma ? 	bib15978012_18950923_148361_221_0002_alto.xml-40-14
bosatt i sydstat $ isynnerhet i $ $ mississippi och louisiana den ha visa sig att den förut gängse uppfattning att neger öka sig hastig än en hvit vara oriktig $	19	0	uppfattning	bosatta i sydstaterna , isynnerhet i Syd-Karolina , Mississippi och Louisiana Det har visat sig att den förut gängse uppfattningen att negrerna öka sig hastigare än de hvita är oriktig . 	bib11653815_18970315_146944_30_0004_alto.xml-51-19
drama bära tanke vara $ att kristendom vara barmhärtighet och kärlek religion $ den lära $ som ej anse någon så djup sjunka $ att han ej kunna återupprätta $ och den vara mellan denna uppfattning och den kristondomens afart $ hvilken sträng döma och fördöma hvarje felsteg $ som styck konflikt röra sig $	35	0	uppfattning	Dramats bärande tanke är , att kristendomen är barmhärtighetens och kärlekens religion , den lära , som ej anser någon så djupt sjunken , att han ej kan återupprättas , och det är mellan denna uppfattning och den kristondomens afart , hvilken strängt dömer och fördömer hvarje felsteg , som styckets konflikt rör sig . 	bib11653811_19021006_145317_153_0002_alto.xml-102-35
såsom gifvet kunna väl anta $ att ny lagberedning för tillämpning af denna $ tänka sig $ att full fog för gods återlämna värkligen skola finna i följd af fel eller brist eller pfl annan grund $ men denna vara ingalunda klar uttrycka $ utan formulering af paragraf 1 morn $ $ där ord underrättelse erhålla en så framskjuten plats $ kunna ingifva den uppfattning $ att en blott förebära af fel eller brist eller annan anledning vara tillräcklig föi köpare befogenhet att vidta den försäljningsåtgärd $ som $ 2 sedermera omförmäla $	64	0	uppfattning	Såsom gifvet kan väl antagas , att nya lagberedningen för tillämpning af denna § tänkt sig , att fullt fog för godsets återlämnande värkligen skall finnas i följd af fel eller brist eller pfl annan grund , men detta är ingalunda klart uttryckt , utan formuleringen af paragrafens 1 morn . , där ordet underrättelse erhållit en så framskjuten plats , kan ingifva den uppfattning , att ett blott förebärande af fel eller brist eller annan anledning är tillräckligt föi köparens befogenhet att vidtaga den försäljningsåtgärd , som mom. 2 sedermera omförmäler . 	bib19225758_18951004_144022_231_0002_alto.xml-49-64
land äro jord och arbete blott hälft så dyr som i europa $ och forsling öfver hafvet vara numera billig och snabb än för femtio år sedan forsling från marseille till $ $ industri känna ännu icke så stark som landtbruk konkurrens men skola enligt d $ estournelles uppfattning komma att lida ännu mera $ särskildt om och när samfärdsmedelns utveckling kasta de annan verldsdelarnes arbete in öfver europa $	48	0	uppfattning	länder äro jorden och arbetet blott hälften så dyra som i Europa , och forslingen öfver hafvet är numera billigare och snabbare än för femtio år sedan forslingen från Marseille till Paris.11 ris.11 Industrien känner ännu icke så starkt som landtbruket konkurrensen men skall enligt d ’ Estournelles uppfattning komma att lida ännu mera , särskildt om och när samfärdsmedelns utveckling kastar de andra verldsdelarnes arbeten in öfver Europa . 	bib19227291_18960416_145289_46_0003_alto.xml-14-48
denna vilja jag icke vid fästa jag vid $ då jag hoppa $ att en stiga upplysning i sig tid äfven här skola medföra en rättvis uppfattning $	26	0	uppfattning	Detta vill jag icke vidare fästa mig vid , då jag hoppas , att en stigande upplysning i sin tid äfven här skall medföra en rättvisare uppfattning . 	bib11653811_18980808_145317_120_0004_alto.xml-41-26
inträffa stärka vi i vi uppfattning $ att denna åtgärd äfven ur konstitutionell synpunkt vara tillrådlig och berättiga redan i somras $	5	0	uppfattning	inträffat stärker oss i vår uppfattning , att denna åtgärd äfven ur konstitutionell synpunkt var tillrådlig och berättigad redan i somras . 	bib15650814_18950109_146365_8_0002_alto.xml-97-5
såsom sig uppfattning $ att hedqvist oeh grafström låta naturalisera sig såsom liibeckare endast för att kringgå den i sverige gälla lagstiftning $ enligt hvilken äkta skap de emellan icke vara tillåta $	2	0	uppfattning	såsom sin uppfattning , att Hedqvist oeh Grafström låtit naturalisera sig såsom liibeckare endast för att kringgå den i Sverige gällande lagstiftningen , enligt hvilken äkten skap dem emellan icke är tillåtet . 	bib15873371_18950726_145112_200_0002_alto.xml-182-2
hvad utförande af en olik nummer beträffa $ visa han sig $ hvilket vara den märklig $ ega en full mogen och klar uppfattning af hvad han tolka $	23	0	uppfattning	Hvad utförandet af de olika numren beträffar , visade han sig — hvilket var det märkligaste — ega en fullt mogen och klar uppfattning af hvad han tolkade . 	bib19277330_18950209_0_17_0003_alto.xml-46-23
ock i hög mått de för en sån erforderlig egenskap $ oveld $ klarhet i uppfattning $ reda i framställning $ jämnhet i lynne $ karaktärfasthet $ sinnesnärvaro och plikttrohet $	15	0	uppfattning	ock i högsta mått de för en sådan erforderliga egenskaperna : oveld , klarhet i uppfattningen , reda i framställningen , jämnhet i lynnet , karaktärfasthet , sinnesnärvaro och plikttrohet . 	bib11653830_18950308_146968_29_0002_alto.xml-30-15
i motsats till den allmän gängse pessimistisk uppfattning $ att gerningso äunen lyckas undkomma $ fötsäkrar piokuratorn vid bpellationsdomstolen $ hvilken embetsman sed undersökning $ ett man lyckas gripa förutom gsorgiew $ som sitta $ för 10 dag sedan $ ännu en annan person $ som på god grund anse vara en af rnördarne $	7	0	uppfattning	I motsats till den allmänt gängse pessimistiska uppfattningen , att gerningso äunen lyckats undkomma , fötsäkrar piokuratorn vid Bpellationsdomstolen , hvilken embetsman Seder undersökningen , ett man lyckats gripa förutom Gsorgiew , som sitter h&kiad för 10 dagar sedan , ännu en annan person , som på goda grunder anses vara en af rnördarne . 	bib15650837_18950731_146391_175_0003_alto.xml-97-7
förtroende till varaktighet af bra tillstånd grunda sig $ med rätta på den uppfattning $ att ändring i läge på den amerikansk marknad väsentligen vara en följd af en amerikansk tullnedsättning $ hvilka visa sig hafva äfven i amerika så gynsamma följd $ att en protektionistisk reaktion $ af all att döma $ skola uteblifva $	13	0	uppfattning	Förtroendet till varaktigheten af bättre tillstånd grundar sig - med rätta på den uppfattningen , att ändringen i läget på den amerikanska marknaden väsentligen är en följd af de amerikanska tullnedsättningarna , hvilka visat sig hafva äfven i Amerika så gynsamma följder , att en protektionistisk reaktion , af allt att döma , skall uteblifva . 	bib19225758_18951017_144022_242_0004_alto.xml-92-13
bestå af två statsminister och föga sju andra medlem $ $ då paragraf slutpassus bestämma $ att $ fader oell son $ eller två broder $ må ej pä samma gång hafva siite i statsråd $ så inträffa $ enligt herr qvams uppfattning $ den glädja omständighet $ att likväl mor och dotter $ nia oell son $ far och dotter $ två syster eller bror och syster $ att $ örn man oell hustru $ på samma gång kunna lia siite i statsråd $ $	42	0	uppfattning	bestå af två statsministrar och minst sju andra medlemmar . » Då paragrafens slutpassus bestämmer , att » fader oell son , eller två bröder , må ej pä samma gång hafva siite i statsrådet , så inträffar , enligt herr Qvams uppfattning , den glädjande omständigheten , att likväl mor och dotter , nior oell son , far och dotter , två systrar eller bror och syster - att icke-tala örn man oell hustru — på samma gång kunna lia siite i statsrådet » . 	bib15650814_18950530_146365_125_0003_alto.xml-85-42
pä sädant sätt böra man komma till riktig uppfattning om $ huru tullbestämmelse stola affatta $ om man $ den sär ju tillägga $ ha full god wilja och dertill jullgod kraft att pä en rättwist sätt $ utan wäldsörande as nägons rätt $ ordna del ömtäliga förhällande $	8	0	uppfattning	Pä sädant sätt bör man komma till riktig uppfattning om , huru tullbestämmelserna stola affattas , om man , det sär ju tilläggas , har fullt god wilja och dertill jullgod kraft att pä ett rättwist sätt , utan wäldsörande as nägons rätt , ordna del ömtäliga förhällandet . 	bib15760690_18950930_145050_150_0003_alto.xml-67-8
i den rapport $ som inkomma efter interpellation afgifvande $ yttra kontrollant med anledning af den kritik de nämd $ väggmålning ådra sig $ att han anse densamma ega konstnärlig värde $ att han för sig del icke kunna dela den uppfattning $ att de med fog kunna säga vara för sedlighetskänsla såra $ ehuruväl han anse att ämne kunna vara lycklig valdt $	41	0	uppfattning	I den rapport , som inkommit efter interpellationens afgifvande , yttrar kontrollanten med anledning af den kritik de nämd » väggmålningarna ådragit sig , att han anser desamma ega konstnärligt värde , att han för sin del icke kan dela den uppfattningen , att de med fog kunna sägas vara för sedlighetskänslan sårande , ehuruväl han anser att ämnet kunnat vara lyckligare valdt . 	bib15975090_18950423_148377_48_0003_alto.xml-96-41
rätt för embetsman att använda tjänstefrimärke vara efter jag uppfattning bero deraf $ huruvida ärende vara att betrakta som en allmän ärende $ så att derför erforderlig skriftvexling må bestrida af statsverk $ eller ock som en enskildt kommunal ärende $ i hvilka sistnämd fall enskild person eller kommun synas böra vidkännas sån kostnad $ och den lärer näppeligen kunna bestrida $ att nu ifrågavarande skrifvelse $ hvarigenom svaraflåtits på en mot kyrkoråd eller $ hvilket här betyda densamma $ mot församling framstäldt fordringsanspråk $ vara till sig natur att betrakta som en kommunal ärende $ hvartill komma att samma skrifvelse tillika innehålla förnärmande tillmäta $ såsom att krafvet vara anstäldt mot medveten oriktig person m $ m $ $ som förvisso ej lärer kunna hänföra till kyrkoherde tjänsteärende $	9	0	uppfattning	Rätt för embetsman att använda tjänstefrimärke är efter min uppfattning beroende deraf , huruvida ärendet vore att betrakta som ett allmänt ärende , så att derför erforderlig skriftvexling må bestridas af statsverket , eller ock som ett enskildt kommunalt ärende , i hvilka sistnämda fall enskild person eller kommunen synes böra vidkännas sådan kostnad ; och det lärer näppeligen kunna bestridas , att nu ifrågavarande skrifvelse , hvarigenom svaraflåtits på ett mot kyrkorådet eller , hvilket här betyder detsamma , mot församlingen framstäldt fordringsanspråk , är till sin natur att betrakta som ett kommunalt ärende , hvartill kommer att samma skrifvelse tillika innehåller förnärmande tillmäten , såsom att krafvet vore anstäldt mot medvetet oriktig person m . m . , som förvisso ej lärer kunna hänföras till kyrkoherdes tjänsteärende . 	bib15760600_18950316_146401_32_0003_alto.xml-226-9
dylik tillvägagående måste nödvändigtvis skapa den uppfattning $ att bägge rike icke i afseende å utrikesrepresentation äro solidarisk $ samt på så sätt befordra den splittring anda $ som i denna afseende ty värr redan förefinnas $	6	0	uppfattning	dylikt tillvägagående måste nödvändigtvis skapa den uppfattningen , att bägge rikena icke i afseende å utrikesrepresentationen äro solidariska , samt på så sätt befordra den splittringens anda , som i detta afseende ty värr redan förefinnes . 	bib19225758_18950923_144022_221_0003_alto.xml-6-6
0 klar uppfattning af hvad som kändt i ar $ menied $ emedan en turkisk myndighet hinna deportera eller fängsla nästan all kristen $ hvilkas vittnesmål en lukta $	2	0	uppfattning	0 klar uppfattning af hvad som kändt i Ar ' menieD , emedan de turkiska myndigheterna hunnit deportera eller fängsla nästan alla kristna , hvilkas vittnesmål de Luktade . 	bib19225758_18950220_144022_43_0002_alto.xml-71-2
ha denna intryck vara $ att mer än en ärlig norsk man och qvinna $ hvilkas uppfattning af konung och han ställning väsentligen bestämma af den radikal press osannfärdig framställan $ måste för sig sjelfva bekänna $ den vara ju icke sann $ hvad vi läsa i vi tidning $	16	0	uppfattning	har detta intryck varit , att mer än en ärlig norsk man och qvinna , hvilkas uppfattning af konungen och hans ställning väsentligen bestämts af den radikala pressens osannfärdiga framställningar , måst för sig sjelfva bekänna ; det är ju icke sant , hvad vi läst i våra tidningar . 	bib19277301_18960803_145146_62_0003_alto.xml-105-16
ingen fara för ögonblick $ ty ryssland fredskäriek vara oförändrad och hel vend hysa den uppfattning $ att den vara ryssland afsigt att hindra frankrike från en eventuel fredsbrott men fråga vara $ om frankrike i längdan kunna hålla tillbaka $	15	0	uppfattning	ingen fara för ögonblicket , ty Rysslands fredskäriek är oförändrad och hela venden hyser den uppfattningen , att det är Rysslands afsigt att hindra Frankrike från ett eventuelt fredsbrott Men frågan är , om Frankrike i längdan kan hållas tillbaka . 	bib19277277_18951002_147683_268_0006_alto.xml-39-15
om generallöjtnant m $ $ hamilton flrifwer en dewäringsman frän hultsfred följa $ hwilket ju kunna wara af intresse säsom wisande gemen man uppfattning af den framstå strateg $ som bekant bestrida generallöjtnant hamilton under generalmajor muncks sjukdom chefsbefattning inom andra arméfördelning $ en befattning $ font han pä grund as sig inträde i pensionsäldern för 2 vara sedan lämna $	23	0	uppfattning	Om generallöjtnant M . W. Hamilton flrifwer en dewäringsman frän Hultsfred följande , hwilket ju kan wara af intresse säsom wisande gemene mans uppfattning af den framstående strategen : Som bekant bestrider generallöjtnant Hamilton under generalmajor Muncks sjukdom chefsbefattningen inom andra arméfördelningen , en befattning , font han pä grund as sitt inträde i pensionsäldern för 2 är sedan lämnade . 	bib15975087_18950724_145596_112_0002_alto.xml-111-23
sångerskernas prestation äro af hög värde $ och de uppfattning af $ carmen $ natur och karaktär full riktig och konsekvent utföra $	9	0	uppfattning	sångerskernas prestationer äro af högt värde , och deras uppfattning af » Carmens » natur och karaktär fullt riktig och konsekvent utförd . 	bib19277349_18951022_147403_134_0002_alto.xml-131-9
redaktör ha icke $ instämma $ $ i någon annan än den allmän uppfattning af $ förhandenvarande förhållande $ $ som i den till han eersonligen framstälda och på samma sätt esvarade inbjudning till möte vara uttrycka $	13	0	uppfattning	redaktör har icke ” instämt ' ’ i något annat än den allmänna uppfattning af ” förhandenvarande förhållanden ” , som i den till honom Eersonligen framstälda och på samma sätt esvarade inbjudningen till mötet var uttryckt . 	bib15873936_18950328_147385_38_0002_alto.xml-95-13
den komma dervid föga an på om vi predikan luther egen mening $ åsigt $ uppfattning och läroframställning gå igen med fotografisk noggrannl $	15	0	uppfattning	Det kommer dervid föga an på om vår predikan Luthers egna meningar , åsigter , uppfattningar och läroframställningar gå igen med fotografisk noggrannlet . 	bib11653811_18990519_145317_75_0003_alto.xml-22-15
med djup känsla af den ansvar $ som medfölja hvarje åtagande af offentlig uppdrag och med den uppfattning $ jag ha om riksdagsmannakallet såsom den ansvarsfull bland all en förtroendeuppdrag $ en medborgare kunna åtaga sig $ ha jag icke vela eftertrakta ära att vid snar förestå val inom samhälle varda utse till representant i riksdag och se gerna $ örn någon dertill i hög grad egna vinna valman bevågenhet $	17	0	uppfattning	Med djup känsla af det ansvar , som medföljer hvarje åtagande af offentligt uppdrag och med den uppfattning , jag har om riksdagsmannakallet såsom det ansvarsfullaste bland alla de förtroendeuppdrag , en medborgare kan åtaga sig , har jag icke velat eftertrakta äran att vid snart förestående val inom samhället varda utsedd till representant i riksdagen och ser gerna , örn någon dertill i högre grad egnad vinner valmännens bevågenhet . 	bib11653811_18990913_145317_140_0002_alto.xml-3-17
blef dock i tid afvärja $ i ty att reservant icke funno skälig att fullfölja sig yrkande $ då denna icke syna finna vid stöd inom kammare $ och särskildt den talman lär uttryckligen förklara $ att han icke dela reservant uppfattning angående votering laglighet $	41	0	uppfattning	blef dock i tid afvärjd , i ty att reservanterna icke funno skäligt att fullfölja sina yrkanden , då dessa icke synas funnit vidare stöd inom kammaren , och särskildt dess talman lär uttryckligen förklarat , att han icke delade reservanternas uppfattning angående voteringens laglighet . 	bib19225758_18950510_144022_108_0002_alto.xml-58-41
hvilken $ sig om att så mycket som möjlig återgifva uttalande af sakkunnig person inom olik ort $ skrif följa $ $ den gäagse uppfattning om dal särställning $ $ yttra en framstående man inom län $ $ och om dea förment liten fara för bolagsvälde inom dal än inom en nordlig län behöfva mycket modifiera för att stämma med rätt förhållande $	24	0	uppfattning	hvilken vinnlägger sig om att så mycket som möjligt återgifva uttalanden af sakkunniga personer inom olika orter , skrifver följande : » Den gäagse uppfattningen om Dalarnes särställning » , yttrade en framstående man inom länet , » och om dea förmenta mindre faran för bolagsvälde inom Dalarne än inom de nordligare länen behöfver mycket modifieras för att stämma med rätta förhållandet . 	bib11653790_19010308_145648_19_0003_alto.xml-60-24
