sentence_lemma	target_index	cluster	lemma	sentence_token	identifier
synas vara föga omfatta $ men den vara mycket möjlig $ att denna uppfattning föranleda deraf $ att ingen katalog ännu kunna tjenstgöra som vägledare $	13	0	uppfattning	synes vara mindre omfattande , men det är mycket möjligt , att denna uppfattning föranledes deraf , att ingen katalog ännu kunnat tjenstgöra som vägledare . 	bib19227291_18960702_145289_79_0002_alto.xml-125-13
frisk $ sund målningssätt och uppfattning af den nästan i kroppsstorlek afbilda agurén erinra i påfallande grad omrembrandt $	5	0	uppfattning	friska , sunda målningssättet och uppfattningen af den nästan i kroppsstorlek afbildade Agurén erinrade i påfallande grad omRembrandt . 	bib15873371_18950327_145112_84_0002_alto.xml-10-5
polisman äro poliskår aristokrat enligt jag uppfattning af sak $	6	0	uppfattning	polismän äro poliskårens aristokrater enligt min uppfattning af saken . 	bib15873371_18951026_145112_293_0004_alto.xml-40-6
vi vilja ej betvifla $ att han genom sig sträf vallden vilja gagna $ mea vi kunna ej annan än beklaga $ att ban ej be nog klar uppfattning att hålla sig fri från löjlig öfverdrift och att han till och med på sig sista dag låta sig drifva af en doktrinär kosmopolitism $ för hvilken fosterlandskänslans enkel kraf någon gång ängö trä i skugga $ en en skugga som då icke kundo undgå att falla öfver han sjelf $	28	0	uppfattning	Vi vilja ej betvifla , att han genom sina sträf vallden ville gagna , mea vi kunna ej annat än beklaga , att ban ej bade nog klar uppfattning att hålla sig fri från löjliga öfverdrifter och att han till och med på sina sista dagar lät sig drifvas af en doktrinär kosmopolitism , för hvilken fosterlandskänslans enklaste kraf någon gång Ängö träda i skuggan , en en skugga som då icke kundo undgå att falla öfver honom sjelf . 	bib19227462_18951024_147640_248_0003_alto.xml-22-28
med en kortfattadt föredrag örn den antik teater $ om hvilken man få en ganska knapphändig uppfattning $ bero måhända därpå att $ den utlofva föredragshållare docent vilhelm lundström som dekoration under turné stanna i sala $ den förra för att till följd af föreläsningsskyldighet återvända till upsala och en sen på grund af en tillfällig missöde $	16	0	uppfattning	med ett kortfattadt föredrag örn den antika teatern , om hvilken man fick en ganska knapphändig uppfattning , beroende måhända därpå att såväl den utlofvade föredragshållaren docenten Vilhelm Lundström som dekorationerna under turnén stannat i Sala , den förre för att till följd af föreläsningsskyldighet återvända till Upsala och de senare på grund af ett tillfälligt missöde . 	bib11653790_18990418_145648_29_0003_alto.xml-8-16
i $ afton telegrafera vi korrespondent $ meddelande om $ att de delegera förhandling skola fortsätta om måndag $ konstatera $ skrifver aftenposten $ att nio man med bestämd uppfattning och med fast vilja beträffande den riktning $ i hvil $ k sak böra leda $ man som stå tikarpt åtskilja $ grupp emot grupp $ ha kunna sitta tillsammans under tvenne sammanträde utan att den hel $ gå sönde r $ $	29	1	uppfattning	I går afton telegraferar vår korrespondent : Meddelandet om , att de delegerades förhandlingar skola fortsättas om måndag , konstaterar , skrifver Aftenposten , att nio män med bestämda uppfattningar och med fast vilja beträffande den riktning , i hvil , ken sakerna böra ledas — män som stå tikarpt åtskilda , grupp emot grupp — ha kunnat sitta tillsammans under tvenne sammanträden utan att det hela » gått sönde r » . 	bib19277277_18950224_147683_54_0006_alto.xml-117-29
under denna förhållande vardt den uppfattning allt stark i sverige $ liksom den bre sig all vid i en stor samhällslager i vi grannland $ att norge vara i färd med att söka framtvinga union upplösning $	5	1	uppfattning	Under dessa förhållanden vardt den uppfattningen allt starkare i Sverige , liksom den bredde sig allt vidare i de stora samhällslagren i vårt grannland , att Norge var i färd med att söka framtvinga unionens upplösning . 	bib11653830_18960507_146968_37_0003_alto.xml-71-5
