sentence_lemma	target_index	cluster	lemma	sentence_token	identifier
3. Zimmermann und Vierort haben vorschlagen $ eine Gemenge von Serum und Scheibe eine Stoff von beliebig Zusammensetzung beimischen $ für welchen d Blutscheibenhülle undurchdringlich sein und d $ obwohl er sich im Wasser lösen $ weder Wasser $ noch irgend eine ander Bestandteil d Blutscheibeninhalt an sich ziehen $	18	0	beimischen	3. Zimmermann und Vierordt haben vorgeschlagen , ein Gemenge von Serum und Scheiben einem Stoff von beliebiger Zusammensetzung beizumischen , für welchen die Blutscheibenhülle undurchdringlich sei und der , obwohl er sich im Wasser löse , weder Wasser , noch irgend einen andern Bestandtheil des Blutscheibeninhaltes an sich ziehe .	ludwig_physiologie02_1856-337-18
woher kommen es denn $ daß Weizen nicht auf Sandboden gedeihen $ daß d Kalkboden $ wenn er nicht eine beträchtlich Menge Ton beimischen enthalten $ unfruchtbar für diese Pflanze sein $	23	0	beimischen	Woher kommt es denn , daß Weizen nicht auf Sandboden gedeiht , daß der Kalkboden , wenn er nicht eine beträchtliche Menge Thon beigemiſcht enthält , unfruchtbar für dieſe Pflanze iſt ?	liebig_agricultur_1840-1095-23
da nämlich in diese Falle gewöhnlich groß Mörtelvorrat halten werden $ so werden d Mörtel wenn man gleich alle Sand beimischen wollen $ zu trocken $ oder doch wenigstens sehr steif werden $ also jedenfalls an Bindekraft verlieren $ weshalb d letztgedenkt Befahren $ bei fett Lufikalk $ gut sein $	20	0	beimischen	Da nämlich in dieſem Falle gewöhnlich große Mörtelvorräthe gehalten werden , ſo würde der Mörtel wenn man gleich allen Sand beimiſchen wollte , zu trocken , oder doch wenigſtens ſehr ſteif werden , alſo jedenfalls an Bindekraft verlieren , weshalb das letztgedachte Berfahren ( bei fettem Lufikalk ) beſſer iſt .	menzel_maurer_1847-2180-20
d Absatz in d Pfanne und an d Gravierwerken bestehen größtenteils aus Gips $ haben jedoch immer noch einige ander Salzteil beimischen $	21	1	beimischen	Der Abſatz in den Pfannen und an den Gravierwerken beſteht groͤßtentheils aus Gyps , hat jedoch immer noch einige andere Salztheile beigemiſcht .	thaer_landwirthschaft02_1810-4648-21
zum Nachweis diese Verfälschung empfehlen Kertesz etwas konzentriert rein Salzsäure in eine klein Porzellanschalechen zu geben und von d zu prüfend Phosphin einige Staubchen vorsichtig auf d Salzsäure zu streuen $ färben sich d Säure gleichmäßig gelb $ so sein d Phosphin rein $ zeigen sich jedoch neben d gelb auch ponceaurot Stelle $ so enthalten es Chrysoidin beimischen $	58	1	beimischen	Zum Nachweis dieſer Verfälſchung empfiehlt Kertész etwas konzentrierte reine Salzſäure in ein kleines Porzellanſchälchen zu geben und von dem zu prüfenden Phosphin einige Stäubchen vorſichtig auf die Salzſäure zu ſtreuen ; färbt ſich die Säure gleichmäßig gelb , ſo war das Phosphin rein , zeigen ſich jedoch neben den gelben auch ponceaurote Stellen , ſo enthält es Chryſoidin beigemiſcht .	ganswindt_faerberei_1889-4093-58
man haben zwei Hauptmethode er d Acker beimischen $ bei welchen dann freilich noch mancherlei Verschiedenheit in d Manipulation statt finden $	7	1	beimischen	Man hat zwei Hauptmethoden ihn dem Acker beizumiſchen , bei welchen dann freilich noch mancherlei Verſchiedenheiten in der Manipulation ſtatt finden .	thaer_landwirthschaft02_1810-4128-7
d mechanisch sein $ d Speise zu zerreiben und innig zu mengen $ oder sie zurückhalten $ um sie d Einfluß d Magensaft desto lang aussetzen $ d chemisch $ ihr eigen auflösend Saft beimischen $	34	1	beimischen	Der mechanische ist , die Speise zu zerreiben und inniger zu mengen , oder sie zurückzuhalten , um sie dem Einfluſs des Magensafts desto länger auszusetzen ; der chemische , ihr eigene auflösende Säfte beyzumischen .	treviranus_biologie04_1814-3613-34
Christus und seine Apostel tragen d wirklich Lehre von Besitzung vor und behaupten sie $ und sein es eine irrig Lehre $ so haben d inspirieren Lehrer d Evangelium notwendig von eine Irrtum frei sein müssen $ die sich unglücklicherweise d Religion beimischen $ die sie ausbreiten suchen $ und sie haben also d Irrtum vielmehr berichtigen müssen $ als daß sie d Volk wissentlich in demselben bestätigt $	42	1	beimischen	Chriſtus und ſeine Apoſtel trugen die wirkliche Lehre von Beſitzungen vor und behaupteten ſie , und wäre es eine irrige Lehre , ſo hätten die inſpirirten Lehrer des Evangeliums nothwendig von einem Irrthume frey ſeyn müſſen , der ſich unglücklicherweiſe der Religion beymiſchte , die ſie auszubreiten ſuchten , und ſie hätten alſo den Irrthum vielmehr berichtigen müſſen , als daß ſie das Volk wiſſentlich in demſelben beſtätigten .	kerner_besessene_1834-57-42
aber da sehen du d dumm Streiche $ die sich immer meine Handeln beimischen pflegen $	13	1	beimischen	Aber da ſiehſt du den dummen Streich , der ſich immer meinem Handeln beizumiſchen pflegt !	immermann_muenchhausen01_1838-2398-13
von d Natur d Ding an sich $ A $ $ zufolge die sie auf wir einwirken $ und eine subjektiv Moment x $ welche durch unsere Sinnesorgan sowohl als durch d spezifisch Natur $ eventuell Beschränkung $ unsere geistig Auffaßungsvermögen diese Einwirkung hinzufügen $ vielleicht auch aus sie wegnehmen $ löschen werden $ unter alle Umstand aber sich sie unvermeidlich beimischen $ sein d Art A bestimmen $ wie d Ding wir erscheinen $ wie wir sie uns Kraft eine Naturnotwendigkeit vorstellen müssen $ es sein $ im mathematisch Sinn d Wort $ A eine Funktion von diese x und a $	61	2	beimischen	Von der Natur der Dinge an sich — a — , zufolge deren sie auf uns einwirken , und einem subjektiven Moment x , welches durch unsre Sinnesorgane sowol als durch die spezifische Natur , eventuell Beschränkung , unsres geistigen Auffassungsvermögens dieser Einwirkung hinzugefügt , vielleicht auch aus ihr weggenommen , gelöscht wird , unter allen Umständen aber sich ihr unvermeidlich beimischt , ist die Art A bestimmt , wie die Dinge uns erscheinen , wie wir sie uns kraft einer Naturnotwendigkeit vorstellen müssen ; es ist , im mathematischen Sinne des Wortes , A eine Funktion von diesem x und a :	schroeder_logik01_1890-714-61
eine weich elegisch Element sein übrigens d Idyll eigen $ gleichsam als sein es $ aus d Sehnsucht nach eine verloren Ideal $ entstehen $ als sein immerdar in d Brust d Mensch d tief Naturgefühl eine gewiß Wehmut beimischen $	39	2	beimischen	Ein weiches elegisches Element ist übrigens dem Idyll eigen , gleichsam als wäre es „ aus der Sehnsucht nach einem verlorenen Ideal " entstanden , als sei immerdar in der Brust des Menschen dem tiefen Naturgefühl eine gewisse Wehmuth beigemischt .	humboldt_kosmos02_1847-70-39
nicht so viel Wert auf Wahl d Neigung müssen legen werden $ nicht so viel andere ihr von Gewicht beilegen $ nicht so viel Rohe und künftig beimischen werden $	27	2	beimischen	Nicht ſo viel Werth auf Wahlen der Neigung muß gelegt werden ; nicht ſo viel anderes ihr von Gewicht beigelegt : nicht ſo viel Rohes und Künftiges beigemiſcht werden .	varnhagen_rahel03_1834-8813-27
es werden eine solch natürlich auftreten $ d plastisch-ideal Stil werden objektiv in seine ganz Haltung sein und ebendarum mehr entwickeln $ wenige unruhig verfahren $ mehr Gedanken-Element beimischen $ er werden vermögen diese Eigenschaft seine Standpunkt wenige in jen Mitte einnehmen $ wo d Inhalt rein in lauter Stimmung aufgehen $ sondern mehr in d erst und dritt unter d Form d Prozeß $ die d $ unterscheiden $ wogegen d charakteristisch Stil recht entscheiden d rein lyrisch Mitte angehören werden $ diese Unterschied werden sich also mit unsere auf d allgemein d inner Prozeß gegründet Einteilung berühren $ aber nur teilweise in eine Art $ worin d logisch Ordnung zugleich d historisch sein $ er werden nicht mit sie zusammenfallen $ vielmehr es werden sich zeigen $ daß $ obwohl d eine Stylrichtung mehr auf diese $ die andere auf jen Stufe d Prozeß ihr Stellung haben $ doch auf jede Stufe jede von beide auftreten und Unterschied innerhalb dieselbe begründen $	28	2	beimischen	Es wird ein ſolcher natürlich auftreten : der plaſtiſch-ideale Styl wird objectiver in ſeiner ganzen Haltung ſein und ebendarum mehr entwickelnd , weniger unruhig verfahren , mehr Gedanken-Elemente beimiſchen , er wird vermöge dieſer Eigenſchaften ſeinen Standpunct weniger in jener Mitte einnehmen , wo der Inhalt rein in lauter Stimmung aufgeht , ſondern mehr in der erſten und dritten unter den Formen des Prozeſſes , die der §. unterſcheidet , wogegen der charakteriſtiſche Styl recht entſchieden der rein lyriſchen Mitte angehören wird ; dieſer Unterſchied wird ſich alſo mit unſerer auf das Allgemeine des innern Prozeſſes gegründeten Eintheilung berühren , aber nur theilweiſe in einer Art , worin die logiſche Ordnung zugleich die hiſtoriſche iſt , er wird nicht mit ihr zuſammenfallen , vielmehr es wird ſich zeigen , daß , obwohl die eine Stylrichtung mehr auf dieſer , die andere auf jener Stufe des Prozeſſes ihre Stellung hat , doch auf jeder Stufe jede von beiden auftritt und Unterſchiede innerhalb derſelben begründet .	vischer_aesthetik030205_1857-2414-28
mögen d Ausgangspunkt d betreffend Empfindung in d entfernt Teil d Organismus liegen $ nirgends anders können diese Empfindung d Mechanismus affizieren $ mittels die kompliziert Bewegung realisieren werden $ nirgends anders können sich sie jen dunkel Vorstellen beimischen $ als im Gehirn $ durch beide aber werden d Empfindung erst zu Trieb $	38	2	beimischen	Mögen die Ausgangspunkte der betreffenden Empfindungen in den entferntesten Theilen des Organismus liegen , nirgends anders können diese Empfindungen den Mechanismus afficiren , mittelst dessen complicirte Bewegungen realisirt werden , nirgends anders kann sich ihnen jenes dunkle Vorstellen beimischen , als im Gehirn ; durch beides aber werden die Empfindungen erst zu Trieben .	griesinger_psychische_1845-467-38
freilich haben sich d Praxis hie und da d Entscheidung über diese Frage leicht zu machen wissen $ indem sie eine bißchen Philanthropenismus ihr althergebracht humanistisch Methode anfügen $ oder eine bißchen Humanismus ihr modern philanthropjenisch Unterrichtsweise beimischen $ von beide nach Gutdünken $	37	2	beimischen	Freilich hat ſich die Praxis hie und da die Entſcheidung uͤber dieſe Fragen leicht zu machen gewußt , indem ſie ein bischen Philanthropiniſmus ihrer althergebrachten humaniſtiſchen Methode anfuͤgte , oder ein bischen Humaniſmus ihrer modernen philanthropiniſchen Unterrichtsweiſe beimiſchte : von beidem nach Gutduͤnken !	niethammer_philantropinismus_1808-557-37
wer können beweisen $ daß sich nicht zuweilen eine schlimm Absicht beimischen $	11	2	beimischen	Wer kann beweiſen , daß ſich nicht zuweilen eine ſchlimme Abſicht beymiſchte ?	heine_reisebilder02_1827-189-11
nur schade $ daß beinahe eine jede seine schön Lied einige schlecht Ton beimischen $	13	2	beimischen	Nur ſchade , daß beinahe ein jeder ſeinen ſchönen Liedern einige ſchlechte Töne beimiſcht !	brehm_thierleben03_1866-17770-13
diese Laute werden aber flötend $ klangvoll Ton beimischen und sie wie jene mit viel Abwechselung und Feuer vortragen $	8	2	beimischen	Dieſen Lauten werden aber flötende , klangvolle Töne beigemiſcht und ſie wie jene mit viel Abwechslung und Feuer vorgetragen .	brehm_thierleben03_1866-3590-8
mit eine Erstaunen $ die um so groß sein $ als sich er d Grausen beimischen $ dass er jene alle doch eigentlich so fremd nicht sein $ ja dass sein apollinisch Bewußtsein nur wie eine Schleier diese dionysisch Welt vor er verdecken $	15	2	beimischen	Mit einem Erstaunen , das um so grösser war , als sich ihm das Grausen beimischte , dass ihm jenes Alles doch eigentlich so fremd nicht sei , ja dass sein apollinisches Bewusstsein nur wie ein Schleier diese dionysische Welt vor ihm verdecke .	nietzsche_tragoedie_1872-84-15
doch mögen d Geist schon früh entfliehen sein $ so daß es nur tot Gebrauch und Bußeübung bleiben $ auch früh schon sich Aberglaube und Irrtum beimischen haben $	26	2	beimischen	Doch mag der Geiſt ſchon fruͤhe entflohen ſein , ſo daß es nur todte Gebraͤuche und Bußuͤbungen blieben ; auch fruͤhe ſchon ſich Aberglauben und Irrthum beigemiſcht haben .	schlegel_indier_1808-506-26
$ Eisen wirken $ wie Seebeck bemerken $ noch stark ein $ dagegen eine Verbindung von 4 Th. Antimon und 1 Th. Eisen d Größe d Oszillation gar nicht vermindern $ obgleich d Antimon allein in einige Grad diese Wirkung zeigen $ Antimon d Kupfer beimischen $ Wismut d Kupfer beimischen $ Nickel d Kupfer beimischen $ vermindern d Einwirkung d Kupfer $	50	3	beimischen	— Eiſen wirkt , wie Seebeck bemerkt , noch ſtaͤrker ein ; dagegen eine Verbindung von 4 Th. Antimon und 1 Th. Eiſen die Groͤße der Oſcillationen gar nicht verminderte , obgleich das Antimon allein in einigem Grade dieſe Wirkung zeigt ; Antimon dem Kupfer beigemiſcht , Wismuth dem Kupfer beigemiſcht , Nickel dem Kupfer beigemiſcht , vermindern die Einwirkung des Kupfers .	brandes_naturlehre03_1832-4092-50
von d fein Element $ welche in d Follikeln enthalten sein $ d Parenchymzellen $ scheinen eine Ablösung einzeln Teil zu erfolgen $ welche nachher als farbelos blut- oder Lymphekörperchen d Blut sich beimischen $	33	3	beimischen	Von den feinen Elementen , welche in den Follikeln enthalten sind , den Parenchymzellen , scheint eine Ablösung einzelner Theile zu erfolgen , welche nachher als farblose Blut- oder Lymphkörperchen dem Blute sich beimischen .	virchow_cellularpathologie_1858-1824-33
4) Shaku-Do $ Kupfer $ welchem 2--5 $ Gold beimischen sein $	9	3	beimischen	4) Shaku-dô , Kupfer , welchem 2—5 % Gold beigemischt sind .	rein_japan02_1886-8695-9
in d hellenisch Altertum $ in d Blütenalter d Menschheit $ finden wir allerdings d zart Ausdruck tief Naturempfindung d dichterisch Darstellung menschlich Leidenschaft $ eine d Sagengeschichte entnehmen Handlung beimischen $ aber d eigentlich Naturbeschreibende zeigen sich dann nur als eine Beiwerk $ weil in d griechisch Kunstbildung sich alle gleichsam im Kreis d Menschheit bewegen $	30	5	beimischen	In dem hellenischen Alterthum , in dem Blüthenalter der Menschheit , finden wir allerdings den zartesten Ausdruck tiefer Naturempfindung den dichterischen Darstellungen menschlicher Leidenschaft , einer der Sagengeschichte entnommenen Handlung beigemischt ; aber das eigentlich Naturbeschreibende zeigt sich dann nur als ein Beiwerk , weil in der griechischen Kunstbildung sich alles gleichsam im Kreise der Menschheit bewegt .	humboldt_kosmos02_1847-31-30
aber heutigentags noch glauben d Fischer fest an d Wirkung dieselbe $ vermeinen damit d Schwertfisch in d Nähe ihr Fahrzeug zu ziehen $ behaupten auch mit Bestimmtheit $ daß diese untertauchen $ wenn jen Formel eine einzig italienisch Wort beimischen werden $ d Fischerei selbst geschehen also noch ganz nach alt Weise $	40	9	beimischen	Aber heutigentages noch glauben die Fiſcher feſt an die Wirkung derſelben , vermeinen damit den Schwertfiſch in die Nähe ihrer Fahrzeuge zu ziehen , behaupten auch mit Beſtimmtheit , daß dieſer untertauche , wenn jener Formel ein einziges italieniſches Wort beigemiſcht werde ; die Fiſcherei ſelbſt geſchieht alſo noch ganz nach alter Weiſe .	brehm_thierleben05_1869-10343-40
er scheiden d Tier in solch mit frei Nerv $ Phaneroneura $ und solch $ die Nervensystem ihr homogen scheinend Körpermasse beimischen sein $	21	10	beimischen	Er ſchied die Thiere in ſolche mit freien Nerven , Phaneroneura , und ſolche , deren Nervenſyſtem ihrer homogen ſcheinenden Körpermaſſe beigemiſcht iſt .	carus_zoologie_1872-8569-21
die sein d berühmt Puzzolanerde von Puzzuoli bei Neapel und d Traß d Brohlthales an d Eifel $ d ebenfalls d Römer schon finden $ $ welche d gelöscht Kalk hälftig beimischen $ eine Maß erzeugen $ die unter Wasser tauchen sogleich hart werden $	31	12	beimischen	Das iſt die berühmte Puzzolanerde von Puzzuoli bei Neapel und der Traß des Brohlthales an der Eifel ( den ebenfalls die Römer ſchon fanden ) , welcher dem gelöſchten Kalke hälftig beigemiſcht , eine Maſſe erzeugt , die unter Waſſer getaucht ſogleich hart wird .	quenstedt_mineralogie_1854-6955-31
die verdoppeln Zahl werden im Jahr 335 erwählen $ aber erst elf Jahr spät $ 346 $ üben d Volk zum erstenmal sein gewinnen Recht durch d Wahl dreier plebejisch Quästor $ dadurch werden auch Plebejer d Senat beimischen $	38	15	beimischen	Die verdoppelte Zahl ward im Jahr 335 erwaͤhlt , aber erſt elf Jahre ſpaͤter ( 346 ) uͤbte das Volk zum erſtenmahl ſein gewonnenes Recht durch die Wahl dreyer plebejiſcher Quaͤſtoren . Dadurch wurden auch Plebejer dem Senat beygemiſcht :	niebuhr_roemische02_1812-1658-38
d modern Ideal d Malerei sollen d Stoff nach d Transzendenz abwerfen und d rein Wirklichkeit in Besitz nehmen $ d Form nach d streng malerisch Stil d richtig Maß d plastisch beimischen $	32	16	beimischen	Das moderne Ideal der Malerei ſoll dem Stoffe nach die Tranſcendenz abwerfen und die reine Wirklichkeit in Beſitz nehmen , der Form nach dem ſtreng maleriſchen Style das richtige Maaß des plaſtiſchen beimiſchen .	vischer_aesthetik030203_1854-2658-32
