sentence_lemma	target_index	cluster	lemma	sentence_token	identifier
bei d prägnant hervortretend holländisch Färbung und bei d überraschend Hindeutung d Vulcanius auf d Lieber Vagatorum und auf d Zeit seine Erscheinung $ welche er auf 1547 festsetzen und zu welcher d bedeler Orden schon längst drucken sein $ lassen sich nicht ohne Grund vermuten $ daß d Vokabel d Vulcanius aus eine um jen Zeit erscheinen holländisch Übersetzung d schon im bedeler Orden weit nach NordDeutschland hinaufgedringen Lieber Vagatorum herstammen $ wobei d Übersetzer mit analog Originalität wie d bedeler Orden spezifisch Ausdruck aus d holländisch Gaunerwortvorrat beimischen $	89	0	beimischen	Bei der prägnant hervortretenden holländiſchen Färbung und bei der überraſchenden Hindeutung des Vulcanius auf den Liber Vagatorum und auf die Zeit ſeiner Erſcheinung , welche er auf 1547 feſtſetzt und zu welcher der Bedeler orden ſchon längſt gedruckt war , läßt ſich nicht ohne Grund vermuthen , daß die Vocabeln des Vulcanius aus einer um jene Zeit erſchienenen holländiſchen Ueberſetzung des ſchon im Bedeler orden weit nach Norddeutſchland hinaufgedrungenen Liber Vagatorum herſtammen , wobei der Ueberſetzer mit analoger Originalität wie der Bedeler orden ſpecifiſche Ausdrücke aus dem holländiſchen Gaunerwortvorrath beimiſchte .	avelallemant_gaunerthum04_1862-1304-89
erst mehrere Monat spät konstatieren d Hausarzt nach wiederholt Schlaganfall Sprachestörung in Form von Aphasie und ich selbst finden $ etwa ¾ Jahr nach d Auftreten d Dyslexie $ eine Rest von ataktisch Aphasie $ welche eine gewiß Grad von Artikulationsstörung beimischen sein $	41	0	beimischen	Erst mehrere Monate später constatirte der Hausarzt nach wiederholten Schlaganfällen Sprachstörung in Form von Aphasie und ich selbst fand ( etwa ¾ Jahre nach dem Auftreten der Dyslexie ) einen Rest von atactischer Aphasie , welcher ein gewisser Grad von Articulationsstörung beigemischt war .	berlin_wortblindheit_1887-514-41
wenn diese Gedankengang richtig sein $ so lassen sich d Annahme von Keimbahn $ wie ich sie früh schon machen haben $ nicht vermeiden $ und d Umstand $ dass nur in diese Bahn liegend Zelle d Fähigkeit besitzen können $ Keimzelle zu werden $ werden sich kaum anders auslegen lassen $ als durch d Annahme $ dass nur diese Zelle Keimplasma beimischen enthalten $	62	0	beimischen	Wenn dieser Gedankengang richtig ist , so lässt sich die Annahme von Keimbahnen — wie ich sie früher schon gemacht habe — nicht vermeiden , und der Umstand , dass nur in diesen Bahnen liegende Zellen die Fähigkeit besitzen können , Keimzellen zu werden , wird sich kaum anders auslegen lassen , als durch die Annahme , dass nur diese Zellen Keimplasma beigemischt enthalten .	weismann_keimplasma_1892-2110-62
nach d hier durchgeführt Betrachtung beruhen d rein Undulationstheorie auf eine Untersuchung d Undulation in d an einander grenzend Ätherschichte von ungleich Dichtigkeit $ diese Untersuchung lassen sich $ ganz entsprechend d akustisch Theorie in streng mathematisch Form durchführen $ und so lange man dabei stehen bleiben $ so sein d Ruhm $ d Fresnel d Undulationstheorie beilegen $ daß sie eine streng mathematisch Entwicklung fähig sein $ und nichts willkürlich beimischen enthalten $ sehr wohl begründen $	71	0	beimischen	Nach den hier durchgefuͤhrten Betrachtungen beruht die reine Undulationstheorie auf einer Unterſuchung der Undulationen in den an einander grenzenden Aetherſchichten von ungleicher Dichtigkeit ; dieſe Unterſuchung laͤßt ſich , ganz entſprechend den acuſtiſchen Theorieen in ſtrenger mathematiſcher Form durchfuͤhren , und ſo lange man dabei ſtehen bleibt , ſo iſt der Ruhm , den Fresnel der Undulationstheorie beilegt , daß ſie einer ſtrengen mathematiſchen Entwickelung faͤhig ſei , und nichts Willkuͤhrliches beigemiſcht enthalte , ſehr wohl begruͤndet .	brandes_naturlehre02_1831-2148-71
in eine Boden $ die einzig und allein nur aus Sand und Ton bestehen $ genügen es $ d Boden nur eine klein Quantität Guano beimischen $ um darauf d reich Ernte von Mais zu erhalten $	25	0	beimischen	In einem Boden , der einzig und allein nur aus Sand und Thon beſteht , genügt es , dem Boden nur eine kleine Quantität Guano beizumiſchen , um darauf die reichſten Ernten von Mais zu erhalten .	liebig_agricultur_1840-633-25
nebenbei müssen es auch zu eine glücklich Ereignis für manche dortig Zirkel gereichen $ die nun endlich d Salz beimischen werden werden $ die Mangel sie so lange ganz ungenießbar machen $	19	0	beimischen	Nebenbei muß es auch zu einem glücklichen Ereigniß für manche dortige Cirkel gereichen , denen nun endlich das Salz beigemiſcht werden wird , deſſen Mangel ſie ſo lange ganz ungenießbar machte .	pueckler_briefe03_1831-1802-19
d letztere haben mehr Azot $ mehr Schwefel und Phosphorstoff beimischen $ welche man bei d Verbrennen aus d Geruch $ die d verbrennt tierisch Körper gleich kommen $ schon sehr deutlich bemerken können $	10	0	beimischen	Der letztere hat mehr Azot , mehr Schwefel und Phosphorſtoff beigemiſcht , welches man bei dem Verbrennen aus dem Geruche , der dem verbrannter thieriſcher Koͤrper gleich kommt , ſchon ſehr deutlich bemerken kann .	thaer_landwirthschaft02_1810-2338-10
Leonardus und Ange lesen still d Brief $ welche sie empfangen haben $ Wehmutsschatten überfliegen Ange $ schön Zug und voll Teilnahme blicken endlich alle zunächst auf sie $ Leonardus mit eine verhalten Freude-Gefühl $ Ludwig mit seelenvoll Zuneigung $ Wind mit rein und gütig Wohlwollen $ und Frau Juliane Wind auch mit Wohlwollen $ die aber eine Zusatz von weiblich Neugier beimischen sein $ daher sie auch zuerst wieder d Wort mit d Frage nehmen $	62	0	beimischen	Leonardus und Angés lasen still die Briefe , welche sie empfangen hatten ; Wehmuthsschatten überflogen Angés ’ schöne Züge und voll Theilnahme blickten endlich alle zunächst auf sie , Leonardus mit einem verhaltenen Freude-Gefühl , Ludwig mit seelenvollster Zuneigung , Windt mit reinem und gütigem Wohlwollen , und Frau Juliane Windt auch mit Wohlwollen , dem aber ein Zusatz von weiblicher Neugier beigemischt war , daher sie auch zuerst wieder das Wort mit der Frage nahm :	bechstein_dunkelgraf_1854-2010-62
d Faser werden endlich so fein $ daß sie eine samtartig Aussehen erhalten $ wie zu Wittichen $ doch pflegen dann Nadel von Pharmakolith sich beimischen $ die man nicht leicht mineralogisch trennen können $	25	0	beimischen	Die Faſern werden endlich ſo fein , daß ſie ein ſammtartiges Ausſehen erhalten , wie zu Wittichen , doch pflegen dann Nadeln von Pharmakolith ſich beizumiſchen , die man nicht leicht mineralogiſch trennen kann .	quenstedt_mineralogie_1854-8408-25
d Nuß aber sein eine unermeßlich und selbstherrlich und er sein mit keine Ding mischen $ sondern allein für sich ruhen er auf sich selber $ $ $ zuerst $ d Nuß müssen von d Materie gesondert sein $ denn sein er d ander beimischen $ so werden d mit er Zusammengemischte er hindern $ so daß er keine Ding so zu beherrschen vermögen $ wie er nun vermögen $ da er auf sich selber ruhen $ und zwar werden eine solch selbständig Kraft $ welche d gemeinsam Drehung hervorbringen $ überhaupt am einfach von d Weltkugel räumlich trennen und von eine Angriffsstelle außerhalb dieselbe d Drehung und Weltbildung bewirkend gedenken $ für Anaxagoras $ welche d Nuß d $ Leichteste $ und rein $ alle $ Ding $ $ sonach eine verfeinert stofflich oder doch an d Grenze von Stofflichkeit noch befindlich sein sein $ sein diese Vorstellung unvermeidlich $ $	44	0	beimischen	Der Nus aber iſt ein Unermeßliches und Selbſtherrliches und er iſt mit keinem Dinge gemiſcht , ſondern allein für ſich ruhet er auf ſich ſelber “ . — Zuerſt : der Nus muß von der Materie geſondert ſein ; denn wäre er dem Anderen beigemiſcht , ſo würde das mit ihm Zuſammengemiſchte ihn hindern , ſo daß er kein Ding ſo zu beherrſchen vermöchte , wie er nun vermag , da er auf ſich ſelber ruht . Und zwar wurde eine ſolche ſelbſtändige Kraft , welche die gemeinſame Drehung hervorbringt , überhaupt am einfachſten von der Weltkugel räumlich getrennt und von einer Angriffsſtelle außerhalb derſelben die Drehung und Weltbildung bewirkend gedacht ; für Anaxagoras , welchem der Nus das „ Leichteſte “ und Reinſte “ aller „ Dinge “ , ſonach ein verfeinertes Stoffliches oder doch an der Grenze von Stofflichkeit noch befindlich geweſen iſt , war dieſe Vorſtellung unvermeidlich . —	dilthey_geisteswissenschaften_1883-2306-44
zuweilen sein er er aber innig beimischen $ und dann entdecken man er nur durch chemisch Untersuchung $	6	0	beimischen	Zuweilen iſt er ihm aber inniger beigemiſcht , und dann entdeckt man ihn nur durch chemiſche Unterſuchung .	thaer_landwirthschaft02_1810-1490-6
d Vereinigung aber $ da sie auch hier nicht nach Willkür geschehen können $ so daß man nach Gutdünken d Unterricht über materiell Gegenstand eine wenig von geistig Gegenstand $ oder umgekehrt d Unterricht über geistig Gegenstand eine wenig von materiell beimischen $ stehen unter d Gesetz d Unterordnung und werden danach so bestimmen $ daß in jede d beide entgegengesetzt Unterrichtsart auf d Unterrichtsgegenstand d ander soviel Rücksicht nehmen werden $ als nötig sein $ um d Zusammenhäng beide in d gesamt Umfang d Wissen zu d Klarheit und Lebendigkeit d Bewußtsein zu erheben $ die erforderlich sein $ von beide Seite Einseitigkeit und Pedantismus $ d wahr Widerspiel alle frei Bildung $ abhalten $	41	0	beimischen	Die Vereinigung aber , da ſie auch hier nicht nach Willkuͤr geſchehen kann , ſo daß man nach Gutduͤnken dem Unterricht uͤber materielle Gegenſtaͤnde ein wenig von geiſtigen Gegenſtaͤnden , oder umgekehrt dem Unterricht uͤber geiſtige Gegenſtaͤnde ein wenig von materiellen beimiſchte , ſteht unter dem Geſetze der Unterordnung und wird darnach ſo beſtimmt : daß in jeder der beiden entgegengeſetzten Unterrichtsarten auf die Unterrichtsgegenſtaͤnde der andern ſoviel Ruͤckſicht genommen werde , als noͤthig iſt , um den Zuſammenhang beider in dem geſammten Umfang des Wiſſens zu der Klarheit und Lebendigkeit des Bewußtſeyns zu erheben , die erforderlich iſt , von beiden Seiten Einſeitigkeit und Pedantiſmus , das wahre Widerſpiel aller freien Bildung , abzuhalten .	niethammer_philantropinismus_1808-1083-41
immer müssen d ausgescheiden Luft $ wenn sie früh d Eiweiß beimischen sein $ sauerstoffreich sein $ als d atmosphärisch $ da Flüßigkeit $ wenn sie Luft aufnehmen $ eine groß Verhältnis von Sauerstoffgas enthalten $ als d atmosphärisch Luft $	11	0	beimischen	Immer muſs die ausgeschiedene Luft , wenn sie früher dem Eiweiſs beigemischt war , sauerstoffreicher seyn , als die atmosphärische , da Flüssigkeiten , wenn sie Luft aufnehmen , ein gröſseres Verhältniſs von Sauerstoffgas enthalten , als die atmosphärische Luft .	baer_thiere_1837-628-11
endlich werden d Beschluß mit d voll Werk durch eine Fuge machen $ worin entweder nur eine ander Bearbeitung d erstere Thema herrschen $ oder noch eine oder auch nach Beschaffenheit desselben zwei ander beimischen werden $	34	0	beimischen	Endlich wurde der Beschluß mit dem vollen Werke durch eine Fuge gemacht , worin entweder nur eine andere Bearbeitung des erstern Thema herrschte , oder noch eines oder auch nach Beschaffenheit desselben zwey andere beygemischt wurden .	forkel_bach_1802-356-34
dann missfallen ich auch höchlich dein Mißfallen am eigen Scherz $ dulden es doch nicht in du $ daß sich deine edel und stolz Empfindung auch etwas verwerflich vornehm beimischen $ die auf Heiterkeit und Lust verachten hinab sehen wollen $	29	0	beimischen	Dann mißfaͤllt mir auch hoͤchlich Dein Mißfallen am eigenen Scherz ; dulde es doch nicht in Dir , daß ſich Deinen edlen und ſtolzen Empfindungen auch etwas verwerflich Vornehmes beimiſche , das auf Heiterkeit und Luſt verachtend hinab ſehn will .	tieck_phantasus03_1816-4006-29
und suchen wir nun nach d Wesentliche diese Sinnesorgan $ d verständig ausgeführt Knochenbau so fest und so beweglich zugleich $ d kräftig Muskel $ die durch seine Zusammenziehung jen Hebelwerk d Knochen in Bewegung setzen $ d Herz mit seine zahlreich Röhre $ d Ader $ eine meisterhaft ausgeführt Pumpenwerk $ welche d ernährend Flüßigkeit $ d Blut $ durch alle Teil treiben $ d ganz verwickelt Bau von Behälter und Kanal in die Nahrungsstoff aufnehmen $ in mannigfach Weise chemisch zersetzen und wieder anders verbinden $ hier d Blut beimischen $ dort als unbrauchbar aussondern werden $ d vielfach Faser und Haut $ welche alle Teil mit einander verbinden und d Ganze umkleiden und zur schön menschlich Gestalt abrunden $ sie alle sein es nicht $	91	0	beimischen	Und ſuchen wir nun nach dem Weſentlichen dieſer Sinnesorgane — der verſtändig ausgeführte Knochenbau ſo feſt und ſo beweglich zugleich , der kräftige Muskel , der durch ſeine Zuſammenziehung jenes Hebelwerk der Knochen in Bewegung ſetzt , das Herz mit ſeinen zahlreichen Röhren , den Adern , ein meiſterhaft ausgeführtes Pumpenwerk , welches die ernährende Flüſſigkeit , das Blut , durch alle Theile treibt , der ganze verwickelte Bau von Behältern und Canälen in denen Nahrungsſtoffe aufgenommen , in mannigfacher Weiſe chemiſch zerſetzt und wieder anders verbunden , hier dem Blute beigemiſcht , dort als unbrauchbar ausgeſondert werden , die vielfachen Faſern und Häute , welche alle Theile mit einander verbinden und das Ganze umkleiden und zur ſchönen menſchlichen Geſtalt abrunden , ſie alle ſind es nicht .	schleiden_pflanze_1848-182-91
nachdem er im siebent Buche d Mensch besprechen $ seine Geburt $ Ähnlichkeit $ Lebensdauer $ Größe $ verschieden Fähigkeit durchgehen und auch hier viel fabelhaft beimischen haben $ beginnen er d acht Buch mit d Wort $	26	0	beimischen	Nachdem er im ſiebenten Buche den Menſchen beſprochen , ſeine Geburt , Aehnlichkeiten , Lebensdauer , Größe , verſchiedenen Fähigkeiten durchgegangen und auch hier viel Fabelhaftes beigemiſcht hat , beginnt er das achte Buch mit den Worten :	carus_zoologie_1872-1301-26
nur sehr selten können wir uns an eine paar Mangaven $ Hancornia Speciosa $ erquicken $ und am allerselten sein wir d Beste $ die äußerlich apfelähnlich $ $ großartig $ schmeckend Frucht von Solanum Lycocarpum $ Fruta De Lobo oder Wolfsfrucht d Sertanejo's bescheiden $ die quellend Süßigkeit durch d schwarz Kern eine wenig zart Bitterkeit beimischen werden $	57	0	beimischen	Nur sehr selten konnten wir uns an ein paar Mangaven , Hancornia speciosa , erquicken , und am allerseltensten war uns das Beste , die äusserlich apfelähnliche , » grossartig « schmeckende Frucht von Solanum lycocarpum , Fruta de lobo oder Wolfsfrucht des Sertanejo’s beschieden , deren quellender Süssigkeit durch die schwarzen Kerne ein wenig zarte Bitterkeit beigemischt wurde .	steinen_naturvoelker_1894-1233-57
am häufig werden $ insbesondere für Anfertigung von feuerfest Tiegel $ Graphit benutzen $ d eigentlich Graphittiegel bestehen oft zu zwei Drittel ihr Gewicht aus Graphit mit eine Drittel Ton $ die unter Umstand auch noch ander Magerungsmittel schon beimischen sein $	39	0	beimischen	Am häufigsten wird , insbesondere für Anfertigung von feuerfesten Tiegeln , Graphit benutzt ; die eigentlichen Graphittiegel bestehen oft zu zwei Drittel ihres Gewichtes aus Graphit mit einem Drittel Thon , dem unter Umständen auch noch andere Magerungsmittel schon beigemischt sind .	ledebur_eisenhuettenkunde_1884-2514-39
hierher gehören auch d erotisch Element $ die schon d hellenisch Anfang d Roman in stark Dosis beimischen sein $	17	0	beimischen	Hierher gehört auch das erotische Element , das schon den Hellenischen Anfängen des Romans in starker Dosis beigemischt war .	gottschall_poetik_1858-5642-17
d Grund $ aus welchen d römisch Gesetz sich mit d wahr faktisch Beschaffenheit d Besitz nicht begnügen $ sondern demselben so vieles rechtsartig beimischen haben $ sein verschieden $	24	0	beimischen	Die Gruͤnde , aus welchen die roͤmiſchen Geſetze ſich mit der wahren factiſchen Beſchaffenheit des Beſitzes nicht begnuͤgten , ſondern demſelben ſo vieles rechtsartige beygemiſcht haben , ſind verſchieden .	glueck_pandecten02verbesserungen_1800-2544-24
erstere $ wenn man d Abgußbrei eine Pigment $ z. B. Zinnober $ Mennige $ Bergblau $ Beinschwarz $ als Pulver beimischen oder d Gips mit gefärbt Wasser anmachen $	21	0	beimischen	Erſteres , wenn man dem Abgußbreie ein Pigment , z. B. Zinnober , Mennige , Bergblau , Beinſchwarz , als Pulver beimiſcht oder den Gips mit gefärbtem Waſſer anmacht .	baumstark_encyclopaedie_1835-9798-21
gediegen sein d Nickel auch $ aber nur in gering Prozent $ die oben $ S. 654 u. F. $ gedenken gediegen Eisen beimischen $ und zwar $ nach Howard $ d sibirisch zu 17 $ d südamerikanisch aber zu 10 pro Cent $	23	0	beimischen	Gediegen ist der Nickel auch , aber nur in geringen Procenten , dem oben ( S. 654 u. f. ) gedachten gediegenen Eisen beygemischt ; und zwar ( nach Howard ) dem Sibirischen zu 17 , dem Südamericanischen aber zu 10 pro Cent .	blumenbach_naturgeschichte_1815-11061-23
so oft ihr in d Kirche gehen $ was verkünden ihr d Altar mit ihr Schmuck $ was d brennend Kerze und d ewig Licht $ was d ernst feierlich Gesang $ die nichts weltlich $ profan $ opernmäßig beimischen werden $ was verkünden ihr die alle $	39	0	beimischen	So oft ihr in die Kirche geht , was verkünden euch die Altäre mit ihrem Schmucke , was die brennenden Kerzen und das ewige Licht , was der ernste feierliche Gesang , dem nichts Weltliches , Profanes , Opernmäßiges beigemischt wird – was verkündet euch das alles :	hug_familie_1896-3654-39
durch d Trieb werden mit groß Leichtigkeit stark oder schwach $ anhaltend oder vorübergehend Gemütsbewegung $ S. $ 27. $ setzen $ und indem d Trieb und d von sie geweckt Gefühl sich d Vorstellen beimischen $ nehmen diese schon eine beweglich $ nach außen drängend Element in sich auf $ bekommen zugleich etwas warm $ sinnlich $ und es ergeben sich aus diese Mischung ganz neu Seelenzustand $	35	0	beimischen	Durch die Triebe werden mit grösster Leichtigkeit stärkere oder schwächere , anhaltendere oder vorübergehendere Gemüthsbewegungen ( S. §. 27. ) gesetzt , und indem die Triebe und die von ihnen geweckten Gefühle sich dem Vorstellen beimischen , nimmt dieses schon ein bewegliches , nach aussen drängendes Element in sich auf , bekommt zugleich etwas Warmes , Sinnliches , und es ergeben sich aus diesen Mischungen ganz neue Seelenzustände .	griesinger_psychische_1845-470-35
im Gegenteil haben sie Cautionsness in zu hoch Grad $ welche ihr Leben als Wermut beimischen sein $ denn sie werden über alle viel zu viel reflektieren $ sich abwechselnd d seltsam Grille machen $ und gerade bei Kleinigkeit $ ohne Not in Kummer und Sorge $ Mißtrauen in sich selbst und Argwohn gegen andere $ oder auch in Apathie verfallen $ sich im Ganze fast immer mit d Zukunft $ wenig mit d Vergangenheit und noch wenige mit d Gegenwart beschäftigen $ $	15	0	beimischen	Im Gegentheile haben Sie cautionsness in zu hohem Grade , welche Ihrem Leben als Wermuth beigemiſcht iſt , denn Sie werden über Alles viel zu viel reflektiren , ſich abwechſelnd die ſeltſamſten Grillen machen , und gerade bei Kleinigkeiten , ohne Noth in Kummer und Sorge , Mißtrauen in ſich ſelbſt und Argwohn gegen Andere , oder auch in Apathie verfallen , ſich im Ganzen faſt immer mit der Zukunft , wenig mit der Vergangenheit und noch weniger mit der Gegenwart beſchäftigen . “	pueckler_briefe04_1831-1033-15
als Grundstoff alle Farbe betrachten aber Isaac Vossius d Schwefel $ welche nach er alle Körper beimischen sein $ cap. 25 p. 60 $ $	16	0	beimischen	Als Grundstoff aller Farbe betrachtet aber Isaac Vossius den Schwefel , welcher nach ihm allen Körpern beigemischt ist ( cap. 25 p. 60 ) .	humboldt_kosmos02_1847-4630-16
Wykii u. s. W. $ $ verbinden $ man sorgen für regelmäßig Unterhaltung d Darmausleerung $ lassen d Unterleib warm halten $ trocken oder spirituos Friktion auf dieselbe machen $ man ordnen ferner als allgemein $ d Reproduktion und d Tonus d Muskelfaser befördernd Mittel innerlich d Gebrauch d Eisen $ anfänglich als Tinktur $ spät in Substanz an $ verbinden damit d Gebrauch aromatisch Krauterbad $ welchen bei mehr phlegmatisch Subjekt etwas Wein oder Branntwein beimischen werden $ empfehlen d fleißig Bewegung in frei Luft $ Reise $ Gebrauch eisenhaltig Mineralbad und eine leicht verdaulich nahrhaft Diät $ verbinden mit d Gebrang eine gut alt Wein $	76	0	beimischen	Wykii u. ſ. w. ) , verbindet , man ſorgt fuͤr regelmaͤßige Unterhaltung der Darmausleerungen , laͤßt den Unterleib warm halten , trockne oder ſpirituoͤſe Friktionen auf denſelben machen , man ordnet ferner als allgemeine , die Reproduktion und den Tonus der Muskelfaſer befoͤrdernde Mittel innerlich den Gebrauch des Eiſens , anfaͤnglich als Tinktur , ſpaͤter in Subſtanz an , verbindet damit den Gebrauch aromatiſcher Kraͤuterbaͤder , welchen bey mehr phlegmatiſchen Subjekten etwas Wein oder Brandtwein beygemiſcht wird , empfiehlt die fleißige Bewegung in freier Luft , Reiſen , Gebrauch eiſenhaltiger Mineralbaͤder und eine leicht verdauliche nahrhafte Diaͤt , verbunden mit dem Gebranche eines guten alten Weins .	carus_gynaekologie01_1820-1089-76
wie es aber in d Vorstufe diese selb Fettbildung und in ander Organ d Körper $ wie Leber $ Darmepithel etc. $ welche Fett zu assimilieren vermögen $ aussehen $ darüber haben wir noch keine Vorstellung $ dass hier vital Substanz d scheinbar homogen Fettelement beimischen sein können und auch wirklich bei mischen sein $ erscheinen aus mancherlei Grund wahrscheinlich $	45	0	beimischen	Wie es aber in den Vorstufen dieser selben Fettbildung und in anderen Organen des Körpers , wie Leber , Darmepithel etc. , welche Fett zu assimiliren vermögen , aussieht , darüber haben wir noch keine Vorstellung ; dass hier vitale Substanzen den scheinbar homogenen Fettelementen beigemischt sein können und auch wirklich bei gemischt sind , erscheint aus mancherlei Gründen wahrscheinlich .	altmann_elementarorganismen_1890-948-45
Tellurblei $ Pb Te $ auf d Grube Sawodinski d Tellursilber beimischen $ haben eine dreifach Blätterbruch $ wie Bleiglanz $	11	0	beimischen	Tellurblei , Pb Te , auf der Grube Sawodinski dem Tellurſilber beigemiſcht , hat einen dreifachen Blätterbruch , wie Bleiglanz .	quenstedt_mineralogie_1854-10919-11
d mit Wasser $ welche etwas Mehl beimischen sein $ bestreichen Brot $ werden mittels eine mit lang Stiel versehen Brett in d Ofen schieben und hier durch d in demselben herrschend Temperatur backen $	7	0	beimischen	Die mit Waſſer , welchem etwas Mehl beigemiſcht iſt , beſtrichenen Brote , werden mittels eines mit langem Stiele verſehenen Brettes in den Ofen geſchoben und hier durch die in demſelben herrſchende Temperatur gebacken .	samter_erfindungen_1896-8247-7
Brandt haben auch Untersuchung über d Rotbruch und d Kaltbruch d Eisen anstellen und kommen zu d falsch Resultat $ dass rotbrüchig Eisen Schwefelsäure enthalten $ während d kaltbrüchig Eisen Arsenik $ Wismut $ nach ander Zink $ oder Spießglanz beimischen sein $	40	0	beimischen	Brandt hatte auch Untersuchungen über den Rotbruch und den Kaltbruch des Eisens angestellt und kam zu dem falschen Resultat , daſs rotbrüchiges Eisen Schwefelsäure enthalte , während dem kaltbrüchigen Eisen Arsenik , Wismut ( nach anderen Zink ) oder Spieſsglanz beigemischt sei .	beck_eisen03_1897-7977-40
auch können man d Salatsauce 2 Eßlöffel dick sauer Sahne beimischen und dagegen 1 Eidotter und 1 Eßlöffel Öl wenige nehmen $	10	0	beimischen	Auch kann man der Salatsauce 2 Eßlöffel dicke saure Sahne beimischen und dagegen 1 Eidotter und 1 Eßlöffel Oel weniger nehmen .	davidis_kochbuch_1879-4828-10
d Beziehung auf d einzeln Feierlichkeit $ auf d vorliegend Ereignis bringen es ganz natürlich mit sich $ dass neben d Wunder d Gott $ neben d Tat d Mensch $ die man erzählen $ man auch d Gefühl $ welche d Feierlichkeit anregen $ Wort geben $ dass man dort d religiös Empfindung $ hier d Betrübnis aussprechen $ dass man also d objektiv angeschaut Stoff eine reflektierend Richtung auf d Subjekt verleihen $ dass man d Tatsache d äußer Wirklichkeit in Verbindung setzen mit d inner Zustand $ kurz $ dass man d episch Gehalt noch eine lyrisch Element beimischen $	101	0	beimischen	Die Beziehung auf die einzelne Feierlichkeit , auf das vorliegende Ereigniss brachte es ganz natürlich mit sich , dass neben den Wundern des Gottes , neben den Thaten des Menschen , die man erzählte , man auch den Gefühlen , welche die Feierlichkeit anregte , Worte gab ; dass man dort die religiöse Empfindung , hier die Betrübniss aussprach ; dass man also dem objectiv angeschauten Stoff eine reflectierende Richtung auf das Subject verlieh , dass man die Thatsachen der äussern Wirklichkeit in Verbindung setzte mit den innern Zuständen , kurz , dass man dem epischen Gehalt noch ein lyrisches Element beimischte .	wackernagel_poetik_1873-1449-101
man können sie aber auch dazu vermögen $ wenn man d Getränk nur eine wenige von mehlig Substanz beimischen $ und vorzüglich passen sich dazu d Oelkuchen $ wovon oben sprechen werden $	18	0	beimischen	Man kann ſie aber auch dazu vermoͤgen , wenn man dem Getraͤnke nur ein weniges von mehligen Subſtanzen beimiſcht , und vorzuͤglich paſſen ſich dazu die Oelkuchen , wovon oben geſprochen worden .	thaer_landwirthschaft04_1812-6346-18
