sentence_lemma	target_index	cluster	lemma	sentence_token	identifier
be protect by the battery of new-york $ governor 's island $ and red hook $ that $ on the arrival of their fleet through the sound $ instead of make a direct attack on new-york $ they should land at kingsbridge $ and take up a position across the island of new-york $ cut off all communication with the mainland $ and $ blockade general washington by land and water $ compel him to capitulate on their own term $ $	33	1	attack	being protected by the batteries of New-York , Governor 's Island , and Red Hook ; that , on the arrival of their fleet through the Sound , instead of making a direct attack on New-York , they should land at Kingsbridge , and take up a position across the island of New-York , cut off all communication with the mainland , and , blockading General Washington by land and water , compel him to capitulate on their own terms . "	fic_1838_7086.txt-2732-33
cry his antagonist $ follow him and stand over him $ ready to renew the attack if he stir with an evil purpose $	15	1	attack	cried his antagonist , following him and standing over him , ready to renew the attack if he stirred with an evil purpose .	fic_1833_7239.txt-1694-15
it be during the captain 's absence at headquarters that some of the traitor arnold 's soldier make an attack on the mansion $	19	1	attack	It was during the Captain 's absence at headquarters that some of the traitor Arnold 's soldiers made an attack on the mansion .	mag_1858_506134.txt-148-19
i dream in a dream $ i see a city invincible to the attack of the whole of the rest of the earth from leave of grass $ 1860-61 $ i dream in a dream $ i see a city invincible to the attack of the whole of the rest of the earth $ i dream that be the new city of friend $ nothing be great there than the quality of robust love $ it lead the rest $ it be see every hour in the action of the man of that city $	43	1	attack	I dreamed in a dream , I saw a city invincible to the attacks of the whole of the rest of the earth from Leaves of grass ( 1860-61 ) I dreamed in a dream , I saw a city invincible to the attacks of the whole of the rest of the earth , I dreamed that was the new City of Friends , Nothing was greater there than the quality of robust love -- it led the rest , It was seen every hour in the actions of the men of that city ,	fic_1860_8118.txt-4037-43
period of its greatest activity be towards the middle of the day $ the hour at which student generally $ $ $ which unfortunate class be most obnoxious to its attack $ -- be unwilling to be disturb $	30	1	attack	period of its greatest activity is towards the middle of the day , the hour at which students generally , - - which unfortunate class is most obnoxious to its attacks , -- are unwilling to be disturbed .	mag_1832_564239.txt-203-30
deed of christian charity $ and by the time it be conclude $ the boy awake $ eager to make an attack upon the luncheon $	21	1	attack	deeds of Christian charity , and by the time it was concluded , the boys awoke , eager to make an attack upon the luncheon .	fic_1857_9075.txt-4573-21
ferri have naturally a robust constitution $ and it be slow in confess the sap and mine process that have be go on ever since he be born $ so that he have have many of what he call $ singular attack $ before he feel permanently the bad for them $	41	1	attack	Ferris had naturally a robust constitution , and it was slow in confessing the sapping and mining process that had been going on ever since he was born , so that he had had many of what he called " singular attacks " before he felt permanently the worse for them .	fic_1859_9037.txt-2260-41
i can not afford to be irritable and captious $ nor to waste all my time in attack $	17	1	attack	I can not afford to be irritable and captious , nor to waste all my time in attacks .	fic_1844_800.txt-2479-17
species of attack against which $ we protest be too mean-spirited to deserve refutation $	2	1	attack	species of attack against which - we protest is too mean-spirited to deserve refutation .	mag_1846_524014.txt-26-2
the colonel will therefore consider the order to stand the attack of the	10	1	attack	The colonel will therefore consider the order to stand the attack of the	fic_1835_7309.txt-3267-10
the moor $ who have quickly place themselves in order of battle to receive the expect attack $ on see but one person $ now look to abdelasis for their order $	16	1	attack	The Moors , who had quickly placed themselves in order of battle to receive the expected attack , on seeing but one person , now looked to Abdelasis for their orders .	fic_1846_7121.txt-2894-16
assertion when we say $ that $ have his sympathy be at all enlist with the assail party $ the sarcasm of its leader would have hurry him into the very first rank of attack $	34	1	attack	assertion when we say , that , had his sympathies been at all enlisted with the assailing party , the sarcasm of its leader would have hurried him into the very first rank of attack .	fic_1834_2652.txt-2410-34
it be within the memory of a large portion of the profession $ that typhoid fever be supposed to be a disease which $ in its early stage at least $ might be so far counteract by a bold attack as to reduce to a few day ' duration a siege which otherwise might be continue for week $ expose the patient to	39	1	attack	It is within the memory of a large portion of the profession , that typhoid fever was supposed to be a disease which , in its early stages at least , might be so far counteracted by a bold attack as to reduce to a few days ' duration a siege which otherwise might be continued for weeks , exposing the patient to	mag_1855_556039.txt-57-39
a day be appoint $ but be unacquainted with the art of writing $ or the use of number $ the period be designate by a bundle of stick $ every stick represent a day $ each of the confederated chief prepare a bundle correspond in number with those of his associate $ one of which be to be burn daily $ and the commit of the last to the flame $ be to be the signal for the attack $ $	79	1	attack	A day was appointed , but being unacquainted with the art of writing , or the use of numbers , the period was designated by a bundle of sticks , every stick representing a day ; each of the confederated chiefs prepared a bundle corresponding in number with those of his associates , one of which was to be burned daily ; and the committing of the last to the flames , was to be the signal for the attack . "	fic_1835_7134.txt-2235-79
$ with the troop near montreal $ endeavour to defend it and the surrounding country against any attack of the colonist $	17	1	attack	" With the troops near Montreal , endeavouring to defend it and the surrounding country against any attacks of the colonists .	fic_1838_7085.txt-2157-17
on the 5th of october $ 1778 $ the legion be order to little egg harbour $ with a body of jersey and pennsylvania militia $ and a field piece from colonel proctor 's regiment of artillery $ the whole under the command of pulaski $ for the defense of the place against an attack $ which be expect from the enemy then on that coast $	54	1	attack	On the 5th of October , 1778 , the legion was ordered to Little Egg Harbour , with a body of Jersey and Pennsylvania militia , and a field piece from colonel Proctor 's regiment of artillery , the whole under the command of Pulaski , for the defence of the place against an attack , which was expected from the enemy then on that coast .	mag_1825_553609.txt-140-54
nature mark out for them the same strategy which napoleon use with such wonderful success $ that of maintain a compact force $ of divide his enemy and bring the great power to bear upon the point of attack $	38	1	attack	Nature marked out for them the same strategy which Napoleon used with such wonderful success , that of maintaining a compact force , of dividing his enemies and bringing the greater power to bear upon the point of attack .	mag_1856_590811.txt-90-38
the attack of the boston teacher upon the board of education and its secretary have fail $ - signally and disgracefully fail $	1	1	attack	The attack of the Boston Teachers upon the Board of Education and its Secretary has failed , - signally and disgracefully failed .	mag_1845_555245.txt-299-1
you assure me that old snell and his two son be the whole force that he carry $ while i find two stout $ able-bodied man besides $ all well arm $ and ready for the attack $	36	1	attack	You assured me that old Snell and his two sons were the whole force that he carried , while I find two stout , able-bodied men besides , all well armed , and ready for the attack .	fic_1834_2652.txt-5065-36
in the spring of 1821 $ he accompany his wife to hartford $ connecticut $ to obtain $ medical assistance for her relief from a cancer $ which be remove $ with some hope of a permanent cure $ but in the summer of 1822 $ it renew its attack and in a few week carry her to the grave $	49	1	attack	In the spring of 1821 , he accompanied his wife to Hartford , Connecticut , to obtain , medical assistance for her relief from a cancer ; which was removed , with some hopes of a permanent cure ; but in the summer of 1822 , it renewed its attack and in a few weeks carried her to the grave .	mag_1840_586558.txt-356-49
i examine the boy 's foot $ and find them red $ shine and tumefied $ with other indication of a severe attack of chilblain $ $	22	1	attack	I examined the boy 's feet , and found them red , shining and tumefied , with other indications of a severe attack of chilblains . "	fic_1853_1170.txt-2289-22
but then $ the work itself $ with the exception of a feeble attack now and then from the prolific pen of skimmer $ $ who write for several publication $ $ be notice by the press with favour $	13	1	attack	But then , the work itself , with the exception of a feeble attack now and then from the prolific pen of Skimmer , ( who wrote for several publications , ) was noticed by the press with favour .	fic_1854_9193.txt-8301-13
here they delay a few minute $ as if expect an attack $ until find that the object of their solicitude have safely cross the field and plunge into the distant wood $ they ride away at a rapid pace in the same direction $	11	1	attack	Here they delayed a few minutes , as if expecting an attack ; until finding that the object of their solicitude had safely crossed the field and plunged into the distant woods , they rode away at a rapid pace in the same direction .	fic_1835_7172.txt-6030-11
if it be such as will warrant an attack $ i be seize with a strong desire to carry it $ either by surprise or by storm $	8	1	attack	If it be such as will warrant an attack , I am seized with a strong desire to carry it , either by surprise or by storm .	fic_1831_7210.txt-1507-8
i think i have just awake $ after the attack which be make upon me by the assassin $ when i be on my way to mr.- marisett 's house $	9	1	attack	I thought I had just awoke , after the attack which was made upon me by the assassin , when I was on my way to Mr. Marisett 's house .	fic_1839_7024.txt-2377-9
$ which should be the signal of an attack have be make there $	8	1	attack	, which should be the signal of an attack having been made there .	fic_1824_7211.txt-3045-8
la tour resolve to avenge these repeat insult $ and $ hear that the fort at penobscot be at that time weakly defend $ he make immediate preparation to commence an attack on it $	31	1	attack	La Tour resolved to avenge these repeated insults ; and , hearing that the fort at Penobscot was at that time weakly defended , he made immediate preparations to commence an attack on it .	fic_1827_2832.txt-890-31
on either side $ crown most commonly by dense and intricate mass of forest $ through which and without a guide $ our little army be compel to pass $ -- present opportunity for frequent ambush and attack $ in which $ very inferior force $ if properly command $ might $ with little danger to themselves $ overwhelm and utterly destroy an advancing enemy $	37	1	attack	on either side , crowned most commonly by dense and intricate masses of forest , through which and without a guide , our little army was compelled to pass , -- presented opportunities for frequent ambush and attack , in which , very inferior forces , if properly commanded , might , with little danger to themselves , overwhelm and utterly destroy an advancing enemy .	nf_1844_749098.txt-536-37
yell the populace $ but they make no attack $	8	1	attack	yelled the populace , but they made no attack .	fic_1844_3928.txt-3118-8
this be the first point of attack $ the only immediate palliative which there seem any hope of apply $	6	1	attack	This is the first point of attack , the only immediate palliative which there seems any hope of applying .	mag_1840_586497.txt-150-6
such be some of the disadvantage of a light sandy soil $ and $ in thoroughly examine many of the fruit garden of the middle state the last few season $ we could not fail to be strike with the fact that in nine case out of ten $ where a variety of fruit be unusually liable to disease $ to blight $ or to the attack of	66	1	attack	Such are some of the disadvantages of a light sandy soil ; and , in thoroughly examining many of the fruit gardens of the middle states the last few seasons , we could not fail to be struck with the fact that in nine cases out of ten , where a variety of fruit was unusually liable to disease , to blight , or to the attacks of	nf_1845_747928.txt-826-66
while place situate in the interior and on navigable stream have be the favorite object of attack $ the sea-board $ in almost all country $ have be nearly exempt $	16	1	attack	While places situated in the interior and on navigable streams have been the favorite objects of attack , the sea-board , in almost all countries , has been nearly exempt .	mag_1832_564307.txt-140-16
mr.- calhoun have have to sustain a tremendous battery of attack $ at the present session $ from the two great leader of the opposition $ mr.- clay and mr.- webster $ and these encounter of intellect-whatever may be think of the propriety of time and place-have present scene of an	10	1	attack	Mr. Calhoun has had to sustain a tremendous battery of attack , at the present session , from the two great leaders of the Opposition , Mr. Clay and Mr. Webster ; and these encounters of intellect-whatever may be thought of the propriety of time and place-have presented scenes of an	mag_1838_586203.txt-253-10
but if the policy of the anglo-americans be sufficient to destroy so powerful a rival as the french $ what can be expect from the unconcerted $ ill-advised resistance or attack of the aborigine $ unskilled in military tactic $ and not sufficiently strong $ on any one point $	30	1	attack	But if the policy of the Anglo-Americans was sufficient to destroy so powerful a rival as the French , what can be expected from the unconcerted , ill-advised resistance or attack of the aborigines , unskilled in military tactics , and not sufficiently strong , on any one point ,	mag_1838_554586.txt-186-30
i gather from him enough to convince me that my fear $ which i have already speak of $ be true $ and as i afterwards hear the fact of that fatal attack $ i will here relate them to you $ $	32	1	attack	I gathered from him enough to convince me that my fears , which I have already spoken of , were true ; and as I afterwards heard the facts of that fatal attack , I will here relate them to you . "	fic_1848_7009.txt-1181-32
upon meet my friend $ they commence a simultaneous attack upon me for have $ as they aver $ leave them in a most eccentric manner the day before $	9	1	attack	Upon meeting my friends , they commenced a simultaneous attack upon me for having , as they averred , left them in a most eccentric manner the day before .	fic_1843_7166.txt-1590-9
$ like the rest of the building $ be render $ by their thickness $ bullet proof $ so that when close and bolt $ the house be capable of withstand an ordinary attack of the indian $	33	1	attack	, like the rest of the building , were rendered , by their thickness , bullet proof -- so that when closed and bolted , the house was capable of withstanding an ordinary attack of the Indians .	fic_1853_2486.txt-330-33
the village of sitka $ and $ on arrive there $ be inform of the meditate attack and their assistance solicit $	16	1	attack	the village of Sitka , and , on arriving there , were informed of the meditated attack and their assistance solicited .	mag_1822_553405.txt-347-16
schiller appear to have resign his professorship $ or at least to have suspend his attention to its duty $ after the attack of illness above mention $ although the fact be not precisely state by the biographer $ and be thus deprive of his ordinary mean of living $	22	1	attack	Schiller appears to have resigned his professorship , or at least to have suspended his attention to its duties , after the attack of illness above mentioned , although the fact is not precisely stated by the biographer , and was thus deprived of his ordinary means of living .	mag_1823_553456.txt-249-22
if nation be at war $ we be not judge of the question of right $ in that war $ we must acknowledge $ in both party $ the mutual right of attack $ and the mutual right of conquest $	32	1	attack	If nations be at war , we are not judges of the question of right , in that war ; we must acknowledge , in both parties , the mutual right of attack , and the mutual right of conquest .	mag_1853_590163.txt-199-32
it be rather a singular thing for a street musician to sing such song as you do $ and in such a manner $ $ $ then $ after a pause $ during which she do not volunteer any information on the subject $ he renew the attack $ with $ $ you must have have some instruction $	47	2	attack	It is rather a singular thing for a street musician to sing such songs as you do , and in such a manner , " -- then , after a pause , during which she did not volunteer any information on the subject , he renewed the attack , with , " You must have had some instruction .	fic_1848_1279.txt-1511-47
indeed such be the shattered condition of the little tenement $ that you might easily have imagine it suffer from a forty year ' attack of chronic disease $ and quite unfit for the habitation of so great a military hero $	24	2	attack	Indeed such was the shattered condition of the little tenement , that you might easily have imagined it suffering from a forty years ' attack of chronic disease , and quite unfit for the habitation of so great a military hero .	fic_1858_1282.txt-1444-24
