sentence_lemma	target_index	cluster	lemma	sentence_token	identifier
if $ therefore $ we call the weight of the prism abc $ w $ the breadth ac $ b $ the height ab $ h $ and the specific gravity of the earth $ s $ we shall have w = if we call the /z/ thrust of w in the direction of the slope w $ then $ neglect * ing friction $ $ on the principle of the inclined plane $ w will be to w as the length of the incline be to its height $ or call the length b c $ / $ then aw bh * s * lih $ $ w $ w ' = = $	72	3	plane	If , therefore , we call the weight of the prism ABC , W , the breadth AC , b , the height AB , h , and the specific gravity of the earth , s , we shall have W = If we call the /z/ thrust of W in the direction of the slope W , then ( neglect * ing friction , ) on the principle of the inclined plane , W will be to W as the length of the incline is to its height ; or calling the length B C , / , then AW bh * s * lih : : W : W ' = = .	nf_1853_747976.txt-286-72
if a plane have only one trace $ and this trjice parallel to the ground-line $ let it be in the vertical plane $ then the plane will be parallel to the horizontal plane $	33	3	plane	If a plane has only one trace , and this trjice parallel to the ground-line , let it be in the vertical plane ; then the plane will be parallel to the horizontal plane .	nf_1836_748113.txt-1786-33
the obvious disqualification of the distribution in question be $ that it make the line of demarcation between subject and object $ or between the me and the not-me $ to fall within the plane of nature $ or between fin'ite and finite $ instead of without that plane $ or between infinite and finite $	34	3	plane	The obvious disqualification of the distribution in question is , that it makes the line of demarcation between subject and object , or between the me and the not-me , to fall within the plane of nature , or between fin'ite and finite , instead of without that plane , or between infinite and finite .	mag_1853_575130.txt-230-34
if $ through the axis of the shaft $ be supposed to pass twenty vertical plane $ make equal angle with each other $ which will cut the surface of the column in twenty place $ and if the surface of the column be curved or hollow between each two line $ from the bottom to the top of the shaft $ terminate immediately under the low annulet $ then the shaft will have twenty curved side $ and as many angle $ and if nearly at the upper end of the shaft be cut one or more groove of an equal depth $ from the surface of the hollow $ each groove be parallel to the annulet under the echinus $ then a column so be call doric $	15	3	plane	If , through the axis of the shaft , be supposed to pass twenty vertical planes , making equal angles with each other , which will cut the surface of the column in twenty places ; and if the surface of the column be curved or hollowed between each two lines , from the bottom to the top of the shaft , terminating immediately under the lowest annulet ; then the shaft will have twenty curved sides , and as many angles ; and if nearly at the upper end of the shaft be cut one or more grooves of an equal depth , from the surface of the hollowing , each groove being parallel to the annulets under the echinus , then a column so is called Doric .	nf_1836_748113.txt-2386-15
hence the horizontal projectant be parallel to the vertical plane $ and be equal to the distance between the original point and the horizontal plane $ and the vertical projectant be parallel to the horizontal plane $ and be equal to the distance between the original point and the vertical plane $	50	3	plane	Hence the horizontal projectant is parallel to the vertical plane , and is equal to the distance between the original point and the horizontal plane ; and the vertical projectant is parallel to the horizontal plane , and is equal to the distance between the original point and the vertical plane .	nf_1836_748113.txt-1726-50
the open box c $ plate 14 $ afford an example of line depress below the ground plane $	17	3	plane	The open box C , Plate 14 , affords an example of lines depressed below the ground plane .	nf_1830_747561.txt-598-17
although the term orthography signify $ in general $ the projection of any plane which be perpendicular to the projecting ray $ without regard the position of the plane on which the object be project $ yet writer on projection substitute it for elevation $ as already define $ by which mean it will be impossible to know when we mean that particular position of orthographical projection $ which be make on a plane perpendicular to the <nul> /z/ if any point $ line $ or plane of any original figure $ or object $ touch the plane on which it be to be project $ the place where it touch the projecting plane $ be the projection of that point $ line $ or plane of the original figure or object $	73	3	plane	Although the term orthography signifies , in general , the projection of any plane which is perpendicular to the projecting rays , without regarding the position of the plane on which the object is projected ; yet writers on projection substitute it for elevation , as already defined ; by which means it will be impossible to know when we mean that particular position of orthographical projection , which is made on a plane perpendicular to the horizon.1 /z/ If any point , line , or plane of any original figure , or object , touch the plane on which it is to be projected , the place where it touches the projecting plane , is the projection of that point , line , or plane of the original figure or object .	nf_1836_748113.txt-1845-73
this point $ where the ray pass through the perspective plane $ be call the seat of their representation $	10	3	plane	This point , where the rays pass through the perspective plane , is called the seat of their representation .	nf_1830_747561.txt-85-10
in their simple form $ they be the lever $ the wheel and axle $ the inclined plane	17	3	plane	In their simple form , they are the lever , the wheel and axle , the inclined plane	nf_1852_748165.txt-661-17
a segment of a cylinder be comprehend under three plane $ and the curve surface of the cylinder $ two of these be segment of circle $ the other plane be a parallelogram $ which be here $ for distinction 's sake $ call the plane of the segment $ and the circular segment be call the end of the cylinder $	9	3	plane	A segment of a cylinder is comprehended under three planes , and the curve surface of the cylinder ; two of these are segments of circles : the other plane is a parallelogram , which is here , for distinction 's sake , called the plane of the segment , and the circular segments are called the ends of the cylinder .	nf_1836_748113.txt-1391-9
so if the trace of the plane be in the horizontal plane $ and parallel to the ground $ line $ the plane will be parallel to the vertical plane $	11	3	plane	So if the trace of the plane be in the horizontal plane , and parallel to the ground - line , the plane will be parallel to the vertical plane .	nf_1836_748113.txt-1787-11
mean follow that the work of the medical profession lie on this lofty plane $ and $ consequently $ the argument in question have nothing to do with the matter at issue $	13	3	plane	means follows that the work of the medical profession lies on this loftiest plane , and , consequently , the argument in question has nothing to do with the matter at issue .	mag_1850_565904.txt-183-13
there be other kind of plane besides the above $ as the plough $ for sink a groove to receive a projecting tongue $ the bead plane $ for stick bead $ the snipe bill $ for form quirk $ the compass plane and the forkstaff plane $	5	3	plane	There are other kinds of planes besides the above ; as the plough , for sinking a groove to receive a projecting tongue ; the bead plane , for sticking beads ; the snipe bill , for forming quirks ; the compass plane and the forkstaff plane ,	nf_1853_747976.txt-1561-5
as the approach of different plane in existence be indicate in form	5	3	plane	As the approach of different planes in existence is indicated in forms	fic_1843_7039.txt-2742-5
the opaque object a $ figure 1 $ plate 18 $ be oblique both to the horizon and the ground plane $	20	3	plane	The opaque object A ( figure 1 , Plate 18 ) is oblique both to the horizon and the ground plane .	nf_1830_747561.txt-779-20
substitute for the vacant frame $ one with a plate of glass in it $ as a perspective plane $ you can trace with a pencil on this glass $ or measure with compass $ the appearance of the figure beyond $	18	3	plane	Substitute for the vacant frame , one with a plate of glass in it , as a perspective plane ; you can trace with a pencil on this glass , or measure with compasses , the appearance of the figures beyond .	nf_1830_747561.txt-670-18
in order to ascertain the apparent height $ raise a perpendicular from the point i $ this be the point at which the line o xx_n $ when produce $ intersect the ground line $ for could the house be move up to the perspective plane $ it would touch it at i <nul> measure on this perpendicular $ by mean of your scale $ the actual height of the house $ of which it be presume you have on your plan an exact description $ set this off $ from i to u $ from u rule u s $ which intersect the perpendicular d e $ at e $ this give the apparent height $	45	3	plane	In order to ascertain the apparent height , raise a perpendicular from the point I , this is the point at which the line O N , when produced , intersects the ground line ; for could the house be moved up to the perspective plane , it would touch it at I F. Measure on this perpendicular , by means of your scale , the actual height of the house ( of which it is presumed you have on your plan an exact description ) set this off , from I to u , from u rule u S , which intersects the perpendicular d e , at e , this gives the apparent height .	nf_1830_747561.txt-303-45
the ray of the sun be reflect from the horizon in all direction $ the projecture of the prism will prevent a part of the reflect ray from proceed to the plane behind the prism $ and consequently the dane would be something darke than the face of the prism which be parallel to it $ but the side of the prism adjoin to the plane will throw a reflection upon the plane $ and therefore it would be difficult to perceive the difference between the face of the prism $ and the plane parallel behind the prism $	31	3	plane	The rays of the sun being reflected from the horizon in all directions , the projecture of the prism will prevent a part of the reflected rays from proceeding to the plane behind the prism , and consequently the dane would be something darker than the face of the prism which is parallel to it ; but the side of the prism adjoining to the plane will throw a reflection upon the plane , and therefore it would be difficult to perceive the difference between the face of the prism , and the plane parallel behind the prism .	nf_1836_748113.txt-2098-31
by the adoption of stationary power $ on inclined plane $ in surmount some of the steep declivity $ it be suppose the distance might be reduce to something less than a hundred and ninety mile $ without any considerable increase of the elevation to be pass $	9	3	plane	By the adoption of stationary powers , on inclined planes , in surmounting some of the steeper declivities , it is supposed the distance might be reduced to something less than a hundred and ninety miles , without any considerable increase of the elevation to be passed .	mag_1829_553976.txt-20-9
a cycloid or epicycloid $ be a figure generate by a circle roll alotog <nul> edgof a ruler $ or another circle at rest $ while a point in the circumference describe a figure on tlie plane call a cycloid or <nul>	36	3	plane	A cycloid or epicycloid , is a figure generated by a circle rolling alotog tbe.atraigbt edgof a ruler , or another circle at rest , while a point in the circumference describes a figure on the plane called a cycloid or epicycloid.	nf_1836_748113.txt-1542-36
reciprocally $ if on each plane of projection the trace of the two plane be parallel $ the plane will also be parallel $	18	3	plane	Reciprocally , if on each plane of projection the traces of the two planes are parallel , the planes will also be parallel .	nf_1836_748113.txt-1801-18
its angle upon a give point a $ in the plane $ on which the ichnography be to be describe $ give the ichnography a l $ of an angle $ which the two under plane make with each other $ the angle ma/ $ which the angle of the solid make with its ichnography a l $ the intersection a a $ of one of its end with the plane of the ichnography $ the angle d a a $ which one side of the end make at a $ with the intersection a a of that end $ also give one of the side of the end $ and the length of the prism $	10	3	plane	its angles upon a given point A , in the plane , on which the ichnography is to be described ; given the ichnography A L , of an angle , which the two under planes make with each other ; the angle Ma/ , which the angle of the solid makes with its ichnography A L ; the intersection A a , of one of its ends with the plane of the ichnography ; the angle D A a , which one side of the end makes at A , with the intersection A a of that end ; also given one of the sides of the ends , and the length of the prism .	nf_1836_748113.txt-1855-10
they be $ as it be $ the step by which it rise to the plane of conviction $ emotion $ action $	15	3	plane	They are , as it were , the steps by which it rises to the plane of conviction , emotion , action .	mag_1859_567139.txt-171-15
$ and the point t and w $ in the plan 9 / g 10 $ and the line xx_j $ k $ i $ m $ parallel to these plane $ the line xx_j ' $ ar $ i $ m $ xx_n $ will make parallel shadow $ therefore $ draw q $ c $ rdjt u $ parallel to xx_j k $ k / $ or m xx_n $ to cut c 6 in e $ k 7 in d $ and g g at w $ join d q $ then to find the depth of the shadow of z m on the elevation $ draw 5 on the ichnography parallel to xx_j w $ draw 4* &^; perpendicular to w xx_p $ likewise 4* b $ parallel to the ray on the elevation $ and s s $ parallel to the axis of the prism $ then s ii the depth of the shadow $ but as the projection of the extremity of i m $ fall upon the adjacent plane at xx_r $ and tf draw e f through s $ cut 8 e at	175	3	plane	, and the points t and w , in the plan 9 / g 10 , and the lines J , k , I , m , parallel to these planes ; the lines j ' , Ar , I , m , n , will make parallel shadows ; therefore , draw q , c , rdjt u , parallel to j k , k / , or m n , to cut c 6 in e , k 7 in d , and G g at w ; join d q ; then to find the depth of the shadow of Z m on the elevation , draw 5 on the ichnography parallel to J W ; draw 4* &^; perpendicular to W P , likewise 4* b , parallel to the ray on the elevation , and S s , parallel to the axis of the prism ; then s ii the depth of the shadow ; but as the projections of the extremities of I m , fall upon the adjacent planes at r , and tf draw e f through s , cutting 8 e at	nf_1836_748113.txt-2012-175
the wall of a house which stand parallel or square before vou $ be a plane parallel with the perspective plane $ or the window through which you look $ but the roof be not $ it make an angle more or less large $ with the perspective plane $ consequently any line lie on it $ $ <nul>	48	3	plane	The wall of a house which stands parallel or square before vou , is a plane parallel with the perspective plane , or the window through which you look ; but the roof is not , it makes an angle more or less large , with the perspective plane , consequently any lines lying on it , ( viz.	nf_1830_747561.txt-384-48
a section through the upper torus of the base $ which be of an euiptical form $ the transverse axis be incline to the plane of the horizon $	24	3	plane	A section through the upper torus of the base , which is of an eUiptical form , the transverse axis being inclined to the plane of the horizon .	nf_1836_748113.txt-2671-24
the floor on which the four foot rest $ be one plane $ the seat be another $ parallel with the former $	11	3	plane	The floor on which the four feet rest , is one plane , the seat is another , parallel with the former .	nf_1830_747561.txt-525-11
- you ascertain by this process precisely how much the house diminish $ in consequence of its distance xx_n i from the perspective plane $	23	3	plane	- You ascertain by this process precisely how much the house diminishes , in consequence of its distance N I from the perspective plane .	nf_1830_747561.txt-304-23
front of the triglyph $ or to the front of the architrave $ and if these plane be in the same plane with each otlier $ and recess beyond the end of the triglyph $ so as to show a small part of the vertical side of the beam $ that be $ to be far in than the channel of the triglyph $ then these space so fill up $ be call <nul>	21	3	plane	front of the triglyphs , or to the front of the architrave ; and if these planes be in the same plane with each otlier , and recessed beyond the ends of the triglyph , so as to show a small part of the vertical sides of the beams ; that is , to be further in than the channels of the triglyph ; then these spaces so filled up , are called metopes.	nf_1836_748113.txt-2425-21
/z/ the ichnography and elevation of the prism stand upon a polygonal base $ have the projecture or cap of the same figure upon it $ project equally over its side $ give the seat of the sun 's ray on the plane of the ichnography $ and also on the elevation $ to project the shadow of the cap on the prism $ and also on a plain parallel to the axis of the prism $	42	3	plane	/z/ The ichnography and elevation of the prism standing upon a polygonal base , having the projecture or cap of the same figure upon it , projecting equally over its sides ; given the seat of the sun 's rays on the plane of the ichnography , and also on the elevation ; to project the shadow of the cap on the prism , and also on a plain parallel to the axis of the prism .	nf_1836_748113.txt-2002-42
if the sun 's ray be parallel to any plane $ that plane to which they be parallel $ be call a plane of shade $	9	3	plane	If the sun 's rays be parallel to any plane , that plane to which they are parallel , is called a plane of shade .	nf_1836_748113.txt-1926-9
if a right line $ situate in a give plane by its trace $ be parallel to tte horizontal plane $ its horizontal projection will be parallel to the horizontal trace of the give plane $ and its vertical projection will be parallel to the ground-line $	19	3	plane	If a right line , situated in a given plane by its traces , is parallel to tte horizontal plane , its horizontal projection will be parallel to the horizontal trace of the given plane , and its vertical projection will be parallel to the ground-line .	nf_1836_748113.txt-1808-19
also of many kind $ those call bench plane - %s the jack plane $ the try plane $ the long plane $ the joint $ and the smooth plane $ be use for bring the stuff to a plane surface $	29	3	plane	also of many kinds ; those called bench planes - %s the jack plane , the trying plane , the long plane , the jointer , and the smoothing plane , are used for bringing the stuff to a plane surface .	nf_1853_747976.txt-1543-29
although i have make use of the roman ovolo and ogee iu all the order $ i do not generally use them in practice $ the bend $ or turn inward $ of the upper edge of the grecian $ ot quirk ovolo $ when the sun shine on its surface $ cause a beautiful variety of light and shade $ which greatly relieve it from plane surface $ and if it be entirely in shadow $ but receive a reflect	66	3	plane	Although I have made use of the Roman ovolo and ogee iu all the orders , I do not generally use them in practice ; the bending , or turning inward , of the upper edge of the Grecian , ot quirk ovolo , when the sun shines on its surface , causes a beautiful variety of light and shade , which greatly relieves it from plane surfaces ; and if it is entirely in shadow , but receive a reflected	nf_1827_747521.txt-191-66
in some the list or edge $ throughout all the circumvolution $ be in the same line or plane $ - such be the antique ionic volute $ and those of vignola $	18	3	plane	In some the list or edge , throughout all the circumvolutions , is in the same line or plane : - such are the antique Ionic volutes , and those of Vignola .	nf_1836_748113.txt-452-18
thus the ijne will be perpendicular to the horizontal plane $ if its projection be the give point in the horizontal plane $	9	3	plane	Thus the Ijne will be perpendicular to the horizontal plane , if its projection be the given point in the horizontal plane .	nf_1836_748113.txt-1760-9
for if you suppose the perspective plane set upright on the ground before you $ high than your eye $ then the horizontal plane $ to reach from your eye to the verge of the sky $ must pass through the perspective plane $ and thus make a line exactly parallel with the top and bottom line of your perspective plane $	23	3	plane	For if you suppose the perspective plane set upright on the ground before you , higher than your eye ; then the horizontal plane , to reach from your eye to the verge of the sky , must pass through the perspective plane , and thus make a line exactly parallel with the top and bottom line of your perspective plane .	nf_1830_747561.txt-105-23
each stratum $ he argue $ must have a force of rotation proportion to its own level $ and can impart force only by descent to a low plane	28	3	plane	Each stratum , he argues , must have a force of rotation proportioned to its own level , and can impart force only by descent to a lower plane	mag_1851_555706.txt-293-28
moreover we see $ and it be very important $ that the line a a $ b b $ perpendicular to the ground line u xx_v $ will not cease to be so in the motion of the plane u xx_v y z $ and as the corresponding line a a $ &; b $ be also perpendiculars $ to the ground line u xx_v $ it follow that the line $ a a ' $ b 6 ' $ will be the respective prolongation of the line a a $ &; b $	38	3	plane	Moreover we see , and it is very important , that the lines A a , B b , perpendicular to the ground line U V , will not cease to be so in the motion of the plane U V Y Z ; and as the corresponding lines a a , &; b , are also perpendiculars , to the ground line U V , it follows that the lines , a a ' , b 6 ' , will be the respective prolongation of the lines a a , &; b .	nf_1836_748113.txt-1734-38
thus $ for example $ if a line be parallel to a horizontal plane $ its vertical projection will be parallel to the ground-line $ and if it be parallel to the vertical plane $ its horizontal projection will be parallel to the ground-line $	33	3	plane	Thus , for example , if a line be parallel to a horizontal plane , its vertical projection will be parallel to the ground-line ; and if it is parallel to the vertical plane , its horizontal projection will be parallel to the ground-line .	nf_1836_748113.txt-1752-33
for a writing desk $ which be an inclined plane $ do not make a right angle with the table on which it stand $ as the book when place upright do $ but it make a small angle $ and this angle be more or less acute $ that be $ small $ according to the great or less inclination of the desk $	9	3	plane	For a writing desk , which is an inclined plane , does not make a right angle with the table on which it stands , as the book when placed upright does ; but it makes a smaller angle , and this angle is more or less acute ( that is , small ) according to the greater or less inclination of the desk .	nf_1830_747561.txt-45-9
in this case the power $ weight as g f $ d f $ or $ which be the same thing $ as a b $ c b $ or as the height of the plane $ the base $	35	3	plane	In this case the power : weight as g f : d f , or , which is the same thing , as A B : C B , or as the height of the plane : the base .	nf_1827_748059.txt-1356-35
the human race do not revolve in a circle $ but ascend in a spiral $ passing $ indeed $ again and again through the same error to the same truth $ but pass through them each time on a high plane $	41	3	plane	The human race does not revolve in a circle , but ascends in a spiral ; passing , indeed , again and again through the same errors to the same truths , but passing through them each time on a higher plane .	mag_1853_566255.txt-503-41
/z/ in general $ the division be by nearly parallel plane $ but sometimes the mass be tortuous or wedgeshaped $	10	3	plane	/z/ In general , the division is by nearly parallel planes ; but sometimes the masses are tortuous or wedgeshaped .	nf_1855_748018.txt-248-10
the section of a cylinder cut by any plane inclined to its axis $ be an ellipsis $	8	3	plane	The section of a cylinder cut by any plane inclined to its axis , is an ellipsis .	nf_1836_748113.txt-1400-8
the ray of the sun be reflect from the horizon in all direction $ the projecture of the prism will prevent a part of the reflect ray from proceed to the plane behind the prism $ and consequently the dane would be something darke than the face of the prism which be parallel to it $ but the side of the prism adjoin to the plane will throw a reflection upon the plane $ and therefore it would be difficult to perceive the difference between the face of the prism $ and the plane parallel behind the prism $	72	3	plane	The rays of the sun being reflected from the horizon in all directions , the projecture of the prism will prevent a part of the reflected rays from proceeding to the plane behind the prism , and consequently the dane would be something darker than the face of the prism which is parallel to it ; but the side of the prism adjoining to the plane will throw a reflection upon the plane , and therefore it would be difficult to perceive the difference between the face of the prism , and the plane parallel behind the prism .	nf_1836_748113.txt-2098-72
