sentence_lemma	target_index	cluster	lemma	sentence_token	identifier
the old slave $ be question $ fall on his knee and confess that he have leave the babe under a plane tree $ on mount ida $ and that he have afterward see him in the hut of mygdomus $	21	0	plane	The old slave , being questioned , fell on his knees and confessed that he had left the babe under a plane tree , on Mount Ida , and that he had afterward seen him in the hut of Mygdomus .	fic_1846_7036.txt-323-21
the plane or buttonwood tree $ so common in our street and environs $ have hitherto	1	0	plane	The Plane or Buttonwood tree , so common in our streets and environs , has hitherto	mag_1844_555220.txt-284-1
there be but a trifling difference in general effect between /z/ our plane or buttonwood and the oriental plane $	12	0	plane	There is but a trifling difference in general effect between /z/ our plane or buttonwood and the Oriental plane .	nf_1841_747926.txt-1307-12
oak $ old english $ young tree $ 363 $ old ship timber $ $ from old tree $ $ medium quality $ $ green $ beech $ medium quality $ alder $ plane tree $	33	0	plane	Oak , old English , young tree , 363 " old ship timber , " from old tree , " medium qualities , " green , Beech , medium quality , Alder , Plane tree .	nf_1827_748059.txt-314-33
on the contrary $ she be advance to a still high plane $ where his dream of possession do not venture to intrude $	11	1	plane	On the contrary , she was advanced to a still higher plane , where his dreams of possession did not venture to intrude .	fic_1860_9165.txt-4809-11
mould plane be use for stick moulding $ as the operation of form moulding with the plane be call $	16	1	plane	Moulding planes are used for sticking mouldings , as the operation of forming mouldings with the plane is called .	nf_1853_747976.txt-1558-16
there be other kind of plane besides the above $ as the plough $ for sink a groove to receive a projecting tongue $ the bead plane $ for stick bead $ the snipe bill $ for form quirk $ the compass plane and the forkstaff plane $	26	1	plane	There are other kinds of planes besides the above ; as the plough , for sinking a groove to receive a projecting tongue ; the bead plane , for sticking beads ; the snipe bill , for forming quirks ; the compass plane and the forkstaff plane ,	nf_1853_747976.txt-1561-26
the intersection of these line on the perspective plane $ make the figure i xx_j k i $ which be the perspective representation of a d b c m the plan $ because $ these point of intersection on the perspective plane be the same which would be make by the ray of light come from the point in the original to the eye $ provide the dimension and position correspond to those in the plate $ as have be show in lesson 7 $	8	1	plane	The intersection of these lines on the perspective plane , make the figure i j k I , which is the perspective representation of a d b c m the plan : because , these points of intersection on the perspective plane are the same which would be made by the rays of light coming from the points in the original to the eye , provided the dimensions and position correspond to those in the plate , as has been shown in Lesson 7 .	nf_1830_747561.txt-330-8
you will observe that the two circle partly describe on the plate $ for the purpose of determine the opening of the box $ be circle stand upright on the ground plane $ and not lay on it $ as be the circle in plate 10 $	31	1	plane	You will observe that the two circles partly described on the plate , for the purpose of determining the opening of the box , are circles standing upright on the ground plane , and not laying on it , as are the circles in Plate 10 .	nf_1830_747561.txt-544-31
from its edge upon the plane $ and if the shadow upon the plane be of no considerable breadth $ and if the plane be extend at any considerable distance beyond the shadow $ then the light part of the plane on which the ray will reflect a great part of the ray towards the prism $ but as these reflect ray will not fall upon the shadow $ it will be deprive of reflection $ but as the side of the prism which project the shadow $ be oppose to the reflect ray $ that side of the prism will receive a strong reflection $ which will cause it to appear much lighter than the shadow it throw on the plane $ but if the shadow be project far on the plane $ it will diminish the reflect surface behind the prism $ and will also cause the reflect surface to be at a great distance from the side of the prism $ and consequently will receive less reflection from the plane $ and in general the reflection on the prism will be continually diminish $ according as the shadow	121	1	plane	from its edge upon the plane ; and if the shadow upon the plane be of no considerable breadth , and if the plane be extended at any considerable distance beyond the shadow , then the lightest part of the plane on which the rays will reflect a great part of the rays towards the prism : but as these reflected rays will not fall upon the shadow , it will be deprived of reflection : but as the side of the prism which projects the shadow , is opposed to the reflected rays , that side of the prism will receive a strong reflection , which will cause it to appear much lighter than the shadow it throws on the plane ; but if the shadow be projected farther on the plane , it will diminish the reflecting surface behind the prism , and will also cause the reflecting surface to be at a greater distance from the side of the prism , and consequently will receive less reflection from the plane ; and in general the reflection on the prism will be continually diminished , according as the shadow	nf_1836_748113.txt-2088-121
plane figure have more than four side be in general call polygon $ and receive other particular name $ according to the number of their side or angle $	0	1	plane	Plane figures having more than four sides are in general called polygons , and receive other particular names , according to the number of their sides or angles .	nf_1827_747521.txt-56-0
if a plane be parallel to the horizontal plane $ this plane will not have a horizontal trace $ and its vertical trace will be parallel to the ground-line $	8	1	plane	If a plane be parallel to the horizontal plane , this plane will not have a horizontal trace , and its vertical trace will be parallel to the ground-line .	nf_1836_748113.txt-1782-8
we be induce to rise in arm against austria $ $ we mean $ not the people $ but the government of austria $ $ not only by the need of redeem ourselves from the shame and grief of thirty-one year of the most abject despotism $ but by a deliberate resolve to take our place upon the plane of nation $ to unite with our brother of the peninsula $ and take rank with them under the great banner raise by piu <nul>	58	1	plane	We were induced to rise in arms against Austria , ( we mean , not the people , but the government of Austria , ) not only by the need of redeeming ourselves from the shame and grief of thirty-one years of the most abject despotism , but by a deliberate resolve to take our place upon the plane of nations , to unite with our brothers of the Peninsula , and take rank with them under the great banner raised by Pius IX.	fic_1856_2655.txt-5061-58
will be no difference between the shadow on the plane $ and the side of the prism which project that shadow $ and if the plane be entirely deprive of light $ by the extensive breadth of the shadow $ the side of the prism will in general be darke than the shadow on the plane $ but this will depend very much on the situation of other object $	55	1	plane	will be no difference between the shadow on the plane , and the side of the prism which projects that shadow ; and if the plane be entirely deprived of light , by the extensive breadth of the shadow , the side of the prism will in general be darker than the shadow on the plane : but this will depend very much on the situation of other objects .	nf_1836_748113.txt-2089-55
their busy $ earnest twittering lead me at once to suspect that they be look out a building-spot $ but as a carpenter 's bench be under the window $ and frequent hammering $ saw $ and plane be go on $ i have little hope they would choose a location under our roof $	37	2	plane	Their busy , earnest twitterings led me at once to suspect that they were looking out a building-spot ; but as a carpenter 's bench was under the window , and frequent hammering , sawing , and planing were going on , I had little hope they would choose a location under our roof .	fic_1843_7039.txt-2100-37
in the neighboring building $ we see it stand in row $ with the low part of the cone in a hole $ to drop the molasses again upon an inclined plane $ which convey it to a vat hold thirty thousand gallon $	31	3	plane	In the neighboring building , we saw it standing in rows , with the lower part of the cone in a hole , to drop the molasses again upon an inclined plane , which conveys it to a vat holding thirty thousand gallons .	mag_1829_553985.txt-220-31
but we be most familiar with the exhibition of gravity in body descend inclined plane $ as in the avalanche and the cataract $	14	3	plane	But we are most familiar with the exhibitions of gravity in bodies descending inclined planes , as in the avalanche and the cataract .	mag_1848_565759.txt-87-14
it follow $ that if the point in space be upon the horizontal plane $ its distance with regard to this last name plane will be zero or nothing $ and the vertical a a will be zero also $	23	3	plane	It follows , that if the point in space be upon the horizontal plane , its distance with regard to this last named plane will be zero or nothing , and the vertical A a will be zero also .	nf_1836_748113.txt-1737-23
then because that the point q be in the plane 6 c	9	3	plane	Then because that the point q is in the plane 6 c	nf_1836_748113.txt-2011-9
6 $ where the parallelogram u xx_v xx_vv x $ represent the horizontal plane $ and the parallelogram u xx_v y z $ represent the vertical plane $ the projection a 6 of the line a a in space upon the horizontal plane u xx_v w x $ be call the horizontal projection $ and the projection a b $ of the same line upon the vertical plane u xx_v y z $ be call the vertical projection $	26	3	plane	6 , where the parallelogram U V VV X , represents the horizontal plane , and the parallelogram U V Y Z , represents the vertical plane , the projection a 6 of the line A A in space upon the horizontal plane U V W X , is called the horizontal projection , and the projection A B , of the same line upon the vertical plane U V Y Z , is called the vertical projection .	nf_1836_748113.txt-1704-26
if a plane be parallel to one of the plane of projection $ this plane will have only one trace $ which will be parallel to the ground-line $ and soluated in the other plane of projection $	34	3	plane	If a plane be parallel to one of the planes of projection , this plane will have only one trace , which will be parallel to the ground-line , and soluated in the other plane of projection .	nf_1836_748113.txt-1779-34
then the plane d $ would represent the horizon plane $	2	3	plane	Then the plane D , would represent the horizon plane .	nf_1830_747561.txt-118-2
the interior of the pyramid be excessively hot $ particularly when surround by a number of arab and flare torch * leave the king chamber $ i descend the inclined plane $ and prepare to descend the well refer to by pliny $	30	3	plane	The interior of the pyramid is excessively hot , particularly when surrounded by a number of Arabs and flaring torches * Leaving the Kings Chamber , I descended the inclined plane , and prepared to descend the well referred to by Pliny .	nf_1838_747585.txt-200-30
so if the trace of the plane be in the horizontal plane $ and parallel to the ground $ line $ the plane will be parallel to the vertical plane $	29	3	plane	So if the trace of the plane be in the horizontal plane , and parallel to the ground - line , the plane will be parallel to the vertical plane .	nf_1836_748113.txt-1787-29
mineral $ the magnet point ever to the north $ so be there a plant in the prairie $ call by traveller the polar plant $ or indian compass $ because the plane of its leaf point due north and south $ without other variation than the temporary ruffle of the breeze $	32	3	plane	minerals , the magnet points ever to the North ; so is there a plant in the prairies , called by travellers the Polar Plant , or Indian Compass , because the plane of its leaf points due North and South , without other variation than the temporary ruffling of the breeze .	fic_1843_7039.txt-2743-32
we observe $ 161 $ that if df $ represent the weight of w $ be resolve into the two force f e perpendicular to the beam and d e in the direction of it $ d e will represent the force exert by w in the direction of the beam $ d e therefore will represent the force with which a spherical weight w will move down the plane $	69	3	plane	We observed ( 161 ) that if df , representing the weight of W , be resolved into the two forces f e perpendicular to the beam and d e in the direction of it , d e will represent the force exerted by W in the direction of the beam , d e therefore will represent the force with which a spherical weight W will move down the plane .	nf_1827_748059.txt-1330-69
/z/ all object situate on the earth be $ in perspective $ say to be on the same plane $ call the ground plane $	23	3	plane	/z/ All objects situate on the earth are , in perspective , said to be on the same plane , called the ground plane .	nf_1830_747561.txt-51-23
/z/ a $ r.-he - /z/ dograpby $ cut the thickness of the ring at a and b $ let a c d be the angle which the sun 's ray nnake with the plane of the ichnography $ or seat a c.-a bisect a b in c $ with the radius c a or c b $ describe a circle $ and through the center c $ draw c d parallel to g d $ cut the circle at d $ also through c $ draw the line a i $ at right angle to c d cut the circle at a and b $ through the point d and 6 $ draw line parallel to the side a and b of the ring $ then the dark line nearest to a $ will represent the line of light $ and that which be nearest to b $ will represent that line which separate	34	3	plane	/z/ A , r. - /z/ Dograpby , cutting the thickness of the ring at A and B ; let A C D be the angle which the sun 's rays nnake with the plane of the ichnography , or seat A C. Bisect A B in c ; with the radius c A or c B , describe a circle ; and through the centre c , draw c d parallel to G D , cutting the circle at d ; also through c , draw the line a i , at right angle to c d cutting the circles at a and b ; through the points d and 6 , draw lines parallel to the sides A and B of the ring ; then the dark line nearest to A , will represent the line of light ; and that which is nearest to B , will represent that line which separates	nf_1836_748113.txt-1959-34
3d $ if the sun be on a line with the perspective plane $ that be $ so place $ that be the perspective plane extend till it reach the sun $ it would go neither before nor behind $ but just through it $ then the sun be in the same plane as the picture $ and the shadow fall in a line parallel with the ground line $	12	3	plane	3d , If the sun is on a line with the perspective plane ; that is , so placed , that were the perspective plane extended till it reached the sun , it would go neither before nor behind , but just through it , then the sun is in the same plane as the picture , and the shadows fall in a line parallel with the ground line .	nf_1830_747561.txt-737-12
so if the trace of the plane be in the horizontal plane $ and parallel to the ground $ line $ the plane will be parallel to the vertical plane $	22	3	plane	So if the trace of the plane be in the horizontal plane , and parallel to the ground - line , the plane will be parallel to the vertical plane .	nf_1836_748113.txt-1787-22
/z/ when two plane abc d $ a b f e $ <nul>	3	3	plane	/z/ When two planes ABC D , A B F E , Fig.	nf_1836_748113.txt-1569-3
now if you make the object of the same size and distance from the eye $ and put the perspective plane in the same place as the original $ $ that be $ the same proportion $ measure by a scale $ $ you will obtain the same angle as the original make $ and this angle will intersect the perspective plane precisely as the original angle would a pane of glass $ at the give distance from the eye $	20	3	plane	Now if you make the object of the same size and distance from the eye , and put the perspective plane in the same place as the original , ( that is , the same proportion , measuring by a scale , ) you will obtain the same angle as the original makes , and this angle will intersect the perspective plane precisely as the original angle would a pane of glass , at the given distance from the eye .	nf_1830_747561.txt-281-20
the four side reach from the seat to the floor $ where the cross piece be place $ be four upright plane $ at right angle with each other $ for if the chair be box up from the floor to the seat $ this box would form the four plane or side $	50	3	plane	The four sides reaching from the seat to the floor , where the cross pieces are placed , are four upright planes , at right angles with each other : for if the chair were boxed up from the floor to the seat , this box would form the four planes or sides .	nf_1830_747561.txt-527-50
after three month ' labor with 800 man $ the obelisk be remove on an inclined plane into the vessel $ through a hole make in the end for the purpose $	16	3	plane	After three months ' labor with 800 men , the obelisk was removed on an inclined plane into the vessel , through a hole made in the end for the purpose .	nf_1853_765349.txt-396-16
reciprocally $ if a plane be parallel to the ground-line $ its two trace will be parallel to the ground-line $	4	3	plane	Reciprocally , if a plane be parallel to the ground-line , its two traces will be parallel to the ground-line .	nf_1836_748113.txt-1797-4
if a line be situate in a give plane by its trace $ this line can only intersect the plane $ of projection upon the trace of the plane which contain it $	19	3	plane	If a line be situated in a given plane by its traces , this line can only intersect the planes " of projection upon the traces of the plane which contains it .	nf_1836_748113.txt-1804-19
fall on an inclined plane $ place like a roof beneath $ and run into cask below $	4	3	plane	falling on an inclined plane , placed like a roof beneath , and running into casks below .	mag_1829_553985.txt-211-4
thus $ if it be a horizontal trace which be perpendicular tothe groundline $ the plane will be perpendicular to the vertical plane of projection $ and if $ on the contrary $ the vertical trace be that which be perpendicular to the ground-line $ then the plane will be perpendicular to the horizontal plane $	54	3	plane	Thus , if it be a horizontal trace which is perpendicular tothe groundline , the plane will be perpendicular to the vertical plane of projection ; and if , on the contrary , the vertical trace be that which is perpendicular to the ground-line , then the plane will be perpendicular to the horizontal plane .	nf_1836_748113.txt-1789-54
bond $ in masonry $ consist in the place of the stone in such relative position that no joint in any course shall be in the same plane with any other joint in the course immediately above or below it $	27	3	plane	Bond , in masonry , consists in the placing of the stones in such relative positions that no joint in any course shall be in the same plane with any other joint in the course immediately above or below it .	nf_1853_747976.txt-544-27
if the sun 's ray be parallel to any plane $ that plane to which they be parallel $ be call a plane of shade $	22	3	plane	If the sun 's rays be parallel to any plane , that plane to which they are parallel , is called a plane of shade .	nf_1836_748113.txt-1926-22
the marrowy organism $ with skin that shed water like the back of duck $ with smooth surface neatly pad beneath $ and velvet lining to their singing-pipes $ be not so common among us as that other pattern of humanity with angular outline and plane surface $ and integument $ hair like the fibrous cover of a cocoa-nut in gloss and suppleness as well as color $ and voice at once thin and strenuous $ $ $ acidulous enough to produce effervescence with alkali $ and stridulous enough to sing duet with the katydid $	45	3	plane	The marrowy organisms , with skins that shed water like the backs of ducks , with smooth surfaces neatly padded beneath , and velvet linings to their singing-pipes , are not so common among us as that other pattern of humanity with angular outlines and plane surfaces , and integuments , hair like the fibrous covering of a cocoa-nut in gloss and suppleness as well as color , and voices at once thin and strenuous , - - acidulous enough to produce effervescence with alkalis , and stridulous enough to sing duets with the katydids .	fic_1859_270.txt-3039-45
note a d xx_n t a section of the plane $ pass through its axis at right angle with the section of the ellipsis $ parabola $ or hyperbola $	9	3	plane	Note A D N t a section of the plane , passing through its axis at right angles with the sections of the ellipsis , parabola , or hyperbola .	nf_1836_748113.txt-1454-9
the two plane $ upon which we project any line whatever $ be call the plane of projection $	2	3	plane	The two planes , upon which we project any line whatever , are called the planes of projection .	nf_1836_748113.txt-1705-2
again $ when we see the broad tail of the fish place vertically $ and that of the whale horizontally $ we know that $ as it s the chief instrument of progression in both $ and exert its power from side to side of its plane $ therefore the first can have but comparatively slender capacity of dive $ and be limit to a narrow range of ascent and descent $ while the latter have this capacity in excess $	46	3	plane	Again , when we see the broad tail of the fish placed vertically , and that of the whale horizontally , we know that , as it s the chief instrument of progression in both , and exerts its power from side to side of its plane , therefore the first can have but comparatively slender capacity of diving , and is limited to a narrow range of ascent and descent ; while the latter has this capacity in excess .	mag_1858_556423.txt-70-46
provide a large table $ this be a horizontal plane $ and will represent the ground plane $ <nul>	9	3	plane	Provide a large table ; this is a horizontal plane , and will represent the ground plane , viz.	nf_1830_747561.txt-644-9
/q/ where this intersect at d be the apparent size of this side $ because it be parallel with the ground plane $	21	3	plane	/q/ Where this intersects at d is the apparent size of this side , because it is parallel with the ground plane .	nf_1830_747561.txt-579-21
the deep leaf of the olive lay here and there like glitter speck of water before his eye $ as they give a plane surface to her rise glance $ and the vine spread with dark purple cluster $ in a wanton maze that clasp even the top of the gigantic oak-tree $ and bind them in many place to the wall itself $ upon which he lean $ and over it wander with unrestrained luxuriance $ make a roof to the verdant neighborhood $ which render it a spot as secret and secure as it seem sacred to the generous nature to which it owe so much $	23	3	plane	The deep leaves of the olive lay here and there like glittering specks of water before his eye , as they gave a plane surface to her rising glance ; and the vine spreading with dark purple clusters , in a wanton maze that clasped even the tops of the gigantic oak-tree , and bound them in many places to the wall itself , upon which he leaned , and over it wandered with unrestrained luxuriance , made a roof to the verdant neighborhood , which rendered it a spot as secret and secure as it seemed sacred to the generous nature to which it owed so much .	fic_1845_7295.txt-4689-23
/z/ give the ichnography and elevation of a base and capital $ and the seat of the sun 's ray on the ichnographj $ and on the elevation $ to project the shadow cause by the several part of itself $ and the line of shade upon the baseimagine the object to be slice $ or cut $ by as many plane $ parallel to the axis of the column $ * and to the sun 's ray $ as may be tliought convenient for the purpose $ then it be plain $ if a ray of light enter any of those plane $ that every part of the ray will be in that plane $ and that the projecting part upon the edge of * it 18 not abiolutelj necessary to suppose the plane parallel to the axis of the	61	3	plane	/z/ Given the ichnography and elevation of a base and capital , and the seat of the sun 's rays on the ichnographj , and on the elevation ; to project the shadows caused by the several parts of itself , and the line of shade upon the baseImagine the object to be sliced , or cut , by as many planes , parallel to the axes of the columns , * and to the sun 's rays , as may be tliought convenient for the purpose : then it is plain , if a ray of light enter any of those planes , that every part of the ray will be in that plane , and that the projecting parts upon the edges of * It 18 not abiolutelj necessary to suppose the plane parallel to the axis of the	nf_1836_748113.txt-2101-61
i be sure travel over the world must be pleasant than spend a life in one place $ and pull a rope be easy work than push a plane $ $	28	3	plane	I am sure travelling over the world must be pleasanter than spending a life in one place ; and pulling a rope is easier work than pushing a plane . "	fic_1852_3671.txt-62-28
